Video ID,Title,Length,Published,Region Restriction Count
k2kZCB0MyVA,Biking Afghanistan Part 2: Finding a Team | Nat Geo Live,5m 22s,2015-07-06T20:29:25Z
aez0ZdRK5Tw,Biking Afghanistan Part 1: Gearing Up | Nat Geo Live,7m 39s,2015-07-06T19:30:00Z
sE8HvAIU0Vo,Wings Water Wind Created Hawaii's Ecosystem | National Geographic,2m 2s,2015-07-02T18:00:02Z
NqtRUoVGiDo,Photographer’s Journey Part 3: Darwin’s Actual Finches | Nat Geo Live,5m 1s,2015-06-29T20:42:28Z
vCxJ8-Rpv4o,Photographer’s Journey Part 2: Bog Mummies Babies and Shark Skin | Nat Geo Live,7m 20s,2015-06-29T19:23:08Z
4c70zoVydwU,Photographer’s Journey Part 1: The Real Friday Night Lights | Nat Geo Live,4m 45s,2015-06-29T18:00:01Z
E7-ARYxGEDk,Wolverine vs. Gut Pile - Deleted Scene | Life Below Zero,1m 29s,2015-06-29T16:00:01Z
jilcwUglzgk,Breaking Trail - Deleted Scene | Life Below Zero,1m 27s,2015-06-28T16:00:01Z
7tKZB2k14iY,Jealousy Bites | Brain Games,3m 6s,2015-06-27T19:00:01Z
E12nwz0ktk8,DIY Drying Rack - Deleted Scene | Life Below Zero,1m 25s,2015-06-27T16:00:00Z
Hl0n1-dAVwo,On the Set of Sleep | Brain Games,1m 45s,2015-06-27T14:00:01Z
D-oUShj2DBs,Wicked Tuna: Outer Banks,31s,2015-06-26T21:24:06Z
hPpfBNVuXp0,Jason Silva on Perspective | Brain Games,1m 23s,2015-06-26T19:00:03Z
yhkHUW3czwo,Jason Silva on Scams | Brain Games,1m 18s,2015-06-26T18:00:02Z
O_KidUQpeKo,What Is a Leap Second? | National Geographic,2m 3s,2015-06-26T18:00:01Z
ZOaKsEI7sr4,Brain Magic - The Scam Illusion | Brain Games,2m 31s,2015-06-26T18:00:00Z
jpOIaRUUukw,Brain Magic - The Sleep Illusion | Brain Games,4m 36s,2015-06-26T14:00:01Z
TVeGdTyStuI,On the Set of Positive Thinking | Brain Games,2m 4s,2015-06-26T13:00:01Z
M-Ki5KHiudw,The Aftermath - Behind The Scenes | Life Below Zero,3m 8s,2015-06-26T13:00:00Z
Tf0XBkpCnwI,Brain Magic - The Perspective Illusion | Brain Games,2m 51s,2015-06-25T19:00:00Z
X7PNbBL2DZA,Log Jam | Dead End Express,2m 40s,2015-06-25T18:00:01Z
1GrpJM0D4h0,The Con Artist Handbook | Brain Games,2m 46s,2015-06-25T18:00:00Z
mBgSp89PAUQ,War Games with Jim and Eugene | Brain Games,3m 6s,2015-06-25T17:00:03Z
tvfMOPTsU_0,How Sleep Deprived Are You? | Brain Games,2m 5s,2015-06-25T14:00:01Z
lgr5iBXtY9A,Brain Magic - The Positivity Illusion | Brain Games,3m 24s,2015-06-25T13:00:03Z
SYWURlcQ8cI,Capuchin Monkey Soap Opera in Costa Rica | Expedition Raw,2m 2s,2015-06-25T12:00:02Z
mdzV1NZa070,Grateful Dad | Dead End Express,2m 19s,2015-06-24T20:00:00Z
km9A4ivR9Vw,Tipsy Vows | Brain Games,3m 4s,2015-06-24T19:00:03Z
mgDaNCxcZO0,Rack Focus | Life Below Zero,3m 32s,2015-06-24T18:00:02Z
cPsvda1XLug,The Pigeon Drop | Brain Games,3m 5s,2015-06-24T18:00:01Z
ujRphIcdx5M,Stretch Your Imagination | Brain Games,2m 17s,2015-06-24T17:00:04Z
B8rQAFIESfc,This Is Your Brain on No Sleep | Brain Games,1m 59s,2015-06-24T14:00:01Z
VgRdFC9jC9w,Jason Silva on Positive Thinking | Brain Games,1m 22s,2015-06-24T13:00:02Z
NSnI6QuaDDw,What Do You See? | Brain Games,3m 6s,2015-06-23T19:00:01Z
5RwIKibu7uI,Hailstone Chop Shop | Life Below Zero,3m 24s,2015-06-23T18:00:00Z
yqi8Mv0FDu0,Jason Silva on Sleep | Brain Games,1m 9s,2015-06-23T14:00:03Z
ISvhZiRFLes,How to Feel Like a Winner | Brain Games,2m 24s,2015-06-23T13:00:01Z
jAi29udFMKw,Laser Scanning Reveals Cathedral’s Mysteries | National Geographic,4m 11s,2015-06-23T12:30:01Z
kO1kgl0p-Hw,The Power of Positivity | Brain Games,3m 12s,2015-06-22T23:03:29Z
DNXLwVz7g9g,SharkFest 2015 | National Geographic,1m 5s,2015-06-22T22:28:11Z
bBgTB1tF4po,These Horses Give Prisoners a Second Chance | National Geographic,3m 32s,2015-06-22T22:00:00Z
CfEQBCLkjLE,Genghis Khan’s Lost Tomb Part 3: A Sacred Encounter | Nat Geo Live,4m 51s,2015-06-22T21:59:22Z
h-ZouPEgZBg,Genghis Khan’s Lost Tomb Part 2: Unearthing the Past | Nat Geo Live,5m 51s,2015-06-22T20:37:22Z
hLgaCJEV2b0,Genghis Khan’s Lost Tomb Part 1: The Search Begins | Nat Geo Live,7m 37s,2015-06-22T19:31:41Z
qOh1JlI6pbk,Neil deGrasse Tyson on Norman Lear | StarTalk,1m 54s,2015-06-22T14:00:02Z
1QosehhenDY,Endangered Species Defender Wins Nat Geo's Highest Honor | National Geographic,1m 17s,2015-06-21T14:00:00Z
hpUdpQJO4s4,Alaskan Freezer - Deleted Scene | Life Below Zero,1m 23s,2015-06-21T13:00:06Z
ciNzKGKhb-o,Fixing the Bobcat - Deleted Scene | Life Below Zero,1m 35s,2015-06-21T13:00:04Z
aB7wHDHtr9M,Gorilla Defenders: On the Front Lines of Illegal Wildlife Trafficking | National Geographic,1m 59s,2015-06-20T14:00:02Z
lzm5B5y9pZ4,The Art of Being Sue - Deleted Scene | Life Below Zero,2m 9s,2015-06-20T13:00:01Z
vjpatgBIlaM,Watch: Illegal Elephant Ivory Crushed in Times Square | National Geographic,1m 10s,2015-06-19T23:00:01Z
EbpHrwBZGo8,Pope Advisor Has Harsh Words for Climate Deniers | National Geographic,1m 59s,2015-06-19T22:30:00Z
0mTqOur4-SU,67-Year Old Adventurer Kayaks Across Atlantic Ocean | National Geographic,55s,2015-06-19T17:00:00Z
L96iEYvk2gk,Meeting her for the first time Lily's Story (Cannabis for Kids Part 3) | National Geographic,7m 50s,2015-06-19T14:01:34Z
xC_Qo_je7_M,Science Literacy in Pop Culture | StarTalk,1m 50s,2015-06-19T14:00:03Z
u9yJGUI0e18,We have to be the guinea pigs. Sophie's Story (Cannabis for Kids Part 2) | National Geographic,7m 7s,2015-06-19T13:01:19Z
LR4-MY-nvvY,The Crash - Behind the Scenes | Life Below Zero,4m 37s,2015-06-19T13:00:01Z
XvwASmdTEOI,Our hands were tied. Millie's Story (Cannabis for Kids Part 1) | National Geographic,7m 7s,2015-06-19T12:00:01Z
xxmsrNE14vM,Making People Laugh | StarTalk,2m 14s,2015-06-18T14:00:03Z
o_xxImoqId4,Tagging a Fish With a Sword for a Face | Expedition Raw,2m,2015-06-18T12:00:03Z
rBmw03SHY70,Bill Nye on TV History | StarTalk,2m,2015-06-17T14:00:03Z
Nw9r7ZwTgmE,Mules on a Boat | Dead End Express,1m 41s,2015-06-16T16:00:01Z
BjHysuMSeJk,Norman Lear and Climate Change TV | StarTalk,2m 13s,2015-06-16T14:00:01Z
XvM3y1fpv3E,Tracking Illegal Fishing—From Space | National Geographic,3m 17s,2015-06-16T12:00:01Z
MGrqh94dLAc,Decades Later Photographer Searches for Gandhi’s Legacy | National Geographic,2m 47s,2015-06-15T21:00:01Z
zUzSe8NL_Ek,Finding Freedom in a Frontier Life | National Geographic,4m 26s,2015-06-15T20:30:00Z
wI9DEBJZlzg,In Gorgeous Palau Explorers Find Wonders Worth Protecting | National Geographic,9m 5s,2015-06-15T18:00:01Z
EvKR1VaXIIA,Why Food Trucks Are Taking Over America | National Geographic,1m 52s,2015-06-15T17:00:00Z
WYY0uc0vgC0,From Sweden to Harlem: A Chef's Journey | Nat Geo Live,9m 28s,2015-06-15T16:00:03Z
VNDXS83BU1k,Neil deGrasse Tyson and NASA's Charles Bolden | StarTalk,1m 37s,2015-06-15T14:00:01Z
7Tk9otg9wf8,Winning the Battle for Endangered Gorillas in Africa's Oldest National Park | National Geographic,54m 56s,2015-06-14T23:00:01Z
AXgifQoe8wg,Dog Food Delivery | Dead End Express,1m 52s,2015-06-14T16:00:00Z
-cr1stoMMsA,Neil deGrasse Tyson on the Future of Space Exploration | StarTalk,2m 7s,2015-06-13T14:00:01Z
wZc6JEPVATM,Explorer Talk: Transformers Food Cube Farms and a Nuclear-Waste Chomper | National Geographic,1h 21m 50s,2015-06-13T14:00:01Z
dK621U3X2uU,Sue the Mechanic - Deleted Scene | Life Below Zero,1m 36s,2015-06-13T13:00:01Z
ybAmScqTeg0,Gorillas Use Passwords ... and Other Facts We Learned From Our Explorers | National Geographic,2m 23s,2015-06-12T22:30:00Z
kfZ5lREuDf0,Elections and Space Missions | StarTalk,1m 58s,2015-06-12T20:00:01Z
ESJaPmfbius,A Short Guide to Chipmunk Noises | National Geographic,58s,2015-06-12T19:00:00Z
2BudWUej5e0,I Am Dying Teaser | National Geographic,3m 13s,2015-06-12T18:55:41Z
p3uAQyRHcPY,This Scientist Wants to Email Vegetables | National Geographic,2m 11s,2015-06-12T18:30:01Z
2QgWj1iDg18,Bill Nye on Space Exploration | StarTalk,1m 25s,2015-06-12T14:00:00Z
yolBoOKS4Uo,Bent and Broken - Behind the Scenes | Life Below Zero,3m 24s,2015-06-12T13:00:04Z
2Ttjbb5anok,Bear vs. Gorilla - Fan Questions | StarTalk,1m 16s,2015-06-11T20:00:00Z
0zf9Arm-IdE,Meet Russia's Tiger Guardians | National Geographic,3m 8s,2015-06-11T19:00:00Z
ZFUmuxK79qo,Short Hawaiian Word Is Also Super Powerful | National Geographic,38s,2015-06-11T18:00:01Z
qK5dXMHSIu8,Weird Worms Live Near Pacific Ocean’s Deepest High-Temp Vent | National Geographic,1m 46s,2015-06-11T17:00:03Z
YDuI8vXNVEI,Being the Wesson Brothers | American Genius,2m 23s,2015-06-11T16:00:04Z
xYXZ5BdAOO8,Being Samuel Colt | American Genius,2m 16s,2015-06-11T16:00:04Z
y-OfTBraNHE,Can This Guy Zap Away Your Bad Memories? | National Geographic,2m 3s,2015-06-11T16:00:01Z
-4n4tWJu-_A,Never Before Seen Amelia Earhart Film Found | National Geographic,2m 39s,2015-06-11T15:00:01Z
727RVWjhiA0,Charles Bolden on Private Enterprise in Space | StarTalk,2m 51s,2015-06-11T14:00:00Z
pEP0sMO-nUQ,Watch Killer Whales and Humpbacks Hunt Together | National Geographic,2m 3s,2015-06-11T13:00:01Z
oqgFHBtNb64,Can Wild Monkeys Hang With Humans? | Expedition Raw,1m 42s,2015-06-11T12:00:02Z
PAl4wXKyCXY,Fireworks in Space - Fan Questions | StarTalk,2m 2s,2015-06-10T20:00:00Z
E98RFejlgBs,Photographing the “Living Goddesses” of Nepal | Exposure,3m 11s,2015-06-10T15:00:01Z
pks4QSWvT4w,International Space Exploration | StarTalk,1m 52s,2015-06-10T14:00:03Z
0zNIGz2gRMQ,How Not to Climb a Mountain | National Geographic,2m 1s,2015-06-09T19:30:00Z
9I2HX7FGEko,Meet the 2015 Emerging Explorers | National Geographic,1m 43s,2015-06-09T18:30:00Z
tyV2huy800I,Building a Smoker | Filthy Riches,3m 7s,2015-06-09T18:00:01Z
l2h37DIDPHE,Being Sergei Korolev | American Genius,2m 31s,2015-06-09T16:00:01Z
pmSVCGbhY48,Being Wernher von Braun | American Genius,2m 15s,2015-06-09T16:00:01Z
vyNLDLUirLI,NASA's Achievements | StarTalk,3m 5s,2015-06-09T14:00:01Z
TGs2JF4GW0g,Tangled in Fishing Net | Sea Turtle Rescue,1m 1s,2015-06-09T13:00:01Z
ki3znMJCpGo,The Monster 11-Ton Net That Threatened Hawaii’s Coast | National Geographic,2m 21s,2015-06-09T12:00:02Z
q8K5yoQqY4E,Orphaned Sea Lion Pups Get a Second Chance | National Geographic,3m 13s,2015-06-08T21:00:00Z
L0MnwYgB8Vk,Neil on the Power of the Telescope | StarTalk,1m 49s,2015-06-08T20:40:44Z
ey7Pj4xu8uk,Meet the 2015 National Geographic Buffett Award Winners | National Geographic,1m 42s,2015-06-08T20:00:01Z
SPF6cSan6tc,TIL: Why Is the Ocean Salty? | Today I Learned,1m 16s,2015-06-08T19:00:00Z
5MEYQjRh3us,Waking Up With a Moose in Your Face | National Geographic,1m 18s,2015-06-08T18:00:01Z
YhK-NBfpfrk,Neil deGrasse Tyson Talks Twitter | StarTalk,1m 57s,2015-06-08T14:00:00Z
au8eyrI9Ta8,We Are What We Eat: Crete | Nat Geo Live,5m 34s,2015-06-08T12:30:03Z
ak7BChSquoo,We Are What We Eat: Tanzania | Nat Geo Live,8m 59s,2015-06-08T12:30:00Z
8-dg6ctPGZM,The Macintosh | American Genius,2m 12s,2015-06-06T18:00:01Z
8qPkR5OeDr8,Erik's Engagement Story - Deleted Scene | Life Below Zero,2m 46s,2015-06-05T21:00:01Z
gyRPPbYKuPA,The Monopoly of Microsoft | American Genius,1m 57s,2015-06-05T18:00:01Z
4Vt5OnK_6QM,Neil deGrasse Tyson and Twitter Fame | StarTalk,3m,2015-06-05T14:00:00Z
MN7mI7TyfhQ,No Easy Out - Behind the Scenes | Life Below Zero,3m 28s,2015-06-05T13:00:01Z
k8zqW2txy8g,Inside a Dog Retirement Home | National Geographic,3m 44s,2015-06-05T12:30:02Z
bN8F0QKsCdY,Are There White Holes? - Fan Questions | StarTalk,2m 53s,2015-06-04T19:00:03Z
shBGtdqvLs4,The Gross Stuff | T.rex Autopsy: Behind the Scenes,2m 44s,2015-06-04T17:00:01Z
kPY_tZyu0tc,Being William Hearst | American Genius,2m 30s,2015-06-04T16:00:03Z
ePQ23LMhRTE,Being Steve Jobs | American Genius,2m 39s,2015-06-04T16:00:02Z
ox3CSQDPYF8,Being Bill Gates | American Genius,1m 59s,2015-06-04T16:00:01Z
1nshAsS_lkU,Being Joseph Pulitzer | American Genius,2m 48s,2015-06-04T16:00:00Z
M4YLIX5BaaU,Bill Nye on Social Media | StarTalk,1m 33s,2015-06-04T14:00:00Z
gjoP32oIUm0,Turns Out Sharks Love Lasers | Expedition Raw,1m 49s,2015-06-04T12:30:00Z
HT9zqaAqQaw,T. rex: Behind the Build | T.rex Autopsy,2m 39s,2015-06-03T17:00:00Z
GArieHb46j0,Twitter Revolutions Debunked by Co-Founder Biz Stone | StarTalk,3m 16s,2015-06-03T14:00:00Z
p6Uimaq9pcs,T. rex Timelapse | T.rex Autopsy,1m 23s,2015-06-03T13:34:40Z
SyRE5SmMdmI,Hoverboards Are Real | National Geographic,1m 35s,2015-06-03T12:30:00Z
aCYdwlQyGQs,Being David Sarnoff | American Genius,2m 36s,2015-06-02T16:00:01Z
3c1ixlOtZo8,Being Philo Farnsworth | American Genius,2m 26s,2015-06-02T16:00:00Z
z5QURxhdJSE,We Are What We Eat: Borneo | Nat Geo Live,4m 13s,2015-06-02T15:00:01Z
-yV3ZfsqMk0,Twitter the Early Days | StarTalk,1m 59s,2015-06-02T15:00:00Z
zpX_v_E50sE,Special Bacteria Helps Heal Sick Bats | National Geographic,2m 4s,2015-06-02T13:27:37Z
MV96K5rYveQ,Halfway Clean | Yukon Gold,1m 31s,2015-06-01T20:41:37Z
-SzoHL7j-SU,We Are What We Eat: Pakistan | Nat Geo Live,6m 57s,2015-06-01T15:00:00Z
9YUwzwQ8mCY,Neil deGrasse Tyson on Chris Hadfield | StarTalk,2m 3s,2015-06-01T14:00:00Z
Dn09SjDKhds,These Bats Mysteriously Survived a Killer Fungus | National Geographic,2m 49s,2015-06-01T13:34:35Z
N_j2jwXVFzI,The Last Battle | Wicked Tuna: Catch of the Week,3m 29s,2015-06-01T13:00:01Z
pJfwVuIRe7Q,Chris Hadfield on Mars Missions | StarTalk,2m 9s,2015-05-31T15:00:03Z
YEA6m0oACMI,Social Media as Fuel for Curiosity | StarTalk,2m 33s,2015-05-29T18:00:00Z
fqRNFfKb9Po,Astronaut Chris Hadfield Gets Candid About Near-Death Test Flights | StarTalk,2m 55s,2015-05-29T14:00:00Z
pV47k629L7o,Emergency Cache - Behind the Scenes | Life Below Zero,3m 13s,2015-05-29T13:00:01Z
C2rjNxWSvdo,Lemur Sounds + Beatboxing = Sick Beats for Conservation | National Geographic,4m 11s,2015-05-29T12:30:01Z
Wr14T3G6-Bk,Frog-Licking and Other Florida Wonders | National Geographic,2m 59s,2015-05-28T18:00:00Z
xXQHyTTcMR4,Bill Nye and Mars Exploration | StarTalk,1m 44s,2015-05-28T14:00:01Z
uNKFSE67ptY,Cheating Death on the Amazon | Expedition Raw,3m 2s,2015-05-28T12:30:01Z
OOTYpzf-hYE,Using Science to Map a Wingsuit BASE Jump | National Geographic,3m 51s,2015-05-27T18:00:00Z
wsx8eT7Nh9Y,Being Glenn Curtiss | American Genius,3m 16s,2015-05-27T16:00:06Z
6NVqB-WK0yY,Being the Wright Brothers | American Genius,2m 31s,2015-05-27T16:00:00Z
L9ZsQv53S_A,We Are What We Eat: Bolivia | Nat Geo Live,6m 55s,2015-05-27T15:00:00Z
PlQ0R_Qem6Q,Astronauts Now vs. Then with Chris Hadfield | StarTalk,2m 31s,2015-05-27T14:00:01Z
yEnVShUZXks,will.i.am on Creativity | American Genius,2m 2s,2015-05-26T16:00:04Z
duYVlZ1IpCc,Thor vs. the Hulk - Fan Questions | StarTalk,1m 3s,2015-05-26T16:00:00Z
ohskrSuq8Mo,We Are What We Eat: Greenland | Nat Geo Live,7m 46s,2015-05-26T15:00:04Z
ELAutJpNj9w,Grassless Lawns Catching On During California Drought | National Geographic,3m 4s,2015-05-26T12:30:01Z
ePbinRcBPII,Biz Stone on Social Innovation | American Genius,2m 42s,2015-05-25T16:00:02Z
lwlDCHeOpKE,We Are What We Eat: Afghanistan | Nat Geo Live,7m 51s,2015-05-25T15:00:06Z
V5l_JCJ7BF8,Neil deGrasse Tyson on President Jimmy Carter | StarTalk,2m 14s,2015-05-25T14:00:00Z
i5Cet4eS2f0,Odd Birds Flirt With Peculiar Noises | National Geographic,57s,2015-05-25T13:00:05Z
cO8UD9AUuzY,Catch of the Week - Persistence Pays Off | Wicked Tuna,2m 35s,2015-05-25T13:00:02Z
RV87qTxBUWM,Reel Talk Ep. 15 - Follow the Leader | Wicked Tuna,18m 48s,2015-05-25T01:30:01Z
aZWxK8wSODo,President Jimmy Carter on Science and Politics | StarTalk,1m 49s,2015-05-24T14:00:02Z
WRddQAtsVj4,Bill Nye on Science & Invention | American Genius,2m 15s,2015-05-23T16:00:06Z
dUC0hz__7eU,Oldest Known Stone Tools Discovered: 3.3 Million Years Old | National Geographic,2m 44s,2015-05-23T13:00:06Z
xgW7R9-ii0M,Steve Wozniak on the Forefront of Technology | American Genius,2m 27s,2015-05-22T21:00:00Z
2ETPdIPaziY,President Jimmy Carter's Scientific Background | StarTalk,1m 7s,2015-05-22T20:00:00Z
ouMvHMBAMWo,An Argument Against Memorization | StarTalk,2m 4s,2015-05-22T14:00:04Z
ybfTWhgbkUM,Alone in the Dark - Behind the Scenes | Life Below Zero,3m 14s,2015-05-22T13:00:01Z
9PJv7K79NVI,Odd Birds Take a Road Trip to Survive | National Geographic,2m 59s,2015-05-22T12:30:01Z
gRdwGb_wctA,Space Exploration - Fan Questions | StarTalk,2m 50s,2015-05-21T20:00:00Z
zt1fTdN3NF8,Monster Fish Part 4: Take Action | Nat Geo Live,5m 39s,2015-05-21T15:00:07Z
S4m_7XaLwes,Bill Nye on Preventing Disease | StarTalk,2m 21s,2015-05-21T14:00:01Z
O7tAuPi_azU,Amazing Drone Footage of Nubian Pyramids | Expedition Raw,2m 15s,2015-05-21T12:30:01Z
DeDNyIFZFr4,ROBOTS 3-D (Trailer) | National Geographic,1m 49s,2015-05-20T18:00:01Z
He24uTIoz-0,Monster Fish Part 3: Elusive Giant Rays | Nat Geo Live,4m 34s,2015-05-20T15:00:01Z
eGdKyFfSAQk,Eradicating the Guinea Worm | StarTalk,3m,2015-05-20T14:00:01Z
f6mJ7e5YmnE,Amazing Time-Lapse: Bees Hatch Before Your Eyes | National Geographic,1m 9s,2015-05-20T13:30:00Z
F2yfHJ14wOw,Monster Fish Part 2: Mongolia's Cannibal Trout | Nat Geo Live,4m 5s,2015-05-19T15:00:00Z
O-5PHyTVegs,President Jimmy Carter's Geek Credentials | StarTalk,2m 6s,2015-05-19T14:00:01Z
yqzVI0CSKCU,Swing Through the Trees With Amazing Spider Monkeys | National Geographic,2m 50s,2015-05-19T12:30:00Z
h5ytEwmW0yk,Catch of the Week - Tuna Trifecta | Wicked Tuna,2m 50s,2015-05-18T16:00:01Z
N38Qm2I8qQ8,Monster Fish Part 1: Mekong's Mythical Creature | Nat Geo Live,6m 6s,2015-05-18T15:00:02Z
jH9XOGglGtw,Neil deGrasse Tyson on Richard Dawkins | StarTalk,2m 9s,2015-05-18T14:00:05Z
hTI8idwjkgw,Badass Women Battle Untamed Mongolian River | Expedition Raw,3m 23s,2015-05-18T13:00:01Z
SgGrcm7islk,Reel Talk Ep. 13 - Tuna Trifecta | Wicked Tuna,18m 11s,2015-05-18T01:45:00Z
aqSQtvN2-9c,Richard Dawkins on Illogical Thinking | StarTalk,2m 47s,2015-05-16T14:00:00Z
qdRuKC0rLLQ,If You’re Scared of Spiders Don’t Watch This | National Geographic,1m 5s,2015-05-16T12:30:00Z
qAQL9gRmq34,The Intersection of Science and Religion | StarTalk,2m 10s,2015-05-15T14:00:02Z
adYg8NfV2oI,Darkness Falls - Behind the Scenes | Life Below Zero,3m 22s,2015-05-15T13:00:01Z
N3k4IQHFlJA,Watch These Millipedes Glow in the Dark | National Geographic,1m 46s,2015-05-15T12:30:00Z
GHldqWpogwk,Mars Colony - Fan Questions | StarTalk,1m 19s,2015-05-14T19:00:00Z
y7V36bDsuC0,Can You Name This African River? (Final Question 2015 Nat Geo Bee) | National Geographic,2m 30s,2015-05-14T18:00:04Z
TwTIhNqc-io,Untamed River Part 4: An Unexpected Ending | Nat Geo Live,3m 58s,2015-05-14T15:00:01Z
PHDVxsTAMjw,Is the Human Mind Wired for Logical Thought? | StarTalk,1m 53s,2015-05-14T14:00:03Z
4E0BsSo93HI,Can You Answer These 3 Geography Questions? | National Geographic,2m 47s,2015-05-14T12:30:00Z
d36_wjeCPVU,Inside Neil deGrasse Tyson's Office | StarTalk,3m 50s,2015-05-13T19:00:01Z
aIrfbZQlui8,National Geographic Live! - Untamed River Part 3: Crime Mosquitoes and Monsoons | Nat Geo Live,6m 2s,2015-05-13T15:00:02Z
et6I-8QLa4I,Destroying the Poetry of the Rainbow? | StarTalk,3m 11s,2015-05-13T14:00:03Z
DwQ4xLdOIbM,Releasing Ferrets Into Their Prairie Home | National Geographic,4m 5s,2015-05-13T12:30:00Z
CR9loG6ppns,American Genius | National Geographic,31s,2015-05-12T15:42:58Z
LWD7tUnOd1g,Untamed River Part 2: Death and Beauty in Mongolia | Nat Geo Live,5m 4s,2015-05-12T15:00:01Z
31nkmvqcy80,Listening to the Rocks | StarTalk,1m 50s,2015-05-12T14:00:01Z
3xWW4sTp4wA,What Has Four Legs Four Eyes and Will Blow Your Mind? | Short Film Showcase,1m 40s,2015-05-12T12:30:01Z
aIJfKA8QchY,Catch of the Week - Payback's a Fish | Wicked Tuna,2m 46s,2015-05-11T19:00:00Z
kQY1JzkUzuw,National Geographic Live! - Untamed River Part 1: The 2,700-Mile Journey Begins | Nat Geo Live,5m 35s,2015-05-11T15:00:06Z
fxWIhh09f6A,Neil deGrasse Tyson on Internet Trolls | StarTalk,2m 25s,2015-05-11T14:00:01Z
zu_vp-CL0aQ,Is California Exporting Tons of Water During a Drought? | National Geographic,2m 10s,2015-05-11T12:30:01Z
Odf8S-4nk1Q,Reel Talk Ep. 12 - Triple Crossed | Wicked Tuna,13m 22s,2015-05-11T01:30:01Z
AaUNWyw0g-8,Did Gulf Oil Spill Cleanup Make Things Worse? | National Geographic,1m 27s,2015-05-10T23:00:00Z
RPWQ3Y11iwY,Neil deGrasse Tyson on Arianna Huffington | StarTalk,2m 38s,2015-05-09T14:00:01Z
2zox5mvwIc4,Inside This Mountain Old Films Live Forever | National Geographic,4m 30s,2015-05-09T13:00:01Z
xp8gKyJKvw8,Case File Pupdate: Lexie Jane | Cesar 911,2m 32s,2015-05-09T02:00:02Z
qioz4Aif-8o,Dozens of WWII Planes Fly Through Restricted D.C. Airspace for V-E Day | National Geographic,1m 24s,2015-05-08T22:47:35Z
3ZvNYIrJgEY,Arianna Huffington on Meditation | StarTalk,2m 53s,2015-05-08T14:00:01Z
vcj4pVhUY0g,Ice Highway - Behind the Scenes | Life Below Zero,3m 18s,2015-05-08T13:00:02Z
7VxMwKETtUg,Turning Cigarette Butts Into Park Benches | National Geographic,2m 45s,2015-05-07T18:00:01Z
XNac_bRB36M,How the Huffington Post Elevated Blogging | StarTalk,2m 58s,2015-05-07T14:00:00Z
sPgLJrk0sGQ,Oil-Eating Bacteria Could Be a Solution to Spill Cleanups | National Geographic,3m 25s,2015-05-07T13:34:16Z
480ZdYW8HvM,Case File Pupdate: Isaboo | Cesar 911,2m 24s,2015-05-07T12:00:01Z
MLI6KlbSYXY,Case File Pupdate: Stella | Cesar 911,2m 49s,2015-05-06T23:00:00Z
zFFr-RExQ5o,Case File Pupdate: Chloe | Cesar 911,2m 5s,2015-05-06T20:54:01Z
lt9BFrJz5Dc,Survivors Share Personal Stories From Nepal Earthquake | National Geographic,4m 28s,2015-05-06T16:00:07Z
NdYbCQElj5c,Sharing in the Information Age | StarTalk,2m 12s,2015-05-06T14:00:06Z
1C8lpBJaYaY,90 Days in 90 Seconds: Life on the Mekong River | National Geographic,1m 31s,2015-05-06T12:30:01Z
o5IefzzEbcI,Oversharing on Social Media | StarTalk,2m 54s,2015-05-05T14:09:00Z
9jUcZmQGxKw,Stand Next to the Sun Without Burning to Death | National Geographic,3m 46s,2015-05-05T12:30:01Z
H1ewknXkwwo,Catch of the Week - Deckhand in Charge | Wicked Tuna,2m 49s,2015-05-04T21:00:01Z
iiF0RszZliM,Sex and Fruit: The Sweet Life of Bonobos | Nat Geo Live,2m 43s,2015-05-04T17:31:55Z
xwhejsHjqlA,One Flower to Feed Them All | Nat Geo Live,3m 57s,2015-05-04T15:00:06Z
f_EiR4PGxsY,Reel Talk Ep. 11 - Three's a Charm | Wicked Tuna,18m 12s,2015-05-04T14:43:12Z
Z503BL6eRjw,Moons vs. Moon Words | StarTalk,1m 35s,2015-05-04T14:00:03Z
4NP097_L0WM,Photographing the Real Detroit | Exposure,3m,2015-05-04T12:30:01Z
GNLL1XjVH28,Neil deGrasse Tyson on Dan Savage | StarTalk,1m 10s,2015-05-03T14:00:01Z
iD-7LGK4x48,Discussing the Science of Sex | StarTalk,1m 29s,2015-05-02T14:00:05Z
uOFJsCeovTo,Chernobyl Fox Makes a Six-Layer Sandwich | National Geographic,1m 21s,2015-05-02T13:00:03Z
onQzDPuhx9A,Dan Savage Discusses Relationships | StarTalk,2m 40s,2015-05-01T14:00:02Z
3pOfXemAz7I,The Unknown - Behind the Scenes | Life Below Zero,3m 54s,2015-05-01T13:00:00Z
789EvgcMZGY,Amazing Photos - Exploring a Dolphin’s World | Exposure,3m 15s,2015-05-01T12:30:00Z
Zss_4EpJj20,In Defense of the One-Night Stand | StarTalk,2m 51s,2015-04-30T14:00:00Z
bF5XycL-Cgc,Real-Life Teddy Bears of the Rain Forest | Expedition Raw,3m 21s,2015-04-30T12:30:01Z
dk4k1QfYl5Y,Social Monogamy vs. Sexual Monogamy | StarTalk,2m 43s,2015-04-29T14:00:00Z
ZdJYKRg99Pw,Exclusive: Deep-Sea Sharks and More Spotted by New Camera | National Geographic,5m 24s,2015-04-29T12:30:01Z
TgOJ-j0N__0,Sex Explained | StarTalk,2m 28s,2015-04-28T14:00:01Z
_bnur3gHJ0s,Here's What We Know About Dolphin Intelligence | National Geographic,5m 4s,2015-04-28T12:30:00Z
mgAlwGH1CcY,Reel Talk Ep. 10 - When Push Comes To Shove | Wicked Tuna,19m 50s,2015-04-27T17:00:03Z
BZz8fUoAu_k,Adventure on the Okavango: The Data Artist | Nat Geo Live,11m 48s,2015-04-27T15:00:01Z
JerMaUzoJEc,Catch of the Week - Back in Business | Wicked Tuna,2m 21s,2015-04-27T14:00:00Z
trVZ8s3jhlU,Why These People Love Detroit | National Geographic,5m 50s,2015-04-27T12:30:31Z
eFAvNyluYi8,How to Move a Two-Ton Elephant to Safety | Short Film Showcase,5m 31s,2015-04-25T14:00:00Z
AatG1KQfVMM,Scientific Accuracy in Film | StarTalk,1m 33s,2015-04-24T14:00:02Z
dciO-dw05mE,Stolen 2,600-Year-Old Sarcophagus Other Artifacts Return to Egypt | National Geographic,2m 36s,2015-04-24T12:00:01Z
MLJtKP6juYU,Out of Control - Behind the Scenes | Life Below Zero,3m 6s,2015-04-24T01:00:01Z
IVC5zEHK8vo,The Big Bang - Fan Questions | StarTalk,1m 24s,2015-04-23T14:00:00Z
GnhutCvbQNo,Wolverine Research Isn’t Pretty | Expedition Raw,3m 25s,2015-04-23T12:00:00Z
D3QIo3mEnfc,Neil deGrasse Tyson Reveals Dream StarTalk Guestlist | StarTalk,1m 37s,2015-04-22T14:00:00Z
hKz_qD1dvVg,Utah Bears End Hibernation Early. That Could Be a Problem | National Geographic,2m 21s,2015-04-22T12:30:00Z
-KaZXFOe1ac,Neil deGrasse Tyson on Christopher Nolan | StarTalk,2m 8s,2015-04-21T14:00:00Z
TZyrkrlqyQ4,Exclusive: Rare Ghost Monkeys Filmed in Colombia | National Geographic,5m 49s,2015-04-21T12:30:01Z
eBREBAnglrQ,Neil deGrasse Tyson Reads Mean Tweets - Pluto Edition | StarTalk,2m 16s,2015-04-20T21:18:53Z
lE_AJdZYxg8,Catch of the Week - Hat Trick for Hard Merch | Wicked Tuna,2m 37s,2015-04-20T18:30:01Z
zxNPrIqs4ak,George Takei and the Acting Bug | StarTalk,1m 41s,2015-04-20T16:00:11Z
XiZH4xuDoJM,Adventure on the Okavango: The Conservationist | Nat Geo Live,10m 13s,2015-04-20T15:00:04Z
ef4CQ8mMiww,Amateur Photographers Get to Be Nat Geo Photo Editors | National Geographic,4m 21s,2015-04-20T12:30:01Z
AKZLS6FTrWA,Reel Talk Ep. 9 - Wicked Pissed | Wicked Tuna,15m 22s,2015-04-20T01:30:00Z
W-wahVm2_zU,Neil's Favorite Female Scientists - Fan Questions | StarTalk,1m 19s,2015-04-19T14:00:00Z
Aat9O85ynsI,Meditative Snow Monkeys Hang Out in Hot Springs | Short Film Showcase,3m 5s,2015-04-18T14:00:01Z
8efUPKN_74U,Neil deGrasse Tyson on George Takei | StarTalk,1m 27s,2015-04-18T14:00:00Z
NAgGCNHQUI0,Deleted Scene: Chicken Coop Conditioning | Cesar 911,2m 7s,2015-04-18T02:00:00Z
QV14okDcbSQ,Armed For Winter - Behind the Scenes | Life Below Zero,3m 34s,2015-04-17T21:25:10Z
4n_kX7uyvqI,Outhouse to the Penthouse | Wicked Tuna,2m 49s,2015-04-17T19:00:01Z
AvcE-lf5Wgo,Rock-Climbing China: A Vertical Journey | Nat Geo Live,8m 50s,2015-04-17T15:00:00Z
pbJ8MXDOK7U,Bat Man of Borneo | Expedition Raw,1m 10s,2015-04-17T12:30:00Z
uloACOKfJts,Rock-Climbing China: A Stone Forest | Nat Geo Live,9m 56s,2015-04-16T15:42:28Z
PNwyO3ayYm0,Divers Search for Tiny Animals in Iceland’s Fissures | Expedition Raw,2m,2015-04-16T12:30:00Z
UkATPicHIo4,The Gulf Oil Spill Disintegrated This Island | National Geographic,2m 37s,2015-04-15T18:03:22Z
