Video ID,Title,Length,Published,Region Restriction Count
X4NHXdXpxAM,Alaska the Final Frontier (Clip) | Alaska: The Next Generation,4m 25s,2022-12-26T16:00:22Z
xuRpF9RnrOM,Sunken Treasures (Full Episode) | Drain the Oceans,47m 23s,2022-12-25T16:00:31Z
M0ZTFrsidwA,Imagine having to do to all this for a snack... #NatGeo #Jaguar #Shorts,42s,2022-12-24T16:00:15Z
ERKRzXY47k4,Trafficked With Mariana van Zeller | Season 3 Trailer | National Geographic,1m 56s,2022-12-22T18:09:49Z
0Ge2E_tyvyU,The Struggle Begins (Full Episode) | Life Below Zero: Next Generation,44m 25s,2022-12-22T16:00:00Z
5KKz7TRcjdU,Power Under Pressure: Getting it Done (Clip) | Alaska: The Next Generation,3m 21s,2022-12-21T16:00:02Z
wjC71u9bP48,What Science Tells Us About Living Longer | Podcast | Overheard at National Geographic,27m 8s,2022-12-21T00:29:56Z
u7Tww3x1kvM,Caption this #PhotoArk #Shorts,19s,2022-12-20T16:00:24Z
0a8FgAQNSDA,Traps on the Land (Clip) | Alaska: The Next Generation,3m 17s,2022-12-19T23:53:43Z
9G69n11o3z8,Cleopatra's Lost Tomb (Full Episode) | Lost Treasures of Egypt,44m 25s,2022-12-18T16:00:04Z
QIhADNqR1hY,The perfect wedding date doesn’t exi— 🕺 #shorts,29s,2022-12-16T19:35:04Z
IHm4Jsu4BLw,The Science Behind James Cameron’s Avatar: The Way of Water | National Geographic,3m 15s,2022-12-16T18:09:06Z
HvjEjZFGpAQ,I Went Bonkers... (Full Episode) | Something Bit Me,44m 24s,2022-12-15T21:37:37Z
UbaoQK_Ksjw,Black Market Artifacts: Smuggled Monoliths (Clip) | To Catch a Smuggler | National Geographic,3m 22s,2022-12-14T15:59:55Z
jQvnk2cRye8,The stunning colors of #Ethiopia #shorts,31s,2022-12-13T16:00:30Z
fJH_j_F_anU,Taxes vs Duty (Clip) | To Catch a Smuggler | National Geographic,3m 24s,2022-12-12T15:59:51Z
mPWMu_l32lU,Ultimate Battleships (Full Episode) | Drain the Oceans,47m 23s,2022-12-11T16:00:31Z
0NVseSphwv4,Drugs for a Fine (Clip) | To Catch a Smuggler | National Geographic,3m 48s,2022-12-09T15:59:46Z
Co5b0mpuaiA,Take a deep breath and stay as long as you'd like 🌊😌 #shorts,57s,2022-12-08T16:00:07Z
_BIbNq6Oe6U,Hidden Pills (Clip) | To Catch a Smuggler | National Geographic,3m 3s,2022-12-07T15:59:48Z
NLreaVcVgZk,The People Behind the Photography | Podcast | Overheard at National Geographic,23m 51s,2022-12-06T12:59:51Z
xuAW6kppkoA,Ever heard of a moonbow?🌈 #shorts,26s,2022-12-05T17:15:01Z
XqyC5QrvrIw,Nazi Secrets (Full Episode) | Drain the Oceans,46m 54s,2022-12-04T16:00:21Z
RZsrhhdGN6U,Where does the scalloped hammerhead get its name? #shorts,17s,2022-12-03T16:00:11Z
TyjOoxDGMkI,Into the deep ocean... #shorts,40s,2022-12-02T17:00:17Z
qR_EchGlBeE,Mystery of the China Seas (Full Episode) | Drain the Oceans,47m 23s,2022-12-01T16:00:21Z
L2Z57erSarc,Suspicious Shampoo (Clip) | To Catch a Smuggler | National Geographic,3m 23s,2022-11-30T15:59:47Z
vSA4CVYwFRU,Protecting the ancient seqouia #Yosemite #shorts,43s,2022-11-29T16:00:33Z
cEnA0T1s6KI,There’s a Bear in My Backyard | Podcast | Overheard at National Geographic,31m 11s,2022-11-29T12:59:56Z
2Tn_wk12yB4,Fool's Gold (Clip) | To Catch a Smuggler | National Geographic,3m 39s,2022-11-28T15:59:48Z
c5GbodqKVT8,Black Market Marijuana (Full Episode) | Trafficked with Mariana Van Zeller,44m 25s,2022-11-27T16:00:16Z
rrqW_OFeObY,Would you accept this dinner invite? #shorts,28s,2022-11-25T22:15:01Z
l0lABRVgFyQ,Meth in the City (Clip) | To Catch a Smuggler | National Geographic,3m 36s,2022-11-25T15:59:55Z
tiTFo4mCpbc,The Ice Harvest (Full Episode) | Alaska: The Next Generation,44m 25s,2022-11-24T16:00:34Z
YI8FtXDMaTk,Rhinoplasty Confusion (Clip) | To Catch a Smuggler | National Geographic,3m 47s,2022-11-23T15:59:48Z
sGO92FCq5b8,Drug busts worth millions on #ToCatchASmuggler #shorts,1m 1s,2022-11-22T16:00:23Z
BoBapnk6TB8,Egypt's Lost Wonders (Full Episode) | Drain the Oceans,47m 23s,2022-11-20T16:00:04Z
7JD1qY5ChKc,Good reef! 🐠 This current isn't playing games. #shorts,23s,2022-11-19T21:00:02Z
mwiTNqQEPp4,Ever been caught in a fish tornado? 🐟🌪️ #shorts,32s,2022-11-18T20:08:47Z
CpiOk_KuDTM,Barberfish remove parasites from larger fish #coralreef #reef #fish #coolfish #shorts,29s,2022-11-18T01:00:10Z
OQz-efDv01k,🔴 LIVE: What Does It Take To Catch a Smuggler? Watch Now | National Geographic,livestream,2022-11-17T18:34:34Z
FLkwu--ynB4,10 million #bats migrate to Kasanka National Park at the start of the rainy season. #shorts,26s,2022-11-16T20:00:04Z
_egCdIA234w,The mystery of the missing toothpaste... #whodunnit #shorts,30s,2022-11-15T20:00:11Z
BT1Sos7zbkE,Pictures of the Year 2022 | Podcast | Overheard at National Geographic,30m 11s,2022-11-15T12:59:54Z
iEWyT92RU1w,Smooth shots with spinner dolphins #spinnerdolphins #shorts,40s,2022-11-14T17:00:27Z
HCoEwVtiR54,Escape from New York (Full Episode) | Doomsday Preppers,45m 24s,2022-11-14T16:00:20Z
qeDs3JC4Ft8,Electroreceptors in their heads help #hammerheadsharks sense electricity⚡ #shorts,38s,2022-11-13T17:00:39Z
XJXaRBe7ZzQ,Maybe this was a bad idea... #lightning #thunderstorms #shorts,27s,2022-11-12T17:30:05Z
gJMS_uVWQS8,Fentanyl Within (Full Episode) | To Catch a Smuggler,44m 25s,2022-11-12T16:00:21Z
8td6EwrH8rk,Fur seals are bouncing back… but they can be naughty! #furseal #seals,24s,2022-11-11T17:00:05Z
3N6YwZSzofE,Simu Liu (Full Episode) | Running Wild with Bear Grylls: Challenge,44m 30s,2022-11-11T16:43:29Z
F5a-PKfNupA,This one's a little feisty! #antarctica #leopardseal #shorts,28s,2022-11-10T17:30:01Z
FhZxZQkJwwY,The Trouble with Ollie | Cesar Millan: Better Human Better Dog,5m 23s,2022-11-09T21:00:07Z
f_5gCRq0fBU,Ancient giants of the ocean #finwhales #antarctica,32s,2022-11-09T17:00:25Z
SWptb9D2j-k,What's this polar bear dreaming of? #shorts,14s,2022-11-08T17:00:28Z
c7Mhozi9Ix0,Tiffany Haddish: Movie Magic (Full Episode) | Brain Games,44m 25s,2022-11-08T16:00:17Z
ju-eNwQhm7o,Who Inspired Wakanda’s Women Warriors? | Podcast | Overheard at National Geographic,27m 18s,2022-11-08T12:59:49Z
gaabPkONJ4Q,Retrograde | Official Trailer | National Geographic Documentary Films,2m 11s,2022-11-07T19:30:11Z
PXtcDGzYuTQ,This gator's got game. #shorts,29s,2022-11-06T16:00:20Z
LpLMCQvS9YI,Living on the Edge (Full Episode) | Life Below Zero: Next Generation,44m 25s,2022-11-05T15:00:22Z
PVARrWKawck,Did you know? Brown bear edition #shorts,18s,2022-11-05T15:00:16Z
GE_M6dIpHFc,Snack time! #shorts,30s,2022-11-04T15:00:15Z
9hPK0SihAIY,Incredible swarm behavior #honeybees #nepal #shorts,22s,2022-11-03T15:00:13Z
6CcZLXO_TLE,Meet Sierra: Moving Forward | Cesar Millan: Better Human Better Dog,4m 54s,2022-11-02T18:00:03Z
Vo_dXLdmUAQ,A shimmering style icon #shorts,15s,2022-11-02T15:00:22Z
a13MgHQaZ90,Baby elephants all day every day #babyanimals #shorts,17s,2022-11-01T15:35:58Z
2tvo36_4xwU,Wayfinding Through the Human Genome | Podcast | Overheard at National Geographic,31m 31s,2022-11-01T11:59:46Z
XY6jo6S8I7Y,Survival is an Ugly Beast (Full Episode) | Doomsday Preppers,44m 25s,2022-10-31T15:00:32Z
XB0JkYO9B_8,Handling Hendrix: Guard of the Yard | Cesar Millan: Better Human Better Dog,4m 41s,2022-10-31T15:00:21Z
NYXXXBnq7kE,Everything Went Dark (Full Episode) | Something Bit Me,44m 25s,2022-10-29T15:00:18Z
MAI_oZ6S3FQ,Volcanoes AND chocolate? Yes please! #shorts,1m,2022-10-28T19:14:48Z
PNzIcakql60,Silent Biter: Meet Freddie | Cesar Millan: Better Human Better Dog,2m 19s,2022-10-28T15:00:16Z
A1exaSamty0,Introducing our top travel picks for 2023! 🌏 Which will you visit? #BestoftheWorld #shorts,13s,2022-10-26T18:00:04Z
alHDQimEtek,Exploring the Active Volcano of Mauna Loa | National Geographic,14m 14s,2022-10-26T14:59:52Z
S3WiIY9Qukk,Foraging for Mushrooms in Olympic National Park | National Geographic,15m 7s,2022-10-26T14:59:51Z
5p8wPs3vGmc,Tidepooling along the Pacific Coast | National Geographic,15m 39s,2022-10-26T14:59:50Z
XQ4Ffpr4fL0,Exploring the Glaciers of Snoqualmie National Forest | National Geographic,14m 5s,2022-10-25T19:37:14Z
mUmkaYV420M,Discovering Resilience in the Oregon high desert | National Geographic,17m 17s,2022-10-25T19:37:11Z
IAT_igLQAb8,Meeting Zoe the Chihuahua | Cesar Millan: Better Human Better Dog,3m 22s,2022-10-25T17:00:19Z
E6n1VS18S-Y,Presenting: Greeking Out by National Geographic Kids | Podcast | Overheard at National Geographic,24m 25s,2022-10-25T11:59:55Z
0jZlAIUBSMc,Detroit Halloween (Full Episode) | Drugs Inc.,44m 25s,2022-10-22T15:00:00Z
T9mAEytnFWs,Assessing Molly's Eyes | Cesar Millan: Better Human Better Dog,4m 18s,2022-10-21T15:00:17Z
_LsbszcsoQo,The Hole Where King Tut’s Heart Used to Be | Overheard at National Geographic,27m 2s,2022-10-18T12:00:02Z
E3y2qYcr8Cs,Dog Therapy Stampede | Cesar Millan: Better Human Better Dog,4m 47s,2022-10-17T15:00:12Z
c3hPSJczrU0,Prepper's Paradise (Full Episode) | Doomsday Preppers,45m 25s,2022-10-15T12:00:25Z
IItT-K0Mg_w,Getting to the end alive #shorts,19s,2022-10-14T22:00:15Z
AySJH3oUMNA,Tasting Wild | Official Trailer | National Geographic,1m 8s,2022-10-13T16:00:07Z
aWYwQA-gS28,Hunted in the Arctic | Edge of the Unknown on Disney+,3m 42s,2022-10-13T15:00:03Z
cj3NQSrhuFM,When assessing the risks goes wrong #Avalanche #shorts,19s,2022-10-12T19:30:03Z
okaECR2_DzI,Super Reefs (Short Film) | Pristine Seas | National Geographic Society,11m 21s,2022-10-12T15:00:35Z
u_AVuJT76Uk,Coke Cakes and Cash (Full Episode) | To Catch a Smuggler,44m 25s,2022-10-11T15:00:39Z
D4KiBPS1lxo,Exploring Pristine Seas | Podcast | Overheard at National Geographic,26m 52s,2022-10-11T11:59:48Z
HgclNx4YXgA,Before Free Solo | Edge of the Unknown on Disney+,4m 6s,2022-10-10T15:00:19Z
RTlD4H-NRpI,Jack Black: Music (Full Episode) | Brain Games,44m 23s,2022-10-08T15:00:26Z
I8OorhtMrVY,Riding one of the largest waves in the world #EdgeoftheUnknown #shorts,19s,2022-10-06T19:00:05Z
SJPnK_NgHVI,Limitless with Chris Hemsworth | Official Trailer | Disney+,2m 21s,2022-10-06T16:05:01Z
DutFDl3AnXU,The Dangers of Climbing Helmcken Falls | Edge of the Unknown on Disney+,4m 6s,2022-10-05T15:00:08Z
4ABz55q8NvE,Canine Quarantine (Full Episode) | Cesar Millan: Better Human Better Dog,44m 25s,2022-10-04T12:00:02Z
gmINktHENug,What the Ice Gets the Ice Keeps | Podcast | Overheard at National Geographic,24m 48s,2022-10-04T11:59:49Z
_v1rrMuKtcI,Riding the Avalanche | Edge of the Unknown on Disney+,3m 27s,2022-10-03T15:00:25Z
5UGQ4XLjTek,Climbers face their fears at Helmcken Falls #shorts,19s,2022-10-02T18:00:03Z
AUFQ44Y3TRM,Stash House Takedown (Full Episode) | To Catch a Smuggler,44m 25s,2022-10-01T15:00:13Z
YVqREW6HhHw,Surrendering to the Unknown #shorts,19s,2022-09-30T16:40:05Z
4--9stmzQZ0,Fight or Die | Edge of the Unknown on Disney+,4m 31s,2022-09-29T15:00:04Z
a0VgHJOcpcs,Sacrifice pain and no margin for error in the #Himalayas #shorts,17s,2022-09-28T19:00:00Z
MkFLvg3E6Sk,Eaten by Jaws and Big Wave Surfing| Edge of the Unknown on Disney+,3m 19s,2022-09-27T15:00:15Z
fkqU0PXs9rQ,What You Do Counts | Podcast | Overheard at National Geographic,26m 15s,2022-09-27T11:59:50Z
5jQd9i9jA6Q,Drew Brees: Performance (Full Episode) | Brain Games,44m 24s,2022-09-27T02:15:22Z
lXJzhWwJFCo,Retrograde Teaser | National Geographic,1m,2022-09-23T19:57:36Z
sNFVKTyOeGM,Filming a Black Bear Swamp Crossing | America the Beautiful BTS | National Geographic,3m 13s,2022-09-23T14:59:52Z
H5QBPZD6_IU,Protecting the Okavango Ecosystem | National Geographic,3m 28s,2022-09-22T15:13:11Z
HTievOoZSkQ,Deadly Waters: Crocodiles and Adventure | Edge of the Unknown on Disney+,3m 44s,2022-09-22T15:00:21Z
iQxEHjXXI4Q,A whole new meaning to life on the edge #shorts,18s,2022-09-21T18:00:11Z
NZtHl-jbmiY,Party Drugs (Full Episode) | To Catch a Smuggler,44m 25s,2022-09-20T23:40:12Z
nM_0dmPnyjE,Filming Wolf Pups | America the Beautiful BTS | National Geographic,2m 54s,2022-09-19T14:59:46Z
20Y2yOpiPFI,The Hazards of High Altitude: A Mistake on the First Attempt | Edge of the Unknown on Disney+,4m 5s,2022-09-18T15:00:02Z
CwMvBxhovHY,Toys (Full Episode) | The 80s: Top Ten,44m 25s,2022-09-17T17:00:07Z
vq_Z4U4eX74,Tagging Hammerhead Sharks | Epic Adventures with Bertie Gregory on Disney+,1m 41s,2022-09-17T14:59:50Z
QKCN_ppi2yw,The Flagmakers | Official Trailer | National Geographic Documentary Films,2m 37s,2022-09-17T02:22:26Z
LV31YkT7bpg,Declaration of Independence (Full Episode) | Life Below Zero: Next Generation,44m 25s,2022-09-15T21:43:24Z
f0s8_FHTGfk,Catching Up with the Lion Cubs | Epic Adventures with Bertie Gregory on Disney+,1m 27s,2022-09-15T14:59:46Z
e1SrhkzITi0,Capturing a Glacial Timelapse | America the Beautiful BTS | National Geographic,3m 1s,2022-09-14T14:59:49Z
0c9XgvOLNhg,A Man of the World | Podcast | Overheard at National Geographic,25m 12s,2022-09-13T17:28:21Z
VF6Cq7qTDYY,Clattering Penguins and Naughty Seals | Epic Adventures with Bertie Gregory on Disney+,1m 57s,2022-09-13T16:59:48Z
YT8yLzC-9MM,Striking Footage of Pilot Whales | Epic Adventures with Bertie Gregory on Disney+,1m 29s,2022-09-12T14:59:46Z
yxqniR7BBH4,Being the Queen: The Life of Queen Elizabeth II | National Geographic (Full Episode),44m 25s,2022-09-10T02:13:28Z
QosTxX-v11s,Hawai'i's Volcanoes of Life | America's National Parks | National Geographic,5m 15s,2022-09-09T14:59:55Z
ksPe1_3Wc1s,Largest gathering of fin whales EVER seen #shorts,14s,2022-09-08T23:29:25Z
85efuFwCWDg,Witness the Majestic Fin Whale | Epic Adventures with Bertie Gregory on Disney+,2m 2s,2022-09-08T15:58:09Z
j4hMVt9Qcdo,Epic shenanigans with Bertie Gregory #shorts,52s,2022-09-07T20:30:04Z
csPy34t-dGQ,Will she take the leap? #EdgeoftheUnknown #shorts,17s,2022-09-07T17:59:43Z
VLCdP924Yys,Witness the ascent of a lifetime #EdgeoftheUnknown #shorts,18s,2022-09-07T00:01:25Z
LiN7VgNXfDs,Inside the Epic World of Bertie Gregory | Podcast | Overheard at National Geographic,22m 44s,2022-09-06T11:59:53Z
xBxI3ooG9iI,Watch elite climber Alex Honnold push the boundaries of possibility #shorts,31s,2022-09-06T00:35:40Z
ifZIo3oM6RY,Yosemite's Strangest Love Story | America's National Parks | National Geographic,3m 51s,2022-09-05T14:59:49Z
rspC_2ujO24,First Response (Full Episode) | 9/11: One Day in America,1h 14m 18s,2022-09-04T15:00:28Z
OOhmXZckmZA,Which would you see first? (It's the giant sequoias for us!) #shorts,47s,2022-09-02T18:00:07Z
kO9wgQbW7BA,Badland's Prairie Dogs vs Coyote | America's National Parks | National Geographic,4m 27s,2022-09-02T14:59:47Z
7e9yfJDbGpM,That last one though... Love is in the air in #AmericasNationalParks #shorts,40s,2022-09-01T18:00:06Z
nGtoS852LWg,Shark vs Sea Turtle: A Showdown #shorts,29s,2022-08-31T22:00:17Z
C9J6_HkN9S8,The Largest Gathering of Gigantic Fin Whales EVER FILMED | Epic Adventures with Bertie Gregory,1m 42s,2022-08-31T16:00:32Z
ZqwKWCugi1w,Filming Tree-Scratching Bears | America the Beautiful BTS | National Geographic,3m 8s,2022-08-31T14:59:54Z
b_hHbTCCSUs,Watch as these bison battle for domination #shorts,40s,2022-08-30T20:00:14Z
RP1pXYCu870,Big Bend's New Bear Cubs | America's National Parks | National Geographic,4m 40s,2022-08-29T22:20:33Z
NsZHsECVYTc,More Than a Grand Canyon | America's National Parks | National Geographic,3m 29s,2022-08-29T22:20:32Z
ouiZc_ur1zo,Introducing our national treasures #shorts,31s,2022-08-29T20:55:50Z
S4bygwU3XMc,Guardians of the Okavango | National Geographic,4m 18s,2022-08-25T13:06:56Z
XJQpD3j5m0M,Cocaine Shoes (Full Episode) | To Catch a Smuggler,44m 24s,2022-08-23T15:00:31Z
9O80JcdZT9s,The Problem with Super Chickens | Podcast | Overheard at National Geographic,29m 3s,2022-08-23T12:00:43Z
0tPfIk49Z7g,Photographing the Grand Canyon's Mountain Lions | America the Beautiful BTS | National Geographic,3m 37s,2022-08-20T14:59:51Z
L0oqdI0Bh4A,Watch Alex Honnold scale one of the Earth's tallest sea cliffs #Shorts Video courtesy Disney+,20s,2022-08-18T16:17:59Z
4l0RqdZNFlY,Oregon High (Full Episode) | Drugs Inc: The Fix,44m 24s,2022-08-16T17:00:05Z
6_4qC71mSMg,What It Takes to Keep America Beautiful | Podcast | Overheard at National Geographic,30m 22s,2022-08-16T11:59:49Z
AMV6758nosU,Hurricane Dorian (Full Episode) | Gathering Storm,44m 24s,2022-08-09T12:00:05Z
9CMEBklrdDM,The Triumph and Tragedy of Indian Independence | Podcast | Overheard at National Geographic,30m 5s,2022-08-09T11:59:52Z
qc0CvdsHvEc,Shark Side of the Moon | SharkFest | National Geographic,3m 57s,2022-08-07T15:00:35Z
y5tTdHIMA34,Luckily for Gibbs Kuguru humans weren’t on the menu #SharkFest #Shorts,52s,2022-08-05T22:25:19Z
_d6pE7Xcmq8,Edge of the Unknown with Jimmy Chin | Official Trailer | National Geographic,1m 31s,2022-08-04T18:59:51Z
AEdwplrrUF0,America's National Parks | National Geographic,1m 30s,2022-08-04T11:59:46Z
GDYEVR12aoE,Super/Natural | Official Trailer | Disney+,1m 22s,2022-08-03T16:54:46Z
iVOcBwtF78o,Epic Adventures with Bertie Gregory | Official Trailer | Disney+,1m 41s,2022-08-03T16:54:39Z
X7rpX7sJFi8,The Hills Have Eyes (Full Episode) | Dead By Dawn,44m 25s,2022-08-02T17:00:31Z
AuKJurf_8tc,Frank Drake’s Cosmic Road Map | Podcast | Overheard at National Geographic,32m 51s,2022-08-02T12:00:06Z
hEBiCjyRkf0,We all know moms are amazing but whale sharks take it to the next level #SharkFest #Shorts,49s,2022-08-01T20:00:11Z
h7v2SfbBvXg,Tiger Sharks' Superpowered Jaws | SharkFest | National Geographic,4m 47s,2022-07-31T15:00:32Z
-hnTi8yV-vY,Extreme Prep Edition (Full Episode) | Doomsday Preppers,45m 25s,2022-07-30T12:00:00Z
RFk5Go7AZCg,Sink your teeth into this tale from 492 B.C. #SharkFest #Shorts,48s,2022-07-29T23:00:18Z
_MooST6Hjno,Harnessing the Power of Yellowstone’s Supervolcano | Podcast | Overheard at National Geographic,32m 36s,2022-07-26T18:31:41Z
ooPblIAzIfA,Night of the Living Dead (Full Episode) | Dead By Dawn,44m 24s,2022-07-26T17:00:34Z
68hn025VLxc,There are a lot of shark gods—but Fiji has one of the coolest. #SharkFest #Shorts,38s,2022-07-25T19:00:02Z
UnqNlLXFKs4,Sky Sharks: Shark Surveillance | SharkFest | National Geographic,3m 50s,2022-07-24T15:00:17Z
xaFJabCy_7o,Slovenia's Outdoor Playground | National Geographic,2m 35s,2022-07-23T16:59:46Z
mODzdx9EJpY,I Suggest We Run (Full Episode) | Doomsday Preppers,45m 24s,2022-07-23T12:00:34Z
OqlWEP8gbCQ,Hard Hit Houston (Full Episode) | Drugs Inc: The Fix,44m 15s,2022-07-19T17:00:12Z
SuyzuEw6bIc,Stonehenge Has a Traffic Problem | Podcast | Overheard at National Geographic,24m 49s,2022-07-19T11:59:53Z
AwkOZXFJRQc,Tagging Tiger Sharks | SharkFest | National Geographic,4m 13s,2022-07-17T15:00:10Z
Zb2_AhdwSH0,Disaster Doesn't Wait (Full Episode) | Doomsday Preppers,45m 25s,2022-07-16T12:00:17Z
xAhAgHNWKTU,10 ways to show these creatures some love in honor of Shark Awareness Day! #SharkFest #Shorts,59s,2022-07-14T19:00:20Z
_UruavGn4fs,Shark Awareness Day | Pristine Seas | National Geographic,2m 31s,2022-07-14T14:59:49Z
Ja0Fdspxoro,TFW you realize you were photobombed by a shark. 🦈 #SharkFest #Shorts,31s,2022-07-13T17:00:23Z
nKu_3kp_EIY,The Skyjacker That Got Away: D.B. Cooper (Full Episode) | Undercover History,44m 24s,2022-07-12T15:00:25Z
00Z8iqSVtPA,Do Shark Stories Help Sharks? | Podcast | Overheard at National Geographic,33m 4s,2022-07-12T11:59:48Z
oggp1zVrcxE,Which shark species is the most massive? #SharkFest #Shorts,55s,2022-07-11T20:27:47Z
rcrkRTaKarQ,Camo Sharks: Breaching Test | SharkFest | National Geographic,3m 57s,2022-07-10T15:00:25Z
I6ACY41CAJ0,Close the Door Load the Shotgun (Full Episode) | Doomsday Preppers,45m 25s,2022-07-09T12:00:08Z
O5kScJae-0E,Golden Gate High (Full Episode) | Drugs Inc: The Fix,44m 5s,2022-07-05T17:00:12Z
KMgRULJWG9o,How Black Climbers Are Closing the Adventure Gap | Podcast | Overheard at National Geographic,26m 16s,2022-07-05T11:59:50Z
Qvw9w3N1TO4,It's Gonna Get Worse (Full Episode) | Doomsday Preppers,45m 24s,2022-07-02T12:00:27Z
BZy1XUTCiL4,Visit the Okavango Delta in 360° | National Geographic,3m 37s,2022-06-30T14:59:52Z
TlF8M_U7khI,L.A. Confidential (Full Episode) | Drugs Inc: The Fix,44m 5s,2022-06-28T17:00:15Z
y8hG0LxXzgU,She Shoots She Scores: Title IX Turns 50 | Podcast | Overheard at National Geographic,31m,2022-06-28T11:59:49Z
8RT34RC-IvA,Into the Spider Hole (Full Episode) | Doomsday Preppers,45m 25s,2022-06-25T12:00:08Z
wL9wvdbk7A4,The Territory | Official Trailer | National Geographic Documentary Films,2m 27s,2022-06-22T16:29:46Z
A1JOsKu-xIE,Sin City (Full Episode) | Drugs Inc: The Fix,44m 4s,2022-06-21T17:00:10Z
GkbtU4reQ48,This Indigenous Practice Fights Fire with Fire | Podcast | Overheard at National Geographic,26m 28s,2022-06-21T11:59:46Z
8j90EGB4rTg,National Geographic goes to space with Disney and Pixar's Lightyear,3m 26s,2022-06-20T22:00:12Z
JAV2lPR5mfc,Rise Again: Tulsa and the Red Summer | Full Documentary,1h 28m 31s,2022-06-19T12:00:17Z
0wOzaVP75ew,Nine Meals Away from Anarchy (Full Episode) | Doomsday Preppers,45m 25s,2022-06-18T12:00:02Z
D6_e6yKH26Q,Clan of the North (Full Episode) | Kingdom of the Polar Bears,44m 25s,2022-06-14T17:00:11Z
DeHUetwnzVg,Sonic Postcards from The Appian Way | Podcast | Overheard at National Geographic,34m 27s,2022-06-14T11:59:49Z
p8jYJQzcKpY,America The Beautiful | Official Trailer | Disney+,1m 54s,2022-06-13T16:00:40Z
sCxWutIeGnw,Friends Can Become Enemies (Full Episode) | Doomsday Preppers,45m 24s,2022-06-11T12:00:34Z
mEdN7gGfAZU,New Breed of Storms (Full Episode) | Storm Rising,44m 24s,2022-06-07T18:00:29Z
OiyNTeHI6GE,Restoring a lost sense of touch | Podcast | Overheard at National Geographic,29m 50s,2022-06-07T11:59:47Z
pW8HeVqF20M,It's All Gonna Hit the Fan (Full Episode) | Doomsday Preppers,45m 25s,2022-06-04T12:00:26Z
oMArx64RBO4,Fire of Love Trailer | National Geographic,2m 15s,2022-06-01T16:00:14Z
m8PnhEXvzFk,Of the Land (Full Episode) | BRAND NEW SERIES | Life Below Zero: First Alaskans,44m 25s,2022-05-31T17:00:13Z
U1q99Wr6nE0,Back to the Stone Age (Full Episode) | Doomsday Preppers,45m 20s,2022-05-28T12:00:16Z
Lk9QKRM_8Jo,Hoisted from Hell (Full Episode) | Extreme Rescues,44m 24s,2022-05-24T17:00:19Z
OoBR3wrk1ew,Where in the World is Jessica Nabongo? | Podcast | Overheard at National Geographic,21m 14s,2022-05-24T11:59:51Z
DKd3G37SGy8,Raiding a Killer Bee Hive | Primal Survivor: Escape the Amazon,4m 23s,2022-05-23T11:59:47Z
jB-CIuUZloM,Bullets Lots of Bullets (Full Episode) | Doomsday Preppers,45m 26s,2022-05-21T12:00:33Z
9s1ZF_qNmtg,Surviving a Coyote Ambush | Something Bit Me!,3m 27s,2022-05-19T11:59:50Z
51dzWMMDok8,Sunken Survivor (Full Episode) | Extreme Rescues,44m 24s,2022-05-17T17:00:03Z
gjOgSlv8Z94,Encountering a Blind Worm Snake | Primal Survivor: Escape the Amazon,2m 12s,2022-05-16T11:59:50Z
B9CBe-MG7t4,The Science Behind Marvel Studios' Multiverse of Madness | National Geographic,1m 31s,2022-05-13T19:59:49Z
khyuH_QfoWU,Lost at Sea (Full Episode) | Extreme Rescues,44m 24s,2022-05-10T17:00:20Z
XWSY4GcFcLA,Greening of Pittsburgh | Podcast | Overheard at National Geographic,24m 58s,2022-05-10T11:59:46Z
W2Q2gLxRWhA,An Encounter With an Electric Eel | Primal Survivor: Escape the Amazon,2m 47s,2022-05-09T11:59:53Z
5kB80aO3O0U,Taking the World Stage (Full Episode) | North Korea: Inside the Mind of a Dictator,44m 24s,2022-05-07T11:59:51Z
-eYaSwwmGl4,We Feed People | Official Trailer | Disney+,2m 3s,2022-05-05T15:59:46Z
mhjjyQmqfGs,Bleeding Out (Full Episode) | Extreme Rescues,44m 24s,2022-05-03T16:59:51Z
psSHkzn2N2Q,Going Undercover to Save Manta Rays | Podcast | Overheard at National Geographic,36m 18s,2022-05-03T11:59:46Z
SijwWTuJoBU,Surviving an Alligator Attack | Something Bit Me!,7m 41s,2022-05-02T11:59:49Z
9qRxNYuR2c4,Dictator's Dilemma (Full Episode) | North Korea: Inside the Mind of a Dictator,44m 24s,2022-04-30T11:59:46Z
Q49IdRBZKcQ,Encountering an Anaconda | Primal Survivor: Escape the Amazon | National Geographic,2m 52s,2022-04-27T11:59:46Z
vACpSrJSXhA,Farming for the Planet | Podcast | Overheard at National Geographic,16m 22s,2022-04-26T19:59:47Z
l-YcpwsKPhA,Disaster Strikes (Full Episode) | Extreme Rescues,44m 24s,2022-04-26T16:59:47Z
9udjtZwIQpY,Surviving a Box Jellyfish Attack | Something Bit Me!,3m 6s,2022-04-25T11:59:49Z
plalHGHwSj8,The Curse of the Bermuda Triangle (Full Episode) | Atlas of Cursed Places,44m 24s,2022-04-23T11:59:53Z
WuLevNeUAss,Harvesting Wild Honey in the Amazon | Primal Survivor: Escape the Amazon | National Geographic,3m 10s,2022-04-20T11:59:46Z
dJFuK_oikQk,Back from the Dead (Full Episode) | Extreme Rescues,44m 24s,2022-04-19T17:00:13Z
hqhHysX4_MQ,The Secret Life of Plants | Podcast | Overheard at National Geographic,21m 41s,2022-04-19T11:59:50Z
uhNOHzcqh2w,Into the Ocean | Branching Out | Part 3,7m 33s,2022-04-18T19:59:48Z
zeapD6XjtYk,Little Farms Big Movement | Branching Out | Part 2,8m 2s,2022-04-18T16:59:48Z
vOmLKN8yu5k,Into the Forests | Branching Out | Part 1,9m 2s,2022-04-18T14:59:50Z
c5jdecvumgA,A Nat Geo Earth Day Adventure | Branching Out | Trailer,1m 57s,2022-04-18T11:59:51Z
XYzJBJi_5S0,Counterfeiting (Full Episodes) | Trafficked with Mariana Van Zeller,47m 22s,2022-04-16T11:59:50Z
58jV7lf0FAw,Surveying The Angolan Highlands | National Geographic,3m 32s,2022-04-13T11:59:50Z
MOvS7w9ceFY,Solving the Mystery of the Boiling River | Podcast | Overheard at National Geographic,34m 37s,2022-04-12T11:59:53Z
ZSLxec0lJKc,Surviving a Hippo Attack | Something Bit Me! | National Geographic,3m 58s,2022-04-11T11:59:49Z
uj1nnnCPAKA,Fentanyl (Full Episode) | Trafficked with Mariana Van Zeller,47m 22s,2022-04-09T11:59:54Z
vmPredMTXpg,Explorer: The Last Tepui Trailer | National Geographic,1m 57s,2022-04-08T14:59:49Z
ivWUZf2-M_U,Scams (Full Episode) | Trafficked with Mariana Van Zeller,47m 22s,2022-04-02T11:59:46Z
N9VBHi_j7AY,Behind the Scenes of Marvel Studios' Moon Knight | National Geographic,1m 31s,2022-03-30T11:59:47Z
ATvKJ_HftNs,Apocalypse (Full Episode) | The Story of God with Morgan Freeman,50m 19s,2022-03-29T16:59:47Z
gHZcW1Vnh0s,Queens of the High Seas | Podcast | Overheard at National Geographic,25m 43s,2022-03-29T11:59:48Z
4W_P_Yxhnt0,Bin Laden's Hard Drive | Full Episode,44m 24s,2022-03-26T11:59:51Z
BtCLZbZSreY,Summer of Soul | National Geographic,1m 31s,2022-03-25T14:59:53Z
WoTzliYivSY,Exploring Iceland in Winter | National Geographic,2m 42s,2022-03-24T13:29:47Z
