Video ID,Title,Length,Published,Region Restriction Count
fp-8UEtpffQ,He Hears Music in the Quietest Place on Earth—Can You? | Short Film Showcase,9m 57s,2017-06-27T12:00:05Z
YsjfnguQo4U,Listen: Cougars Are Terrified of Human Chatter | National Geographic,1m 6s,2017-06-26T20:00:03Z
I76lavqaoh8,Watch: Man Removes 'World's Deadliest Snake' from Home | National Geographic,1m 34s,2017-06-26T15:00:02Z
Cpsr33bN4oM,Dog Meat Sales Continue at Chinese Festival Despite Expected Ban (GRAPHIC) | National Geographic,1m 27s,2017-06-25T17:00:00Z
5G_c-yruYCY,See Inside Russia's Famed Mariinsky Ballet Theatre | National Geographic,2m 7s,2017-06-25T12:00:00Z
DqV3V49NoHs,Why Four Cowboys Rode Wild Horses 3,000 Miles Across America (Part 3) | Nat Geo Live,13m 7s,2017-06-24T11:59:53Z
g2ba63x1N9A,Watch: Elephants Rescue Their Baby From a Pool | National Geographic,1m 7s,2017-06-23T20:00:02Z
wk9xoPhcaUY,Like Spider-man This Spider Shoots Silk to Attack Its Prey | National Geographic,1m 20s,2017-06-23T15:00:12Z
l9R0bkYYbvc,Experience a Historical Russian Bathhouse | National Geographic,2m 14s,2017-06-23T12:00:07Z
wN1eQ9sfuk4,Watch a Croc's Brutal Death Roll | Boss Croc,2m 6s,2017-06-23T12:00:07Z
WLTUNDpb4qw,Spouts of Hope | Chasing Genius | National Geographic,4m 15s,2017-06-22T17:00:02Z
VfgJfqurpR4,Life in Flight | Chasing Genius | National Geographic,3m 35s,2017-06-21T17:00:02Z
qdjo9UiDSZY,This Russian Palace is Home to 150 Fountains | National Geographic,2m 16s,2017-06-21T12:00:06Z
kBFJ7HtbizA,It’s a Rough Life for Baby Crocs | Boss Croc,2m 39s,2017-06-21T12:00:05Z
ynN39sfqT8w,Coal Mining's Environmental Impact | From The Ashes,2m 54s,2017-06-20T23:00:03Z
6lis0RQLNAs,Rare Video: Cougar Pounces on Deer | National Geographic,50s,2017-06-20T17:00:00Z
74yhlpQntkc,My Water Is Not Safe to Drink | From The Ashes,2m 29s,2017-06-20T15:00:01Z
MUahMBzm_DM,A Mysterious Fungus Is Killing Rattlesnakes | National Geographic,4m 9s,2017-06-20T12:00:01Z
sPyAQQklc1s,Lions 360° | National Geographic,4m 31s,2017-06-19T21:32:52Z
bfSdu30J59k,Stranded Beluga Whale Rescued Flown Back to Sea | National Geographic,1m 24s,2017-06-19T17:00:04Z
H2GBXlrLkC4,Adorable Raccoon Babies Make Human Friend | National Geographic,1m 55s,2017-06-19T15:00:02Z
bFwhvvIw2zw,The Hidden Girls of Afghanistan | Explorer,1m 43s,2017-06-18T17:00:04Z
JFqcxVaXfBc,These Two Young Bushmen Hope for a New Life in the Modern World | Short Film Showcase,29m 5s,2017-06-18T15:00:02Z
sQGjiieee-A,The Letter That Led to the Atomic Bomb | Genius,2m 12s,2017-06-18T12:00:04Z
DsLvf7q-9N0,Explorers Festival Saturday June 17 | National Geographic,5h 56m 39s,2017-06-17T19:57:15Z
mX2Nq2EvMxc,Why Four Cowboys Rode Wild Horses 3,000 Miles Across America (Part 2) | Nat Geo Live,32m 14s,2017-06-17T11:59:51Z
wpYsvlYH3aw,Explorers Festival Friday June 16 | National Geographic,8h 15m 42s,2017-06-16T22:13:23Z
hOUQRdTAIus,Taking a Jet Pack Flight | Explorer,3m 26s,2017-06-16T20:00:01Z
JGIoAFelPis,Watch: Spider Battles Scorpion Twice Its Size | National Geographic,1m 11s,2017-06-16T17:00:02Z
YDdnS_SuZRg,Usually Enemies Bald Eagles Adopt Red-Tailed Hawk Chick | National Geographic,1m 16s,2017-06-16T12:00:03Z
gO7dftIZAGc,Explorers Festival Thursday June 15 | National Geographic,16m 15s,2017-06-15T23:51:47Z
eh4YU_Ix8pQ,A Little Bit of Hummingbird Love | Animal All-Stars,2m 27s,2017-06-15T20:00:02Z
aGPrX6o0hH8,These Slimy Fish Lips Are Made for Eating Coral | National Geographic,1m 12s,2017-06-15T20:00:00Z
CvFMS6ffXs4,Attacked for Being Albino Kids Receive Prosthetic Limbs and New Hope | National Geographic,1m 10s,2017-06-15T17:00:00Z
ZRN-Lu-m-oY,Meet a Beautiful Beetle That Loves to Eat Poop | National Geographic,4m 19s,2017-06-15T12:00:02Z
c1qHTXL5YmY,Here's What You Missed on Episode 8 | Genius,1m 6s,2017-06-14T23:00:01Z
R5JjATrT4Lk,Clingy Orangutan Gets Too Close For Comfort | National Geographic,1m 25s,2017-06-13T20:00:00Z
SxQLKBYNG5U,Watch: Owl 'Swims' for Its Life in Rare Video | National Geographic,1m 14s,2017-06-13T17:00:05Z
V-wFu_MeYjE,Defending Marine Wildlife | Explorer,3m 35s,2017-06-13T15:00:03Z
V-E2eu6jbL4,This Deep-Sea Lizard Fish Will Give You Nightmares | National Geographic,1m 2s,2017-06-13T12:00:01Z
IgwWJEA67Ls,This Sea Creature Does an Awesome Hermit Crab Impression | National Geographic,1m 52s,2017-06-12T15:00:02Z
YRegxovrh68,Wasp Paralyzes Spider—But the Food Fight Isn't Over | National Geographic,1m,2017-06-12T12:00:03Z
kfx9XH-1CTQ,Escape from ISIS Control | Hell on Earth,1m 45s,2017-06-11T23:00:02Z
EPJQ1QTxbBQ,Inside the Extraordinary Mind of a Pinball World Champion | Short Film Showcase,10m 38s,2017-06-11T15:00:01Z
9mXJK86GCsI,The Uncertainty Principle | Genius,2m 23s,2017-06-11T12:00:01Z
6hfecpOeGzA,Photo Walk in Napa Valley | National Geographic,45m 21s,2017-06-10T23:56:11Z
69RBm-Gw64g,A Napa Valley Nature Walk | National Geographic,36m 43s,2017-06-10T19:48:21Z
gsqlpcVEsqc,Elephant Family Bonds | Elephant: King of the Kalahari,3m 9s,2017-06-10T16:00:05Z
I63lqFupVmQ,Why Four Cowboys Rode Wild Horses 3,000 Miles Across America (Part 1) | Nat Geo Live,21m 53s,2017-06-10T12:00:01Z
1M5UR2HX00o,For Seagulls Mating Is a Balancing Act | National Geographic,54s,2017-06-09T20:00:01Z
aptQGskZios,Can You Tell a Monkey's Mood From Its Face? | National Geographic,1m 14s,2017-06-09T12:00:02Z
Et7_f-PfUxk,Ravens Like You Better When You're Being Fair | National Geographic,1m 7s,2017-06-08T20:00:00Z
rQP0x4gGKec,See How They Track Polar Bears in Russia | National Geographic,3m 16s,2017-06-08T17:00:09Z
RqMPeUvx9NQ,Take Me Back | 10 Days of Genius | National Geographic,6m 28s,2017-06-08T15:00:03Z
HuTGEsvOjKE,Are These the Oldest Modern Human Fossils Ever Found? | National Geographic,1m 2s,2017-06-08T12:00:00Z
2vF_iOJpC4Q,He Risked Death as First American to Explore Africa's Deepest Parts | National Geographic,3m 48s,2017-06-07T20:00:00Z
mHQXz5FctRg,Stick with Me | 10 Days of Genius | National Geographic,2m 16s,2017-06-07T15:00:09Z
rfRoH_ZZeEc,Here's What You Missed on Episode 7 | Genius,1m 24s,2017-06-07T12:00:05Z
mdExaXaqpFs,Siberian Tiger Rescued From City Streets Returned to Wild | National Geographic,1m 50s,2017-06-06T23:00:01Z
ut76F3Sgjcc,Gravity vs. Love | 10 Days of Genius | National Geographic,2m 28s,2017-06-06T20:00:12Z
CM5ufmcl4AA,Giant Spider Devours Cricket On Man's Hand | National Geographic,1m 20s,2017-06-06T17:00:00Z
fGRWwan8YEQ,Elephant vs. Rhino | Animal Fight Night,2m 51s,2017-06-06T16:00:02Z
9HoUDDetAg0,See First Video of Most Dangerous Rope-Free Climb Ever (Alex Honnold) | National Geographic,51s,2017-06-06T15:00:02Z
gxtjCvRmqmU,This Walking Fish Has Scientists Stumped | National Geographic,1m 45s,2017-06-05T17:00:07Z
kxU9ftFZJzQ,Curiosity | 10 Days of Genius | National Geographic,2m 46s,2017-06-05T15:00:03Z
8lS_ar5UpiU,Beneath Iran's Dusty Desert Lie Ancient Water Tunnels Still in Use | National Geographic,3m 13s,2017-06-05T12:00:00Z
zVRW47Xghbk,Female Snipers Fighting ISIS | Hell on Earth,2m 40s,2017-06-04T23:00:02Z
dRONKNCVnuo,These Are the Mental Health Pioneers | Explorer,4m,2017-06-04T17:00:02Z
1MkKUFnAV0M,Falling in Love | 10 Days of Genius | National Geographic,2m 14s,2017-06-04T15:00:00Z
40yqDWiEr_g,Einstein the Mad Scientist | Genius,2m 36s,2017-06-04T12:00:00Z
IW_Fe3Pa_4M,Close Call: Great White Shark Collides With Diving Cage | National Geographic,1m 16s,2017-06-03T20:00:02Z
OBRppKPXKuU,How to Protect Ostrich Eggs | Animal All-Stars,3m 27s,2017-06-03T20:00:00Z
c4dGMQC2aR4,When Pigs Fly | 10 Days of Genius | National Geographic,1m 36s,2017-06-03T15:00:03Z
NiVhWBsXdh8,See Why These Cute Little Goats Are the Latest Yoga Craze | Short Film Showcase,4m 6s,2017-06-02T20:00:00Z
evyunVf4u1A,Watch This Tarantula Crawl Out of Its Own Skeleton | National Geographic,1m 12s,2017-06-02T17:00:04Z
raUyrYRiqt4,Movement | 10 Days of Genius | National Geographic,6m 4s,2017-06-02T16:09:06Z
caCMooaCIsA,The Big Blue Bird | Dr. K's Exotic Animal ER,3m,2017-06-02T12:00:03Z
t-llelAbVWc,Renewable Energy For the People | From the Ashes,1m 26s,2017-06-02T00:22:12Z
rHyETkC8O7g,Where No Grid Has Gone Before | Breakthrough,2m 30s,2017-06-01T23:00:02Z
7W7hEUGtv4U,That's One Smart Bird | Animal All-Stars,2m 18s,2017-06-01T20:00:01Z
3VivE4h326U,Relativity Ramen | 10 Days of Genius | National Geographic,3m 22s,2017-06-01T15:00:00Z
BJpSS-nHbWg,Managing the New York City Power Grid | Breakthrough,2m 1s,2017-06-01T12:00:01Z
8xr9xdtYUE0,Here's What You Missed on Episode 6 | Genius,1m 20s,2017-05-31T20:00:01Z
R37B-Ov_gz8,The Mirror | 10 Days of Genius | National Geographic,2m 18s,2017-05-31T15:00:18Z
sQ8l3eCbxcc,Ruins—and Fierce Weaponry—From Bloody Roman Battle Discovered | National Geographic,1m 5s,2017-05-31T12:00:04Z
eAnYAiusIuE,A Tortoise Spa Day | Dr. K's Exotic Animal ER,2m 36s,2017-05-31T12:00:04Z
8KCQrLA3UKw,Watch: Killer Whales Charge Blue Whale (Rare Drone Footage) | National Geographic,1m 29s,2017-05-30T20:00:01Z
RGEYG8nHWf0,The Instrument | 10 Days of Genius | National Geographic,3m 59s,2017-05-30T14:59:48Z
vb3el-o55gA,Watch an Octopus Pursue Crab in Mesmerizing Chase | National Geographic,57s,2017-05-30T12:00:04Z
tDP-kF6Z6Bw,Orangutans Nurse Their Young For Much Longer Than You'd Think | National Geographic,55s,2017-05-29T17:00:07Z
tFOaKafBFEo,WATCH: Two of World's Deadliest Snakes Battle on Golf Course | National Geographic,1m 20s,2017-05-29T12:00:04Z
Rqe4QEtwQdU,This Empowering Memorial Honors the Legacies of Military Women | National Geographic,2m 49s,2017-05-28T20:00:02Z
0816-bn8Gg8,Tattoo Parlors Are Illegal in Cuba. This Guy Started One Anyway | Short Film Showcase,7m 13s,2017-05-28T15:00:00Z
okBpSCqrNFA,Squid: The Deep Sea Devils | Deep Sea Killers,3m,2017-05-27T20:00:04Z
p9boacxCgiE,My Life As an Adventure Filmmaker and Photographer (Part 3) | Nat Geo Live,32m 24s,2017-05-27T14:59:50Z
PSjFHODFlRc,Shelter From a Snowstorm | Primal Survivor,1m 39s,2017-05-27T12:00:02Z
w7zWGOGjLxs,The World's Biggest Wasp | Bite Sting Kill,3m 51s,2017-05-26T20:00:05Z
R6L6Gos33HI,Cooking With Cannabis | Assignment Explorer,3m 6s,2017-05-26T17:00:02Z
WyM-2BkQom8,First-Ever Look at the Intricate Way Ladybugs Fold Their Wings | National Geographic,1m 26s,2017-05-26T15:00:02Z
kJkOPLJhKDU,The Future of Weather Forecasting | Breakthrough,3m 12s,2017-05-25T23:00:01Z
cBL-5mOGHt8,The Biggest Spider on the Planet | Bite Sting Kill,3m 38s,2017-05-25T20:00:01Z
qX_zsnCbWd4,Why Science Says It's Good for Kids to Lie | National Geographic,5m 24s,2017-05-25T17:00:01Z
jx3wcdCtL58,Elevator Thought Experiment | Genius,2m 23s,2017-05-25T15:00:04Z
pv251g5oH1M,See What It Takes to Move a 1,100-Ton Stone Tomb | National Geographic,1m 24s,2017-05-24T17:00:04Z
hjcke3glWPk,Here's What You Missed on Episode 5 | Genius,1m 20s,2017-05-24T15:00:05Z
mLuUPb8urvA,Endangered Baby Bird Rescued and Returned to the Sea | National Geographic,1m 40s,2017-05-23T12:00:06Z
4ws4g72nsxw,Kangaroos...in Trees? | Paradise Islands,2m 26s,2017-05-23T12:00:01Z
gtTzh8_IbeI,Watch Rare Wild Sheep Run Up Steep Mountainside With Ease | National Geographic,1m 16s,2017-05-22T20:00:02Z
x225ncTb_Vc,A Day in the Life of 'The Dogist,' Pet Photographer Extraordinaire | Short Film Showcase,6m 14s,2017-05-21T20:00:02Z
dMz8mRlrzsE,Inside a Civil War Most People Have Never Heard of | National Geographic,9m 46s,2017-05-21T15:00:02Z
pTcboHrhEls,Einstein's Escape from Hitler | Genius,2m 37s,2017-05-20T20:00:02Z
phc7dVaO8kQ,How to Fix a Leaky Wooden Boat | Primal Survivor,3m 8s,2017-05-20T15:00:04Z
NtI7MsPIf-Y,My Life As an Adventure Filmmaker and Photographer (Part 2) | Nat Geo Live,29m 24s,2017-05-20T11:59:52Z
SC31SLia-WE,Watch: Clever Raven Outsmarts a Trash Can | National Geographic,1m 21s,2017-05-19T20:00:03Z
oeQsZupdMhUCyclops Goat Born in India | National Geographic,1m 7s,2017-05-19T17:00:04Z
k3gEr0mVCbA,Mystery Behind Narwhals' Iconic Tusks Revealed | National Geographic,1m 16s,2017-05-19T15:00:05Z
P0WDE5LHZSU,The Two Einsteins: Behind the Scenes | Genius,3m 9s,2017-05-19T12:00:01Z
aU4jcov7k5Y,Adorable Baby Owl Needs Help | Bandit Patrol,3m 8s,2017-05-19T12:00:01Z
87aFa0GA2Bc,Are Drones a Threat? | Breakthrough,3m 20s,2017-05-18T23:00:01Z
AdVTRL9_GAA,'T. rex' Ant Found Alive for First Time (Rare Species) | National Geographic,1m 14s,2017-05-18T12:00:00Z
ffzO7I4obMg,38 Million Pieces of Plastic Trash Cover This Remote Island | National Geographic,1m 4s,2017-05-17T20:00:02Z
ffXiLBWGV9s,Raja the Rowdy Kinkajou | Dr. K's Exotic Animal ER,3m 19s,2017-05-17T20:00:02Z
5P6Z7WHwcio,How Do You Get a Camera to Stick to a Manta Ray? Peanut Butter | National Geographic,1m 59s,2017-05-17T17:00:01Z
9LlEGteVWS0,Here's What You Missed on Episode 4 | Genius,1m 21s,2017-05-17T12:00:01Z
NyPuetyXBbc,360° Thought Experiment Trailer | Genius,46s,2017-05-16T23:00:00Z
P2BUDRzmFpM,Watch: Baby Kangaroo Rescued After His Mother Dies | National Geographic,1m 19s,2017-05-16T17:00:02Z
TZPrk9IZ3Jw,Once This Island Had Just One Tree—Look at It Now | National Geographic,1m 56s,2017-05-16T12:00:02Z
h-zHlyGnbBQ,Watch: Cape Seal Collides With Kayaker | National Geographic,1m 25s,2017-05-15T20:00:02Z
CehqV3lfayA,Newly Unveiled Dinosaur Fossil is Best Preserved Of Its Kind | National Geographic,50s,2017-05-15T17:00:02Z
yr30TZjQSdM,Watch: Buffalo Herd Charges Hyenas to Defend Calf | National Geographic,1m 31s,2017-05-15T12:00:06Z
k11l1qFfeYE,Slow Going Turtles: Bonus Scene - Ep. 9 | Untamed with Filipe DeAndrade,2m 8s,2017-05-14T20:00:01Z
Ov4MXWKMxjE,This Taxi Driver Has an Amazing Life Story You'll Want to Hear | Short Film Showcase,17m 51s,2017-05-14T17:00:03Z
ZrRBGGVTM38,Looking at Nat Turner's Legacy | Explorer,2m 21s,2017-05-14T15:00:03Z
mmU2NdYrVD8,Love and Science | Genius,2m 34s,2017-05-14T12:00:03Z
5j5TdORzgh0,My Life As an Adventure Filmmaker and Photographer (Part 1) | Nat Geo Live,19m 2s,2017-05-13T20:00:01Z
8OPNHU0RS_w,How to Make Your Own Fishing Line | Primal Survivor,2m 23s,2017-05-13T17:00:00Z
CeYrpijNVKc,Baby Animals Find Their Footing | Animal Moms,2m 26s,2017-05-13T12:00:03Z
Eb-5M0Jtt34,This Rock Climbing Kid Has a Hidden Strength: His Super Mom | Short Film Showcase,8m 59s,2017-05-13T12:00:00Z
ikxBeIQ-Qn0,Watch: Eel Swallows a Pufferfish Whole | National Geographic,1m 10s,2017-05-12T20:00:03Z
wvXfDeGdUUA,This Vibrant Fish Looks Crazy But It’s Pretty Lazy | National Geographic,50s,2017-05-12T15:00:06Z
ysJvO0V_3eA,An In-Depth Interview with Emily Watson From 'Genius' | Genius,2m 2s,2017-05-12T12:00:06Z
VnQnvRhgNPI,The Challenges with Cancer Trials | Breakthrough,3m 3s,2017-05-11T23:00:03Z
sJkEBpHcuTc,Croc vs. Roo | Australia's Deadly Monsters,2m 6s,2017-05-11T20:00:05Z
D_gQCjxyVec,Finding a Cancer Killer | Breakthrough,3m 22s,2017-05-11T12:00:01Z
Bouplz--hOg,How Would You Envision a Space Colony? | Short Film Showcase,8m 38s,2017-05-10T20:00:00Z
BmUQFxXaQK0,How I Got Arrested Working to Save Elephants | National Geographic,3m 24s,2017-05-10T15:00:00Z
cKw1_l3htvA,Alien: Covenant | In Utero A 360 Virtual Reality Experience | 20th Century FOX,2m 42s,2017-05-10T14:59:53Z
LZSsXRR_AYQ,Here's What You Missed on Episode 3 | Genius,1m 17s,2017-05-10T12:00:03Z
F-4q_vZOuYI,Watch a Gorgeous Time-Lapse of Monkeys in the Ethiopian Highlands | National Geographic,1m 6s,2017-05-09T20:00:01Z
19jvDaUWqBw,Ferocious Fight: Male Cuttlefish Battle Over Mate (Never Before Seen) | National Geographic,1m 9s,2017-05-09T15:00:00Z
qTy320CMO74,Shocking Footage of Baby Elephant Tossed Around by Adult Explained | National Geographic,3m 11s,2017-05-09T12:00:04Z
gCvv0SMOPGk,Baby Sea Turtles: The Hardest Animals to Film? - Ep. 9 | Untamed with Filipe DeAndrade,5m 49s,2017-05-09T12:00:03Z
YzTjKArGPTI,Under Sea Ice in Antarctica | Explorer,1m 50s,2017-05-08T23:00:00Z
26kSPQceaOQ,How One Orphaned Gorilla Inspired Her to Save Hundreds More | National Geographic,4m 49s,2017-05-08T20:00:00Z
RuGeeGRdYlQ,The Protectors Walk in the Ranger's Shoes (Full VR Documentary) | National Geographic,10m 27s,2017-05-08T16:00:02Z
cdDFibNI7DM,Discover This Island's Hidden Treasures in a Stunning Time-Lapse | Short Film Showcase,4m 8s,2017-05-08T15:00:03Z
cDpiLPP6pKA,She Fears Her Tribe's Story Will Be Forgotten | Short Film Showcase,13m 19s,2017-05-07T17:00:02Z
qfUrLteNu8E,This is the World’s Most Expensive Spice | National Geographic,3m 23s,2017-05-07T12:00:05Z
OxKBKWy9w2o,Finding Water in the Desert | Primal Survivor,3m,2017-05-06T12:00:03Z
5TW41aswu_Q,What Does 'Genius' Mean? | Genius,2m 59s,2017-05-05T23:00:01Z
yQhhPO9lAMU,Jeff Goldblum Joins Explorer | Explorer,1m 15s,2017-05-05T17:00:05Z
BsVnFOebK0s,Jumping Spider Seductions: Bonus Scene - Ep. 8 | Untamed with Filipe DeAndrade,1m 56s,2017-05-05T16:00:03Z
tnaj1ry25No,Watch: Great White Shark Feasts on Dead Whale | National Geographic,56s,2017-05-05T15:00:04Z
ytqHvToFssA,For Jumping Spiders Choosing the Wrong Mate Turns Deadly | National Geographic,1m 16s,2017-05-04T20:00:03Z
MZj8c6xxAls,Molecules Bumping Into One Another | Genius,2m 20s,2017-05-04T17:00:02Z
Pi3zJIW9OQU,A Hyena Queen Deposed | Animal Fight Night,3m 28s,2017-05-04T16:00:02Z
uaotkHlHJwo,LA 92 (Full Documentary) | National Geographic,1h 53m 47s,2017-05-04T15:00:07Z
68vxYRAony8,Crashing Into Saturn: This Cassini Mission Is the Most Epic Yet | Short Film Showcase,3m 55s,2017-05-04T12:00:00Z
BRW0U_H_Elg,Here's What You Missed From Episode 2 | Genius,1m 19s,2017-05-03T23:00:00Z
ZQ3y8U6Fbd4,Made in Space: 3-D Printing Could Change the Way Astronauts Travel | Short Film Showcase,8m 41s,2017-05-03T20:00:02Z
aCtvqKGYy0k,See Inside a 124-Mile-Long Cave | National Geographic,56s,2017-05-02T17:00:02Z
fQWcbHMeEMc,Cheetahs vs. Wild Dogs: Who Will Win This Food Fight? | National Geographic,2m 18s,2017-05-02T12:00:04Z
7Q1GwIMiczI,The Weird Sex Lives of Jumping Spiders: Ep. 8 | Untamed with Filipe DeAndrade,4m 50s,2017-05-02T12:00:01Z
rW1H9ZhymEw,See One of the World's Rarest Big Cats | National Geographic,58s,2017-05-01T20:00:03Z
GCoCaCL-uhc,POV: See Antarctica From the Back of a Whale | National Geographic,1m 43s,2017-05-01T17:00:02Z
ikLhknCsBLI,Cows for Cash | Explorer,1m 57s,2017-05-01T15:00:08Z
QpGV1QF2Qf4,Watch: Monkeys Forced to Perform in Circus on Nature Reserve | National Geographic,1m 31s,2017-05-01T12:00:03Z
yj8sAnZ6c3g,Mozart Helps Me Think | Genius,2m 49s,2017-04-30T23:00:04Z
7cnkCP2yQ6w,Making Incredible Artwork Out of Cow Dung | National Geographic,2m 32s,2017-04-30T17:00:01Z
sgHbvz-e2uE,He Grew Up on the Streets Now He's Making Them a Better Place | Short Film Showcase,8m 53s,2017-04-30T15:00:05Z
RvgwXZDYwaY,What is Farming Heroin? | Explorer,1m 57s,2017-04-30T12:00:03Z
lcGM1ecV4q0,More Questions Than Answers | LA 92,2m 37s,2017-04-29T16:59:55Z
ZSGr9fQXJpw,The Isolation of Addiction | Breakthrough,2m 28s,2017-04-29T15:00:03Z
sB4DxW3wtd4,Soar Above a Fairy-Tale World in This 2-Minute Drone Video | Short Film Showcase,1m 53s,2017-04-29T12:00:06Z
V-Qv9TfG6dw,How Bicycles Changed Women's Lives | Origins: The Journey of Humankind,3m 31s,2017-04-28T23:00:01Z
3XmsqGCXrU4,Why Does This Octopus Carry Shells Around? | National Geographic,1m 4s,2017-04-28T17:00:00Z
BEI4Gos3hvA,Hangin' with Hummingbirds: Bonus Scene - Ep. 7 | Untamed with Filipe DeAndrade,1m 36s,2017-04-28T16:00:01Z
EMmyamL4VGw,A 750-Year-Old Secret: See How Soy Sauce Is Still Made Today | Short Film Showcase,5m 38s,2017-04-28T12:00:02Z
AXTl5M8leO8,Flight of the Hummingbird | Untamed with Filipe DeAndrade,46s,2017-04-27T20:00:01Z
5rg7vgniCZc,The Power of Transportation | Origins: The Journey of Humankind,2m 14s,2017-04-27T20:00:00Z
FaEp3W5rhDE,Here's What You Missed From Episode 1 | Genius,1m 4s,2017-04-27T12:00:01Z
nG9lYpWy6KM,This Small Satellite Could Predict the Next Hurricane | Short Film Showcase,7m 59s,2017-04-26T20:00:02Z
cbxSBDopVyw,See Blue Whales Lunge For Dinner in Beautiful Drone Footage | National Geographic,1m 29s,2017-04-25T20:00:06Z
uUCD19mEliU,Would You Stay if Your Home Became a Desert? | National Geographic,3m 56s,2017-04-25T17:00:05Z
ieHMMBsB6_M,These Naked Rats Can Survive 18 Minutes Without Oxygen | National Geographic,1m 5s,2017-04-25T15:00:06Z
Bl5ZYDpd3Cs,The Fascinating Lives of Bleeding Heart Monkeys (Part 3) | Nat Geo Live,14m 48s,2017-04-25T12:00:05Z
8vm-Y4iQLY8,Hummingbirds: Nature's Gladiators - Ep. 7 | Untamed with Filipe DeAndrade,4m 16s,2017-04-25T12:00:00Z
tSfiaFiOVmw,Around the World on Sun Power | Origins: The Journey of Humankind,3m 29s,2017-04-24T20:00:01Z
49Flq2n3qrQ,This Captive-Born Panda Just Made a Breakthrough in the Wild | National Geographic,1m 9s,2017-04-24T15:00:00Z
ZSPkcpGmflE,50 Years Ago This Was a Wasteland. He Changed Everything | Short Film Showcase,8m 17s,2017-04-24T12:00:04Z
ojMEkPVfvKQ,A Dangerous Night In L.A. | LA 92,2m 26s,2017-04-23T22:59:47Z
y-EzdALuLQs,3,500-Year-Old Egyptian Tomb Explored: What Was Inside? | National Geographic,1m 3s,2017-04-23T20:00:01Z
Jf43KusIHMw,Two Champions One Family: Hear Their Inspiring Story | Short Film Showcase,10m 56s,2017-04-23T17:00:01Z
QXm3GiVz1_Y,The Mobile Home Economics | Explorer,3m 10s,2017-04-23T12:00:01Z
RKj7SUVUgtk,Our Drive to Boldly Go | Origins: The Journey of Humankind,2m 30s,2017-04-22T20:00:00Z
1VyhG3ypG5s,Spend a Relaxing Hour in Yellowstone’s Beautiful Landscapes | National Geographic,1h 1m 9s,2017-04-22T17:00:01Z
7CIOWh1JNTs,How To Survive Quicksand | Primal Survivor,2m 25s,2017-04-22T12:00:00Z
q1HjonCqaXc,The Japanese Government Wants You to Date | Explorer,2m 7s,2017-04-21T23:00:02Z
XCDy7aOvNbQ,Riding Alongside a Light Beam | Genius,3m 44s,2017-04-21T17:00:01Z
d4N_CBnuc5g,Cute Octopus Latches Onto Diver's Arm | National Geographic,2m 17s,2017-04-21T15:00:04Z
u2QPQv9abic,Behind the Scenes with Geoffrey Rush | Genius,3m 3s,2017-04-21T12:00:04Z
05T6BBip2_U,Weird Deep-Sea 'Worm' As Long As an Arm | National Geographic,1m 34s,2017-04-20T17:00:01Z
F3PJgl0L5DU,Tigers Fight For Territory | Mission Critical,3m 9s,2017-04-20T16:00:02Z
6JNIVev0_9M,The Decline in Drug Research | Breakthrough,2m 4s,2017-04-20T12:00:01Z
LljPYWfFtao,If We Colonize the Moon This Company Wants to Ship Our Stuff | Short Film Showcase,9m 42s,2017-04-19T17:00:02Z
eHLXEjr0OVg,The Power of Confidence | Cesar Millan's Dog Nation,2m 15s,2017-04-19T16:00:04Z
Ca0zAAIVK3E,Robot vs. Volcano: “Sometimes It’s Just Fun to Blow Stuff Up” (Exclusive) | National Geographic,3m 25s,2017-04-19T12:00:00Z
cE4IvvEtKCo,Egg-Stealing Baboon Incurs Wrath of Geese | National Geographic,1m 24s,2017-04-18T20:00:02Z
8QB-NRY8Vr4,Test Your Opossum Knowledge | Pet Talk,3m 11s,2017-04-18T20:00:01Z
PAK7SfhLd-Y,Watch Squid Snatch Squid in Surprise Attack | National Geographic,1m 1s,2017-04-18T17:00:03Z
I55wjokXAeM,Crocs vs. Gators: Who is King? - Ep. 6 | Untamed with Filipe DeAndrade,5m 22s,2017-04-18T12:00:02Z
k6e3O2tz0_c,The Fascinating Lives of Bleeding Heart Monkeys (Part 2) | Nat Geo Live,19m 29s,2017-04-18T11:59:56Z
R7XzmDaIIDY,Hell on Earth - Official Film Trailer | National Geographic,1m 33s,2017-04-17T23:00:03Z
rV0ro0uleVo,From the Ashes - Official Film Trailer | National Geographic,2m 5s,2017-04-17T19:59:58Z
H2s4pQbo-YY,Finding a New Level of Freedom | Cesar Millan's Dog Nation,3m 16s,2017-04-17T16:00:02Z
qthOTYr9cys,POV: If A Lion Bit You Here's What You'd See | National Geographic,1m 40s,2017-04-17T15:00:04Z
XCXM1jqX3gI,Here Cutting Down Millions of Trees is Actually a Good Thing | National Geographic,3m 6s,2017-04-17T12:00:01Z
a_mzB0gGhLs,Bobcat Marley is One Ferocious Feline | Bandit Patrol,2m 18s,2017-04-16T20:00:00Z
8DkClfndrH8,This Artist's Amazing Transformation Will Blow Your Mind | Short Film Showcase,1m 31s,2017-04-16T17:00:00Z
yIv9kEKdj6Q,See Why This Roller Skating Girl Squad Is the First of Its Kind | Short Film Showcase,7m 1s,2017-04-16T12:00:05Z
G1G1eUgd5zs,The Evolution of Shelter | Origins: The Journey of Humankind,2m 29s,2017-04-15T23:00:00Z
jTN5lr877Cw,360° Giant Sequoias on a Changing Planet – Part 2 | National Geographic,2m 36s,2017-04-15T17:00:03Z
m8l5mM8V40E,A Dangerous Job in Afghanistan | Explorer,1m 19s,2017-04-15T15:00:03Z
OFIH-1Pm_zA,Durian Fruit: A Stinky Jungle Treasure | Primal Survivor,2m 47s,2017-04-15T12:00:02Z
3wbfgr4QPlw,Why Are Bunnies Associated With Easter? | National Geographic,1m 45s,2017-04-14T20:00:00Z
eGFy6hdQ6HE,War-Torn Zoo's Last Surviving Animals Rescued in Mosul | National Geographic,1m 40s,2017-04-14T17:00:04Z
e-sqzXkgmroParamedic Ants Save the Wounded in Termite Wars | National Geographic,1m 25s,2017-04-14T15:00:05Z
z5JjTls5kUI,TIL: These Birds Trick Others Into Raising Their Gigantic Kids | Today I Learned,2m 8s,2017-04-14T12:00:05Z
EuGcL3RTzSI,Puppy Behaviors Explained | BarkFest,2m 5s,2017-04-14T12:00:02Z
7LvdFqtoJAM,Here's What Earthquakes Look Like From Inside the Earth | National Geographic,2m 21s,2017-04-13T17:00:00Z
UtkAJscxbZU,How Elevators Changed the World | Origins: The Journey of Humankind,3m 19s,2017-04-13T15:00:07Z
xGMHTYNNhFI,Medical Benefits of LSD? | Breakthrough,1m 30s,2017-04-13T12:00:09Z
b3TqOlIG43k,Prepare Yourself For Puppy Playtime | BarkFest,2m 53s,2017-04-13T12:00:04Z
e47ZEapVguQ,Top 3 Best Puppy Friends | BarkFest,1m 39s,2017-04-12T16:00:05Z
yytrFWa-OH0,How Water Built and Destroyed This Powerful Empire | National Geographic,1m 50s,2017-04-12T12:00:05Z
JiDZljsjKHA,Relaxing a Real Rascal | Cesar Millan's Dog Nation,2m 16s,2017-04-12T12:00:03Z
ym7x3ogGjO4,The Fascinating Lives of Bleeding Heart Monkeys (Part 1) | Nat Geo Live,20m 12s,2017-04-11T20:00:03Z
K18zW6glutw,The Making of 'Genius' | National Geographic,8m 3s,2017-04-11T17:00:01Z
RZbIV9R--Zk,Blue-Ringed Octopus Pounces on Unsuspecting Crab | National Geographic,53s,2017-04-11T15:00:02Z
XXD8s40b0rg,Camera Traps Reveal the Wild Elusive Lives of Snow Leopards | National Geographic,3m 7s,2017-04-11T12:00:03Z
IQWOYjowR5k,Coyotes Have One Mission: Food - Ep. 5 | Untamed with Filipe DeAndrade,5m 30s,2017-04-11T12:00:02Z
EruaNHzV_Gs,Genius | National Geographic,31s,2017-04-10T21:18:03Z
XAG6A5oQr_U,Another Day Another Dog BarkFest | BarkFest,3m 12s,2017-04-10T20:00:01Z
