"Video ID",Title,Length,Published
2pJY7kBXBb4,"What Are We Really Doing While We Sleep | Compilation","28m 7s","2022-07-25T23:40:06Z"
cIH1FyNTzMw,"Being a New Parent is Hard | Compilation","27m 52s","2022-06-13T23:42:15Z"
"MX3RLigD-UA","Cinema Psychology | Compilation","25m 47s","2022-05-16T19:00:05Z"
TR1jAlI_VYw,"The Psychology of Senses | Compilation","33m 36s","2022-04-11T19:00:07Z"
LNBXhocsQyY,"Tune Into Psychology | Compilation","22m 17s","2022-03-14T19:00:30Z"
uhCxUsSlcPU,"The Stages of a Failed Relationship | Compilation","37m 43s","2022-02-15T00:24:57Z"
udZqhQO7nAc,"Your Most Burning Psych Questions | Compilation","40m 33s","2021-12-30T20:00:29Z"
duPUrUuofI0,"Why Is It So Hard to Make a Decision?","5m 41s","2021-12-23T20:00:21Z"
XzLgw2Y8gNw,"Can This AI Hear Alzheimer’s on the Phone?","6m 20s","2021-12-16T22:07:35Z"
"nAC5wImVF-4","Your Nose Does More Than You Give It Credit For","6m 16s","2021-12-09T21:30:43Z"
plUMFlryKDc,"How to Get Things Done by NOT Doing Them | Compilation","26m 36s","2021-12-02T20:00:19Z"
x06dB_jxsEk,"How Our Brains Learn Consciousness","5m 51s","2021-11-25T20:00:11Z"
27Rlcu1C9HE,"Your Brain on Psilocybin","6m 28s","2021-11-18T20:51:49Z"
pfIG7gkuDZ4,"The Taste of Color","6m 46s","2021-11-11T20:00:11Z"
qeZpkXOWKt0,"Your Brain and Stress | Compilation","28m 22s","2021-11-04T22:57:14Z"
_oDqdfVNrxc,"How Self Care Can Save the Environment","5m 26s","2021-10-30T19:00:11Z"
OYGp9JHPrTU,"Dopamine Isn’t Just a Happy Chemical","4m 41s","2021-10-29T22:37:54Z"
0_uegbXrYtU,"What Squids and Frogs Taught Us About How Brain Cells Talk","6m 8s","2021-10-22T22:45:42Z"
eTKfyKKLQPU,"Have You Seen That Face Before?","5m 14s","2021-10-08T21:29:10Z"
237yhd2YxNc,"The Sound of Your GPA Slipping Away","5m 53s","2021-09-30T19:26:48Z"
mHVnhtuJNuE,"What’s In Your Brain? | Compilation","36m 56s","2021-09-16T19:00:11Z"
"S5KktZb-zWo","Are Your Eyes Part of Your Brain?","6m 38s","2021-09-09T21:15:13Z"
2dL4ebhPfX4,"Is Mind Control Possible? | Compilation","33m 54s","2021-09-02T19:00:01Z"
tfh84jUUDxE,"Remote Control Brain Receptors","8m 2s","2021-08-24T23:04:35Z"
l1foR2yo_70,"Is Teletherapy Really Effective?","5m 26s","2021-08-12T19:48:09Z"
edrqQHEbuLw,"Getting Free Serotonin from Nature | Compilation","23m 16s","2021-07-29T19:00:09Z"
BxPQ9bFfEP0,"The Human Neocortex Isn’t as Special as We Thought","6m 6s","2021-07-22T19:00:05Z"
m6BALyClWyg,"Do we have more than 5 senses?","5m 20s","2021-07-15T20:18:13Z"
2IQ3d8TIgZA,"The Tiny Molecule Responsible for Startle Syndrome","7m 5s","2021-07-08T22:31:56Z"
8c0HMbgJ2oc,"This Is Your Brain On Food | Compilation","33m 3s","2021-07-01T23:07:46Z"
EZyswO7Is10,"Your Brain on Retail Therapy","4m 55s","2021-06-24T20:14:13Z"
mv8y_cxegyI,"Why YOU Should Take a Break to Watch This Video","4m 47s","2021-06-17T19:00:24Z"
dRiuhK4a9xE,"This Is Your Brain on Language | Compilation","31m 5s","2021-06-10T19:00:06Z"
"AYLU-HiUPAQ","Why You Think You Look Better in Selfies","5m 28s","2021-06-03T19:00:03Z"
"nanW2-dSXms","The Overlap of Autoimmunity and Mental Health Conditions","7m 10s","2021-05-27T20:40:03Z"
cek02jB5eI8,"The Neuroscience of Tongue Twisters","5m 30s","2021-05-20T19:00:09Z"
Uch5QxkYeX4,"Why Do We Have Bright Ideas in the Shower?","5m 45s","2021-05-13T19:00:12Z"
91rAPnJMtdQ,"The Secret World of Temper Tantrums","6m 50s","2021-05-06T19:00:02Z"
6zynZzSUZlc,"Communication While Dreaming","6m 12s","2021-04-29T19:00:04Z"
IQoqYth4oWY,"Video Games Hack Your Brain (In a Fun Way)","4m 48s","2021-04-22T21:01:59Z"
AWwvgNWLWdE,"What Neuroscience Can Learn from Meditation","6m 24s","2021-04-15T19:00:02Z"
3AqKU5ktBG4,"Meet Your Microglia: Your Brain's Overlooked Superheroes","9m 42s","2021-04-08T19:01:03Z"
mt_fM0zTrjo,"Is That Shiny Thing Pretty, or Are You Just Thirsty?","6m 11s","2021-04-01T19:00:08Z"
BFUTRU5JwLk,"How to Reprogram a Brain Cell","5m 40s","2021-03-25T22:00:36Z"
qo18ijOMgF8,"Why Does Crying Make You Feel Better?",6m,"2021-03-18T19:00:22Z"
id987QbZmug,"Why Does Lithium Help Bipolar Disorder?","5m 27s","2021-03-11T20:00:09Z"
K4A66EOfLWQ,"How Fast Food Can Make You More Impatient","6m 45s","2021-03-04T22:49:28Z"
yvvdT75eNng,"The Science Behind Our Niche Interests | Compilation","26m 56s","2021-03-01T22:56:02Z"
xPecMsFmEm4,"Is Coding a Math Skill or a Language Skill? Neither? Both?","5m 45s","2021-02-25T22:09:18Z"
yF5ulbytZE4,"Why a Bad Series Finale Ruins the Whole Show","5m 8s","2021-02-18T20:21:05Z"
xMFs0ijNmJg,"Beautiful Baby Brains! | Compilation","29m 13s","2021-02-11T20:00:28Z"
sSlM2yV7ZcM,"You Read More Slowly As You Get Older — Here's Why","6m 25s","2021-02-04T23:40:24Z"
Q4lRRm9v3Bk,"Why You Can’t Listen to Music While You Work","5m 30s","2021-01-28T20:00:11Z"
oJLfygtRy0A,"Do ""Game Faces"" Really Work in Sports?","6m 3s","2021-01-22T00:29:54Z"
s6FuBFZc2SE,"Why Do We Have Such Long Childhoods?","4m 54s","2021-01-14T20:00:08Z"
sCj6EwXSO50,"How Music Can Heal the Brain","6m 33s","2021-01-07T20:00:29Z"
rGxyKCwzxkM,"Why We Respond to Disasters with Altruism","6m 39s","2020-12-31T20:00:09Z"
0P1qO8e3BAc,"5 Psychology Videos to Prep for Next Semester | Compilation","28m 29s","2020-12-24T21:15:21Z"
tezaNSrv3tw,"This Jawless Fish Could Help Treat Brain Diseases","5m 30s","2020-12-17T20:00:07Z"
gkI551rjVzc,"The Dark Side of Disgust","6m 11s","2020-12-10T22:13:57Z"
d_LqlsEyRvQ,"Why You Shouldn't Always Trust Your Gut | The First Instinct Fallacy","5m 2s","2020-12-03T20:00:05Z"
uJ1AT8sPJXk,"Magic Isn't Magic: It's Psychology","6m 45s","2020-11-26T20:00:16Z"
IEsMpgdPeY4,"Why Are Some U.S. Cities Declaring Racism a Public Health Crisis?","8m 25s","2020-11-19T22:25:49Z"
"d4aD-epti4c","Why It's So Hard to Admit You're Wrong | Cognitive Dissonance","5m 31s","2020-11-12T20:00:09Z"
vxawgQnWCBc,"How Fake Internet Accounts Divide Us and How to Stop Yourself From Falling for Them","5m 41s","2020-11-05T23:23:07Z"
IqE3YjstENg,"Why Ouija Boards Are So Convincing","5m 22s","2020-10-29T22:26:32Z"
ROuhS5vEJQ0,"How Paintings Help You See the World Differently","6m 3s","2020-10-22T19:00:03Z"
78RhBJAEAtk,"Identity Politics: How All Your Identities Sway Your Vote","6m 27s","2020-10-15T19:00:02Z"
8NYaDNK0xvM,"How Political Questions Mess with Your Brain","6m 20s","2020-10-08T19:16:24Z"
A91tvp0b1fY,"We Don't All Have a ""Mind's Eye"" | Aphantasia","6m 36s","2020-10-01T20:16:02Z"
LaX2Db9syRg,"How Losing Your Job Changes You","5m 33s","2020-09-24T19:00:03Z"
"4nq-g1BXkt8","How Psychics Exploit Our Cognitive Biases","5m 14s","2020-09-17T19:00:00Z"
ULdW78vnRQs,"Why Is It So Hard to Remember Things Right Now?","5m 2s","2020-09-10T19:00:05Z"
xsGJkSDtLvo,"Studying the Brain with... Quantum Mechanics?","11m 34s","2020-09-03T21:39:20Z"
2IkBJogw5G0,"Why We Love Movie Villains (According to Psychology)","6m 40s","2020-08-27T20:28:50Z"
jwwr5zuaW9o,"3 Friendly Robots Improving Our Social Lives","5m 7s","2020-08-20T20:17:37Z"
7gvfDB5_cz4,"What Whistled Speech Tells Us About How the Brain Interprets Language","6m 31s","2020-08-13T19:00:02Z"
xq7tSzfjolE,"5 Myths You've Probably Seen on TV","27m 56s","2020-08-06T23:33:18Z"
__igs6RhSXk,"How to Write Directly on the Brain","5m 32s","2020-07-30T19:00:10Z"
I3MOsc6DDN0,"Why Do Some Words Sound So... Lumpy?","6m 10s","2020-07-27T21:18:43Z"
"MOtrHV-vTn8","Forget Angry: Here’s How Hunger Makes You Impulsive","5m 58s","2020-07-16T19:24:08Z"
5IfuwgI95tI,"Why Do You Always Have Room for Dessert?","6m 21s","2020-07-09T20:29:32Z"
"-JcfEnagvRk","Why You Don't Really Know the Size of a Walrus","6m 18s","2020-07-02T19:04:07Z"
PrsRtKYsQhc,"Why Is It So Hard to Let Go of Grudges?","5m 47s","2020-06-25T19:00:04Z"
Pl9viHyAg5k,"Animal Personalities Are More Like Ours Than You Might Think","6m 29s","2020-06-18T19:28:55Z"
UnKqxUd63oE,"The Surprising Link Between Allergies and Suicide","6m 17s","2020-06-11T20:37:56Z"
Ne4WITiQBEg,"Why Is Everyone Having Vivid Dreams Right Now?","4m 47s","2020-06-04T19:00:03Z"
QB3zXPp2sFU,"Borderline Personality Disorder: Sorting Fact From Fiction","7m 23s","2020-05-28T21:39:20Z"
GxnwBNrpSd0,"Why the Pandemic Has Us Buying Roller Skates and Baking Bread","4m 31s","2020-05-21T19:01:40Z"
4cZOuS_zPl4,"Why Dancing Is So Helpful for Parkinson's","6m 1s","2020-05-14T19:00:00Z"
Iyw2hjgcSRY,"3 Ways Physics Can Help Us Understand the Brain","7m 20s","2020-05-07T23:53:54Z"
v_QgWgEGpCY,"When Did Modern Behavior Evolve?","6m 51s","2020-04-30T19:55:31Z"
SUYUtVNCYl0,"Equine Therapy: Why Horses Might Make Great Therapy Animals","5m 36s","2020-04-23T19:00:07Z"
"7Eb-0VYN0k8","The Overlooked Connection Between ADHD and Sleep","6m 2s","2020-04-16T19:25:40Z"
ZucX8iWD8Eo,"Why Death Photography Is So Helpful for Grief","5m 23s","2020-04-09T19:00:10Z"
9PfOfK234EY,"What Social Distancing Actually Is & What it Means for Mental Health","8m 29s","2020-04-02T19:00:03Z"
ftNHOj8Qv8s,"What Parental Burnout Looks Like (and How to Avoid It)","5m 19s","2020-03-30T20:09:10Z"
0OQjDEpyH_k,"What Does Gum Disease Have to Do With Alzheimer's?","5m 23s","2020-03-26T23:11:39Z"
ytLM_zgwqsM,"Schizophrenia May Be an Autoimmune Condition","6m 55s","2020-03-23T21:12:42Z"
q52ZCoehGrs,"Hemispatial Neglect: When Half Your World Disappears","6m 42s","2020-03-19T21:08:32Z"
qSHWouZL988,"How You Affect Other People’s Brain Waves | Inter-Brain Connections","5m 43s","2020-03-16T19:00:11Z"
U6cg0KIwozg,"Engrams: Where Your Brain Keeps Memories","6m 21s","2020-03-12T19:00:08Z"
hx9JolK4ATk,"How Bad Helmets Gave Us a Map of Vision","5m 42s","2020-03-09T20:13:46Z"
csqOL_KT4Go,"Why Psychology Tells Us What We Already Know","5m 50s","2020-03-05T22:12:20Z"
j2lgUEehMHk,"Why Do We Get the Spins When We’re Drunk?","5m 45s","2020-03-02T20:00:08Z"
FqhOYqxwYh8,"Why Can’t I Remember My Dreams?","5m 51s","2020-02-27T20:00:00Z"
DRuPF6JtWdw,"Magenta Is All In Your Head","3m 30s","2020-02-24T20:40:34Z"
hTRBAjYGjsI,"Why More Choices Don't Make You Happy","4m 33s","2020-02-20T20:00:05Z"
l5Xzq7pzWKw,"The Bizarre Future of Stroke Treatment","7m 38s","2020-02-17T20:00:07Z"
"Z3q-iAKsI1s","You Can Inherit Fear?","6m 15s","2020-02-13T20:00:04Z"
mdf0WxBQWR0,"Valentine's Day Is Bad for Relationships (and That's a Good Thing)","6m 22s","2020-02-10T20:00:06Z"
p6GDNpylILE,"When Blindsight is 20/20","5m 50s","2020-02-06T19:59:52Z"
cGZJflerLZ4,"Are Colors Real?","9m 15s","2020-02-03T22:59:39Z"
7aendfVlBBk,"Rorschach: Psychology’s Most Controversial Test","6m 12s","2020-01-30T20:00:01Z"
kjwIgKa560s,"What We Often Get Wrong About the Brain's ""Language Centers""","7m 58s","2020-01-27T21:55:40Z"
EFxSZBz8tQ0,"When Insomnia Becomes Deadly","5m 44s","2020-01-23T20:02:26Z"
tY66z2w5yy0,"What If Your Body Didn't Paralyze You During Sleep?","6m 21s","2020-01-20T20:00:08Z"
7oRpJ525OZs,"Being a Messy Person Has Its Perks","4m 39s","2020-01-16T20:00:00Z"
f_I1CrkUdEY,"Placebos Work Even if You Know They’re Placebos!","6m 7s","2020-01-13T20:00:04Z"
"I-vl6ezEpjE","Why You're More Afraid of Sharks Than Cows","4m 43s","2020-01-09T20:00:01Z"
KwOhfmygHyM,"Your Brain's Secret to Freestyling","5m 35s","2020-01-06T20:00:04Z"
L061cpw4qv4,"3 Big Things We Learned About the Brain in 2019","6m 38s","2020-01-02T20:00:02Z"
1MdDTmGla2c,"Psychology Hacks to Help Your New Year's Resolutions | Compilation","28m 19s","2019-12-30T22:00:02Z"
8p_9wccG2NY,"When Procrastination Isn't So Bad","5m 58s","2019-12-23T20:00:01Z"
JgltmbOVRqI,"The Surprising Connection Between Reading and Rhythm",5m,"2019-12-19T23:20:50Z"
Wt0q1xjEFgk,"When Your Brain Can't Accept Reality: Anosognosia","6m 42s","2019-12-16T20:00:06Z"
yGabNZ03QJI,"Why Are Some People So Bad at Singing?","4m 46s","2019-12-12T20:00:07Z"
W1ZFVeNAAeI,"Why Do So Many People Fall for Robocalls and E-mail Scams?","5m 53s","2019-12-09T20:00:12Z"
yHVTgZw7geY,"How Psychology Can Explain the Deadly Medieval Dancing Plagues","6m 59s","2019-12-05T20:25:14Z"
SMxYD3oTAIA,"This Common Drug Could Stop You from Developing PTSD","5m 26s","2019-12-02T20:00:59Z"
GhuLCzklgSg,"'Tis The Season for Snuggles: The Psychology of Cuffing Season","5m 46s","2019-11-28T20:00:01Z"
efZSno1KNdI,"How Stores Try to Manipulate Your Senses to Sell You Stuff","6m 43s","2019-11-25T22:19:47Z"
n1jY405Czmo,"How Close Are We to Growing Brains in a Dish?","6m 15s","2019-11-21T20:00:04Z"
do_zld2dS1M,"The Very Real Consequences of Weight Discrimination","5m 14s","2019-11-18T21:59:35Z"
27SzyKhaIPE,"Mental Health Apps: How Medicine Can Keep Up With Tech","5m 42s","2019-11-14T20:00:00Z"
DVdcOKIouTU,"The Science Behind the Pimple Popping Phenomenon","5m 7s","2019-11-11T20:00:01Z"
9V3JoxQIoV4,"Alice in Wonderland Syndrome","5m 21s","2019-11-07T20:00:01Z"
8SsC9UWYPDM,"Why Diet Might Be a Big Deal for Mental Health","5m 51s","2019-11-04T20:00:02Z"
G_IHLWflImk,"Why Do Our Brains Have Distinct Hemispheres?","7m 10s","2019-10-31T22:53:42Z"
q4xGNmo4ipU,"Is Your Brain Ready for Mars?","7m 6s","2019-10-28T19:00:05Z"
xdSh3Ycw1fw,"The Bizarre Link Between Blindness and Schizophrenia","4m 28s","2019-10-24T19:00:09Z"
mDxSU9LJxOc,"Want to Speak a Foreign Language Better? Have a Drink","5m 42s","2019-10-21T19:00:06Z"
uCg1M9WWWcY,"If You're Reading This, You've Reshaped Your Brain","4m 47s","2019-10-17T19:00:08Z"
NL21HUqwGc0,"The Most Common Eating Disorder You've Never Heard Of","5m 39s","2019-10-14T19:00:04Z"
YNrXsAzEois,"How Basic Psychology Can Save Kids' Lives","5m 37s","2019-10-10T20:09:27Z"
LIKcI1MBnto,"Why Tickle Fights Aren't Just for Kids","6m 6s","2019-10-07T19:00:02Z"
iWJDWi6K2QA,"How to Take the Best Notes, According to Psychology","6m 2s","2019-10-03T19:02:59Z"
Yie1dWzmgvw,"Can These Psychology Strategies Prevent Bullying?","4m 58s","2019-09-30T19:00:02Z"
CC2LG5TQn_4,"We Totally Missed a Different Kind of Dementia for Decades","4m 59s","2019-09-26T19:10:41Z"
Fpj43qwSmtg,"What Slot Machines Can Tell Us About Our Brains","7m 45s","2019-09-23T19:00:03Z"
BG7PGBs2j70,"We Don't Know How To Type","5m 20s","2019-09-19T19:05:48Z"
0itEOM8oxkE,"What ""Alien Abductions"" Say About Our Brains","5m 58s","2019-09-16T21:22:49Z"
MQd98NByhqw,"There's More Than One Bipolar Disorder","5m 35s","2019-09-12T19:00:01Z"
Nc0Tw6ISYKk,"The Good Behavior Game","6m 59s","2019-09-09T19:00:03Z"
"d-N364D4Hr8","What Do We Actually Know About Depression? | Compilation","24m 16s","2019-09-02T19:00:03Z"
8Zj1_OLVRIs,"You Don't Know Yourself as Well as You Think","5m 49s","2019-08-29T21:00:01Z"
OgkFmBHo8Og,"Why We Like Bad News","6m 1s","2019-08-26T19:00:03Z"
VmgS2JltwX4,"Spelunking in the Uncanny Valley","7m 37s","2019-08-22T19:00:06Z"
kLVZoesOgtg,"Are We Inherently Good?","4m 42s","2019-08-19T21:04:00Z"
_xe5vzHHTnU,"Heads-Up: Depression Isn't the Only Postpartum Disorder","5m 27s","2019-08-15T19:00:03Z"
Q0wfm9wrhXA,"Why Is Riding a Bike ""Just Like Riding a Bike?""","5m 47s","2019-08-12T19:00:04Z"
ywLdjuQLaQ0,"The Dark Side of Needing Closure","5m 44s","2019-08-08T19:00:04Z"
"7Ieyo6-FeEA","The FOMO Is Real — But You Can Overcome It","6m 18s","2019-08-05T19:00:00Z"
UBVC4DnxJyw,"Where Are All the Women with ADHD?","5m 20s","2019-08-01T21:00:58Z"
mwtastq845M,"Kids Aren't As Gullible As You Think","6m 33s","2019-07-29T19:00:05Z"
"HMBWMdP0-tg","Why Do We Go All In on Lost Causes?","4m 43s","2019-07-25T19:00:00Z"
fm1PAbIzOB0,"Is Your Dog As Smart As A Two Year Old?","6m 38s","2019-07-22T19:00:08Z"
0FH7SOBwE1M,"Why Can I Hear This .gif?","5m 53s","2019-07-18T20:43:12Z"
reUic5tyVwo,"The Stroop Task: The Psych Test You Cannot Beat",8m,"2019-07-15T19:00:05Z"
TJi2IfnEd5c,"How (and Why) to Find Your Life's Purpose","5m 11s","2019-07-11T19:00:05Z"
TRviYv43XS8,"Houseplants Can (Probably) Make You Happier","7m 15s","2019-07-08T19:00:05Z"
KBtXU1GKvio,"Can You Actually Become More Emotionally Intelligent?","5m 19s","2019-07-04T19:00:02Z"
YksgBohXABM,"What People Get Wrong About Schizophrenia","5m 56s","2019-07-01T19:00:02Z"
8lLISZzlRD4,"Alcohol Can Enhance Creativity—But at a Cost","8m 47s","2019-06-27T19:00:00Z"
QW7rPIf2RBQ,"What Psychologists Can Tell You About Ghosting","4m 32s","2019-06-24T20:14:17Z"
tYOUdtWzsHE,"How We Manipulate Our Brains With Electricity","8m 10s","2019-06-20T20:07:40Z"
pGYKcqzG_7M,"What Do Mirror Neurons Really Do?","6m 46s","2019-06-17T19:00:03Z"
HKLHpty0CWQ,"Why Are Feelings So Complicated?! | Compilation","27m 49s","2019-06-10T19:00:02Z"
1RpPcauLcvE,"When People Get Different Accents","5m 21s","2019-06-06T19:00:00Z"
wCmnqE_VL78,"Why Eating Disorders Are Way More Common Than You Think","8m 34s","2019-06-03T21:06:51Z"
MstAuQmBtDc,"Groups That Chant Together, Stay Together","4m 47s","2019-05-30T19:00:02Z"
SYLySBpGGM8,"Statistics Say Screens Aren't Destroying Today's Teens","7m 31s","2019-05-27T19:00:00Z"
"aTd-lrnZvsQ","Why Do We Still Teach Freud If He Was So Wrong?","5m 56s","2019-05-23T19:00:00Z"
oOkISlxST38,"What Really Happened to Phineas Gage?","7m 43s","2019-05-20T22:29:34Z"
MHM3ItHd22I,"Can You Really Change Your Personality?","4m 35s","2019-05-15T19:25:33Z"
gDEy6zfMkE0,"The Not-So-Silver Lining: When Positive Thinking Backfires","8m 18s","2019-05-13T19:36:32Z"
KQ3dOn0hWWg,"What Is Neurofeedback Therapy?","4m 59s","2019-05-09T19:00:04Z"
wf_M5l2y3sM,"Will Learning Another Language Make You Smarter?","7m 14s","2019-05-06T19:00:06Z"
27CUawrRmjQ,"Are Sympathy Pains Real?","5m 17s","2019-05-02T19:00:00Z"
yBz7MBQydGU,"Can You Become a Morning Person?","6m 32s","2019-04-29T21:53:08Z"
GAC9ODvSxh0,"Why Depression Isn't Just a Chemical Imbalance","5m 59s","2019-04-25T19:03:52Z"
GVAalB2LVto,"When Everything Feels Like a Dream | Depersonalization-Derealization Disorder","7m 45s","2019-04-22T19:37:04Z"
YapkNuBcBT0,"Is The Mirror Test Just a Reflection of Human Nature?","6m 20s","2019-04-18T23:45:00Z"
Mg4yMSPtDp0,"Why Can't We Figure Out What Causes Chemo Brain?","6m 32s","2019-04-15T20:41:18Z"
dwBH409PhL4,"Why You Really Love That Wobbly Table","6m 10s","2019-04-11T19:00:04Z"
l4J7EyHah1A,"Psychology Hacks to Become a Better Teacher (or Student!)","14m 36s","2019-04-08T19:00:03Z"
"ClGQ-GXS4WQ","Why Baby Talk Is Good for Babies","4m 42s","2019-04-04T19:00:01Z"
7PR0tDfCatU,"Why Perfectionism Isn’t as Good as You Think","6m 24s","2019-04-01T20:14:56Z"
BEmSoOA1Eyg,"The Surprising Benefits of Watching Cute Cat Videos","4m 54s","2019-03-28T19:00:01Z"
fvYBu0Ng1xw,"The Future Of Depression Treatment","7m 46s","2019-03-25T20:41:12Z"
SDyWftcMZgA,"How to Form a Habit","4m 22s","2019-03-21T19:00:03Z"
pjhnax9JLkE,"Why Athletes Choke Under Pressure","6m 27s","2019-03-18T19:53:16Z"
GLcFCs7_ZKA,"How The Famous ""Marshmallow Test"" Got Willpower Wrong","5m 34s","2019-03-14T19:00:02Z"
S9tBnXz2B1Q,"How to Turn Anxiety Into Excitement","6m 34s","2019-03-11T23:06:59Z"
IVoXHkkRZfY,"Can You Give Yourself a Better Sense of Direction?","4m 49s","2019-03-07T20:00:02Z"
"R3-jt7aIXbk","Why You Have That Little, Lying Voice in Your Head","5m 37s","2019-03-04T22:53:59Z"
xdAjGRvxGPM,"Why Do Depression and Anxiety Go Together?","6m 21s","2019-02-28T20:00:05Z"
"FDPJTo-gNUI","The Research-Backed Secrets to Getting Inspired","7m 16s","2019-02-25T20:00:01Z"
P3FZgrTXsCM,"The Problem With Those 9 Personality Types","4m 35s","2019-02-21T20:00:05Z"
NvAZXX_aMUw,"The Magic of Being ""In the Zone""","6m 30s","2019-02-18T20:00:00Z"
"zQtrwA-CD2M","You're More Likeable Than You Think!","4m 56s","2019-02-14T20:00:06Z"
tmU8jDTkSOY,"How Much Does Your 'Type' Really Matter?","5m 15s","2019-02-11T20:00:10Z"
uME3JOM3W4k,"The Real Secret to Fighting Peer Pressure","4m 32s","2019-02-07T20:23:23Z"
VBW3NjZXMII,"Does Depression Make You More Realistic?","5m 39s","2019-02-04T22:47:04Z"
"nM-GhFzX8yQ","Babies are Surprisingly Smart","4m 51s","2019-01-31T21:44:12Z"
"2-YiMGEVMns","How to Get to Know Yourself in a Healthy Way","6m 9s","2019-01-28T20:00:00Z"
FBpry4OYbyE,"How to Clear Your Mind","4m 30s","2019-01-24T20:00:00Z"
395PDQcrcFs,"Do These Eyes Freak You Out?","4m 54s","2019-01-21T20:00:00Z"
dG8rvxEDgCU,"Why Does Music Make You Emotional?","5m 23s","2019-01-17T20:00:03Z"
QGhUiQXo3CA,"Your Favorite Food May Have Been Decided Before Birth","5m 24s","2019-01-14T22:26:58Z"
2zqLku10qfs,"Does Sensory Deprivation Really Help You Think?","5m 21s","2019-01-10T20:05:27Z"
zet3ciKDIYE,"How the Right Tunes Can Improve Your Workout","5m 27s","2019-01-07T22:37:03Z"
5DH9lAqNTG0,"The Best Ways to Keep Your Mind Young","5m 35s","2019-01-03T20:00:00Z"
dDGeISed3Tg,"How to Keep Power from Going to Your Head","4m 35s","2018-12-31T20:00:03Z"
w6kUOjJ98cY,"Why People Do So Many Weird Things on the Internet | Compilation","29m 12s","2018-12-27T20:00:08Z"
oxCKtWPkiJE,"SciShow Psych Talk Show: Kati Morton","25m 16s","2018-12-20T23:47:48Z"
JJaLbvS9YDk,"Why Being Introverted Doesn't Make You Antisocial | Antisocial Personality Disorder","5m 46s","2018-12-17T21:24:54Z"
Rvm_4qJYMzI,"The Science of the 36 Questions That Help People Fall in Love","5m 12s","2018-12-13T22:22:39Z"
bddn6nnmRnY,"Why You Probably Can't Predict Your Own Happiness","5m 20s","2018-12-10T20:00:01Z"
qoKg5N7ciKI,"What It's Like to Have a Near-Perfect Memory","5m 39s","2018-12-06T20:00:07Z"
puUUwPOsYR4,"The Benefits of Being Easily Distracted","5m 49s","2018-12-03T20:30:39Z"
GZkbw44QBtA,"How Facing Your Fears Can Help You Conquer Them","5m 22s","2018-11-29T22:51:24Z"
krt16StMtYk,"Why Do You Feel Like You're Being Watched?","5m 13s","2018-11-26T23:00:21Z"
akWAc3ju_Hg,"3 Baffling Depression Treatments and Why They Might Work","6m 3s","2018-11-22T20:00:02Z"
5Abp3ea8jV8,"Why You Might Not Want to Be 'The Smart Kid'","5m 16s","2018-11-19T20:53:59Z"
ijhFa0kuUPI,"Why Having a Baby Can Cause Depression in Both Parents","5m 11s","2018-11-15T21:09:33Z"
GdcDKpLUajs,"How Dangerous Is Loneliness, Really?","5m 30s","2018-11-12T23:02:18Z"
4jtTJVKEjWw,"Here's When You Should Trust Your Gut","5m 10s","2018-11-08T20:00:01Z"
xZUOz1laRko,"Do Weighted Blankets Really Do Anything?","5m 13s","2018-11-05T20:00:04Z"
gbAnHHyr4JA,"3 Strategies to (Kind of) Change Someone's Opinions","5m 4s","2018-11-01T19:17:36Z"
9ONY2OCmDak,"Why You'll Never See Your Eyes Move in a Mirror","5m 28s","2018-10-29T19:31:42Z"
biYd_f3QvyA,"Why the Way Back Feels Shorter (Even When it Isn't)","4m 10s","2018-10-25T19:00:02Z"
lwEvw6a1fS8,"Why Our Brains Recognize Faces So Easily... or Fail at It","4m 55s","2018-10-22T19:00:03Z"
wiKManuLYvM,"Why Comic Sans Isn't the Worst Font Ever","3m 46s","2018-10-18T20:05:06Z"
Rs1vxKsBdxg,"Why Do Good People Sometimes Do Bad Things?","5m 31s","2018-10-15T22:07:40Z"
0efKbfLWHDs,"Why We Hide Our Good Deeds","5m 12s","2018-10-11T19:00:00Z"
fuGu_ughDGw,"Is Everyone A Little Bit Racist? | Implicit Bias","5m 25s","2018-10-08T19:00:03Z"
92x1blW23x4,"Why We're Bad at Guessing Other People's Motives","4m 49s","2018-10-04T22:04:53Z"
rJEcJKflGjs,"Real Pain and 'Explosive' Brains | Fibromyalgia","6m 6s","2018-10-02T23:43:07Z"
jFCLFfz_pz0,"Why Do People Join Cults?","4m 47s","2018-09-27T19:00:08Z"
ZiT9cjGi0lo,"How To Make Eyewitness Testimony More Reliable","5m 9s","2018-09-24T19:00:07Z"
SO0oBpl8G_Y,"Why Just Smiling Could Make You Feel Happier","5m 8s","2018-09-20T22:44:03Z"
"i-2YQ4ikV1M","Can You Really Tell if Someone is Lying to You?","5m 40s","2018-09-17T19:00:03Z"
dp1oPvX5T1M,"Does a Bigger Brain Make You Smarter?","5m 23s","2018-09-13T19:00:06Z"
lLLGwXFh5uw,"The Lesser-Known Symptoms of Depression","5m 26s","2018-09-10T19:00:03Z"
yMlAyUGqaDM,"3 Ways Money Could Buy You Happiness","5m 3s","2018-09-06T19:30:35Z"
SYx3Lix4LaU,"Did We Just Figure Out How to Program a Brain?","6m 8s","2018-09-03T19:00:01Z"
ml51ngXIDbY,"Why People Are Sending Themselves Hate Messages","5m 29s","2018-08-30T19:00:03Z"
BOQQPt2LoNY,"How Does Reverse Psychology Work?","5m 2s","2018-08-27T19:01:21Z"
o28MAoe13Nk,"Do Trigger Warnings Really Help?","4m 44s","2018-08-23T19:00:03Z"
N_OXZhPugKc,"What Does Pornography Do to Your Brain?","6m 12s","2018-08-20T21:06:15Z"
gNWn78LeBHY,"How Twitter Bots Use Psychology to Fool You","5m 14s","2018-08-16T21:00:02Z"
d1YYgY0etrU,"Why Do You Sabotage Yourself Before a Big Test? | Self-Handicapping","5m 53s","2018-08-13T19:00:03Z"
mF18FdrT3Fs,"To Heal the Brain, Sometimes We Need to Damage It","4m 44s","2018-08-09T19:00:03Z"
KP9HFcK6YOM,"How Auditory Illusions Trick Your Brain into Hearing Things","5m 11s","2018-08-06T19:00:34Z"
pdkKSCsFUSo,"When Waking up After Decades Turned out to Be Temporary","6m 7s","2018-08-02T19:00:08Z"
VJe9nXGvwaw,"Will Video Games Eventually Replace Your Therapist?","4m 59s","2018-07-30T19:04:59Z"
AEsq4BMUu1I,"Why Pregnancy Makes You Forgetful... but Helps Your Baby","4m 48s","2018-07-26T19:00:01Z"
8yNkNy5mHEk,"How Different Types of Alcohol Affect Your Emotions","5m 45s","2018-07-23T21:27:58Z"
Rv22TMtNNkI,"Is the Bystander Effect Real?","5m 9s","2018-07-19T19:00:01Z"
rJKzERURJnk,"What Do ""Smart Pills"" Really Do to Your Brain?","5m 46s","2018-07-16T19:00:08Z"
Ft2h0hokK7Q,"Brain Hacks to Make Your Food Taste Better","6m 47s","2018-07-12T19:00:28Z"
eGT1R03MAOc,"What If Your Ears Switched Sides of Your Head?","4m 44s","2018-07-09T19:00:02Z"
ODuRBPjoPrs,"Why Does Pet Therapy Work? (It's Not Just Cute Dogs)","4m 41s","2018-07-05T19:00:01Z"
P5vXvgX535g,"Why Does Nature Make You Feel Better?","5m 45s","2018-07-02T19:00:04Z"
"7Y_H-a4wfG0","Does LSD Really Have A Medical Use?","7m 28s","2018-06-28T19:46:27Z"
MVc6jgQJefo,"How to Get Over That Broken Heart—But Also Learn From It","6m 15s","2018-06-25T19:11:55Z"
"-jXWiOMTNVI","Why Does Time Fly as You Get Older?","4m 30s","2018-06-21T19:00:01Z"
"z5c7ubF0u-U","Are There ""Male"" and ""Female"" Brains?","6m 56s","2018-06-18T19:13:18Z"
7ibmDIjPxoM,"Why Is It Important to Express Your Feelings?","4m 40s","2018-06-14T19:00:00Z"
rnMkfMH3wmI,"What Does Facebook Really Know About Your Personality?","7m 32s","2018-06-11T23:33:27Z"
525RHo9Y2Kk,"The Real Reason You're Always Losing Your Keys","4m 43s","2018-06-07T19:00:00Z"
SpBzDBXQQe8,"What Your Dance Moves Say About Who You Are","6m 5s","2018-06-04T19:00:02Z"
Q2o29_2l_jE,"What 100,000+ Children Taught Us About Neglect in Early Childhood","4m 26s","2018-05-31T19:00:01Z"
"UiY6wr--0dE","We Were Super Wrong About Mental Illness: The DSM's Origin Story","6m 26s","2018-05-29T19:00:00Z"
