Video ID,Title,Length,Published
7AmyfuJDMlY,Saturn's Beautiful Aurora,2m 8s,2009-11-25T20:13:46Z
1ywiO44ypuE,Apollo 12 on the Ocean of Storms,3m 11s,2009-11-19T01:32:09Z
5OFThORmR-s,When Will Time End? (Version 1),21m 15s,2009-11-11T03:04:38Z
nByekIx7XXw,New Discovery about the Fabric of Space-Time,5m 46s,2009-11-07T22:25:35Z
CEQouX5U0fc,How Large is the Universe (VERSION 1)?,20m 14s,2009-10-19T21:31:49Z
cW7BvabYnn8,The Largest Black Holes in the Universe (VERSION ONE),18m 48s,2009-09-28T19:56:19Z
Y2OxpSS64Eg,Hubble Dazzling First Light Images in HD,2m 6s,2009-09-09T19:17:45Z
QOW-NYPEp84,Proof that Black Holes Exist,1m 14s,2009-09-03T21:31:09Z
Pe8ECk73-98,Mars in Stunning HD,2m 33s,2009-08-22T03:34:14Z
FlXuUxFTcLs,The Asteroid that Flattened Mars,20m 13s,2009-08-21T03:13:36Z
LNW4-4uq2C8,Saturn's Mysterious Moons (V1),18m 40s,2009-08-12T21:09:20Z
OtFTpK0FRXI,How Black Holes Erupt,1m 51s,2009-07-29T17:54:10Z
i8OLcbxZ0cA,Crashing into the Moon (version 1),17m 42s,2009-07-20T19:24:59Z
B882w2gC22s,Apollo 11 on the Sea of Tranquility,3m 11s,2009-07-12T12:39:59Z
yHkMYpKExh8,Einstein's Messengers,20m 14s,2009-06-30T21:08:22Z
NTim2L5M6h4,Probing the Secrets of Matter and Energy,9m 19s,2009-06-28T11:33:19Z
M0mBMxGhLAY,Echoes of a Dying Star,4m 8s,2009-06-18T17:30:35Z
vPQvTgD2quQ,Blast into Outer Space Spectacular Fall to Earth,5m 2s,2009-05-28T14:22:16Z
X0I4pWXRwU8,Icy Moon Shadows,1m 38s,2009-05-21T19:45:39Z
ItX8M55-65g,City Lights From Outer Space,1m 42s,2009-05-14T21:38:33Z
M8rAxA6o-wY,Earth From Space: High Resolution NASA Footage,1m 40s,2009-05-02T02:52:15Z
982cTjWx_zc,Secrets of a Dynamic Sun,5m 29s,2009-04-27T17:17:48Z
ieKdvNJ20HE,The Pulse of Alien Life,20m 6s,2009-01-12T05:18:18Z
mT4Zcu1vb7Q,Search for Alien Worlds,21m 41s,2009-01-12T03:04:29Z
qfRiqwQBegQ,Supernova: Exploding Stars,20m 18s,2009-01-04T02:54:09Z
rw5trKz_kdc,Mysterious Black Holes,21m 50s,2009-01-03T17:47:06Z
8CW3acoCynA,To the Edge of Space,21m 27s,2009-01-02T21:40:26Z
h_IiiEF4rGw,To the Edge of Time,21m 11s,2009-01-02T19:38:13Z
bHrBtAUe-Ns,Spacecraft on its way to the Asteroids,2m 29s,2009-01-02T03:11:37Z
ODg2gj7_fzo,Stunning Portrait of the Milky Way Galaxy,3m 8s,2009-01-01T04:11:17Z
Z9iIw4OQNXc,Cyclone on Saturn,1m 46s,2009-01-01T03:34:13Z
LTqm-OvenVc,First Image of an Alien Planet,3m 27s,2008-11-19T16:09:27Z
e5NJcoNUZvc,Vomit Comets and Space Hotels,2m 5s,2008-10-09T04:22:36Z
PdkMh78_qyw,Magnetic Monster,3m 7s,2008-08-23T04:18:33Z
fmTioY_b-sY,Amazing History of the Telescope,11m 55s,2008-07-28T15:05:02Z
GYKyt3C0oT4,What's Inside a Black Hole?,2m 44s,2008-07-12T00:02:21Z
LAdj6vpYppA,Laser Pumped Flying Saucer Spacecraft,6m 38s,2008-06-22T19:31:27Z
T4f4wxb6j1s,Beyond Human: Robot Soccer,7m 28s,2008-06-14T14:36:22Z
DSLVo6XaXW4,Beyond Human: Can a Robot Be a Person?,5m 24s,2008-06-12T11:32:18Z
Li4w9DPPNYI,Beyond Human: Emotional Robots,3m 43s,2008-06-07T02:28:47Z
fwzYWjaKSDA,Beyond Human: How to Design a Humanoid,7m 26s,2008-06-05T04:01:24Z
06zz9kHNv1g,Beyond Human: The Age of Androids,9m 59s,2008-06-02T11:16:54Z
4AMNNtXdxSI,Future of Google Glass: The Cyborg Mind,9m 2s,2008-05-29T02:32:04Z
tW7Fy5rHLgk,Beyond Human: The Invasion of the Inhuman,9m 41s,2008-05-28T13:50:34Z
urVXWUD8Q3Y,Beyond Human: The Cyborg Revolution,9m 59s,2008-05-28T04:17:47Z
GCS6e51zlPc,This Robot Will Crush You,1m 32s,2008-05-15T16:24:16Z
0gmJX9SgWNw,Baseball on the Moon,2m 5s,2008-05-15T13:23:15Z
u9RQx2PcmLM,Black Hole Eruption in the Galactic Center,2m 1s,2008-05-15T02:46:02Z