Video ID,Title,Length,Published
KEBFXHjM6mw,Killer Asteroid: Defending Earth 4k,48m 1s,2022-12-23T21:00:10Z
AkToyclV9DQ,Search for the Cosmic Dawn: James Webb Space Telescope - 4k,25m 35s,2022-10-15T14:00:09Z
J8lJtgyAcIA,Other Earths: The Search for Habitable Planets - 4k,45m 1s,2022-05-21T04:00:11Z
k0Wiealif5U,Search for the Edge of Space - 4k,42m 33s,2022-04-25T01:02:13Z
1DGl_kgo9A8,Planet Hunting with the James Webb Space Telescope,21m 37s,2021-12-22T17:00:12Z
WRlvAhTEy4o,Mars Calling - 4k,49m 44s,2021-12-18T15:00:09Z
vLM-v7LeiEg,The Most Powerful Black Holes in the Universe 4k,48m 1s,2020-12-04T19:00:09Z
snHcrlxHXbA,Are There Other Earths: The Odds of Life Around Nearby Stars,35m 23s,2020-11-27T17:00:16Z
qaUhLXolGaI,Voyage of Curiosity: A Martian Chronicle 4k,54m 40s,2020-11-18T17:00:09Z
90WQb0rQdi4,Journey to the Pale Red Dot - 4k,42m 6s,2020-11-11T17:00:09Z
HTGxCxNVn9g,Venus Death of a Planet 4k,50m 11s,2020-10-16T19:00:10Z
buiCRFB7w9o,SkyRide to Mt. Washington,20m 27s,2020-09-01T16:08:30Z
CmkjB4jmEa0,Venus: Warnings of a Doomed Planet,12m 21s,2020-08-18T22:00:05Z
lXqz2LlX9mM,Is There Life in the Clouds of Venus?,7m 20s,2020-08-14T22:00:20Z
yGGEWyF24G8,Venus: Doing Science in Hell,8m 59s,2020-08-13T22:00:37Z
uCYyog_CD_c,Cloud Cities of Venus: Settling Earth's Twin,37m 51s,2020-07-31T16:00:09Z
KO232yiziuc,Hubble Eye In The Sky - 4k,29m 40s,2020-07-29T16:08:18Z
-jSg336Cgq8,How Large is the Universe? 4k,25m 2s,2020-04-13T18:18:54Z
oqfjl_HtFdA,SuperTornado: Anatomy of a Megadisaster - 4K,44m 12s,2020-01-26T23:00:10Z
3FPyevxctFs,Seeing Inside the Sun - 4K,9m 54s,2020-01-24T18:00:01Z
M7RMnpiUrfE,When Will Time End? - 4k,25m,2020-01-11T20:44:13Z
lSRdJYGtvnY,Is the Universe Infinite? - 4k,25m 2s,2019-10-28T19:58:24Z
nZIOZwUPNnA,Climate Change NOW,5m 18s,2019-08-22T17:51:46Z
AEEpHmC1jzo,Apollo 8 and the Reading of Genesis - 4K,1m 58s,2019-08-01T15:22:29Z
DlczwcBDzeE,Apollo's New Moon - 4k,49m 59s,2019-07-18T23:58:17Z
RuR6NQNaRyg,Hubble Legacy Field: One of the Most Important Images of All Time - 4K,9m 19s,2019-07-02T17:58:19Z
_g6X4Dzos5E,The Incredible Journey of Apollo 12 - 4K,25m 2s,2019-06-24T20:47:01Z
LVtNvJPU1wY,Earth's Most Destructive SuperVolcanoes 4K,28m 5s,2019-06-19T19:55:23Z
nz4mOCRveP8,Birth of a Black Hole 4K,25m 2s,2019-06-05T18:48:38Z
qzYfwHr_62g,Buzz Aldrin Shows Us How to Walk on the Moon - 4k,3m 45s,2019-05-13T21:06:01Z
KpV-VEv3VUE,Seeing the Beginning of Time 4k,47m 58s,2019-04-19T17:07:04Z
u4NQVyzFhRI,Hurricane Florence: Storm of the Future,17m 41s,2018-10-04T13:50:51Z
lDZP7p6Nq-g,Best of NASA: Landmark Ghost Particle Detection in 4k,2m 7s,2018-07-12T17:04:32Z
HUauhrSSj_4,Best of NASA: Tour Of The Moon in 4K,4m 57s,2018-06-08T21:09:29Z
o2lRpiediP8,Collision That Formed The Moon,8m 37s,2018-02-28T20:54:45Z
inuCAqj8UgQ,Seeing Inside the Sun,9m 55s,2018-02-05T18:38:43Z
C1mmTwjHhHs,Star Crash: The Explosion that Transformed Astronomy,15m 21s,2017-11-13T19:00:55Z
YyvZs3IBlLk,Grand Journey to Understand the Evolution of the Universe,6m 53s,2017-10-27T15:58:06Z
VDeecl5UpgQ,Cassini at Titan: A World Unveiled,3m 11s,2017-09-08T14:47:52Z
r-OFala_muE,I Will Rescue You -- Scenes from Hurricane Harvey,8m 49s,2017-09-01T19:33:54Z
nYaD1RlTKEs,Voyager: Silent Ambassador 40 Years Later,3m 28s,2017-08-31T14:34:28Z
2Skwx2V98lA,Mars' Atmospheric Erosion,1m 30s,2017-08-30T02:55:04Z
S1UIw1op2yU,Greenland's 100,000-Year-Old Ice,3m 31s,2017-08-29T18:04:10Z
OQ5meWY5bYM,Neptune Through the Eyes of Kepler,1m 59s,2017-08-29T16:55:53Z
paTVVXm1rC4,Space Rush: The Quest to Live in Space - 4k,16m 44s,2017-06-10T00:47:54Z
xsOboZEyvGc,Tribute to John Glenn,50s,2016-12-12T14:32:32Z
A7YRiprQ8cU,Black Hole-powered Starship,13m 35s,2016-09-16T19:00:33Z
14VWRGWG5MI,Pine Island: An Iceberg as Large as New York City,1m 30s,2016-09-16T12:13:02Z
IpveWJpT3ns,A High Energy Revelation,3m 27s,2016-09-13T19:34:58Z
-BKDzU7UcTc,The Future of Hubble,11m 38s,2016-09-12T14:57:57Z
sqmaRivZRh8,Proxima B: The Pale Red Dot,5m 13s,2016-09-12T14:49:29Z
OgL-6vt5iVA,To the Asteroid Bennu and Back,3m 36s,2016-09-12T14:43:14Z
HfTngy3Rk5Q,Inside a Supertwister,9m 30s,2016-08-19T17:11:00Z
-k3ze3G4Lyg,Juno: Scraping Jupiter,2m 6s,2016-06-30T14:13:00Z
BiQXFKYa-co,The Improbable Rise of Planet Earth,22m 37s,2016-06-23T14:45:59Z
Mc4jAiJameA,Black Holes and the High Energy Universe,24m 30s,2016-06-17T14:50:10Z
AO-gegCmRpQ,Cosmic Journeys - Day of the Asteroid,25m 18s,2016-05-20T13:43:27Z
I0hlgFvqZcM,Figure It Out: How They Kept the Hubble Space Telescope Working,18m 51s,2016-05-18T16:23:24Z
T5yotk1n6-I,Giants on the Cosmic Frontier,5m 16s,2016-02-17T20:22:53Z
h5y1JlgCCwg,China's Moon: Journey of the Jade Rabbit,4m 14s,2016-02-05T21:42:28Z
brh--gYjZts,Mystery of the Red Sprites,6m 5s,2016-02-01T20:43:57Z
xfmtFO2eAag,EARTHRISE: The First Lunar Voyage,55m 30s,2015-12-22T14:29:03Z
g5M48YamRKE,Life Of Hubble,4m 57s,2015-12-10T19:24:57Z
p1yDh0mLRjA,Cinematic Mars,4m 6s,2015-11-16T22:30:01Z
B03w7zNP8I0,Mars: Death of a Planet,7m 37s,2015-11-11T19:08:36Z
52Wa_Izi0Io,Finding Earth's Twin,3m 40s,2015-11-06T22:35:55Z
D_EYeR056X4,Discoveries of a Restless Young Solar System,3m 38s,2015-10-09T15:30:09Z
nTUFWr2nx8U,Magnetism and the Search for Life,5m 19s,2015-10-02T14:40:49Z
kdJ41vGSqB8,Hubble's Pluto Discoveries,4m 37s,2015-09-24T16:01:04Z
mfQq2b4VT84,The Wonders of Pluto,3m 40s,2015-09-18T22:17:31Z
InUVmPkby3U,The Fate of Mars' Atmosphere,3m 11s,2015-09-11T14:51:40Z
lJXG5zfTL2A,A God's Eye View of the Universe,3m 24s,2015-09-04T16:00:04Z
2o1X5LKoIE8,Cosmic Journeys - Solar Superstorms,44m 37s,2015-08-29T15:00:01Z
XwkMCHf516s,Cosmic Journeys - Supermassive Black Hole at the Center of the Galaxy,31m 24s,2015-08-27T15:00:02Z
394x4tV5WfE,Ultimate Bipolar Nebula,4m 8s,2015-08-26T14:29:40Z
_kKfo7NCYTI,Final Encounter: Cassini and Dione,3m 22s,2015-08-21T18:33:44Z
5h1Dlgt8cb4,Is the Universe Dying?,3m 52s,2015-08-14T16:30:00Z
piehWYdlOQA,When A Solar Storm Engulfs Earth,4m 19s,2015-08-07T17:00:02Z
dzAOXdeJJb0,What Dawn Discovered on Vesta and Ceres,4m 44s,2015-08-04T22:15:51Z
IN1KJ8LYW3U,Cosmic Journeys - Hubble: Universe in Motion,50m 2s,2015-07-31T19:00:00Z
ook0Nqqj73k,Bone-Chilling Sounds Picked Up by Spacecraft,1m 42s,2015-07-22T16:02:29Z
7FUYdm3DRjk,Cosmic Journeys - Glimpsing the Solar System's Birth,15m 47s,2015-07-10T17:11:11Z
uiATpTX4VJs,How a Black Hole Would Kill You,3m 10s,2015-07-03T16:00:02Z
VVjMP2DPDBo,Galapagos: Realm of Giant Sharks,52m 48s,2015-06-26T14:00:01Z
4ddoW8csry8,Black Holes and Dark Matter,3m 3s,2015-06-23T20:53:15Z
ytY48qWZrKM,Highways Of Light - Star Trail Time-lapse,2m,2015-05-01T20:39:37Z
OGHIreagI7Y,Hubble Space Telescope Celebrates 25 Years in Space,3m 21s,2015-04-23T15:00:44Z
Q8-aojqxBV0,Age of Hubble - Final Preview,1m 32s,2015-03-25T20:41:12Z
bMr7vaJJXGI,Deeper than the Hubble Deep Field,4m 24s,2015-03-18T12:26:29Z
MrPHlGWNmd8,Superstar Duet in Eta Carinae,3m 58s,2015-01-07T21:03:16Z
ynBFzS-M9HQ,Hubble Return to the Eagle Nebula,5m 3s,2015-01-06T19:59:55Z
t-yHYQV6yKk,Solar Storms: 10 Hottest Facts,5m 59s,2014-12-09T20:21:23Z
ta7-pA2yOGY,Stunning New View of Planetary Genesis,4m 37s,2014-11-06T13:59:57Z
dQdRrhDMXnY,Cosmic Journeys - Interstellar Flight,25m 41s,2014-10-30T03:30:37Z
9JT_-KjeWYE,Interstellar Flight - Preview,1m 33s,2014-10-28T15:39:34Z
WUTY-hJGAMM,Super Earths: 10 Major Discoveries,4m 18s,2014-10-18T00:35:22Z
n2BRXp71UvI,Supermassive Black Holes: 10 Astounding Facts,4m 41s,2014-10-03T23:23:27Z
kRmXL08DuaI,Interstellar flight: 10 Hard Facts,3m 13s,2014-09-30T21:45:14Z
RTNZDosUaBY,Cosmic Journeys - Life: Destiny or Chance?,25m 16s,2014-09-19T19:32:03Z
HOrNHdTAG-Y,Life: Destiny or Chance - PREVIEW,2m 43s,2014-09-12T19:38:24Z
oA1sphuyazY,Cosmic Journeys - Fate of Antarctica,25m 24s,2014-07-22T04:25:18Z
Yt3ZCnFx5Og,Cosmic Journeys - Supervolcanoes,28m 5s,2014-05-24T02:06:02Z
32qqEzBG9OI,Major New Cosmic Simulation: Why it's Significant,6m 13s,2014-05-09T17:18:02Z
qmJ_bcAvoVw,Earth's Most Destructive Supervolcanoes - Preview,1m 13s,2014-04-29T21:02:04Z
jj4aANSBWXI,An Asteroid with Rings?,4m 16s,2014-03-28T16:36:58Z
kteMXaUNvlc,Greenland Ice Sheet Changing,4m 32s,2014-03-27T18:08:48Z
PxG66QMd4wE,Cosmic Journeys - The Search for Earth-like Planets,27m 10s,2014-03-24T22:30:50Z
hWiHgj1yhJ4,Hubble's Stunning Monkey Head Nebula,3m 39s,2014-03-17T16:42:37Z
EOO7BfzEcf8,The Search for Earth-Like Planets - Preview,1m 22s,2014-03-13T14:08:50Z
bOSQcDBMwJA,X-Ray Wind Strips Galaxy,4m 19s,2014-03-05T21:33:31Z
BEbvYqljAzQ,Water Planet,7m 5s,2014-02-28T19:57:13Z
FV_5v52Mdi0,Tracking Solar Torrents,4m 27s,2014-02-21T16:16:12Z
3wOFAkggSiU,How Large Can a Telescope Be?,7m 5s,2014-02-20T16:45:57Z
JqJ-aTrqJg4,Opportunity Knocks 10 Years Later,6m 29s,2014-02-11T19:51:18Z
W7vZmyfaaV4,Reinventing Space Flight,49m 39s,2014-02-04T00:08:43Z
VPHWv2rOSJQ,Unlikely Planetary Treasure Trove,3m 51s,2014-01-17T15:18:25Z
XNN7Q2cUhWo,The Moon Battered by Impacts,5m 31s,2013-12-26T21:36:59Z
3yCb8vVxpnQ,Strange Case of the Pulsating Star,3m 55s,2013-12-17T22:25:42Z
e4_t-cbxu7k,The Great Solar Magnetic Flip,2m 34s,2013-12-17T21:29:32Z
2U3ucaVzRqQ,Surface of the Sun as You've Never Seen it,3m 22s,2013-12-16T21:37:54Z
Rl8H4XEs0hw,Einstein's Rings and the Fabric of Space,6m 22s,2013-12-10T01:50:08Z
7qym7b-qvkE,Super Hurricanes and Typhoons,30m 19s,2013-12-05T14:30:06Z
W6BdiKIWJhY,What Curiosity is Discovering on the Road to Mt. Sharp,8m 26s,2013-11-26T22:30:43Z
7RE-oem9WC4,Super Hurricanes - Preview,1m 15s,2013-11-26T21:08:46Z
QrZ8LyDbiAQ,Was Mars Once Like Earth?,9m 15s,2013-11-12T20:24:36Z
X6rm5HSDy6g,Supermassive Black Hole at the Center of the Galaxy - PREVIEW,1m 44s,2013-11-02T00:25:21Z
jRkXXY0CyyI,Titan's Chemical Cocktail,3m 39s,2013-10-17T15:35:03Z
V5YdsYJR5Qw,Cosmic Journeys - Earth in 1000 Years,31m 13s,2013-10-05T05:57:00Z
yuoyqOVizMA,Earth in 1000 Years - Preview,1m 46s,2013-09-19T21:15:59Z
IcNatimOkvc,Polarizing Planets,6m 25s,2013-09-09T19:32:09Z
aG0qMiicMUA,Hubble's Time Tunnel,6m 10s,2013-09-06T22:29:43Z
pSCFqGY2LIs,Melting Ice Caps: One Scientist's Point of View,6m 53s,2013-09-05T17:29:30Z
O4Z9g7nKWPs,Black Holes and Exploding Stars: FERMI at Five,4m 56s,2013-08-21T21:56:42Z
aI38xdNIamU,Meteor Explodes Over Russia,3m 21s,2013-08-16T22:06:53Z
M2JCKiSO7AA,The Incredible Sungrazing Comets,5m 17s,2013-07-30T17:44:06Z
SusUPkGTFQo,Titan: The Mystery of the Missing Waves,4m 34s,2013-07-25T21:30:21Z
COWE6sMzdqI,Cosmic Journeys - HyperEarth,11m 41s,2013-07-24T17:16:39Z
T6ObZ-Fgjr8,Penetrating the Solar Surface,4m 17s,2013-07-01T18:18:51Z
ttIvSMtXRM8,Point and Shoot on Mars,3m 20s,2013-06-29T20:36:15Z
UyKHwFAJ9o4,Super-Earths: New Planets Found!,5m 31s,2013-06-26T23:05:31Z
lq4KEUsXlNs,No Gentle Galaxy Collision,3m 56s,2013-06-23T19:01:40Z
IxRwfNOION4,Dust Traps and Planet Factories,3m 28s,2013-06-06T19:30:04Z
GD6W3UkIE10,Hubble Realms of Light 4K,6m 13s,2013-05-29T02:34:09Z
Mqg3mekKw7w,The Mighty Ring,4m 8s,2013-05-23T16:50:12Z
8EaLJJtVHTA,Tornadoes from Below and Above,4m 40s,2013-04-24T21:19:18Z
jr0lkUwOULQ,Horsehead Sculpted in Dust,4m 39s,2013-04-19T21:11:06Z
JadQfs7iQGo,Supervolcanoes - Fulldome Trailer,1m 18s,2013-04-19T18:36:42Z
UBRQJLi0S8w,Solving Cosmic Cold Cases,8m 31s,2013-04-10T17:17:32Z
seXbrauRTY4,Voyager Journey to the Stars,24m 4s,2013-04-06T15:20:47Z
YxNhOaVJbJM,Supernova Through the Eyes of the Hubble Space Telescope,8m 31s,2013-04-03T21:59:15Z
fpyRQ46fUEM,Curiosity's First Major Discovery,5m 47s,2013-03-16T00:48:08Z
7YaDRC379eI,Voyager Journey to the Stars - PREVIEW,1m 8s,2013-03-15T12:47:42Z
SIJ55xXj9vQ,SpaceRip: The BEST Space Videos on the Web,1m 6s,2013-03-13T21:33:10Z
VX6XSqP6UVo,Sea Lion Hunters,6m 29s,2013-03-07T16:43:27Z
rpf-PP2Q2yM,Journey to the Sea of Cortez,2m,2013-02-27T19:45:14Z
N1CxA7r-4oc,NASA Telescope Discovers the Origin of Cosmic Rays,3m 29s,2013-02-21T22:54:08Z
6LyEp_Emr4A,Reinventing Space Flight - PREVIEW,1m 35s,2013-02-08T00:44:59Z
fRyD1ourEzU,Black Hole Galaxy Sculptor,3m 48s,2013-02-05T20:12:42Z
ViNQW-mF94k,The Quantum Guide - Search for the Higgs Particle,6m 38s,2013-01-31T19:51:07Z
BfYIYDG9QX4,Night of Meteors,3m 5s,2013-01-18T23:44:31Z
UFnkrJZutjE,Doctor Plasma Explains the Universe (Parody),2m 17s,2013-01-18T22:19:52Z
YzbTfC0tyxg,The Quantum Guide - Pulsars,7m 40s,2013-01-15T22:34:27Z
ZW57NsZvVeM,Cosmic Journeys - Trailer,1m 17s,2013-01-15T16:49:19Z
tNa0ahyNDKc,From Space: The Fastest Growing U.S. Cities,4m,2013-01-12T00:45:40Z
fvRcYBOTeZ4,Earth Morphing Before Our Eyes,5m 1s,2013-01-11T16:51:10Z
b3e_Kp_q0rs,The Mysterious Shape of a Dead Star,4m 1s,2012-12-19T20:02:59Z
PJIiKMHI4ic,A Comet Grazing the Sun,3m 28s,2012-12-16T21:43:01Z
3kHBPc943sg,Curiosity's Revolutionary Experiments,16m 40s,2012-12-15T00:49:21Z
ATrICg_26lM,Rover Curiosity: Landing sequence breakdown,4m 6s,2012-12-12T18:10:26Z
qSznKLIWTRU,Remembering Apollo,7m 24s,2012-12-07T23:52:08Z
a7-m6AwG3EA,Earth Gamma Ray Blasters,4m 1s,2012-12-06T19:04:30Z
7uNtMV7zq00,Hubble's Greatest Hits: Part 3,3m 30s,2012-12-05T22:48:09Z
neTSBO2L-Io,Hubble's Greatest Hits: Part 4,4m 5s,2012-12-05T21:55:35Z
U3-AJ1ENkEU,Hubble's Greatest Hits part 2,3m 49s,2012-12-05T21:34:19Z
anfbjiShjP8,What Scientists Are Seeing Over Antarctica,8m 34s,2012-12-01T21:17:40Z
7h_mB0WW0jM,Birth of a Black Hole,25m 1s,2012-11-29T14:06:29Z
RUKzebn8vDo,Cosmic Journeys: Birth of a Black Hole - Preview,1m 57s,2012-11-19T15:47:33Z
OPsPgwPOxos,High-Res Images of Cities at Night from the International Space Station,5m 9s,2012-11-14T16:43:49Z
wNKyugxly04,Hubble Lightness of Being,4m 20s,2012-11-13T22:52:06Z
-RGNhZ292Zg,Part I: High-Res Images of Cities at Night (from ISS),5m 25s,2012-11-10T03:37:21Z
pvvgPZKqWJk,Zombie Planet Returns,2m 34s,2012-10-27T17:39:28Z
lY5gl7-uYZI,Epic New Hawaiian Volcano Activity,4m 9s,2012-10-25T21:10:56Z
Xu3-0Ubhiwo,The Turbulent Story of Galaxy Evolution,3m 40s,2012-10-21T19:23:19Z
Y8DV7WFdTw8,Earth-sized Planet Found Orbiting the Sun's Nearest Neighbor,4m 1s,2012-10-18T16:34:13Z
GjO0zdXqCU0,Dark Matter Structure Revealed,5m 36s,2012-10-16T14:45:11Z
--V1nNO9bow,Light from the Core of the Sun,3m 50s,2012-10-16T02:20:14Z
oC31pqk9sak,Why Mars Died and Earth Lived,9m 32s,2012-10-13T15:28:45Z
whUx2pyv3gg,Battle of Giant Windy Stars,2m 20s,2012-10-13T02:12:04Z
gbsU9CmrkxQ,Astronomers Spot Sudden Black Hole Flare Up,2m 8s,2012-10-05T23:39:14Z
3vbqXlMWKwU,Giant Telescopes of the Future,6m 32s,2012-10-05T17:16:19Z
P2u277ulwxI,Curiosity Finds River Rocks and River Beds on Mars,4m 42s,2012-10-01T12:11:38Z
GVds0q0y5RM,Black Hole Merger Simulation,1m 57s,2012-09-30T21:28:06Z
xp-8HysWkxw,The Largest Black Holes in the Universe,24m 59s,2012-09-26T16:43:59Z
jsGR6QDX7xY,The Most Powerful Objects in the Universe,25m 7s,2012-09-23T19:02:00Z
GOa2L8_IAnQ,When Will Time End?,25m 12s,2012-09-20T16:53:37Z
d_uBlDoecak,Solar Storms Rising,3m 5s,2012-09-19T19:37:28Z
yaX4iGw-b_Y,How Large is the Universe?,25m 4s,2012-09-18T11:59:01Z
VeDwONUNNIQ,Finding Another Earth Within Reach,7m 43s,2012-09-17T17:44:26Z
xOMGtUCvMVw,Exo-Planet Hot Flareup,4m 2s,2012-06-28T15:39:58Z
U0_6kbeagIk,Blue-Flame Plasma on the Face of the Sun,3m 6s,2012-06-11T21:47:24Z
VP_FDGIIvD0,Ray Bradbury & Friends,4m 7s,2012-06-08T13:55:00Z
qnYCpQyRp-4,Milky Way Versus Andromeda As Seen from Earth,3m 53s,2012-06-04T20:47:15Z
FBhIDjWaByg,The Incredible Journey of Apollo 12,24m 31s,2012-05-29T00:42:46Z
Muk4F_LvbYs,How a Giant Telescope Works,6m 54s,2012-05-16T20:16:49Z
vhoJ0BMz5k4,Crashing into the Moon - Preview,1m 49s,2012-05-11T14:16:25Z
H6xW87tmNHw,Tale of the Shepherd Planets,4m 50s,2012-04-24T23:38:10Z
DnSmFC-JgvQ,DYNAMIC EARTH - Trailer for a New Fulldome Planetarium Show,1m 19s,2012-04-20T16:19:53Z
PcHICww6JL0,Hubble's Greatest Snaps,3m 55s,2012-04-17T19:10:35Z
6alG2Dkg3ns,Tornadoes and Twisters On Mars,3m 28s,2012-04-13T18:54:00Z
PBxs87XHNps,Narrowing the Search for Dark Matter,3m 3s,2012-04-05T22:26:33Z
cj4qCnzeRVk,Birth of a Great Observatory,5m 53s,2012-03-30T15:28:14Z
xhaKrv3N8ME,Cruising To Mars,3m 20s,2012-03-26T14:39:27Z
OvWYzIaQ6is,NASA Debunks Wacky 2012 Claims,3m 32s,2012-03-07T22:46:15Z
BEhIGoq9tow,Seeing Earth from Space: New International Space Station Time-lapse,4m 15s,2012-03-06T17:51:09Z
-EV3pzjwJpE,Wandering Stars: a tour of the planets,14m 47s,2012-03-01T20:48:17Z
68LOZvQTjB0,The Shrinking Expanding Moon,2m 29s,2012-02-21T01:13:35Z
x9ctGHw8MWQ,EARTH Masterpieces of Stone and Ice,13m 32s,2012-02-17T00:22:04Z
WGTBJHFNywI,Birth of the Moon,24m 26s,2012-02-11T17:25:27Z
1QdJ34mhKcg,Birth of the Moon - PREVIEW,1m 46s,2012-02-02T19:17:55Z
ONIjmVuLPak,Mars Opportunity Discoveries at Eight Years,3m 1s,2012-01-26T17:01:00Z
E6FpSOg2BxE,The Spectacle of Star Death,5m 32s,2012-01-20T16:48:39Z
EM2eFfTXnCs,Why the Runaway Universe Discovery Won the Nobel Prize in Physics,4m 12s,2012-01-17T04:28:00Z
EPyl1LgNtoQ,The View from Space - Earth's Countries and Coastlines,3m 47s,2011-12-21T20:24:24Z
S_nCIJnZDW8,The Violent End Stage of Star Formation,3m 30s,2011-12-15T19:05:41Z
ciWGrZMkXVM,Black Hole Meltdown in the Galactic Center,4m 54s,2011-12-14T18:31:30Z
d1coV7XqE1M,What sets Curiosity apart from other Mars Rovers?,13m 35s,2011-12-09T18:42:27Z
Ysc53elyQys,Einstein's Greatest Blunder,3m 52s,2011-12-05T00:08:38Z
v0UiaMFSHWY,The Great Solar Mag Flip,3m 19s,2011-11-30T16:34:41Z
SB4h-7onDTs,Re-Launching the First Science Rocket to Space,3m 38s,2011-11-30T01:51:27Z
ayNfFrswdc4,Ghost Lights from Earth Orbit,4m 11s,2011-11-18T00:52:46Z
5xrza6PIJdw,Tour of the Moon,5m 35s,2011-11-10T20:58:28Z
CmwclZQLOaw,Dwarf Planet Crossing at the Solar System's Edge,3m 42s,2011-11-09T04:46:57Z
VxVlwAvi6Zo,Pulsar Enigma Discovered,3m 10s,2011-11-07T00:55:56Z
a1OL3WkCfwc,Closest Known Approach by a Large Asteroid,1m 58s,2011-11-06T03:07:49Z
Cu8FRXDiX9Y,Hubble Burning Questions,9m 13s,2011-11-03T16:13:14Z
QUpWCRadIIA,Mysteries of a Dark Universe,25m 1s,2011-10-13T22:04:03Z
WZpJIK7LMR8,Mysteries of a Dark Universe - PREVIEW,1m 13s,2011-10-06T19:44:58Z
t6t8m44WbwM,Visualizing Jets Blasted Out of Newborn Stars,3m 38s,2011-09-16T18:08:17Z
MO2LFSifklE,An Asteroid's Surface in Fine Detail,1m 58s,2011-09-16T17:38:50Z
Yw6aAq7uODU,Big New ExoPlanet Haul,2m 52s,2011-09-16T14:44:48Z
Y5oNwJNdMxY,The Riddle of AntiMatter,24m 3s,2011-08-19T14:58:56Z
nmDZhQAIeXM,Extreme Solar Flares,2m 53s,2011-08-14T18:59:05Z
nNA_fXNUmeQ,In Search of Pure Dark Skies,5m 55s,2011-08-13T20:19:17Z
V5rBQy12Xbc,The Riddle of Anti-Matter - PREVIEW,1m 34s,2011-08-05T19:40:07Z
pBam6B9wrdI,Water Flows Discovered on Mars,2m 1s,2011-08-05T04:02:39Z
MP3jAg1C_hA,Andromeda Stars in Your Eyes,3m 45s,2011-07-21T01:09:26Z
9Tjb5JvCB4s,Breathtaking Images of the Sun,1m 27s,2011-07-04T16:16:46Z
sjkPeexEdyI,Breathtaking New Images of the MOON,3m 33s,2011-07-02T02:52:43Z
Hgf3i__YDrc,Unexplained Gamma-Ray Pulsar,2m 8s,2011-06-30T02:58:54Z
GT-HTJ0HB1I,The Most Distant Quasar Ever Discovered,3m 35s,2011-06-29T16:00:54Z
bTyKhRZKuZc,Behind the Scenes on Endeavour's Final Flight,16m 1s,2011-06-22T14:18:47Z
qPE4ILbe4CM,Pandora's Dark Mystery,3m 51s,2011-06-22T12:29:28Z
FtRZqpdcvbg,Warped Galaxy in Turmoil,2m 50s,2011-06-16T02:39:11Z
qq3U5o4Yblw,Strange Magnetic Bubbles at the Edge of the Solar System,2m 35s,2011-06-09T20:55:06Z
6V7Hqom8GzM,Catching Solar Waves,3m 7s,2011-06-08T04:05:19Z
rj18UQjPpGA,What an Astronaut's Camera Sees: International Space Station,7m 1s,2011-05-26T21:51:50Z
CXuNRMVxUdY,Flare States of the Crab Nebula,2m 27s,2011-05-23T17:02:25Z
QoDIk7ryljg,How an Asteroid Got a Rooster Tail,1m 1s,2011-05-03T13:58:22Z
lTEK7HhFLMw,Voyager Humanity's Farthest Journey,3m 14s,2011-05-02T21:39:38Z
JgMXPXdqJn8,Cosmic Journeys - Mars: Earth that Never Was,25m 18s,2011-04-30T23:55:20Z
7JVn_CUCdvk,Hubble Targeting the Big Questions,7m 34s,2011-04-22T20:29:53Z
3aJE7bqfjpc,Where We Stand in the Cosmic Energy Continuum,5m 52s,2011-04-21T15:37:09Z
kOM_ROx6gbo,Solar Tsunami,4m 3s,2011-04-19T13:34:48Z
YL__UbPsPDg,Saturn's Mysterious Moons,25m 15s,2011-04-14T21:14:02Z
pc7GeSr2vuI,Saturn's Mysterious Moons - PREVIEW,1m 38s,2011-04-08T15:30:02Z
Y-70vwwabKk,Neutron Star Collision and Gamma Ray Burst Discovery,3m 8s,2011-04-07T19:00:28Z
-FmT12sHdrs,Radio Saturn Wobbles and Sirens,2m 11s,2011-04-06T18:26:40Z
xp5AzO8_YPg,Hurricane Katrina at Peak Intensity: Computer Simulation,3m 29s,2011-03-31T14:25:52Z
EWpfASE4VRo,Earth As You've Never Seen It,7m 51s,2011-03-29T18:57:48Z
FBnJ68zf5u8,Into the Spider's Lair,3m 44s,2011-03-24T18:20:35Z
FENnKEgRRYw,The Halloween Solar Storms,4m 33s,2011-03-21T20:54:51Z
IK2M4tSd-ic,Heartbeat of a Black Hole,4m 28s,2011-03-02T19:09:02Z
Kz8OV0U4UOM,Hubble Black Hole Probe,6m 42s,2011-03-01T18:14:16Z
QEMq5uWchcc,PREVIEW: Alien Planets & Eyeball Earths,1m 39s,2011-02-10T18:31:42Z
blE9gpnKpT4,360 Degree View of the Sun,2m 53s,2011-02-06T16:20:51Z
EUBwPf9J2Ng,Planet Vulcan: Toxic Oasis,2m 10s,2011-01-28T15:50:22Z
hNfZ8m5ol48,Unmasking Giant Black Holes,3m 10s,2011-01-23T04:44:47Z
dTY3sVA2wOw,Strange Rumblings of a Neutron Star,1m 52s,2011-01-18T21:30:40Z
kuLcuPnvR9o,Gamma Ray Thunderstorms,1m,2011-01-12T00:00:55Z
UcaZfWaNR64,Seeing the Formation of Planets,5m 52s,2011-01-07T18:22:55Z
8yBB81ifc40,Imagining Extrasolar Planets,3m 5s,2010-12-31T16:07:46Z
AEzj7kF-8pc,Mars Spacecraft that Could,1m 6s,2010-12-19T19:32:19Z
AY5TSzJQsBs,Hubble's Triumph Remembered,6m 46s,2010-12-17T23:05:20Z
Ioiy43pxyH0,Ice Volcano on Titan,1m 56s,2010-12-14T22:38:46Z
ipdRhgLWGXo,The Infinite Monkey Theorem,1m 32s,2010-12-10T15:26:27Z
dG1JpC5jels,Is the Universe Infinite?,23m 54s,2010-11-24T00:04:29Z
LbqzRYAZO_A,Planet from Another Galaxy (about to get cooked),3m 20s,2010-11-19T04:37:16Z
_BrLP105Grg,Is the Universe Infinite? PREVIEW,1m 32s,2010-11-17T19:08:15Z
vZEg5iSJoD0,A Look at the Milky Way's Birth,2m 11s,2010-11-13T03:52:40Z
FgNncFUfBJs,How the Universe Evolved,3m 39s,2010-11-05T15:46:11Z
uDsWD9QmwJ8,A Look at the Milky Way's Future,3m 30s,2010-11-04T13:12:40Z
qVA7R9z4fpU,How Solar Systems & Planets Evolve,3m 5s,2010-11-03T19:40:32Z
5BNgK7Lmg9w,New Look at the Infant Universe,6m 44s,2010-10-30T04:45:39Z
sJ6_CDwUEYs,Rendezvous with a Comet,2m 23s,2010-10-28T10:08:32Z
UTqFIHn_1IE,Curious ExoPlanet Hot Spot,41s,2010-10-22T14:22:37Z
qRoDGii9Zxw,The Most Distant Galaxy in the Universe So Far,4m 24s,2010-10-21T15:04:13Z
9mcc86nGnVU,Chrome-plated Universe,3m 23s,2010-10-15T21:11:07Z
DSatQkr78Po,Search for Asteroid Threats,2m 33s,2010-10-12T16:51:29Z
AJNnn5yx-kA,Curiosity Shop of Saturn's Moons,6m 10s,2010-10-06T16:03:15Z
JNPKUEpTmmQ,Mapping the History of Space & Time,6m 24s,2010-10-04T16:24:41Z
ntOG6GsdxjI,Planet of Altered States - Avatar Mashup,1m 58s,2010-09-28T17:46:43Z
yFHu03CKAxE,Alien's View of Our Solar System,2m 36s,2010-09-23T21:34:42Z
wWlFG_Ywl1I,Craters Reveal the Moon's Turbulent Early History,44s,2010-09-16T21:19:41Z
0lTbQ4nPFjg,Cosmic Energy: Cold Sparks to Black Holes,21m 32s,2010-09-10T19:20:59Z
WkY6s7Mj8-g,HubbleART: Pearl Jam to Final Doom,3m 51s,2010-09-02T18:37:55Z
oaIU4sak7Zk,Cold Sparks & Black Holes - Preview,1m 34s,2010-09-02T00:15:29Z
r96nO0qoLUU,Sensational Solar System Discovery,3m 47s,2010-08-24T14:34:39Z
zeApJ2nuYmY,Viking First Views of Mars,2m 51s,2010-08-21T04:04:38Z
-xJnE2uw6EM,Glacier Slab Breaks Off,2m 25s,2010-08-19T23:43:24Z
iNmHuBtF3Ew,New High-Intensity Cosmic Explosion,1m 55s,2010-08-13T22:36:53Z
n06yrTx0PKc,Lurking Dragon Cosmic Swan,2m 14s,2010-08-06T21:30:55Z
rgre5C-7Af4,Saturn's Ring Disturber,1m 33s,2010-07-30T19:07:07Z
pV58YptFTK0,The Unbearable Beauty of the Night Sky,7m 3s,2010-07-22T21:37:52Z
uP-Drk7AQdM,Earth & Titan,3m 4s,2010-07-18T03:43:41Z
ELhM3TGma7o,Universe Painted in Light,13m 13s,2010-07-15T03:38:02Z
QRn73BhlDJY,Earth: Planet of Altered States,3m 16s,2010-07-01T20:50:11Z
qEhhVmxYSNI,Gulf Oil Eruption in 1080p: Where the slick is going,1m 26s,2010-06-18T21:24:51Z
FDyszoB0A0c,When Worlds Collide,5m 8s,2010-06-16T16:58:57Z
12eO84E8k18,A Super Jupiter Makes its Mark,4m 41s,2010-06-10T22:41:29Z
90XFpu-65JY,Kilauea: Into the Night Volcano,2m 31s,2010-05-18T21:36:11Z
NfwlpHWwvJk,Portrait of Gliese 581,3m 49s,2010-05-13T18:42:09Z
Sh2-P8hG5-E,The Eerie Sounds Of Saturn,2m 21s,2010-05-10T19:26:13Z
DbkpdaPdwAk,Pluto Red Outpost on the Final Frontier,2m 11s,2010-05-05T21:00:16Z
--X9zfgZtS0,Hubble Telescope Space-Shattering Discoveries,15m 54s,2010-04-29T04:17:08Z
hgxa_soWutg,Hubble 20th Anniversary in Space,9m 24s,2010-04-23T20:26:16Z
6GbejVnYWJs,Saturn Struck By Lightning,2m 28s,2010-04-21T16:59:56Z
Kambs1N7nIM,Global Temperature Puzzle,5m 49s,2010-03-31T20:46:40Z
JkeglSqQMyQ,Fly Down into the Marianas Trench,47s,2010-03-25T19:49:02Z
CkV8RRRu7gE,How to Wrangle a Giant Telescope Mirror,9m 12s,2010-03-19T21:17:35Z
ul4DHFWAmOY,Titan Flying Down to Canyon Country,1m 18s,2010-03-05T15:47:46Z
vCd3S4Yc8sU,Mars Strange Volcano and Impact Features,2m 31s,2010-03-04T21:57:31Z
uGcDed4xVD4,Earth 100 Million Years From Now,3m 19s,2010-02-12T19:44:12Z
5CR2n4xDFVM,Saturn Rare Double Aurorae,4m 15s,2010-02-11T17:49:09Z
SM7inRnkoA8,Milky Way Hot and Cold,2m 24s,2010-02-10T16:24:09Z
8LeDir65-AE,Orion Nebula Buried Secrets,2m 45s,2010-02-10T15:25:11Z
FIoBVYJs3js,Earth's Frozen Frontiers,9m 30s,2010-02-09T21:54:56Z
YPjXxKpM4DM,Voyage to Pandora: First Interstellar Space Flight,21m 8s,2010-02-08T20:31:12Z
U3ioMmo07KQ,Mars Flying Down to Frost Patches and Crater Floors,2m 10s,2010-02-07T03:43:18Z
xC6J57DmsW8,Mars Making Tracks,3m 18s,2010-01-28T20:35:26Z
wnb20chqbxM,The Beauty Of Stars Being Born,4m 35s,2010-01-21T02:17:27Z
3u810PTA5Tc,Nibiru-Planet X Now Approaching Earth!,6m 11s,2010-01-15T21:57:48Z
v3Kcw0UrIFI,The Search For Earth-Like Planets - Version 1,21m 29s,2010-01-09T03:05:06Z
bW2ox6BJjHY,Volcano Hot Pulse of Fire,3m 1s,2009-12-22T17:03:36Z
EgrdAUFFMrA,Colonizing Space - '70s Style!,4m 33s,2009-12-11T18:49:28Z
KCADH3x56eE,Supermassive Black Hole in the Milky Way Galaxy (Version 1),20m 9s,2009-12-09T17:56:57Z
vRZeyGH-PHk,Largest Black Holes in the Universe (Les Plus Gros Trous Noirs de l'Univers),19m 16s,2009-12-08T21:31:15Z
YUhEigdFFyI,NASA Response to Crazy 2012 Claims,3m 25s,2009-12-07T14:40:29Z
51UzH2f1F-k,Saturn Sensational One Ring Discovery,4m 57s,2009-11-28T14:54:42Z
