WirEgSaCzeQ,The Truth About 9/11 | The British Conspiracy Road Trip (US History Documentary) | Real Stories,57m 17s,2021-07-20T16:00:12Z
_oMMatsr7QI,London 7/7 Bombings: Debunking The Myths (Conspiracy Documentary) | Real Stories,57m 28s,2021-06-12T16:00:31Z
g7UdgoGDkJU,Do You Believe In Aliens? | Conspiracy Road Trip (UFO Documentary) | Real Stories,57m 1s,2021-04-03T16:00:16Z
qZAapn0KC_I,Hawaii's Hidden Darkness (Conspiracy Documentary) | Real Stories,53m 10s,2019-08-11T17:00:08Z
RO0PEXz1Yb4,Do We Really Have Freedom Of Choice? (Conspiracy Documentary) | Real Stories,1h 16m 55s,2019-07-20T15:00:03Z
qQKaCTdrmJc,Cancer Cure Cover-Up? (Conspiracy Documentary) | Real Stories,1h 50m 56s,2019-07-04T17:00:13Z
fdEKbbhxiUE,The Global Financial Web Exposed: Britain’s Second Empire (Conspiracy Documentary) | Real Stories,1h 16m 9s,2018-10-16T17:00:03Z
