##2013
8UEyl8MHT9s,Training session 31/12/13,5m,2013-12-31T11:59:36Z
dLz6xmnOLak,#FCB2013 Facts & Figures of FC Barcelona during this year,2m 17s,2013-12-27T11:09:46Z
rx0N9te8eMU,Pedro y Alba analizan el triunfo contra el Getafe,1m 43s,2013-12-22T19:28:19Z
oL2f2VsGSnA,Training session 21/12/2013,4m 54s,2013-12-21T12:30:57Z
0_idYJ8cl3Y,FCB Escola makes football popular in India,5m 18s,2013-12-20T18:37:05Z
xnvyyDtiytk,Proclamació premis Vázquez Montalbán i Balanç del president Sandro Rosell,33m 45s,2013-12-19T12:56:51Z
bb-gy2Ohdpw,Inauguració de la nova FCBotiga Megastore,34m,2013-12-18T20:28:26Z
OO2czOpQK5Y,Partit complet entre Barça B i Mitra Kukar FC (18/12/2013),1h 46m 3s,2013-12-18T12:45:57Z
taKmWc5n5Ac,Sergi Roberto: A poc a poc estic tenint més minuts,57s,2013-12-18T00:25:26Z
qksHclGI-Qc,Los 5 mejores goles de la cantera (14 y 15 de diciembre),1m 34s,2013-12-17T19:52:31Z
7gt8WIglfHY,Training session 17/12/13,2m 23s,2013-12-17T13:12:26Z
Ff5VBSKKRK4,Els jugadors de futbol sala tornen a fer de les seves vestits de Pare Noel,1m 45s,2013-12-17T11:49:43Z
9K5FEqRtxbQ,Tata Martino: We'll have to see what form City and Barça are in in February,2m 15s,2013-12-16T16:32:04Z
EoYe9sj3aag,Bartra: It's a really important victory,1m 41s,2013-12-14T23:01:41Z
X3mxqLqJlZQ,Martino: Es el partido que más contento he acabado,2m 9s,2013-12-14T22:25:18Z
DH_gBJT9bAg,Ronaldinho's overhead kick against Villarreal (2006/07),1m 21s,2013-12-13T17:10:50Z
mcGrjka5Uqk,Els jugadors del Barça signen la samarreta de la Diada del Soci Solidari,1m 16s,2013-12-13T16:34:44Z
e_UJGrDo8zU,Tata Martino: This was our most complete performance,2m 40s,2013-12-12T09:53:20Z
L1DGAyw4uQk,Martino: the game against Celtic is very important in all aspects,2m 44s,2013-12-10T16:29:00Z
rf1z3-qU1Lo,La rueda de prensa de Sergio Busquets y Tata Martino íntegra,39m 40s,2013-12-10T13:11:16Z
oPrWj8Zn8oo,La roda de premsa de Tata Martino íntegra,26m 35s,2013-12-10T13:08:34Z
kfSlgMls3oU,La rueda de prensa del proyecto inmobiliario del Camp Nou íntegra,21m 16s,2013-12-09T20:46:49Z
uTC4JFDoZzc,Jordi Alba: 80 minutes of happiness,2m 15s,2013-12-09T09:47:55Z
qIn_BbYyED0,Víctor Hugo Morales: Messi és un home molt responsable,2m 33s,2013-12-05T15:52:56Z
Xy5zAiDeP6I,La rueda de prensa de Gerardo Martino íntegra (05/12/2013),29m 54s,2013-12-05T15:11:47Z
yYZfLPI2E2o,De la desolació a l'alegria en un mateix partit de l'Aleví D,1m 57s,2013-12-05T12:13:56Z
NQ_pkIjNRyo,Jordi Cardoner: El soci que alliberi el seu seient aconseguirà el somriure d'un nen,2m,2013-12-05T11:29:24Z
MRSQRdRdQdI,FC Barcelona - Espot de suport al partit de famosos de La Marató de TV3,28s,2013-12-03T12:06:50Z
xtmTWHIJzZs,El equipo ya está en Bilbao,2m 24s,2013-12-01T15:36:41Z
2mZupl1gkUY,DIRECTO - Rueda de prensa de Tata Martino,19m 56s,2013-11-30T12:27:23Z
bHMbxcXP8c8,Cardoner felicita el Juvenil A del Barça,27s,2013-11-28T17:38:06Z
PAuL_ow-lWQ,José Manuel Pinto: La confianza se gana jugando partidos,6m 2s,2013-11-24T12:32:32Z
ArEHdgM8qb0,Adama parla del seu debut,2m 17s,2013-11-23T19:20:10Z
HUecOJiY0-4,Tchouf et Niko: L'invité spécial,2m 36s,2013-11-22T16:29:25Z
eN5LrwZsELE,Mascherano: Messi es el mejor jugador que he visto en mi vida,1m 38s,2013-11-22T10:18:23Z
oWXpKO46Qw0,Jordi Alba sobre Leo Messi: És el millor del món tothom ho sap,3m 3s,2013-11-18T17:44:42Z
ymDCnMQDNak,L'etapa blaugrana d'Enrique Castro 'Quini' / Los años de Quini en el FC Barcelona,27m 16s,2013-11-16T10:41:21Z
aDf2TSoSl5g,Canastas por encima del aro en Kiev,25s,2013-11-15T12:27:33Z
Bt2GKVFLu8o,Enrique Castro Quini's time at FC Barcelona,27m 13s,2013-11-15T11:10:37Z
3YXmCcj78V0,Training session 14/11/2013,5m 10s,2013-11-14T15:29:54Z
uqCG5xI_5Ng,Víctor Valdés: Messi es Dios,1m 52s,2013-11-13T12:15:19Z
Eec4UXd-AnM,Tata Martino: Hemos hecho un partido muy inteligente,2m 21s,2013-11-10T22:55:55Z
Asre1S-wF2s,El vestuario del Benito Villamarín a punto,32s,2013-11-10T13:07:39Z
WctggKxEHv8,Xavi Hernàndez's press conference,18m 20s,2013-11-08T12:09:09Z
NZKOMA0JCBM,Neymar: Estoy muy contento por la victoria,42s,2013-11-06T23:38:47Z
L4ETMiLozh8,Roda de premsa íntegra de Pedro Rodríguez 04/11/2013,14m 23s,2013-11-04T12:31:07Z
maYYzZReOWQ,Warming up before the derby Barça-Espanyol,3m 38s,2013-11-02T15:15:57Z
B4SncYsjrxA,FC Barcelona - Los vestuarios del Palau abiertos,1m 20s,2013-10-31T11:06:20Z
z4_wtqqR44w,Timelapse of the Camp Nou during FC Barcelona v Real Madrid,1m 7s,2013-10-28T13:20:27Z
HFbX2ntjwls,Rueda de prensa íntegra de Gerardo Martino 28/10/2013,30m 2s,2013-10-28T12:11:11Z
TlMueHO7uM4,Training session 24/10/2013,4m 58s,2013-10-24T15:26:23Z
hkxOYpiVoXc,Alexis Sánchez and Tata Martino press conference (21/10/2013),34m 45s,2013-10-21T17:00:14Z
av6EEfKvbeA,Gerardo Martino's press conference 18/10/2013,23m 7s,2013-10-18T11:45:11Z
o2kWQRAK5Po,FC Barcelona - Els cinc millors gols del planter (12 i 13 octubre),1m 19s,2013-10-16T10:49:14Z
L43JpDcztF8,FC Barcelona - El himno del Barça con acento danés,32s,2013-10-16T09:14:42Z
hid9_tCuEQ8,FC Barcelona - Messi se incorpora al trabajo con el grupo,5m 24s,2013-10-14T18:42:14Z
JxENTiRcgpE,FC Barcelona - Sesión de entrenamiento y partido amistoso contra el Sant Andreu 10/10/2013,4m 24s,2013-10-10T11:43:52Z
9hx7won6AgE,FC Barcelona - Behind the scenes: Mixed Zone FCB-Valladolid,7m 33s,2013-10-10T09:08:41Z
A2vhSVkxunk,FC Barcelona - Martino happy with the second half against Valladolid,2m 41s,2013-10-05T23:48:22Z
309GHmrAjoc,FC Barcelona - Entrenament 05/10/13,1m 6s,2013-10-05T12:35:01Z
il7tonEzOT0,FC Barcelona -- Presentació del Barça B el Juvenil A el futbol formatiu i els equips femenins,42m 46s,2013-10-02T17:56:34Z
hLr0ukuyYdI,FC Barcelona - Presentación del Barça B el Juvenil A el fútbol formativo y los equipos femeninos,42m 48s,2013-10-02T17:50:28Z
PFEl84lOcIg,Cesc: L'any passat vam aprendre la lliçó,2m,2013-09-30T19:19:25Z
Z11qdzXDXU8,Cesc: El año pasado aprendimos la lección,2m,2013-09-30T19:18:47Z
xQbtpN694Jc,FC Barcelona -- La roda de premsa de Cesc Fábregas i Tata Martino íntegra,48m 45s,2013-09-30T18:19:38Z
PPf_uZwkwMg,FC Barcelona -- La rueda de prensa de Cesc Fábregas y Tata Martino íntegra,48m 43s,2013-09-30T18:16:23Z
DGONBomfSmo,FC Barcelona - Zubizarreta: Sabemos lo que es Celtic Park,58s,2013-09-30T10:18:39Z
zCQFUo66Vw0,FC BARCELONA -- GIRONA FC Lliga Divisió d'Honor Juvenil (DIRECTE),1h 55m 39s,2013-09-27T22:09:52Z
HCNjb5hHefQ,FC Barcelona - Complete Gerardo Martino's press conference 27/09/2013,23m 20s,2013-09-27T14:37:23Z
6NMbQOsAAxI,FC Barcelona - Fútbol-baloncesto en el entrenamiento,11s,2013-09-27T10:38:06Z
FMkgUZ5byv8,FC Barcelona - Los porteros goleadores del Barça Alusport,1m 34s,2013-09-27T08:36:12Z
BQ6TmkSEEF4,FC Barcelona - El Barça B de futbol sala visita el Centre Penitenciari de Joves,3m 10s,2013-09-24T12:21:14Z
YtPUssQwkkk,FC Barcelona -- Rueda de prensa de Gerardo Martino íntegra,19m 46s,2013-09-23T11:05:00Z
9FNQPa_vsMg,FC Barcelona - Pedro i Valdés després del triomf al camp del Rayo,2m 1s,2013-09-21T21:04:57Z
rlKNpuftrQo,FC Barcelona - Martino: El equipo ha ido de menos a más,1m 36s,2013-09-21T20:59:52Z
Eg5YpEbEKrk,FC Barcelona - Pautasso: We'll never take the Barça style away,2m 32s,2013-09-20T17:47:35Z
zNEFo-DrmfM,FC Barcelona -- La roda de premsa de Gerard Piqué i Tata Martino íntegra,1h 6m 58s,2013-09-17T13:19:26Z
tgJaS_CClbo,FC Barcelona - Els precedents amb l'Ajax sempre amistosos,1m 49s,2013-09-17T11:18:09Z
lNjfGFW5xR4,FC Barcelona - Fernández Gual y Barroso quieren hacer historia en el Mundial de Angola,46s,2013-09-17T11:01:03Z
shKRMpHtWjM,FC Barcelona - Fernández Gual i Barroso volen fer història al Mundial d'Angola,46s,2013-09-17T10:59:17Z
fnXNageUIts,En Directe: la roda de premsa de Cristian Tello,14m 2s,2013-09-16T11:20:47Z
YQ4ethtCYWg,FC Barcelona - Leo Messi inicia la votación del FIFA FIFPro World XI,1m 46s,2013-09-12T15:25:54Z
zSbg0rFUAms,FC Barcelona - Adriano: Siempre intento mejorar como futbolista,2m 29s,2013-09-12T15:08:17Z
h-Aj3Y5r8to,FC Barcelona - Fernandao: Haber ganado dos títulos es un plus para nosotros,1m 39s,2013-09-12T14:55:35Z
izi08kEQI5o,FC Barcelona - Puyol trabajo de campo,1m 9s,2013-09-10T11:42:20Z
S0bIs3LERV4,FC Barcelona - Martino y Alves novedades en el entrenamiento,1m 27s,2013-09-10T11:39:30Z
2zT4N_cVrB0,FC Barcelona - Bob Guyette un enamorado de Barcelona,1m 52s,2013-09-08T09:49:40Z
JyYku4eWD4Q,FC Barcelona - 'When Barça smiled again',25m 34s,2013-09-08T09:12:50Z
75hQcTzp2gA,FC Barcelona Especial Ronaldinho - 'Cuando el Barça recuperó la sonrisa',25m 34s,2013-09-08T09:12:28Z
pz2enxcI7EA,FC Barcelona - 'Quan el Barça va recuperar el somriure',25m 34s,2013-09-08T09:12:10Z
TijlYR2dSks,FC Barcelona - Entrenamiento 06/09/2013,1m 25s,2013-09-06T11:10:13Z
qZ0SBMZVcNw,FC Barcelona - Els 5 millors gols del planter (31 d'agost i 1 de setembre),1m 22s,2013-09-03T16:15:48Z
u8k-4sZP6Jg,FC Barcelona - Zubizarreta: Tenemos la plantilla que queríamos,1m 41s,2013-09-03T16:13:00Z
_mgJjpw4sW0,FC BARCELONA - Rueda de prensa de Josep Maria Bartomeu y Andoni Zubizarreta íntegra,1h 20m 9s,2013-09-03T11:56:35Z
UbDQnHM_tX4,FC Barcelona - Jordi Alba: Los Valencia-Barça son partidos especiales,1m 7s,2013-08-30T12:15:31Z
BjO-C0H235U,FC Barcelona - Jordi Alba: Els València-Barça són partits especials,1m 7s,2013-08-30T12:12:34Z
aF44OK-UfTo,FC Barcelona - Mascherano: La Supercopa s'havia de quedar aquí,1m 25s,2013-08-29T14:01:53Z
27eQBDzZoP4,FC Barcelona - Valdés sobre su futuro las dos paradas y el buen inicio de temporada,1m 27s,2013-08-29T13:50:56Z
RHcTuDp4vkM,FC Barcelona - Así ha sido la renovación de Busquets,53s,2013-08-27T15:13:19Z
Xd1x3aiUtGs,FC Barcelona - Pullen supera la revisión médica,44s,2013-08-27T15:10:17Z
Dq1T_txC0kY,FC Barcelona - Xavi: Hem de fer valer el gol de Neymar a Madrid pot donar un títol,4m 16s,2013-08-26T11:06:28Z
QljfePWJ5B8,FC Barcelona - Viatge a Màlaga,1m 25s,2013-08-25T15:31:16Z
LHOInBPLrlg,FC Barcelona - Entrenamiento 23/08/2013,1m 44s,2013-08-23T18:10:29Z
vm1yQB4bsk4,FC Barcelona - Alves habla de Messi y Neymar Jr,2m 12s,2013-08-23T16:52:17Z
clbC-A7zPSM,FC Barcelona - Eusebio: Hemos conseguido una plantilla que nos ilusiona mucho,1m 14s,2013-08-23T09:35:05Z
Fa7xHWskkU4,FC Barcelona - Sorín: El estreno del Barça fue una demostración de fútbol,2m 6s,2013-08-20T11:38:23Z
YW_8MQlAGYo,FC Barcelona - Gerardo Martino: Hemos insistido mucho en recuperar la presión,3m 5s,2013-08-18T20:51:20Z
fV8EBkXcMRA,Live Streaming! Gerardo 'Tata' Martino's press conference,24m 22s,2013-08-17T10:14:13Z
XWrqtFmb5BY,FC Barcelona - Jonathan Dos Santos: Tata Martino me ha dicho que confía en mí,2m 1s,2013-08-15T16:58:48Z
QouE7gTHqOE,FC BARCELONA -- Roda de premsa de Jonathan dos Santos en directe,15m 27s,2013-08-15T16:10:28Z
8azJCTD0_Js,FC Barcelona - Fernandao: El reto es mantener lo que estamos haciendo,3m 39s,2013-08-15T11:24:17Z
tmbm_bmZYr4,FC Barcelona - Els nens del Comú amb el Barça Alusport,1m 15s,2013-08-14T10:57:50Z
m9fbu1aFw-g,FC Barcelona - Primer contacte amb la pista d'Andorra del Barça Alusport,5m 31s,2013-08-12T14:18:42Z
HndxmtP2AXY,FC Barcelona - El primer dia del Barça Alusport a Andorra,1m 31s,2013-08-12T11:43:11Z
t8jloTlRwHs,FC Barcelona - Tata Martino: We're ready for the start of La Liga,55s,2013-08-11T16:33:28Z
YCTj7DMJ-1Q,FC Barcelona - Gerard Piqué: We're adapting to what the boss wants,1m 13s,2013-08-11T16:30:56Z
OHhyvQTvSME,FC Barcelona - Piqué: Los que estamos tenemos nivel para defender el equipo durante la temporada,1m 13s,2013-08-11T16:25:21Z
ZLsTPg_NHC4,FC Barcelona-Xavi Pascual valora el trabajo del Barça de Balonmano,4m 39s,2013-08-08T13:48:00Z
bsMkHyVPRGY,FC Barcelona El Video Bloc de Kiril Lazarov (III),1m 30s,2013-08-07T19:08:27Z
Ocifh7ftATk,FC Barcelona - Pedro: Tata nos da un impulso extra,52s,2013-08-07T18:16:19Z
mePOL8JSdhA,Pedro: Tata gives us that extra little bit,52s,2013-08-07T18:14:09Z
zL07MLqCQ-E,FC Barcelona - Jordi Alba: Tata Martino està inculcant coses molt positives,1m 17s,2013-08-07T11:21:31Z
LWAcZMSxeLY,FC Barcelona - Piqué: Cesc will stay at Barça,2m 17s,2013-08-07T11:19:05Z
pMcPcolvPgw,FC Barcelona Handbol a Encamp,2m 10s,2013-08-05T16:54:54Z
1mAEo6aIygY,Joan Gamper Trophy 2013 - Highlights: FC Barcelona - Santos (8-0),1m 32s,2013-08-03T09:41:40Z
k7GxXVFkMIw,FC Barcelona - Neymar: Vull tots els títols,1m 17s,2013-08-01T16:59:44Z
E0SEskbOuwM,FC Barcelona - Neymar amb el Trofeu Joan Gamper,26s,2013-08-01T14:55:12Z
ql_Bpp3flzc,FC Barcelona - Las palabras de Neymar tras el partido en Polonia,2m 39s,2013-07-31T09:34:26Z
TN_S3BVNG9Y,FC Barcelona - Valerenga post-match reaction,1m 4s,2013-07-28T16:44:36Z
QgWW0h6jp_4,FC Barcelona - Creus valora les incorporacions de Nachbar Papanikolaou i Dorsey,3m 13s,2013-07-26T08:53:53Z
WA-0bRn2cVU,FC Barcelona - Este es el spot del Trofeo Joan Gamper,36s,2013-07-23T15:08:15Z
CXsdphgMIdo,FC Barcelona - Entrenament 22/07/13 (tarda),1m 29s,2013-07-22T19:14:20Z
PZTYpTtLTCI,FC Barcelona - Papanikolaou: Es una gran oportunidad,1m 2s,2013-07-22T15:35:40Z
84SOYo5Owr4,FC Barcelona - Papanikolaou firma contrato tras superar la revisión médica,1m 17s,2013-07-22T15:04:08Z
DF_ur-gFiRY,FC Barcelona - Dongou y Samper se reencuentran,2m 37s,2013-07-19T11:13:38Z
1IhiEYtJk1k,FC Barcelona - La roda de premsa de Tello íntegra,5m 40s,2013-07-19T09:30:46Z
HcQGxCVVufc,FC Barcelona - Messi valora la llegada de Neymar,1m 41s,2013-07-17T16:16:18Z
28z6eDGtZTE,FC Barcelona - Rueda de prensa íntegra de Leo Messi 17/07/2013,11m 16s,2013-07-17T08:30:56Z
7RzqE6QP6Mg,FC Barcelona - Roda de premsa íntegra de Leo Messi 17/07/2013,11m 16s,2013-07-17T08:30:54Z
22nc4jwCFao,FC Barcelona - El primer entrenamiento de la temporada 16/07/2013,1m 48s,2013-07-16T12:31:16Z
3hykXJlY7sE,FC Barcelona - Ilie Sánchez: Som un grup dinàmic i ambiciós,42s,2013-07-14T14:31:09Z
l77WdlYLU1Y,FC Barcelona - Sessió matinal del Barça B a Torremirona,1m 12s,2013-07-14T13:37:51Z
WkMb0GLC_dg,FC Barcelona - Una temporada llena de vips en el Estadio,2m 27s,2013-07-05T14:36:03Z
ZZTW6mghlVU,FC Barcelona - Una temporada plena de vips a l'Estadi,2m 27s,2013-07-05T14:29:45Z
4xGCMshFZKc,FC Barcelona - Raül Marín: El meu objectiu és ajudar l'equip a ser campió,38s,2013-07-05T14:22:11Z
LrNaZ4DQhQs,FC Barcelona - Rafinha: Mi objetivo es poder jugar,1m 47s,2013-07-04T17:15:37Z
C68SiSIPylM,Marc Muniesa marxa a l'Stoke City,1m 35s,2013-07-03T16:18:31Z
VSBogkN-uP4,FC Barcelona - Bartra: He complert un somni que era poder estar al primer equip,1m 55s,2013-07-02T09:56:46Z
I_zY78UJEVI,FC Barcelona - 30 años de esta genialidad de Maradona en el Bernabéu,19s,2013-06-26T11:37:57Z
S1IobXei6yA,FC Barcelona - Ricard Pruna valora la operación a Carles Puyol,1m 56s,2013-06-19T15:27:18Z
KrUzCSrFGFQ,FC Barcelona - Puyol hopes to be back for FC Barcelona's preseason,1m 56s,2013-06-19T15:26:00Z
cQjF2V3dqDE,FC Barcelona - Ricard Pruna valora l'operació a Carles Puyol,1m 56s,2013-06-19T15:16:45Z
SFp6kIRj2XI,FC Barcelona - Arribada del Barça Regal a Madrid,44s,2013-06-18T18:19:20Z
72CZhgAaXqU,FC Barcelona - No et perdis el quart partit d la final entre el Barça Alusport i ElPozo Múrcia,35s,2013-06-18T10:30:01Z
aIFBQdatR7E,FC Barcelona - Clausura redonda en las categorías inferiores de la Copa Catalunya,2m 26s,2013-06-17T15:08:11Z
lak2xQ1JxgQ,FC Barcelona - Sada: Es un reto motivante y bonito,1m 37s,2013-06-15T17:07:57Z
KholuZPJ8fI,FC Barcelona - Carmona: Pienso que las defensas están mejor que los ataques,1m 4s,2013-06-15T17:04:59Z
UnHZURrNSKs,FC Barcelona - Carmona: Penso que les defenses estan millor que els atacs,1m 4s,2013-06-15T17:01:56Z
ko27WzWJAXo,FC Barcelona - Cardoner fa una crida a l'actualització del cens,1m 51s,2013-06-15T10:41:32Z
LA_gddRpxIk,FC Barcelona - Llegada a Murcia del Barça Alusport,1m 11s,2013-06-14T14:34:40Z
2lwF8jQxPvY,FC Barcelona - Los nombres propios de la comparecencia de Rosell,2m 56s,2013-06-13T17:53:47Z
2CMiXCtmVnA,FC Barcelona - Els noms propis de la compareixença de Rosell,2m 56s,2013-06-13T17:50:34Z
8yYq79-dXNg,FC Barcelona - El referèndum sobre el Camp Nou principis del 2014,36s,2013-06-11T15:42:09Z
le5Axdq_xMs,FC Barcelona - Conoce a los siete juveniles que subirán al Barça B,1m 40s,2013-06-11T15:26:38Z
Fvqv8gSsdVo,FC Barcelona - Tercer partit de les semifinals de futbol sala contra Caja Segovia,35s,2013-06-08T09:48:16Z
LdTVTDGjbnE,FC Barcelona - Eusebio renovat,1m 18s,2013-06-07T16:40:47Z
zJcp2rq8fNI,FC Barcelona - Ilie renovat fins al 2015: Estic molt content,1m 14s,2013-06-06T16:05:21Z
4wd11iGqjE8,Tchouf au Barça - Bonnes vacances,2m 3s,2013-06-06T15:29:25Z
UwL3HatRYu8,FC Barcelona - Peerapol Euariyakul FC Barcelona's new honorary fan from Thailand,1m 39s,2013-06-06T11:37:29Z
4ZFRae9E37M,FC Barcelona - Rosell: Estem molt orgullosos per la feina feta i l'actitud,51s,2013-06-06T11:09:42Z
SXNVOfy9sY0,FC Barcelona - Sopar de final de temporada dels equips de futbol formatiu i del futbol femení,1m 2s,2013-06-06T11:07:26Z
5d2avpG2vEg,FC Barcelona - Neymar: Espero deixar la meva petjada al Barça,2m 38s,2013-06-05T17:15:13Z
1yrqHH8rWz4,Karabatic: Enfin à Barcelone,20s,2013-06-05T15:29:20Z
jOXmOEtpUL8,Nikola Karabatic: Je suis très fier,2m 8s,2013-06-05T15:22:06Z
ISL3gRXLjfk,FC Barcelona - Bartomeu y Zubizarreta explican los detalles de los fichaje de Neymar,3m 37s,2013-06-03T19:31:23Z
QPeMcuEnlPk,FC Barcelona - Bartomeu i Zubizarreta expliquen els detalls dels fitxatge de Neymar,3m 37s,2013-06-03T19:30:17Z
Yxys5lSms3Q,FC Barcelona - Neymar: Estoy muy feliz y muy emocionado,1m 2s,2013-06-03T17:29:13Z
sMzzW1vtg78,Los primeros toques de Neymar Jr en el Camp Nou,2m 19s,2013-06-03T17:02:06Z
2WzEzXIgiZw,FC Barcelona - Neymar firma como jugador del Barça hasta el 2018,51s,2013-06-03T16:58:17Z
GivXThfafxU,FC Barcelona - La revisión médica de Neymar en la Ciudad Deportiva,1m 23s,2013-06-03T15:33:42Z
eljql1A_PSs,FC Barcelona - Comiat del Camp Nou a Éric Abidal,7m 42s,2013-06-01T19:03:11Z
9WU9Fwc7xWU,FC Barcelona - Puyol: I want to continue at Barça,2m 55s,2013-05-31T18:21:49Z
C8XurdwUstI,FC Barcelona - Rueda de prensa íntegra de Víctor Valdés 31/05/2013,28m 33s,2013-05-31T09:32:32Z
q8ik70nwAZA,FC Barcelona - Abidal: I'm going and I'll definitely be back,2m 27s,2013-05-30T16:42:14Z
auiNiICCyi4,FC Barcelona - Abidal: Me voy pero seguramente volveré,3m 2s,2013-05-30T16:34:34Z
I3DR-f7Myko,FC Barcelona - Roda de premsa íntegra d'Éric Abidal 30/05/2013,51m 37s,2013-05-30T12:02:43Z
dveEEWmQyKY,FC Barcelona - Complete Éric Abidal's press conference,51m 35s,2013-05-30T12:01:45Z
FXhWr1tvWfI,FC Barcelona - Rueda de prensa íntegra de Éric Abidal 30/05/2013,51m 32s,2013-05-30T12:01:19Z
m2Rd_ErfkWc,FC Barcelona - Adriano renueva hasta 2017,2m 1s,2013-05-28T18:42:47Z
ay41qjkoNoY,FC Barcelona - Entrenament 28/05/2013,2m 18s,2013-05-28T15:28:43Z
Huj3CNttVAE,FC Barcelona - Alves: Neymar está feliz por venir sabe que es un gran club,2m 49s,2013-05-26T21:49:44Z
f41i2NBRNHc,FC Barcelona - Vilanova: I congratulate Neymar for choosing the sporting option,1m 38s,2013-05-26T21:45:51Z
eQRS2DQZFRg,FC Barcelona - El vestuario avala a Neymar,1m 6s,2013-05-26T09:33:26Z
051LH0zgfzc,FC Barcelona - Entrenamiento 23/05/2013,2m 54s,2013-05-23T14:55:25Z
lY6rN1q19uI,FC BARCELONA - Xavi Hernández recibe el 3º Premio Barça Jugadors,28m 24s,2013-05-23T12:06:15Z
g5QpNHJlkGM,FC Barcelona - Els 5 millors gols del planter (18 i 19 de maig),1m 45s,2013-05-23T09:51:16Z
VcN9ST_oZ3k,FC Barcelona - FC Barcelona - Els campions del planter,2m 59s,2013-05-21T16:44:49Z
yoqjN0ZRiFs,FC Barcelona - Los campeones de la cantera,2m 59s,2013-05-21T16:31:50Z
EgM3K3rD8vE,FC Barcelona - Máxima eficacia en las tandas de penaltis,2m 20s,2013-05-21T15:52:31Z
zlu-cDT0a0Y,FC Barcelona - Piqué: I give our season a high mark,2m 50s,2013-05-21T09:33:31Z
nkBRuGD_vOY,FC Barcelona - Así ha sido la fiesta de los campeones en el Camp Nou,28m 5s,2013-05-19T21:37:42Z
L6Z6Rp5BsWo,FC Barcelona - Tito Vilanova: Es veurà un bon partit,53s,2013-05-18T15:31:09Z
UQ6nfccEv_I,FC Barcelona - Entrenamiento 18/05/2013,2m 26s,2013-05-18T11:23:32Z
VsdMmDwCY10,🏆 CHAMPIONS LEAGUE FINAL 2006 | BARÇA 2-1 ARSENAL | HIGHLIGHTS,4m 24s,2013-05-16T15:00:48Z
-33S3PaROOY,FC Barcelona - 'Unides fem força',19m 10s,2013-05-16T14:59:41Z
PqfGn07lML4,FC Barcelona - FCB Capball nova aplicació digital del Barça,54s,2013-05-16T11:27:38Z
MNgHu7M82rk,FC Barcelona - Deulofeu signs new contract; set to stay at FC Barcelona through 2017,45s,2013-05-15T17:52:46Z
moj8vawmEEY,FC Barcelona - Toni Freixa: L'any que ve el Barça tindrà el millor equip possible,1m 17s,2013-05-15T17:02:08Z
T_62pn26cfk,FC Barcelona - Spaghetti with vegetables of We are what we eat,1m 18s,2013-05-15T08:45:31Z
4qaF_Yb1Jic,FC Barcelona - Sergi Gómez: Es un orgullo renovar por el mejor equipo del mundo,47s,2013-05-14T16:04:32Z
xeSwgWvM1U4,FC Barcelona - La rúa de los campeones de Liga íntegra,2h 47m 12s,2013-05-13T19:54:59Z
EmJlu-KDEfc,FC Barcelona - La rúa en 60 segundos,1m 5s,2013-05-13T19:33:06Z
bNFlGg5_OIc,Tchouf au Barça - Jour de match (Épisode 22),3m,2013-05-13T14:28:08Z
QVb2IEnqhvg,FC Barcelona - Alves highlights the difficulty of the winning,2m 58s,2013-05-12T20:52:40Z
VnXeFOKudnw,FC Barcelona - Alves destaca la dureza de la Liga,2m 58s,2013-05-12T20:52:29Z
vDJ4BlXHT8E,FC Barcelona - Vilanova: Hemos sido los mejores de la Liga,2m 33s,2013-05-12T20:42:27Z
4E_DcKnlZM4,FC Barcelona - Alves recalca la duresa de la Lliga,2m 58s,2013-05-12T20:37:01Z
wZeGKhjhcNc,FC Barcelona - Vilanova: Hem estat els millors a la Lliga,2m 33s,2013-05-12T20:30:29Z
NepwUxfnsfU,FC Barcelona - Vilanova: We have been the best team in the league,2m 33s,2013-05-12T20:27:47Z
s1Ji0SYisPo,FC Barcelona - Arribada del Barça a Madrid,1m 12s,2013-05-12T16:25:49Z
z62H_GgYB6Y,FC Barcelona - Bartomeu i Zubizarreta després de guanyar la Lliga,2m 22s,2013-05-12T12:12:23Z
xoyGPCjIyH8,FC Barcelona - Bartomeu y Zubizarreta tras ganar la Liga,2m 22s,2013-05-12T12:09:03Z
cRbP_G_HFjc,FC Barcelona - Sandro Rosell valora el título de Liga,1m 52s,2013-05-12T12:07:19Z
b14d978y7HQ,FC Barcelona - El president Sandro Rosell valora el títol de Lliga,1m 52s,2013-05-12T12:06:07Z
DGUUhpmMt54,En Directe: la roda de premsa de Tito Vilanova,6m 10s,2013-05-11T12:11:56Z
ipiFL-Us3CI,En Directo: la rueda de prensa de Tito Vilanova,6m 41s,2013-05-11T12:06:35Z
QoKWz9szOIw,Live Streaming! Tito Vilanova's press conference,10m 31s,2013-05-11T12:03:02Z
DWg5JBKcL5o,FC Barcelona - Carmona: Debemos disfrutar la final,3m 12s,2013-05-10T12:44:12Z
3pt1kA8vBjE,FC Barcelona - Carmona: Hem de gaudir la final,3m 12s,2013-05-10T12:40:05Z
aYVGlaj1yLM,FC Barcelona - Entrenament 10/05/2013,2m 15s,2013-05-10T10:40:50Z
UHHhL0n2MlY,FC Barcelona - 10 grandes goles del Barça en el Vicente Calderón,2m 25s,2013-05-10T08:52:13Z
a3ujgZ--yqo,FC Barcelona - Thiago sobre la Liga: Es la competición más importante,1m 21s,2013-05-09T15:43:00Z
SNRYfZfPbKA,FC Barcelona - Entrenament 08/05/2013,2m 22s,2013-05-08T15:50:42Z
IfeMnvDeGkU,Wilde habla sobre la final de la Copa del Rey ante ElPozo Murcia,2m 6s,2013-05-08T14:22:32Z
DfxMdOi1azs,FC Barcelona - Cream of Pumpkin Soup of We are what we eat,1m 15s,2013-05-07T09:19:56Z
GeVA1D3kCPE,FC Barcelona - Crema de calabaza de 'Somos lo que comemos',1m 15s,2013-05-07T09:16:13Z
6aeqX0mWing,FC Barcelona - La crema de carabassa de 'Som el que mengem',1m 15s,2013-05-07T09:11:57Z
N16b0TuFuS0,FC Barcelona - Sabella: Messi cuando entra lo cambia todo,34s,2013-05-06T14:47:20Z
_0AA5tG9itE,FC Barcelona - Tello: Para mí es un elogio que la gente quiera que juegue,57s,2013-05-06T14:44:13Z
eqM8dkmI13M,FC Barcelona - Tello: Per mi és un elogi que la gent vulgui que jo jugui,57s,2013-05-06T14:42:43Z
ji7ZB_W7aeo,FC Barcelona - Així va celebrar la Lliga el Femení A,57s,2013-05-06T10:43:51Z
wgjvihUPblY,FC Barcelona - The players highlight the team's excellent football,2m 40s,2013-05-05T23:18:20Z
a4gM7Wh_9aI,Messi i Sergio s'entrenen amb el grup,3m 18s,2013-05-04T15:03:39Z
FmQ0Bwj3lzg,Tito Vilanova: Queremos dar una satisfacción a la gente,1m 21s,2013-05-04T14:57:22Z
jAFXr6g2_0g,Tito Vilanova: Volem donar una satisfacció a la gent,1m 21s,2013-05-04T14:55:27Z
noysBmiLeWc,FC Barcelona - Borregán a 48 horas de su homenaje,2m 39s,2013-05-03T14:56:16Z
zTP0Snvsbig,FC Barcelona - Beto Borregán a 48 hores del seu homenatge,2m 39s,2013-05-03T14:52:28Z
N5Ju_fAnCJk,FC Barcelona - Adriano: La temporada no ha terminado. Falta cerrar la Liga,1m 19s,2013-05-03T12:20:05Z
mS5FwVDRHTM,FC Barcelona - Iniesta: De esto aprenderemos,2m 14s,2013-05-02T10:12:59Z
ixgIXfDTcBY,FC Barcelona - Vilanova: El resultado en Múnich nos ha pesado muchísimo,2m 37s,2013-05-01T22:55:50Z
m_2aahr-gqk,FC Barcelona - Vilanova: The result in Munich weighed heavy on us,2m 12s,2013-05-01T22:50:46Z
dhs0TKhhv8Y,FC Barcelona - Tito Vilanova: El resultat de Munic ens ha pesat molt,2m 37s,2013-05-01T22:41:32Z
zQiVITzYHRk,FC Barcelona - The squad admit Bayern's superiority,2m 28s,2013-05-01T22:28:41Z
r7x-rXCg_f4,FC Barcelona - La plantilla reconoce la superioridad del Bayern,2m 28s,2013-05-01T22:28:25Z
Jv3cjYNeCWk,FC Barcelona - La plantilla reconeix la superioritat del Bayern,2m 28s,2013-05-01T22:12:41Z
3-B9BcaCqVk,FC Barcelona - Rosell: Las notas al final de curso,5m 40s,2013-05-01T21:54:05Z
aXjrMeygPKM,FC Barcelona - Rosell: Les notes al final de curs,5m 40s,2013-05-01T21:33:37Z
p2JQ11x5fr8,FC Barcelona - Ruedas de prensa íntegras de Tito Vilanova y Gerard Piqué 30/04/2013,49m 8s,2013-04-30T15:21:03Z
TwLAt4HTcQs,FC Barcelona - Rodes de premsa íntegres de Tito Vilanova i Gerard Piqué 30/04/2013,49m 34s,2013-04-30T15:20:21Z
dSrFqhLsflA,FC Barcelona - All the details about Gerard Piqué's and Tito Vilanova's press conference 30/04/2013,49m 12s,2013-04-30T15:06:04Z
ZoANRMe8rmU,FC Barcelona - El Barça Intersport protagonista en L'illa Diagonal,1m 32s,2013-04-30T11:53:49Z
mCpLk0Ix_uo,FC Barcelona - El Barça Intersport protagonista a L'illa Diagonal,1m 32s,2013-04-30T11:52:08Z
k1oMjR20rig,FC Barcelona - Roura: We're moving little by little closer to our objective,1m 50s,2013-04-27T19:02:26Z
EgPMc4zDVvM,FC Barcelona - Roura: Ens apropem poc a poc al nostre objectiu,1m 50s,2013-04-27T18:54:54Z
LMOKfkt0KZw,FC Barcelona -- Reus Deportiu (OK Liga EN DIRECTO),1h 24m 8s,2013-04-26T20:56:02Z
ve7UAxJVaQA,FC Barcelona -- Reus Deportiu (OK Lliga EN DIRECTE),1h 24m 9s,2013-04-26T20:55:03Z
cwmtJKPWLMU,FC Barcelona - Tito Vilanova: Em sento amb forces,8m 36s,2013-04-26T16:06:34Z
ZtljqBXbnzk,FC Barcelona - Piqué y Shakira en el Palau Blaugrana,52s,2013-04-26T14:55:25Z
I2aigvA4y68,FC Barcelona - Bartomeu: Cal valorar moltíssim aquesta Lliga,1m 25s,2013-04-25T16:04:06Z
D_vOK5hHBR4,FC Barcelona - Algunos de los mejores goles del Barça en San Mamés,1m 39s,2013-04-25T14:08:38Z
4xu3zXRA9Xw,FC Barcelona - Homenaje a Beto Borregán,30s,2013-04-23T16:46:43Z
SZnsNKcV1JM,FC Barcelona - Bayern-Barça: 'Road to London',3m 29s,2013-04-23T11:15:24Z
bBMB7O3bZLU,FC Barcelona - Xavi: Qui imposi la seva personalitat s'ho endurà,2m 28s,2013-04-22T19:17:09Z
DKmmYgYo5sg,Carmona: Ganar la UEFA Futsal Cup lejos de casa es un reto,8m 4s,2013-04-22T17:04:23Z
P8f_yoRFKvM,Carmona: Guanyar la UEFA Futsal Cup lluny de casa és un repte,8m 4s,2013-04-22T17:02:58Z
bG8bU-6BEXg,FC Barcelona - Training session 20/04/13,1m 42s,2013-04-20T11:15:06Z
41Hxp_q44M4,FC Barcelona - Muniesa a l''ADN Barça' de Barça TV,38s,2013-04-19T10:09:59Z
swv0RTyDh_A,FC Barcelona - Jasikevicius: Tenemos que tener confianza de cara al quinto partido,2m 5s,2013-04-19T10:08:36Z
nwkREaG3VeA,FC Barcelona - Samper: Debutar és una alegria immensa i un somni fet realitat,1m 9s,2013-04-18T12:24:21Z
nDhUVWOwlmk,FC Barcelona - Los jugadores ovacionan a Salva Bertomeu chófer del equipo,1m 31s,2013-04-18T11:58:55Z
0AuaL-0XccY,FC Barcelona - 25º aniversario de la Penya Barcelonista de Zaragoza,1m 46s,2013-04-14T10:40:29Z
-YjKec3ZzWE,FC Barcelona - Entrenamiento 13/04/2013,1m 51s,2013-04-13T15:00:28Z
DYuuMmQFJ_U,FC Barcelona - Roura es queda amb l'ambició de l'equip,2m 55s,2013-04-10T22:31:28Z
jWkPq_I3Kbo,FC Barcelona - Pedro: Ens mereixem ser a les semifinals,2m 36s,2013-04-10T22:20:47Z
dfn6VWhUE9s,FC Barcelona - Iniesta: We'll play against Paris Saint-Germain as if it were a final,2m 41s,2013-04-10T10:41:01Z
lFzlOf3VD2g,FC Barcelona - Xavi: Hay generación para lograr más éxitos,3m 41s,2013-04-07T10:49:57Z
iXAccNdqPR0,FC Barcelona - Homenaje a los célebres Antoni Ramallets y Josep Seguer,1m 23s,2013-04-06T17:40:00Z
4DUTPsFCE1Y,FC Barcelona - Roura: Tenim baixes però confio en la plantilla,1m 8s,2013-04-05T16:31:33Z
wSJh-uw7iUQ,FC Barcelona - Entrenamiento 05/04/2013,1m 32s,2013-04-05T11:48:22Z
hnvkLNCUfqo,FC Barcelona - De la Fuente Pesic i Bodiroga sobre l'Eurolliga del 2003,1m 12s,2013-04-04T16:03:39Z
Uo38Vktehts,FC Barcelona - Els cinc millors gols del planter (30-31 març),2m 11s,2013-04-03T10:05:26Z
SsoWXkqROQY,FC Barcelona - Roura: El 2-2 es un buen resultado,2m 47s,2013-04-02T22:35:26Z
wwNrwZkl43k,FC Barcelona - Iniesta: We leave with a bitter-sweet taste,2m 3s,2013-04-02T22:28:47Z
R5UwmJGET58,FC Barcelona - Iniesta se va con sensaciones agridulces,2m 3s,2013-04-02T22:18:49Z
ROYa2nG5pWg,FC Barcelona - Villa: No podemos cometer el mismo error que contra el Milan,1m 58s,2013-04-01T17:40:08Z
WvZyUM3cwyk,FC Barcelona - David Villa: We can't make the mistake we made in Milan,1m 58s,2013-04-01T17:36:21Z
R8KqQaucdBE,FC Barcelona - El equipo con Tito Vilanova descansa en París,1m 37s,2013-04-01T14:06:38Z
ODm2WtEIWRI,FC Barcelona - El Club i l'Agrupació homenatjaran Seguer i Ramallets el 6 d'abril,2m 23s,2013-03-27T16:24:20Z
LZ8PZ3lBF_4,FC Barcelona - Cinc grans gols a Balaídos,2m 30s,2013-03-27T09:26:55Z
15MJy_7cFYU,FC Barcelona - Teaser spot 'Som el que mengem' amb Juan Carlos Navarro,17s,2013-03-26T09:22:03Z
CV9jQylz1eA,FC Barcelona - Eric Castel entre el Barça y el PSG,1m 38s,2013-03-25T10:18:25Z
1qOssBJTmL0,FC Barcelona - Espectacular jugada del Femení A,1m 39s,2013-03-22T18:07:52Z
G_jy27i2bVo,Tchouf au Barça - L'attaché de presse (Épisode 19),2m 31s,2013-03-22T16:50:34Z
E_iUjOWuUc8,Thierry Henry - Best goals for FC Barcelona (2007-2010) / أساطير برشلونة: أهداف تييري هنري,26m,2013-03-19T18:33:08Z
yeZA2iuGaJ4,FC Barcelona - Els 5 gols del planter (16 i 17 de març),1m 6s,2013-03-19T16:27:49Z
Yda7_Bz4US4,FC Barcelona - Joan Creus: Me he sentido apoyado por el cuerpo técnico y la Junta Directiva,44s,2013-03-19T16:25:27Z
Jp8P37I0BoI,FC Barcelona - Abidal se vuelve a vestir de azulgrana en un entreno del filial contra el Istres,2m 29s,2013-03-19T13:27:17Z
Czab16GnDLY,FC Barcelona - Roura post match reactions,2m 32s,2013-03-17T23:23:42Z
XkXI37xMBOI,Jordi Roura: Un viu més tranquil quan té a Messi,2m 32s,2013-03-17T23:20:44Z
W3QQ4b0hbKw,FC Barcelona - Jordi Alba looking for the same intensity,1m 50s,2013-03-16T17:58:49Z
AAEBviQ4zCE,FC Barcelona - Roura: An especially complicated match,1m 59s,2013-03-16T17:44:38Z
VWvVceCaGh4,FC Barcelona - Roura: Un partido especialmente complicado,1m 59s,2013-03-16T17:39:46Z
RY4YUtMETH4,FC Barcelona - Roura: We need to have cool heads,2m 46s,2013-03-11T19:39:10Z
WekUBiwalpU,FC Barcelona - Piqué: We can do this and much more,3m 45s,2013-03-11T18:59:11Z
NB3cJTfvUog,Jordi Roura: Lo daremos todo para intentar lograr la remontada,2m 3s,2013-03-09T22:34:35Z
B6CkAm1X4EE,FC Barcelona - Roura: We will give everything to pull off a comeback,2m 3s,2013-03-09T22:30:21Z
-_dgJVj3Xu0,FC Barcelona - Sergi Roberto: Tenemos buenas sensaciones,1m 12s,2013-03-07T11:38:36Z
p47KSyWJlig,FC Barcelona - Sergi Roberto: Tenim bones sensacions,1m 12s,2013-03-07T11:36:28Z
rrOVv5Vqg-Y,FC Barcelona - Pascual: Ganar en Grecia nos daría un empujón emocional,1m 12s,2013-03-06T11:50:28Z
Kre_8206I4Y,FC Barcelona - Pascual: Guanyar a Grècia ens donaria una empenta emocional,1m 12s,2013-03-06T11:48:24Z
Ng7Mj-3SEr4,FC Barcelona - Els cinc millors gols del planter de la setmana (6 de març),1m 46s,2013-03-06T10:07:47Z
Hw7XwbrjcIk,FC Barcelona - Rosell: Esperaremos a Tito el tiempo necesario,1m 51s,2013-03-04T20:20:10Z
vYk6v8CA1Rk,FC Barcelona - Jordi Alba: We are confident we can come through this,2m 19s,2013-03-02T19:22:08Z
2ryEd-2TUGI,FC Barcelona - Jordi Alba: Tenemos confianza en nosotros mismos para salir de este mal momento,2m 19s,2013-03-02T19:12:28Z
zj-mCCG8wwU,FC Barcelona - Jordi Roura: La moral debe estar alta,1m 7s,2013-03-01T18:53:34Z
ZQidNBM55_A,FC Barcelona - Jordi Roura: La moral ha de ser alta,1m 7s,2013-03-01T18:34:58Z
b2FO_9zYl5Q,FC Barcelona - Dídac Lee: Buscamos acuerdos de colaboración en el Mobile World Congress,41s,2013-02-28T10:53:37Z
GQG4-OCnaA8,FC Barcelona - Dídac Lee: Busquem acords de col·laboració al Mobile World Congress,41s,2013-02-28T10:51:01Z
iCXXjM2x314,FC Barcelona - Roura: Estic convençut que sortirem d'aquest sotrac,2m 37s,2013-02-26T23:19:09Z
wQgU0oKi3Gg,FC Barcelona - Sandro Rosell confirms trip to New York to visit Tito Vilanova,1m 53s,2013-02-26T23:09:49Z
Z4D4BvLDTow,FC Barcelona - Jordi Roura: We don't know how to sit back-- we'll be out for a win,2m 30s,2013-02-26T16:49:37Z
_CpNMWrUgtk,FC Barcelona - Entrenamiento 26/02/2013,1m 59s,2013-02-26T12:23:40Z
HFV3Sf_ER24,FC Barcelona - Cesc: Tenemos que ser lo más efectivos posible,3m 6s,2013-02-25T09:41:56Z
S4F8x0pnQUA,FC Barcelona - Messi: Mi cuerpo está mejor si no descansa,4m 55s,2013-02-24T13:19:29Z
l1bpgvQROVs,FC Barcelona - Roura: Este equipo siempre ha sabido reaccionar,2m 6s,2013-02-22T19:41:42Z
oqTYsZgJ7qg,FC Barcelona - Roura: This team always bounces back,2m 6s,2013-02-22T19:40:09Z
ngL_5wmqY2w,FC Barcelona - Roura: Aquest equip sempre ha sabut reaccionar,2m 6s,2013-02-22T19:37:48Z
bTZcFUnIqsA,FC Barcelona - Villa s'entrena amb el grup. Abidal rep l'alta mèdica,1m 36s,2013-02-21T13:07:27Z
RXrdbw8oGNk,FC Barcelona - Puyol: Now it's time for a comeback at Camp Nou,2m 32s,2013-02-21T00:13:05Z
N_U92uki5wE,FC Barcelona - Roura: If one team has credit in the bank it's Barça,2m 25s,2013-02-21T00:11:34Z
MISDKVZHDOY,FC Barcelona - Barça-Chelsea (Next Gen Series),2h 23m 9s,2013-02-20T19:11:03Z
Fkg12zyQk-U,FC Barcelona - Puyol:AC Milan are on form we have to respect them,2m 17s,2013-02-20T10:09:29Z
MPOmy-rvurg,FC Barcelona - Puyol: L'AC Milan arriba en un bon moment,2m 17s,2013-02-19T18:11:42Z
bjgSZpAC_XE,Aquest és el triple guanyador de Marcus Eriksson en el Barça Regal B - Bàsquet Corunya,47s,2013-02-18T12:58:10Z
TM-gl1sANQM,FC Barcelona - Busquets: Se ha visto que no pensábamos en Milán,1m 45s,2013-02-16T22:10:54Z
BsGJt7ViSz4,FC Barcelona- Adriano: I'm feeling really good this season despite the small injuries,1m 15s,2013-02-14T17:05:45Z
gmwvEpd6YqA,FC Barcelona - Adriano quiere seguir en el Barça,1m 15s,2013-02-14T16:22:48Z
gQKAkwW1bMw,FC Barcelona - Entrenamiento 14/02/2013,2m 37s,2013-02-14T13:07:50Z
LfWg4sl3So4,FC Barcelona - 'La generació d'Epi la generació del canvi',26m 9s,2013-02-13T16:22:45Z
u11MMgQaG0o,FC Barcelona - Alex Song amb el dia de l'esport al Qatar,2m 21s,2013-02-13T10:42:39Z
gUUHDqGoPks,FC Barcelona - Alex Song: My children try to emulate Messi,2m 21s,2013-02-13T09:48:23Z
R6HlxjmFAdg,Xavi Pascual: Nada es gratuito debemos seguir creciendo,1m 1s,2013-02-12T16:06:25Z
X-WP-dgOJzI,FC Barcelona - Iniesta: It was a great morning for football,2m 23s,2013-02-10T16:14:16Z
PA0CM0Q8jl4,FC Barcelona - El vestuario satisfecho con el triunfo ante el Getafe,2m 23s,2013-02-10T16:11:20Z
I1EMvTT7SlQ,FC Barcelona - Rosell: La primera vuelta ha sido histórica,1m 43s,2013-02-08T12:21:47Z
K6ZR7x1z2Xo,FC Barcelona - Alba satisfecho con la renovación de Messi,52s,2013-02-07T17:44:00Z
nRSRm_LLv_U,FC Brcelona - Balliu: Juguem amb molta il·lusió i sense la pressió d'altres,24s,2013-02-07T14:01:17Z
SDqFq3BoD8g,En directo: la rueda de prensa de Jordi Alba.,16m 27s,2013-02-07T12:41:26Z
qsKEQoGs_HU,FC Barcelona - Zubizarreta: The essence of Barça is its idea of play,2m 9s,2013-02-06T17:25:25Z
rtcJYpg0__k,Sarunas Jasikevicius: En la Copa no hay favoritos,1m 29s,2013-02-05T18:10:32Z
sHgsSBMkK3o,Jordi Roura: I think a draw is a fair result,1m 43s,2013-02-03T21:05:17Z
_9ezdoUOgD4,FC Barcelona - Roura: Amb Valverde el València va cap amunt,1m 24s,2013-02-02T14:51:24Z
j82XzgkvrXE,La mejor noche de Xavi Rabaseda en la Euroliga,53s,2013-02-01T12:59:14Z
8aYb9MKQqS8,La millor nit de Xavi Rabaseda a l'Eurolliga,55s,2013-02-01T12:56:26Z
yPaLApoFh9w,FC Barcelona - Cesc: Nos vamos un poco decepcionados,2m 8s,2013-01-30T23:12:14Z
V1Lszbfgvbc,FC Barcelona - Cesc: Marxem una mica decebuts,2m 8s,2013-01-30T23:09:35Z
v7uvoe3VYzg,FC Barcelona - Jordi Roura: We were the better team,1m 38s,2013-01-30T22:53:40Z
6cRYgPPalF8,FC Barcelona - Jordi Roura: Hem estat superiors,1m 38s,2013-01-30T22:47:02Z
sqiJIxCmwPU,FC Barcelona - El desplaçament a Madrid,1m 50s,2013-01-30T15:50:25Z
CkgMhFNQRC0,FC Barcelona - Sergio Busquets: A good result at the Bernabeu is a win not a draw,1m 3s,2013-01-29T15:44:39Z
VU8jdoWWpR8,FC Barcelona - Xavi signs through 2016,1m 26s,2013-01-29T15:41:31Z
puL8y0I7A68,FC Barcelona - Rueda de prensa íntegra de Jordi Roura 29/01/2013,19m 49s,2013-01-29T12:41:23Z
adw_22owVIQ,FC Barcelona - Roda de premsa íntegra de Jordi Roura 29/01/2013,20m,2013-01-29T12:40:47Z
IyCnMCgiR4I,FC Barcelona - All details about Jordi Roura's press conference 29/01/2013,19m 49s,2013-01-29T12:40:17Z
Ue50sp3D5gM,FC Barcelona - Roura: We're going to concentrate exclusively on Osasuna,1m 53s,2013-01-27T16:24:18Z
bthat74cOFw,FC Barcelona - Roura: Vamos a centrarnos exclusivamente en Osasuna,1m 52s,2013-01-26T17:29:03Z
W2KzCc1gi3c,FC Barcelona - Els jugadors creuen que la classificació és justa,2m 6s,2013-01-25T00:18:33Z
430Fiuq1o7w,FC Barcelona - Roura: The players have once again given us a lesson,1m 15s,2013-01-24T23:49:34Z
js-TtktNMLY,FC Barcelona - Roura: Aquests jugadors han tornat a donar una lliçó,1m 15s,2013-01-24T23:45:22Z
VtRmB_a0qI4,FC Barcelona - Roda de premsa íntegra de Jordi Roura 23/01/2013,14m 24s,2013-01-23T12:43:25Z
z3TyoeaSPY8,FC Barcelona - Rueda de prensa íntegra de Jordi Roura 23/01/2013,14m 31s,2013-01-23T12:43:16Z
A_M23glCD1w,'FUTBOLNET' en Río de Janeiro: el juego,1m 6s,2013-01-22T10:54:33Z
8m4GhcCHGW8,FC Barcelona - Rueda de prensa íntegra de Andrés Iniesta 21/01/2013,24m 54s,2013-01-21T16:38:09Z
NUwkNaN3sDE,Tito Vilanova: No tengo ningún reproche a mis jugadores,1m 41s,2013-01-19T20:08:09Z
h7crZOWiSDg,FC Barcelona - Thiago: Confiamos en sacar la eliminatoria,1m 17s,2013-01-17T16:38:33Z
97fAi7mLDdQ,FC Barcelona - Zubizarreta: Me alegro por Guardiola,1m 11s,2013-01-17T13:27:10Z
GiP5CuHVGUk,FC Barcelona - Roura: Intentaremos mantener nuestro ritmo en Málaga,2m 8s,2013-01-12T20:31:36Z
lrfojrgiPag,FC Barcelona - Roura: Intentarem mantenir el nostre ritme a Malaga,2m 8s,2013-01-12T20:27:13Z
wJ9OSyx-tgM,FC Barcelona - La CBS dedica un '60 minutes' al FC Barcelona,14m 7s,2013-01-11T12:09:44Z
VDUIV4MziZA,Bartra: We're fighting for all of the titles and that means we have more games to play,1m 38s,2013-01-11T10:51:35Z
pL974ky-5RY,FC Barcelona - Perfilant els últims detalls abans del derbi,54s,2013-01-06T12:38:23Z
Q-6znjMJuJw,FC Barcelon - Roura: Tito estará en el banquillo,1m,2013-01-05T13:36:16Z
ESkexW2qC5E,FC Barcelona - Mascherano: El derby no será fácil,30s,2013-01-04T14:04:50Z
I1yS4v7-eSA,FC Barcelona - Primera sessió de l'any,2m 29s,2013-01-02T13:18:38Z