Video ID,Title,Length,Published,Region Restriction Count
5d2sNeIomps,A River Full of Crocs | Outback Wrangler,2m 15s,2017-01-25T21:00:01Z
_jBaVKgu-1A,Cobra in the Kitchen | Snake City,3m,2017-01-25T17:00:02Z
O7H3R5bidGc,No Hoofin’ Around | The Incredible Dr. Pol,2m 44s,2017-01-24T21:00:05Z
-Ul5rsuIopA,Stuck in a Truck | Snake City,3m 4s,2017-01-24T17:04:06Z
SVVvdDbOIII,Attending Puppy School | Puppy Days,2m 49s,2017-01-24T13:00:38Z
MatZdZ_2L7Q,Fistful of Croc | Outback Wrangler,1m 9s,2017-01-23T17:00:02Z
fN71Vkmhjq0,Yes Reindeer - Season 4 Episode 4 | Coffee Break with Dr. Pol,1m 46s,2017-01-23T13:00:05Z
z11tEdQMihg,Small Boat Giant Croc | Outback Wrangler,2m 31s,2017-01-22T21:00:02Z
q05A6WJZ6ng,The Prairie Dog Life | Destination WILD,2m 51s,2017-01-21T17:00:02Z
GJiXgovOzd8,Simon vs. Rock Python - Episode 2 | Deadliest Snake Encounters,2m 42s,2017-01-21T13:00:02Z
CMLsyj6s_1w,The Tarantula Mating Game | Destination WILD,2m 45s,2017-01-20T21:00:20Z
VnUCs-It6tE,The Rip Van Winkle of the Desert | Destination WILD,2m 17s,2017-01-20T13:00:03Z
rLK2j_6Wy-Y,Caught Croc Handed | Outback Wrangler,3m 11s,2017-01-19T17:00:05Z
U53zKq84lxs,There's a New Pup in Town | Puppy Days,3m 8s,2017-01-19T13:00:02Z
MBc8PZI8X1E,Crocodile Breath is Not a Good Smell | Outback Wrangler,2m 25s,2017-01-18T21:00:00Z
MLdrDORP45M,The Blue-Footed Booby Dance | Destination WILD,3m 5s,2017-01-18T17:00:30Z
TdkhrIeD2DE,One Mini Mama | The Incredible Dr. Pol,3m 30s,2017-01-18T13:00:01Z
2D2aAHEPJzI,The Vanishing Mamba | Snake City,4m 28s,2017-01-17T17:00:00Z
Ax8Yf52NxSQ,A Puppy Playdate | Puppy Days,2m 57s,2017-01-17T13:00:00Z
XUAPMWfqlNk,A DIY Croc Harpoon | Outback Wrangler,3m 19s,2017-01-16T17:00:30Z
8k_c-7o92uM,Emu’s Ears - Season 4 Episode 3 | Coffee Break with Dr. Pol,1m 46s,2017-01-16T13:00:00Z
kXuv0ImsJVI,Grass Fishing for Crocs | Outback Wrangler,3m 9s,2017-01-15T21:00:30Z
Eb_ldh-JOjs,Cobra at the Bait and Tackle | Snake City,2m 59s,2017-01-15T17:00:00Z
RQeo6Ye0YVA,Two Crocs One Trap | Outback Wrangler,3m 11s,2017-01-13T21:00:01Z
dGbD9z-Z7sE,Wild Galapagos: Top 3 Moments | Mission Critical,3m 41s,2017-01-13T13:00:05Z
u1cVS1zIDo8,Molly the Hurt Hoof Reindeer | The Incredible Dr. Pol,2m 33s,2017-01-12T21:00:02Z
2hvzENDA5UQ,Croc Tug of War | Outback Wrangler,2m 3s,2017-01-12T17:00:00Z
me0mKBhz7D4,The Bell Training Technique | Puppy Days,2m 58s,2017-01-12T13:00:06Z
z0SFkTzLM1s,Dancing with Death - Episode 1 | Deadliest Snake Encounters,2m 50s,2017-01-11T21:00:04Z
6uZxbhAavjs,Creatures of the Deep Sea | Mission Critical,4m 23s,2017-01-11T17:00:01Z
CChoJftAxiI,That’ll Do Big Pig That’ll Do | The Incredible Dr. Pol,3m 17s,2017-01-11T13:00:01Z
9I8iAl4qIDI,Crocodile Airlift | Outback Wrangler,3m 2s,2017-01-10T21:00:05Z
udRbNkdlydU,Cobra in a Car | Snake City,2m 59s,2017-01-10T17:00:06Z
lsvztII4TcA,A Country Pup | Puppy Days,2m 29s,2017-01-10T13:00:30Z
pOioi8OghsM,Entering a Shark Eden | Mission Critical,4m 28s,2017-01-09T17:00:05Z
AoRpRihM6R0,That's Zedonkulous - Season 4 Episode 2 | Coffee Break with Dr. Pol,1m 46s,2017-01-09T13:00:00Z
jTHVLKh1zz8,Securing the Croc Trap | Outback Wrangler,3m 6s,2017-01-08T21:00:01Z
TtxoMlzdjzI,The Deadly Black Mamba | Snake City,2m 57s,2017-01-08T17:00:21Z
Bf_cRzkd_pk,Beware of Bird - Season 4 Episode 1 | Coffee Break with Dr. Pol,1m 46s,2017-01-06T13:00:30Z
NwUmNIWWQ50,Finding a Furever Puppy | Puppy Days,2m 39s,2017-01-05T13:00:02Z
4Cfd0r1r5E8,A Prickly Stink-uation | The Incredible Dr. Pol,3m 29s,2017-01-04T13:00:00Z
ngPs3kINUXE,Salivating for a New Nest | Wild Borneo,1m 59s,2017-01-03T17:00:31Z
D-NTtimdkNE,Crate Training Woes | Puppy Days,2m 55s,2017-01-03T13:00:01Z
nGLdbpqf9SE,Borneo's Flying Reptiles | Wild Borneo,2m 35s,2017-01-02T17:00:30Z
-W_AT1BLrek,All I Want for Christmas Are Pups! | The Incredible Dr. Pol,2m 22s,2017-01-02T13:00:00Z
wq-ScQkDgNM,Baby Wildebeest Meets Baby Hyena | Destination WILD,2m 51s,2016-12-29T13:00:04Z
xn0Se6VL0DQ,Flapping Pheasant - Season 3 Episode 8 | Coffee Break with Dr. Pol,1m 46s,2016-12-27T13:00:04Z
msVIse6FFkE,Croc River of Death | Destination WILD,3m 11s,2016-12-26T13:00:03Z
i8ZcNykA8vg,A Muskox Face-Off | Polar World,3m 12s,2016-12-22T13:00:07Z
XX6VB-y9_Pk,Living with Reindeer | Polar World,2m,2016-12-20T13:00:06Z
HIyTffLW4yo,You Smelly Devil! | Animal Armory,3m 1s,2016-12-16T21:00:02Z
IkKNmeSyckg,Monster Bites | Animal Armory,3m 3s,2016-12-16T13:00:01Z
kuE6Okri_rQ,Aiming for the Eyes | Animal Armory,3m 20s,2016-12-15T17:00:04Z
rG_Iie3mOAk,Proof of a Leopard | Mission Critical,2m 31s,2016-12-15T13:00:05Z
j7yU87enMRo,An Alluring Spider | Animal Armory,2m 32s,2016-12-14T21:00:02Z
OiGB_aA9Tg0,Eight Legs and a Killer Bite | Animal Armory,2m 40s,2016-12-14T13:00:03Z
9P_5b-9j3sM,In Search of a Leopard | Mission Critical,2m 43s,2016-12-13T13:00:01Z
XmR5InTQNkQ,Attack of the Creepy-Crawlies | Animal Armory,2m 38s,2016-12-12T17:00:02Z
s8wOlktYmRY,Houdini of the Sea | Animal Armory,2m 51s,2016-12-09T21:00:02Z
mSflRbBMu_M,Ice Cold Hunters | Animal Armory,3m,2016-12-09T13:00:02Z
35wsQvHYfuk,Buffalo Brawl | Animal Fight Night,2m 37s,2016-12-07T17:00:06Z
d69UsGeTbcA,Strength in Numbers | Savage Kingdom,3m,2016-12-06T17:00:02Z
zYEX3xazl3k,Eyewitness to Carnage | Savage Kingdom,2m 40s,2016-12-06T13:00:03Z
ralF95JcX4c,Stay Together Survive Together | Savage Kingdom,2m 3s,2016-12-05T17:00:03Z
zjTQYv9mpXc,Brain v. Brawn | Savage Kingdom,2m 4s,2016-12-04T17:00:04Z
l5Yf7xX9iZI,Filming Predators Up Close | Savage Kingdom,2m 6s,2016-12-04T13:00:01Z
xWlFv70pMPY,Stealthy Saba | Savage Kingdom,2m 6s,2016-12-03T18:00:03Z
NyJdQAdZHVo,A Steenbok's Fight For Life | Destination WILD,3m 8s,2016-12-03T13:00:01Z
k4lWBACLjs4,Witness to a Warthog Kill | Savage Kingdom,1m 32s,2016-12-03T00:00:01Z
4BZU6-VMVW4,Life in the Bush | Savage Kingdom,1m 54s,2016-12-02T13:00:00Z
kOg2TGoVYoE,Heavyweight Champions | Animal Armory,2m 15s,2016-12-01T16:00:03Z
wl2j6WOb2sE,A Cheetah Intruder | Destination WILD,2m 53s,2016-12-01T13:00:03Z
eSA9ji-XY4w,Rooks and Rookies | Animal Fight Night,2m 38s,2016-11-30T16:00:02Z
5xLm8MPoPkI,Sheep Go Smash | Animal Armory,2m,2016-11-29T16:00:00Z
Ab1OKtFcPvs,Execution or Exile? | Savage Kingdom,2m 58s,2016-11-29T13:00:00Z
WDjRyRk4t_s,Death of a Leopard Cub (Behind the Scenes) | Savage Kingdom,2m 7s,2016-11-29T00:00:02Z
7VpzqtJwBe8,Fur is Going to Fly | Animal Fight Night,1m 15s,2016-11-28T16:00:00Z
nEmjowwRnE4,Welcome to Zalika’s Lair | Savage Kingdom,2m 29s,2016-11-28T13:00:02Z
KlCG0Fgvjuk,A Pride Divided | Savage Kingdom,2m 15s,2016-11-27T13:00:01Z
D-BY_hMyKv8,No Place Like Home | Savage Kingdom,2m 1s,2016-11-26T13:00:01Z
su-RH8uQg8c,Psycho Shrew vs. Scorpion | Animal Fight Night,2m 14s,2016-11-25T16:00:04Z
QgL6WVVlxAE,Sea Eagle vs. Sea Snake | Animal Fight Night,1m 30s,2016-11-24T16:00:01Z
17kkQiRsxb8,Lethal Jaws | Animal Armory,2m 15s,2016-11-24T13:00:00Z
6jfz0xr0t2M,New Zealand's Giant Bird Monsters | Wild New Zealand,2m 17s,2016-11-23T16:00:00Z
XqzTxLEkvAA,Terrifying Talons | Animal Armory,2m 22s,2016-11-23T13:00:05Z
j_Ml36QHzVk,New Zealand's Most Famous Bird | Wild New Zealand,1m 40s,2016-11-22T16:00:02Z
_NnMSd18l-c,Welcome Home Little Ones | Savage Kingdom,2m 13s,2016-11-22T13:00:01Z
OGVf_qLsyyQ,A Very Curious Parrot | Wild New Zealand,1m 49s,2016-11-21T16:00:01Z
AWhETzqUQGw,Home is Where the Pride Is | Savage Kingdom,2m 57s,2016-11-20T13:00:00Z
77u5-l5p7Y8,Matsumi the Queen! | Savage Kingdom,2m 49s,2016-11-18T13:00:01Z
Zx2YyvbxTkc,Mo' Pig Mo' Problems | Dr. Oakley Yukon Vet,2m 52s,2016-11-17T13:00:02Z
sODVuysx26U,The Little Prince | Destination WILD,1m 47s,2016-11-16T19:00:03Z
e7uHiKPCy80,No Place Like Leopard Rock | Savage Kingdom,2m 37s,2016-11-16T13:00:02Z
LbHKFeu1g8Y,Teemana and Molao: The Formidable Hunters | Savage Kingdom,1m 8s,2016-11-15T16:00:01Z
9xyF2MyERsQ,Recovering From a Bear Brawl | Dr. Oakley Yukon Vet,2m 10s,2016-11-15T13:00:00Z
R5gwtTVJyG4,Zalika: The Outlaw Queen | Savage Kingdom,1m 14s,2016-11-14T16:00:02Z
xk5JyH6VQDE,The Silver Fox Facts | Yukon Do It,1m 51s,2016-11-14T13:00:06Z
z9zFKud2xps,Saba: The Phantom Assassin | Savage Kingdom,1m 11s,2016-11-13T16:00:02Z
A8ckmI9M2OA,Making a Mad Dash | Safari Brothers,2m 33s,2016-11-13T13:00:00Z
Ru0m002vSPg,Satau: A Banished Queen | Savage Kingdom,1m 1s,2016-11-12T16:00:01Z
T73g6b0Q5h0,Okavango River Safari | Safari Brothers,3m 32s,2016-11-12T13:00:01Z
b8p3jNGakrg,Sekekama: The Colossal King | Savage Kingdom,1m,2016-11-11T16:00:02Z
CozXRRVOECo,Matsumi: The New Queen | Savage Kingdom,1m 26s,2016-11-10T16:00:00Z
i9qAB-PZUgk,Not Taking the Bait | Dr. Oakley Yukon Vet,2m 29s,2016-11-10T13:00:06Z
IW8mRYv5SEg,Does a Mink Stink? | Yukon Do It,2m 31s,2016-11-09T19:00:01Z
DcXT779vlPc,Devils at Dinner | Mission Critical,2m 34s,2016-11-09T17:00:02Z
8TcSmQ6OgUw,Sea Wolf Encounter (Episode 16) | wild_life with bertie gregory,5m 56s,2016-11-09T14:00:00Z
fq0ySR_yg3w,An Unusual Devil Home | Mission Critical,2m 43s,2016-11-08T17:00:03Z
iKApCs8hkFM,A Reindeer Checkup | Dr. Oakley Yukon Vet,2m 24s,2016-11-08T13:00:05Z
OhpRIhV8Kl8,Top 3 Tasmanian Devil Moments | Mission Critical,3m 16s,2016-11-07T17:00:03Z
Jl68hzTf-a8,Water Woes | Safari Brothers,2m 18s,2016-11-06T18:00:01Z
Zq0UJcWhhIw,Night Safari Surprise | Safari Brothers,1m 55s,2016-11-05T16:00:02Z
GRR4dneRDTY,Built for the Arctic | Destination WILD,3m 11s,2016-11-04T12:00:00Z
DxgWMoVI8lI,The Life of a Polar Bear Cub | Destination WILD,2m 24s,2016-11-03T12:00:00Z
EhBNaJFE0hk,Wolf Prints Lead to ‘Smell of Death’ (Episode 15) | wild_life with bertie gregory,5m 57s,2016-11-02T13:00:00Z
IY7g1JCfRgk,A Showy Dolphin Super-Pod | Destination WILD,2m 48s,2016-11-01T20:00:00Z
i09V7EMUW5E,Baboon Babies | Safari Brothers,2m 48s,2016-11-01T15:00:06Z
BFOOM1BBVDQ,Owl You Need to Know About Owls | Yukon Do It,2m 30s,2016-11-01T14:00:01Z
B-RaI9ol3SI,A Parrot with a Secret | Dr. Oakley Yukon Vet,2m 11s,2016-11-01T12:00:01Z
ntc17ai3gSs,Cub’s First Salmon Run | Destination WILD,2m 54s,2016-10-31T22:00:04Z
Hp8sxjElYUo,The Puppy Question | Dr. Oakley Yukon Vet,3m 6s,2016-10-31T12:00:30Z
IrdbENkylZM,Camouflage Queen | Wonderfully Weird,2m 55s,2016-10-30T17:00:02Z
COOxP3_HFcM,Slimed! | Wonderfully Weird,3m 8s,2016-10-29T17:00:00Z
aPwlfBUagCA,Curious Kats | Safari Brothers,2m 8s,2016-10-29T12:00:01Z
1p0i3fYBuG4,Spider Speed Dating | Wonderfully Weird,2m 48s,2016-10-28T12:00:00Z
j9UY7Gvi9QQ,Vancouver Island by Air (Episode 14) | wild_life with bertie gregory,7m 48s,2016-10-26T13:00:03Z
EYw6vaX4aEM,Don't Let the Bed Bugs Bite! | Wonderfully Weird,1m 49s,2016-10-26T12:00:01Z
z2rE8Oquxjk,Lunch Date with a Hippo | Safari Brothers,2m 2s,2016-10-25T17:00:30Z
ec1ofsTOHCw,Yukon-Style Round Up | Dr. Oakley Yukon Vet,1m 56s,2016-10-25T12:00:02Z
sk_28GNlup0,Bald Eagle Essentials | Yukon Do It,1m 46s,2016-10-24T12:00:04Z
PX7WI-jnJXc,No Bad Eggs in the Hen House | Dr. Oakley Yukon Vet,3m 5s,2016-10-23T12:00:02Z
TyOHii6n4bc,Lessons in Lion Tracking | Safari Brothers,3m 38s,2016-10-22T12:00:05Z
TSKKHqBfJx0,How to Protect a Horse's Eyes (Deleted Scene) | Dr. Oakley Yukon Vet,1m 29s,2016-10-21T12:00:02Z
KX3W1cQtATc,A Hard Journey That's Worth the Reward | Destination WILD,3m 54s,2016-10-20T17:00:01Z
Yo3aEunJ6WE,Dinnertime with Wolves | Destination WILD,3m 10s,2016-10-20T12:00:02Z
K-20EhU96Ys,A Baby Otter Learns to Swim | Destination WILD,2m 4s,2016-10-19T17:00:02Z
rHoY0K1ZT64,Salmon Sperm and Egg Harvesting (Episode 13) | wild_life with bertie gregory,3m 41s,2016-10-19T13:00:03Z
OD4A9Xj0cYo,Fantastic Mr. Fox | Destination WILD,1m 40s,2016-10-19T12:00:02Z
tcWxzaz7f-Y,Safety Around Elephants | Safari Brothers,3m 8s,2016-10-18T17:00:02Z
szbq0M4BESQ,Tracking Down a Colt | Dr. Oakley Yukon Vet,2m 2s,2016-10-18T12:00:03Z
FaiPGoEUzHQ,How to Find a Falcon | Yukon Do It,1m 56s,2016-10-17T12:00:01Z
hDE6V1K1SqE,Hounded By An Infection | Dr. Oakley Yukon Vet,2m 51s,2016-10-16T12:00:03Z
cu1GJbvpfc4,Thirsty Elephants and a Pod of Hippos | Safari Brothers,2m 42s,2016-10-15T12:00:02Z
ORgWiSe4AM4,Sled Dog Diagnosis (Deleted Scene) | Dr. Oakley Yukon Vet,1m 52s,2016-10-14T12:00:01Z
wYnGDHHHf6I,Lounging Lion | Safari Brothers,1m 46s,2016-10-13T20:00:03Z
gn4YhUpq1bs,Untamed with Filipe DeAndrade (Trailer) | Nat Geo Wild,1m 58s,2016-10-13T15:50:15Z
CPat007X-pg,Gotta Catch That Croc | Safari Brothers,2m 5s,2016-10-12T20:00:00Z
LCvoBKowu_U,Wombat Fortress | Kangaroo Dundee,1m 47s,2016-10-12T16:00:03Z
zkYAVkfMunU,Go Forth and Gestate | Dr. Oakley Yukon Vet,2m 7s,2016-10-12T13:00:03Z
1HPz5lCkbfw,Bears Catching Salmon (Episode 12) | wild_life with bertie gregory,5m 20s,2016-10-12T13:00:01Z
x5YB3m1uz74,That’s Roger! | Kangaroo Dundee,3m 3s,2016-10-11T16:00:04Z
E-RvzmcOTW8,Checking on Cute Sled Dogs | Dr. Oakley Yukon Vet,2m 46s,2016-10-11T13:00:00Z
IypHRvXXfBs,Vancouver Island: Trees and Trails Surfing and Sushi | wild_life with bertie gregory,1m 27s,2016-10-10T19:00:01Z
1QhsNoUigMQ,Saving a Disabled Ram | Animal ER,2m 59s,2016-10-10T17:00:00Z
oCNCDwdXbks,How to Spot a Wolverine | Yukon Do It,1m 47s,2016-10-10T12:00:02Z
SNLbtKmHijg,Kiki's on the Mend | Animal ER,2m 14s,2016-10-09T12:00:03Z
zg80K34tgOA,Three Crazy Camels! | Kangaroo Dundee,3m,2016-10-08T20:00:05Z
Sh3_IQfcrDI,A Real Daddy's Girl | Mission Critical,2m 10s,2016-10-08T13:00:02Z
yb2Y2rcgnCw,Emus in the House | Kangaroo Dundee,2m 53s,2016-10-07T20:00:02Z
U1zWzB52eCc,Pain in Oreo's Leg | Animal ER,2m 3s,2016-10-07T17:00:02Z
lrg0gv7BOsI,A Hard Life For a Gorilla | Mission Critical,2m 42s,2016-10-07T13:00:03Z
iuM-149-Hak,Damn You Jack (Deleted Scene) | Dr. Oakley Yukon Vet,1m 38s,2016-10-06T23:00:00Z
os1kwb2a4wk,A Silverback Showdown | Mission Critical,2m 56s,2016-10-06T13:00:02Z
grCtsv-UBrg,Pogo’s Problem | Animal ER,2m 49s,2016-10-05T17:00:02Z
ii68l7OC4ls,Hands Up a Horse | Dr. Oakley Yukon Vet,3m 33s,2016-10-05T13:03:30Z
23tiek1rlVo,Salmon Sex and Death Sustains This Forest (Episode 11) | wild_life with bertie gregory,4m 22s,2016-10-05T13:00:00Z
8XlIND6o3i8,Protecting Orphaned Gorillas | Mission Critical,2m 48s,2016-10-04T20:06:10Z
2FxxFkoS3k8,Top 3 Mountain Gorilla Moments | Mission Critical,3m 20s,2016-10-04T17:00:00Z
e6GOBLjO6cI,Finally on the Mooove | Dr. Oakley Yukon Vet,2m 1s,2016-10-04T13:00:03Z
XPuYkVXWo68,Don't Get on a Porcupine's Prickly Side | Yukon Do It,1m 35s,2016-10-03T13:00:03Z
iT_xb1wNlpM,An Antlion's Spiraling Death Trap | Wildest Wonders,3m 27s,2016-10-01T19:00:04Z
LWzUt5uoDV0,Not Just Another Pretty Face | Wildest Wonders,3m 43s,2016-09-30T19:00:02Z
NKq3nR3L9_E,An Acid Bird Bath | Wildest Wonders,2m 17s,2016-09-29T19:00:02Z
BCJE309i_Ls,Freaky Frozen Frogs | Wildest Wonders,2m 43s,2016-09-28T19:00:01Z
Y4wMztQG4B0,The Wild Sheep Dash | Dr. Oakley Yukon Vet,2m 35s,2016-09-28T15:00:03Z
X0uNIndOyMk,Whales (Episode 10) | wild_life with bertie Gregory,5m 12s,2016-09-28T13:00:03Z
SrRpTGDOEL0,Treating a Muskox Is No Small Job | Dr. Oakley Yukon Vet,2m 29s,2016-09-27T15:00:03Z
7J05LD7EcSI,How to Recognize a Reindeer | Yukon Do It,1m 29s,2016-09-26T13:00:01Z
pXfxa4Bhayk,Turtles in Trouble | Animal ER,2m 43s,2016-09-22T17:00:04Z
q0WNCrppb0A,Jackal Pup vs. Seal Pup | Gangster Jackals,1m 56s,2016-09-22T16:00:06Z
cnMXwFcfwgQ,Doggy Back Pain | Animal ER,2m 31s,2016-09-21T17:00:02Z
wqdHg8NQ6Bk,Ready for 4-H | The Incredible Dr. Pol,2m 41s,2016-09-21T14:00:04Z
ZhbSOgL6gSU,Wolf Prints (Episode 9) | wild_life with bertie gregory,5m 59s,2016-09-21T13:00:02Z
y27_ZmTmUmE,Best in Show | Cesar 911,3m 2s,2016-09-20T20:00:01Z
AhEdKY4ujjg,Jackal on the Hunt | Gangster Jackals,2m 31s,2016-09-20T16:00:00Z
IZkmElLCVO8,Bloated Bovine Emergency | The Incredible Dr. Pol,3m 26s,2016-09-19T14:00:02Z
8hfA-8j-6GM,Two Dogs One Mission | Cesar 911,2m 20s,2016-09-18T20:00:01Z
yHlqfdSz3f0,Vancouver Island: Up Close With Wild Animals | wild_life with bertie gregory,1m 33s,2016-09-18T13:00:06Z
tcblYQ0JxUU,How to Move a Rhino | Mission Critical,2m 17s,2016-09-15T20:00:03Z
XBMUYw6nel0,Table Manners 101 | Cesar 911,2m 7s,2016-09-14T20:00:02Z
TJb5KNNf5a4,No Ordinary Farm Call | The Incredible Dr. Pol,1m 59s,2016-09-14T16:00:02Z
wlQwJWQAQ2o,Bear Fights to Save Her Cubs (Episode 8) | wild_life with bertie gregory,4m 25s,2016-09-14T13:00:08Z
MGOVFGLplyY,Supporting Puntong the Rhino | Mission Critical,2m 10s,2016-09-13T20:00:02Z
GoL0KeJXNCo,Pool Time Progress | Cesar 911,2m 50s,2016-09-13T20:00:01Z
EmhSjHLZKt0,Polments: Happy Halloween | The Incredible Dr. Pol,2m 17s,2016-09-13T16:00:02Z
oX3ftRfjcvk,Smokey the Duck - Client Tales | The Incredible Dr. Pol,2m 50s,2016-09-12T16:00:05Z
0eUZnv26mRY,Can’t Keep a Good Pup Down | The Incredible Dr. Pol,2m 39s,2016-09-12T12:00:00Z
tbAeOruPqYU,Don't Sweat It - Season 3 Episode 6 | Coffee Break With Dr. Pol,1m 31s,2016-09-11T16:00:04Z
eaS5oQi8bKg,This Bird's Cluck Brings All the Hens to the Yard | The Forbidden River,1m 42s,2016-09-11T12:00:01Z
MOdpxhCkL_o,Wiki Goes Home | The Incredible Dr. Pol,1m 34s,2016-09-10T21:00:00Z
QKshvvNLWSk,Home is Where the Yurt Is | The Forbidden River,1m 43s,2016-09-10T12:00:02Z
TnxctuH0pg8,Limping Bull - Client Tales | The Incredible Dr. Pol,2m 6s,2016-09-09T21:00:01Z
iiIzKcjc0gg,Turtle Power - Season 3 Episode 5 | Coffee Break With Dr. Pol,1m 32s,2016-09-09T15:59:37Z
FC44XPlhHEU,Pine Nuts Galore | The Forbidden River,2m 44s,2016-09-09T12:00:01Z
TPIBPRigFTE,Let the Feast Begin | The Forbidden River,3m 3s,2016-09-08T12:00:01Z
8sv-vqrhIBc,Prepping a Tiger for Surgery | Animal ER,3m 57s,2016-09-07T18:00:00Z
W3u1ilylgLc,All Bark and Hopefully No Bite | Cesar 911,2m 52s,2016-09-07T16:00:05Z
Wp5xfu7-fAo,Baby Bears (Episode 7) | wild_life with bertie gregory,5m 3s,2016-09-07T13:49:18Z
LF__QeackMc,China's Love of Cranes | The Forbidden River,2m 20s,2016-09-06T16:00:02Z
cbhrz69D_tM,Take This Broken Wing | The Incredible Dr. Pol,2m 56s,2016-09-06T12:00:03Z
l5Pb70TI1tg,Challenging a Vizsla | Cesar 911,3m 5s,2016-09-05T16:00:06Z
zOVmH7q9ZP4,The Elusive Amur Leopard | The Forbidden River,2m 33s,2016-09-05T16:00:05Z
iCZ35k1orK0,The Tooth of the Matter | The Incredible Dr. Pol,2m,2016-09-05T12:00:06Z
Bcw06_4kJ2E,Cranial Concerns | Animal ER,3m,2016-09-04T16:00:00Z
7d6Dm3O5dTo,Cubs Will Be Cubs | Secret Life of Tigers,1m 51s,2016-09-04T12:00:00Z
A7AtG8laFfI,The Jackal Wants Some Too | Secret Life of Tigers,2m 25s,2016-09-03T12:00:00Z
lEpojbxotd4,When a Tiger Hunts | Secret Life of Tigers,2m 20s,2016-09-02T12:00:02Z
Ke9uEv9CB-A,Searching for the Tigress | Secret Life of Tigers,3m 1s,2016-09-01T19:00:01Z
Am9R5MOtCjc,Leader of the Pack | Cesar 911,2m 25s,2016-09-01T16:00:00Z
kN9D40lFuJ4,One Sore Camel | The Incredible Dr. Pol,3m,2016-09-01T13:00:07Z
EVOg1toJjhU,Hitching a Ride with Mama Bear | Secret Life of Tigers,2m 16s,2016-08-31T19:00:01Z
9Bd_aMDsRqs,The Cat Who Thinks She's a Person | Kitten Impossible,1m 49s,2016-08-31T16:00:01Z
kQyiVujXYAY,Sea Lions (Episode 6) | wild_life with bertie gregory,5m 31s,2016-08-31T13:00:03Z
8dsLxF6VoXM,Facing Fears | Cesar 911,2m 28s,2016-08-30T16:00:00Z
cNx0E-SXTAY,Tiger Cub Escape | Secret Life of Tigers,3m 52s,2016-08-30T12:00:03Z
dTTz202V1tY,Skateboarding Cat Does Tricks | Kitten Impossible,3m 4s,2016-08-29T16:00:04Z
tBG-9pejySQ,Pawsitively Adorable Danes | The Incredible Dr. Pol,1m 54s,2016-08-29T13:00:06Z
q-On0WONOZI,Bob and Weave - Season 3 Episode 4 | Coffee Break With Dr. Pol,1m 32s,2016-08-28T13:00:05Z
oX7u-fSuOBQ,The One-Eyed Surfing Cat | Kitten Impossible,2m 1s,2016-08-26T22:48:15Z
WdQWFHOQOv8,Top 3 Cutest Panda Baby Moments | Mission Critical,3m 7s,2016-08-26T19:00:02Z
NrQLrjctEXU,Undercover Pandas | Mission Critical,2m 24s,2016-08-26T16:00:02Z
14zR8I8LXYI,Bear Beach Bash | Bears,1m 57s,2016-08-26T13:00:00Z
iDjsEA8hPyw,Sleepy Sleepy Pandas | Mission Critical,1m 29s,2016-08-25T16:00:06Z
enx-cYI7Sro,Dr. Pol Sweepstakes Winner | The Incredible Dr. Pol,1m 55s,2016-08-25T14:00:04Z
dw8_0oKrOJs,That Was Not a Calving | The Incredible Dr. Pol,1m 57s,2016-08-25T13:00:06Z
80Fh1LmQDMM,Sea Otters (Episode 5) | wild_life with bertie gregory,6m 4s,2016-08-24T13:00:00Z
vGsRoffKGsM,Healing Waters | Cesar 911,2m 58s,2016-08-23T19:00:04Z
Xf8HJ0P_pAo,Pampered Pandas | Mission Critical,1m 48s,2016-08-23T16:00:04Z
sBZs79xfJKM,The Search for Salmon | Bears,1m 57s,2016-08-23T13:00:03Z
fLevVdCJv6A,A Miracle Baby | Mission Critical,2m 53s,2016-08-22T16:00:02Z
CrN9OBOSryQ,No Kits Yet! | The Incredible Dr. Pol,1m 20s,2016-08-22T13:00:00Z
K7wGvxMPqtI,Dr. Pol Rescues a Kitten | The Incredible Dr. Pol,2m 35s,2016-08-18T16:00:01Z
Hql3Cj4YKOI,Wolves: Waiting for a Sighting (Episode 4) | wild_life with bertie gregory,3m 57s,2016-08-17T13:00:03Z
whV42Lkf4o4,Vancouver Island: A Wild World Within Your Reach | wild_life with bertie gregory,1m 6s,2016-08-14T13:00:04Z
gRF8Cda6nVE,Bald Eagles (Episode 3) | wild_life with bertie gregory,4m 14s,2016-08-10T13:00:02Z
Arq8jN7A2JA,Keeping Up With Dr. Pol | The Incredible Dr. Pol,2m 1s,2016-08-08T13:00:00Z
sW9Jw8JruB0,Bear Catching Crabs (Episode 2) | wild_life with bertie gregory,4m 37s,2016-08-03T13:00:04Z
S_zD4N2NqWQ,Sea Wolf: The Search Begins (Episode 1) | wild_life with bertie gregory,4m 57s,2016-08-03T13:00:01Z
UHv_96vio2E,Calm and Assertive in Hong Kong | Cesar 911,1m 58s,2016-08-02T20:00:01Z
okb9v-pgPRg,Unique Sheep - Season 3 Episode 3 | Coffee Break With Dr. Pol,1m 32s,2016-07-31T13:00:02Z
sD3FOFZKKiY,Official Trailer | Savage Kingdom,1m 40s,2016-07-31T12:00:03Z
HIvZQ4Knrok,Saltine the Cria - Client Tales | The Incredible Dr. Pol,2m 32s,2016-07-31T01:00:00Z
hG6lEklrUHc,Panda Babies - Preview | Mission Critical,36s,2016-07-29T12:00:03Z
ogsNgEq4yB4,Approaching Animals in the Wild | wild_life with bertie gregory: Q&A,1m 52s,2016-07-29T07:00:03Z
bKe32dHkSKQ,Staying Focused for Days in a Photography Hide | wild_life with bertie gregory: Q&A,1m 35s,2016-07-29T07:00:01Z
-Iym4CBGi3w,Official Trailer | wild_life with bertie gregory,1m 55s,2016-07-29T07:00:00Z
bkddG-5orc4,How Vancouver Island Inspired a Wildlife Photographer | wild_life with bertie gregory: Q&A,1m 39s,2016-07-29T07:00:00Z
rZviWPZoYhg,Official Trailer | Wild New Zealand,1m 28s,2016-07-28T23:44:49Z
AUKW0xWhPsg,Surrender State | Cesar 911,3m 3s,2016-07-28T17:00:00Z
6okkKX3mjV4,Serval vs. Snake | South Africa,2m 55s,2016-07-28T16:00:01Z
ilGoSs6wDrE,Cria Vision Test | The Incredible Dr. Pol,2m 6s,2016-07-28T13:00:04Z
2yYMDjUFInA,Taking the Bull by the Horns | Cesar 911,2m 13s,2016-07-27T17:00:01Z
NdpDNx2p67E,A Mudskipper Battle | South Africa,2m 3s,2016-07-27T15:00:00Z
vYHWbI46Q5I,Penguin Crime Spree | South Africa,2m 48s,2016-07-26T15:00:06Z
6OBsbJnDx7o,Not-So-Wide Receiver | The Incredible Dr. Pol,2m 19s,2016-07-25T13:00:01Z
PjezTJy-o5Y,Gracie the Camel - Client Tales | The Incredible Dr. Pol,1m 57s,2016-07-24T14:00:01Z
OkMs6Yf15tc,Reindeer Games - Season 3 Episode 2 | Coffee Break With Dr. Pol,1m 32s,2016-07-24T12:00:01Z
-51jcNHSTUc,Getting to Higher Ground | Otter Town,1m 25s,2016-07-21T13:00:01Z
WvBT1lnoqkI,Training for a Better Life | Cesar 911,3m 7s,2016-07-20T13:00:03Z
7EB2HPPUtsw,Hungry Wild Otters | Otter Town,59s,2016-07-19T16:00:01Z
m1Z8xBqDutc,Tiny Therapy Horse - Client Tales | The Incredible Dr. Pol,3m 4s,2016-07-18T16:07:15Z
tJdl6utjm8Y,Overcoming a Bad History | Cesar 911,2m 4s,2016-07-18T16:00:03Z
NbaH0ifQ4wc,Looking for a Bump Under the Humps | The Incredible Dr. Pol,2m 22s,2016-07-18T13:00:01Z
yFbQleRhuoM,Be Emused - Season 3 Episode 1 | Coffee Break With Dr. Pol,1m 31s,2016-07-17T12:00:02Z
94O20kZ8Yi4,Making New Friends | Cesar 911,2m 26s,2016-07-14T13:00:00Z
L5-GFKFnVrs,Dr. Pol's Favorite Mini-Horse | The Incredible Dr. Pol,2m 18s,2016-07-13T13:00:03Z
eLgxRIBdNyQ,Testing Truffle's Boundaries | Cesar 911,1m 51s,2016-07-12T13:00:30Z
kLoiZASjggs,This Little Piggy Got a Pedicure | The Incredible Dr. Pol,1m 59s,2016-07-11T13:00:02Z
YVurGpqGqfg,Stranger Danger | Baboon Queen,3m 12s,2016-07-07T13:00:02Z
90FIS5C8aU0,Getting Out of a Pickle | Dr. K's Exotic Animal ER,1m 48s,2016-07-06T13:00:00Z
arQR6j9090o,The Hunting Baboon Queen | Baboon Queen,2m 39s,2016-07-05T13:00:00Z
2Khb4UN3cSM,Dr. K Goes to School | Dr. K's Exotic Animal ER,1m 44s,2016-07-04T13:00:01Z
j09cwQ7Vy50,A Cheetah Takes Down a Wildebeest | Deadly Game,2m 3s,2016-07-03T17:00:05Z
wE6pEsjgdHo,A Capybara Family's Day at Play | Deadly Game,1m 21s,2016-07-01T17:00:03Z
XBbXpM8cnAM,The Incredible Dr. Pol - Teaser Trailer | The Incredible Dr. Pol,31s,2016-07-01T15:08:47Z
Ja-vBrwaWOk,Timothy the Totally Tiny Goat | Dr. K's Exotic Animal ER,2m 20s,2016-06-29T13:00:01Z
J65FnTKoBCg,Jumping Into a Pool of Gators | Dr. K's Exotic Animal ER,2m 29s,2016-06-27T13:00:02Z
R4xpda7p1Zk,Landing a Lemon | Mega Hammerhead,2m 46s,2016-06-24T13:00:02Z
jyoOTXSKlT4,Night Diving with Sharks | SharkFest,2m 36s,2016-06-23T16:00:03Z
7ypLTWfstGo,Eye of the Wolf | Dr. K's Exotic Animal ER,1m 52s,2016-06-23T13:00:01Z
EejtbF-PY0g,It's Hammer Time! | Mega Hammerhead,2m 28s,2016-06-22T19:00:01Z
llSyFLKL6vU,A Gas Can and a Prayer | Sharkatraz,2m 31s,2016-06-22T13:00:03Z
cx9BwsQ7Bdk,SharkFest 2016 Is Almost Here | Sharkfest,1m 2s,2016-06-21T15:00:02Z
VCmT9201cos,Elephant Party Crasher | Animals Gone Wild,2m 12s,2016-06-21T13:00:02Z
Ww4yL8rS6xs,Eye Can See Clearly | Sharkatraz,2m 10s,2016-06-20T17:00:02Z
CzQWYxESlIo,A Celebrity Skunk Check-Up | Dr. K's Exotic Animal ER,2m 3s,2016-06-20T13:00:00Z
qEy2JMxfrp0,A Skunk in Need | Animals Gone Wild,2m 50s,2016-06-18T13:00:03Z
NygmdjerkLQ,Elephant in the Mirror | Mind of a Giant,2m 11s,2016-06-16T13:00:01Z
EBEL8ptlaFY,A Leaping Lemur | Dr. K's Exotic Animal ER,2m 8s,2016-06-15T13:00:30Z
TBNaIRI80EM,A Shark Showstopper | Animals Gone Wild,2m 18s,2016-06-14T16:00:02Z
m0UqrxJocbk,Looking at an Elephant's Big Brain | Mind of a Giant,1m 18s,2016-06-14T13:00:02Z
p8w2L-VbPBs,Testing the Tortoise Tracker | Dr. K's Exotic Animal ER,2m 23s,2016-06-13T13:00:02Z
vFjIJ-XYJ5Q,A Primate Pickpocket | Animals Gone Wild,2m 9s,2016-06-11T16:00:04Z
u4AuQNX6MvA,Chaos on the Cape | When Sharks Attack,1m 23s,2016-06-08T16:00:03Z
9Qj7x2iz3X4,Sidelined Skunk | Dr. K's Exotic Animal ER,1m 58s,2016-06-08T13:00:00Z
CoYUxzRf_Ww,Life-Saving Labrador | Animals Gone Wild,1m 57s,2016-06-07T13:00:00Z
