Video ID,Title,Length,Published,Region Restriction Count
yV3bFP4DFH4,See How Our Photographers Captured the Pets of Nat Geo | Nat Geo Wild,2m 34s,2018-05-26T12:00:04Z
6zYRTPWTJzA,Leopard and Buffalo 'Kiss' In Rare Moment Caught on Film | Nat Geo Wild,1m 48s,2018-05-25T12:00:01Z
efrTgJeFX94,Safari Live - Day 161 | Nat Geo Wild,3h 57s,2018-05-24T19:59:56Z
nCtgfLVCDN4,This Family Thought They Were Raising a Dog—It Was a Bear | Nat Geo Wild,1m 31s,2018-05-24T12:00:09Z
F6EiDe40AbY,Safari Live - Day 160 | Nat Geo Wild,3h 4m 36s,2018-05-23T19:59:52Z
ArfC-9jKf7Q,Wild Leopard Plays With a Tourist's Foot | Nat Geo Wild,1m 31s,2018-05-23T16:00:01Z
Y8zWjrrUyWY,World Turtle Day: A Day Worth Shellabrating | Nat Geo Wild,2m 23s,2018-05-23T12:00:02Z
AFbu21AGSho,Watch a Hercules Beetle Metamorphose Before Your Eyes | Nat Geo Wild,1m 28s,2018-05-22T12:00:00Z
UitH2v8it1M,Safari Live - Day 159 | Nat Geo Wild,3h 11s,2018-05-21T17:01:28Z
eaLnK4jc1nA,How Bat Moms Find Their Babies in Crowded Dark Caves | Nat Geo Wild,2m 8s,2018-05-19T12:00:03Z
ox33ig8tcN4,The Giant Centipede Has an Unexpected Meal | Nat Geo Wild,1m 46s,2018-05-18T12:00:08Z
130uqjizMTc,Safari Live - Day 157 | Nat Geo Wild,3h 24s,2018-05-17T19:59:51Z
YGgsDx0AJzQ,Safari Live - Day 156 | Nat Geo Wild,3h 1m 4s,2018-05-16T19:59:56Z
zb17eK0uLIg,Two Lions vs. Bucking Wildebeest—Who Will Win? | Nat Geo Wild,1m 39s,2018-05-16T12:00:05Z
4fX7WJtJLWo,The Pika is Quick and Elusive | America the Beautiful,1m 24s,2018-05-15T20:00:01Z
Lr1FpZsjNF4,Africa's Rarest Parrot Filmed Mating for the First Time | Nat Geo Wild,1m 51s,2018-05-15T12:00:01Z
GEETYPAo5IQ,Safari Live - Day 155 | Nat Geo Wild,3h 14s,2018-05-14T19:59:54Z
oW7yv9ZeY3I,Why Are Gray Whales Losing Their Tails? | Nat Geo Wild,2m 3s,2018-05-14T12:00:04Z
2Gkih9rbLRE,What Causes Animals To Be Born With Two Heads? | Nat Geo Wild,1m 45s,2018-05-13T20:00:02Z
x_sA5q-64SY,Nudibranch Snacks Along The Ocean Floor | Nat Geo Wild,1m 15s,2018-05-13T12:00:04Z
XR2fNwLJwPo,This Tiny Aquatic Mammal Has a Snorkel Snout | Nat Geo Wild,1m 6s,2018-05-12T12:00:06Z
Jr8vK0z-06w,Curious Lion Bites Tourist's Car Door on Safari | Nat Geo Wild,1m 21s,2018-05-11T20:00:04Z
9wBUKtCsCuc,For Kangaroos the Mating Game is Dangerous | Nat Geo Wild,1m 46s,2018-05-11T12:00:01Z
0Hf_3yhHLjo,Safari Live - Day 153 | Nat Geo Wild,2h 58m 13s,2018-05-10T17:06:43Z
q950J4BogZw,Do Elephants Grieve? New Video Suggests They Do | Nat Geo Wild,2m 33s,2018-05-10T12:00:05Z
nmu2I5UJkpU,Safari Live - Day 152 | Nat Geo Wild,3h 2m 4s,2018-05-09T17:02:36Z
xZL4_xFRCDQ,Caribou Spar to Assert Dominance | Alaska's Grizzly Gauntlet,2m 34s,2018-05-09T16:00:05Z
kT9Vj_c8nJE,Grumpy Toadfish Sing Strange Love Songs | Nat Geo Wild,1m 43s,2018-05-09T12:00:03Z
2Lrg9ZYCFfA,Rare Mexican Wolf Pups Meet Their Wild Foster Families | Nat Geo Wild,1m 48s,2018-05-08T12:00:00Z
MUX3reuewhs,Safari Live - Day 151 | Nat Geo Wild,3h 5m 9s,2018-05-07T17:07:02Z
tBPoPIvyd9U,A Cheetah Mother Works Hard For Her Family | Nat Geo Wild,2m 15s,2018-05-07T12:00:07Z
UcEFWbLWuS8,An Octopus Hitches a Ride on a Diver’s Arm | Nat Geo Wild,1m 58s,2018-05-06T20:00:04Z
rSua6Pi4yDQ,For Elephants Two Seasons Reign Supreme | Nat Geo Wild,1m 53s,2018-05-06T12:00:05Z
5yti6ce5ik0,A Brief History of Dogs | Nat Geo Wild,3m 30s,2018-05-05T12:00:00Z
Ac48QB0su6Q,Why Did the Baby Boars Cross the Road? | Nat Geo Wild,1m,2018-05-04T12:00:00Z
6jW-PdZt0iY,Safari Live - Day 149 | Nat Geo Wild,3h 1m 47s,2018-05-03T17:01:20Z
767BWjKzXfc,Alaska’s Deadly Sharks | Alaska's Deadliest,3m 18s,2018-05-03T16:00:00Z
1Hhy2EE2MNg,Baby Orangutan and Mother Saved From Near-Death Human Encounter | Nat Geo Wild,1m 30s,2018-05-03T12:00:01Z
VoU5RgT9n1M,Safari Live - Day 148 | Nat Geo Wild,3h 1m 13s,2018-05-02T16:54:57Z
bGeLmv-Y330,Baby Sloth Is Rescued in Costa Rica | Nat Geo Wild,1m 20s,2018-05-02T12:00:02Z
8sO3XJY1hro,A Jellyfish Explosion | Alaska's Deadliest,1m 42s,2018-05-01T20:00:01Z
XcGT4Eso4fU,Great White Shark Bites Down on a Submarine Drone | Nat Geo Wild,1m 50s,2018-05-01T12:00:07Z
wutTDe6sn1s,Safari Live - Day 147 | Nat Geo Wild,3h 1m 12s,2018-04-30T17:27:59Z
ZNHQe9IOgcw,Jaguars vs. Giant Otters: Who Will Win? | Nat Geo Wild,2m 16s,2018-04-30T12:00:07Z
fpq7s6lQc58,The Nile Crocodile Grows To Be How Big? | Nat Geo Wild,1m 33s,2018-04-29T12:00:04Z
V7CIE3JUxyY,Crocodile and Sharks Eat a Whale in First-Ever Video | Nat Geo Wild,1m 18s,2018-04-28T20:00:04Z
14YIVuon9aM,This Famous Dodo Didn't Just Die—It Was Murdered | Nat Geo Wild,1m 3s,2018-04-28T12:00:00Z
RI5hsraUK98,How Female Bears Show Dominance | Alaska's Grizzly Gauntlet,1m 51s,2018-04-27T20:00:03Z
OWFBISgIoxw,Cheetah Cubs on the Hunt | Nat Geo Wild,1m 57s,2018-04-27T12:00:03Z
SYJCM9rUAQs,Safari Live - Day 145 | Nat Geo Wild,3h 2m 36s,2018-04-26T17:35:19Z
9KeDxJEc0rU,A Wolverine Showdown | Alaska's Deadliest,3m 10s,2018-04-26T16:00:01Z
AS0z6EVj7D0,How Does A Humpback Give Birth? | Nat Geo Wild,55s,2018-04-26T12:00:01Z
HuKGPu_9IWk,Safari Live - Day 144 | Nat Geo Wild,2h 54m 22s,2018-04-25T17:26:05Z
2tnL50aHHok,Elephants Lock Tusks In Brawl | Nat Geo Wild,1m 46s,2018-04-25T12:00:00Z
Uf5IQiLOQK0,Silent Snowy Owl Attack | Alaska's Deadliest,2m,2018-04-24T16:00:03Z
A0ufn6VLYt0,Hundreds of Octopus Moms Found in Deepest Nursery Ever Discovered | Nat Geo Wild,1m 31s,2018-04-24T12:00:01Z
QjGxLFa6wHg,Safari Live - Day 143 | Nat Geo Wild,3h 3m 20s,2018-04-23T17:27:19Z
T11rOkgpRnA,The Grouse's Unique Mating Ritual | America the Beautiful,2m 33s,2018-04-23T16:00:03Z
ifSDPMmtIns,Rare African Elephant Twins are Thriving | Nat Geo Wild,1m 32s,2018-04-23T12:00:04Z
GdfHODPp6GM,Watch Attempt to Save a Tiny Orphaned Fruit Bat | Nat Geo Wild,1m 18s,2018-04-22T16:00:01Z
bzUutdbRW9Q,A Celebration of Wildlife and Nature | Symphony For Our World,5m 2s,2018-04-21T23:00:06Z
QmVPwBWlC04,Thousands of Cranes Take Flight in One of Earth's Last Great Migrations | Nat Geo Wild,6m 3s,2018-04-21T16:00:01Z
dQQHMWmrhP8,Penguin Love Story | Symphony For Our World,3m 12s,2018-04-20T12:00:03Z
edNZsCPQcFI,Safari Live - Day 141 | Nat Geo Wild,3h 1m 31s,2018-04-19T17:13:50Z
xkD-wI_3IYM,Lions Use Teamwork to Hunt | Nat Geo Wild,1m 54s,2018-04-19T16:00:13Z
gN3_wRL1ldY,Safari Live - Day 140 | Nat Geo Wild,3h 4m 24s,2018-04-18T19:17:26Z
Jwmr8os4dRQ,The Ostrich's Anti-Predator Tactics | Africa's Deadliest,2m 19s,2018-04-18T16:00:01Z
UmAA-8VlC1Y,Watch the First 2 Minutes of Symphony For Our World | Symphony for Our World,2m 18s,2018-04-18T12:00:07Z
UGzNYJtL5Ak,Safari Live - Day 138 | National Geographic,3h 1m 55s,2018-04-17T13:00:24Z
p-uXHoZP_hs,Orphaned Sloth Bear Cub Is Playful and Healthy One Year After Rescue | Nat Geo Wild,1m 31s,2018-04-17T12:00:10Z
pbcD-cuobSE,Safari Live - Day 139 | Nat Geo Wild,3h 1m 46s,2018-04-16T17:19:15Z
VRchgTun0_s,Hippo vs. Lions | Africa's Deadliest,3m 3s,2018-04-16T16:00:01Z
3i4rUieYmFs,This Rescued Kitten Isn't Just Any Cat—It's a Wild Leopard Cat | Nat Geo Wild,1m 16s,2018-04-15T12:00:01Z
jtY9kOZrAR0,Lion Cubs Affected By Mysterious Paralyzing Disease | Nat Geo Wild,1m 41s,2018-04-14T12:00:04Z
8vglQPacLn4,Safari Live - Day 137 | Nat Geo Wild,3h 7m 47s,2018-04-12T17:42:57Z
MrFEyCV763A,Safari Live - Day 134 | National Geographic,3h 3m 42s,2018-04-12T17:33:28Z
oKTAseJI3F0,Safari Live - Day 133 | National Geographic,3h 2m 21s,2018-04-12T17:32:20Z
KYW21qerALI,Parasites Hitch a Ride on Turtle's Shell | Nat Geo Wild,1m 46s,2018-04-12T12:00:01Z
3azwSun1KhM,Safari Live - Day 136 | Nat Geo Wild,3h 4m 5s,2018-04-11T18:39:51Z
W8TAMqbWJUk,Mongoose v. Leopard | Africa's Deadliest,2m 39s,2018-04-11T16:00:05Z
0Ac8iAhYri8,Rescued Animals Have a New Mission | Nat Geo Wild,2m 34s,2018-04-11T12:00:01Z
FSaZurDToYM,This Snake Rips its Prey Into Pieces Instead of Swallowing it Whole | Nat Geo Wild,2m 5s,2018-04-10T12:00:01Z
rrpQpNzyftQ,Safari Live - Day 135 | Nat Geo Wild,3h 42s,2018-04-09T18:46:40Z
BySmYswh4_4,A Squirrel's Prosthetic Wheels Are the Key to Recovery | Nat Geo Wild,1m 47s,2018-04-09T12:00:00Z
hfhlpYPYLaU,Little Red Flying Fox Take a Long Flight | Nat Geo Wild,1m 55s,2018-04-08T12:00:03Z
HR5SP4aBeJQ,This 'Mini Kangaroo' is One of Many Unknown Marsupials | Nat Geo Wild,1m 33s,2018-04-07T12:00:01Z
fFQLlYwtPkE,The Elephant's Warning System | Africa's Deadliest,2m 39s,2018-04-06T12:00:04Z
pJ2kSnGhZXQ,Safari Live - Day 132 | Nat Geo Wild,2h 57m 30s,2018-04-05T17:24:21Z
FNnv6aJSx5k,Safari Live - Day 131 | Nat Geo Wild,3h 3m 2s,2018-04-04T17:38:35Z
BjkuMFZBJ3k,Is this Mongoose Playing Dead or Just Playing? | Nat Geo Wild,1m 58s,2018-04-04T16:00:00Z
4FrVqAue538,Mom Comes to the Rescue of a Pygmy Elephant Baby | Nat Geo Wild,1m 46s,2018-04-03T12:00:00Z
2GJBQirA4HU,Safari Live - Day 130 | Nat Geo Wild,3h 3m,2018-04-02T19:59:50Z
PH8Lqu1rqvc,Safari Live - Day 129 | National Geographic,3h 42s,2018-04-02T19:59:49Z
j8WqD-2B9p8,See Two Pine Martens Start a Food Fight | Nat Geo Wild,1m 43s,2018-04-02T12:00:03Z
G4ewNJ77xT8,Two Lynx Cats Scream at Each Other—Can You Stand It? | Nat Geo Wild,2m 30s,2018-04-01T12:00:05Z
vXjSE1GGYG0,Drone Video Captures Caribou From the Air | Nat Geo Wild,1m 27s,2018-03-31T20:00:06Z
5QmGXt6Z60w,See the Frog With a Special Thumb Used While Mating | Untamed,1m 42s,2018-03-31T12:00:01Z
HWVmhrNHAVE,These African Buffalo Have Each Other's Backs | Nat Geo Wild,1m 27s,2018-03-30T20:00:01Z
XhsyZnVx2rQ,First-Ever Footage of Deep-Sea Anglerfish Mating Pair | Nat Geo Wild,2m 20s,2018-03-30T12:00:05Z
4hkxhMzMumk,Safari Live - Day 128 | Nat Geo Wild,2h 58m 14s,2018-03-29T19:59:49Z
F9NbMfa9iP4,These Army Ants Demand Corpses | Nat Geo Wild,1m 50s,2018-03-29T16:00:02Z
5iia0aHIEnA,Wild Elephant Blows Smoke in Unusual Video | Nat Geo Wild,1m 15s,2018-03-29T12:00:01Z
pkil60ZTRBM,Safari Live - Day 127 | Nat Geo Wild,3h 2m 25s,2018-03-28T19:59:53Z
L2-tIgN8F9g,Watch a Wild Buffalo Give Birth in Africa | Nat Geo Wild,1m 45s,2018-03-28T12:00:02Z
CXl09omwZNA,See First Ever Video of an Orca Mother and Son Killing a Calf | Nat Geo Wild,1m 32s,2018-03-27T20:00:02Z
l6jY4iU-9vw,Bald Eagles' Food Fight Captured In Slow-Motion | Nat Geo Wild,3m 46s,2018-03-27T12:00:05Z
5FC0Y-8gDlw,Safari Live - Day 125 | National Geographic,3h 3m 32s,2018-03-26T20:00:14Z
VgezSVwfhSg,Safari Live - Day 126 | Nat Geo Wild,3h 8m 21s,2018-03-26T17:22:48Z
f_Jx790v9lU,Wildlife and the Wall | WILDxRED,5m 40s,2018-03-26T16:00:07Z
TZzW1pfwmfU,These Fish Can Jump Farther When They’re Older | Nat Geo Wild,1m 21s,2018-03-26T12:00:02Z
jYy93Xb-wUU,The Battle For Africa's Deadliest Predator Continues | Nat Geo Wild,2m,2018-03-25T20:00:01Z
wJ5weBS59kw,We're Not Foaling Around - Season 2 Episode 10 | Barnyard Babies with Dr. Pol,1m 16s,2018-03-25T16:00:04Z
j-AF5Aa82xA,Locals Use Backhoe to Rescue Stranded Elephant | Nat Geo Wild,1m 49s,2018-03-25T12:00:07Z
yQbIe07jhrg,Will Your Dog Pick You Over a Stranger? | Nat Geo Wild,1m 53s,2018-03-24T20:00:02Z
InkFViHqCDw,Pythons 101 | Nat Geo Wild,4m 38s,2018-03-24T16:00:02Z
HXP996xFHuY,Slither On Over to See This Boa | Untamed,1m 43s,2018-03-24T12:00:01Z
4NZ0JuDAyTo,Watch a Lion Try to Eat a Tortoise | Nat Geo Wild,1m 36s,2018-03-23T20:00:00Z
QLd0RsFQBwc,Sounding the Prairie Dog Alert System | America's Wild Frontier,2m 24s,2018-03-23T12:00:01Z
HJcZxp9cZII,Safari Live - Day 124 | Nat Geo Wild,3h 2m 36s,2018-03-22T17:26:49Z
dEjMUs5HNhs,Watch a Playful Young Elephant Charge at Cars | Nat Geo Wild,1m 35s,2018-03-22T16:00:04Z
m9tzxxW9NQc,Octopuses Mate With a Special “Sex Arm” | Nat Geo Wild,1m 21s,2018-03-22T12:00:06Z
J9aCSpHdA04,Safari Live - Day 123 | Nat Geo Wild,3h 1m 48s,2018-03-21T17:22:24Z
Gp0y7N7FUOE,Explore a Hidden Colony of 1.5 Million Antarctic Penguins | Nat Geo Wild,1m 9s,2018-03-21T12:00:00Z
0XW34PZINqo,Python Babies Nurtured by Snake Mom in First-Ever Footage | Nat Geo Wild,2m 26s,2018-03-20T20:00:01Z
ZXUcCwxdZxY,A Big Horse Means Big Pain | The Incredible Dr. Pol,2m 50s,2018-03-20T16:00:02Z
P2a_smk8IJk,Rare Two-Headed Snake Surprises Vets | Nat Geo Wild,2m 22s,2018-03-20T12:00:02Z
TqPdeylM09E,Safari Live - Day 122 | Nat Geo Wild,3h 3m 22s,2018-03-19T19:59:48Z
CnrMAVSoCqo,Safari Live - Day 121 | National Geographic,3h 2m 23s,2018-03-19T19:59:48Z
ne8qn114RM0,See Rare Video of Wild Gorilla Newborn Clinging to Its Mom | Nat Geo Wild,55s,2018-03-19T12:00:08Z
iqwqfFoJmo4,Watch an Elaborate Rat Snake Dance-Off | Nat Geo Wild,2m 24s,2018-03-18T20:00:04Z
qQMxTsF6tJo,Take a Gander at These Geese - Season 2 Episode 9 | Barnyard Babies with Dr. Pol,1m 16s,2018-03-18T16:00:02Z
aM4IQuK0GGg,Snake Catcher Risks Life to Rescue Cobra From Well | Nat Geo Wild,1m 53s,2018-03-18T12:00:01Z
-WrY_eROLCg,Rhino Mom Teaches Hungry Hyenas Not to Mess With Her Calf | Nat Geo Wild,2m 3s,2018-03-17T16:00:00Z
J1jHzl0LHII,The Ever-Evolving Giant Grasshopper | Untamed,1m 43s,2018-03-17T12:00:01Z
4wymns98a78,This Furry Creature Weaseled Its Way Into a Home Got Rescued | Nat Geo Wild,1m 4s,2018-03-16T20:00:00Z
ompEfbL5PmE,Defrosted Frogs Come Alive | America's Wild Frontier,2m 30s,2018-03-16T12:00:03Z
Ur6Lwu0XWfY,Migrating Wildebeest Run Croc Gauntlet | Nat Geo Wild,1m 51s,2018-03-15T16:00:04Z
7dhzXsq_nZw,Safari Live - Day 120 | Nat Geo Wild,3h 3m 21s,2018-03-14T19:59:47Z
CkrXbenYYCc,Seal Pups Face a Hungry Predator | Nat Geo Wild,1m 50s,2018-03-14T16:00:01Z
dHMdXU6goWU,You Goiter be Kidding Me! | The Incredible Dr. Pol,2m 36s,2018-03-13T16:00:03Z
JFvrIdyXSZk,The Rare Type D Orca Filmed Underwater For The First Time | Nat Geo Wild,2m 4s,2018-03-13T12:00:03Z
3XFSm92RPmY,Safari Live - Day 119 | Nat Geo Wild,3h 3m 58s,2018-03-12T19:59:46Z
9Bntb4_qnCg,Safari Live - Day 118 | National Geographic,3h 2m 15s,2018-03-12T19:59:46Z
GxOrdvu6Rr8,This Incredible Octopus Looks Psychedelic | Nat Geo Wild,1m 43s,2018-03-12T12:00:01Z
FcTMgDmXmNE,Flamingo Mysteriously Appears in a San Diego Salt Marsh Far From Home | Nat Geo Wild,1m 45s,2018-03-11T20:00:02Z
QXvTVYazOlg,Nothing Like That Fresh Puppy Smell - Season 2 Episode 8 | Barnyard Babies with Dr. Pol,1m 16s,2018-03-11T16:00:01Z
q3XCoAMDWWU,See a Bear Freed From a Cage to Begin a New Life | Nat Geo Wild,3m 22s,2018-03-11T12:00:05Z
Ko_tSbs9UdQ,Jaguar and Giant Anteater Standoff Ends With a Twist | Nat Geo Wild,1m 20s,2018-03-10T17:00:05Z
H-1WjsckeOM,Spot This Snake Hiding In Plain Sight | Untamed,1m 45s,2018-03-10T13:00:02Z
1sgMnfbpq2E,Tortoise Narrowly Avoids Being Trampled By Elephants | Nat Geo Wild,1m 39s,2018-03-09T21:00:00Z
5cPi5EvO2WE,Baby Bears Test Out Climbing Skills | America’s Wild Frontier,2m 22s,2018-03-09T13:00:00Z
wSuiz6fTjYQ,Safari Live - Day 117 | Nat Geo Wild,2h 19m 36s,2018-03-08T17:54:43Z
SDfwVvZzT8w,A Missing Upper Beak Doesn’t Stop This Little Bird From Eating Cake | Nat Geo Wild,1m 3s,2018-03-08T13:00:02Z
jkMBEIzmTH0,Safari Live - Day 116 | Nat Geo Wild,3h 2m 43s,2018-03-07T21:00:06Z
0ggJ627z4jU,Mother Bear Fights Tiger to Save Her Cub in Dramatic Video | Nat Geo Wild,1m 58s,2018-03-07T13:00:00Z
K_LR4fVCg30,Sloth Saved from Train Track and Released to Brazilian Rainforest | Nat Geo Wild,1m 10s,2018-03-06T13:00:01Z
WmctHWPP_dg,Safari Live - Day 115 | Nat Geo Wild,3h 2m 10s,2018-03-05T22:56:08Z
y05a9IFgr0o,Safari Live - Day 114 | National Geographic,13m 54s,2018-03-05T20:59:50Z
B2f1yj5Y7Kk,This Frog is a True Gladiator | Untamed,1m 42s,2018-03-05T17:08:00Z
G8GfjjNqEh8,Orphaned By Poachers a Baby Rhino Makes a New Friend | Nat Geo Wild,3m 5s,2018-03-05T13:00:02Z
53uPnQy2_eg,A Tiny Turkey Takeover! - Season 2 Episode 7 | Barnyard Babies with Dr. Pol,1m 16s,2018-03-04T17:00:01Z
iAYGQ2tqYbM,This Is What Happens When Underwater 'Aliens' Fight | Nat Geo Wild,1m 46s,2018-03-04T13:00:06Z
usBiL71eACc,Baby Elephant Takes a Helicopter Ride | Nat Geo Wild,1m 46s,2018-03-03T21:00:02Z
FJRhZo0fMPg,Helping a Sick Kitten | The Incredible Dr. Pol,2m 51s,2018-03-03T17:00:01Z
lrDKtxwXCno,Just Like Us These Chimps Splash in the River to Stay Cool | Nat Geo Wild,1m 40s,2018-03-02T17:00:05Z
ciBw_2RotwI,Every Night This Dog Waits in Vain for the Same Train Car | Nat Geo Wild,2m 21s,2018-03-02T13:00:03Z
gHGdsUHjHQ8,Safari Live - Day 113 | Nat Geo Wild,3h 1m 21s,2018-03-01T21:01:07Z
tlEdN0OIjGc,These Animals Survive Extreme Heat | Wild Chile,2m 20s,2018-03-01T17:00:05Z
xkJmxJU2XaY,Watch: Rare Yellow Cardinal Spotted in Alabama | Nat Geo Wild,54s,2018-03-01T13:00:04Z
p71Njkhl0Io,Safari Live - Day 112 | Nat Geo Wild,3h 2m 4s,2018-02-28T17:55:00Z
dGf6XLNTDlY,No Spring Chicken: 67-Year-Old Albatross Hatches Chick | Nat Geo Wild,55s,2018-02-28T13:00:03Z
JL0VSfZ0yX4,Manta Ray Swims in Trash-Filled Ocean | Nat Geo Wild,58s,2018-02-27T21:00:02Z
uMGh86DXAcA,Safari Live - Day 111 | Nat Geo Wild,3h 1m 26s,2018-02-26T20:59:59Z
dO0mqaXpLjI,Safari Live - Day 110 | National Geographic,3h 19s,2018-02-26T20:59:59Z
ghwoUG1nZAw,Keeping Up With Kittens - Season 2 Episode 6 | Barnyard Babies with Dr. Pol,1m 16s,2018-02-25T17:00:04Z
rTEL0dYFKvg,Sperm Whales Stay Close to Mom For Years | Nat Geo Wild,1m 46s,2018-02-25T13:00:07Z
Miq8bW6tNEE,How Do Big Horn Sheep Butt Heads? | Nat Geo Wild,1m 46s,2018-02-24T21:00:00Z
buNr3KKMOZE,Look at This Iguana Run! | Untamed,1m 42s,2018-02-24T13:00:05Z
6qWH5b7h_i0,Why Is This Marsupial Defecating Seeds? | Wild Chile,2m 11s,2018-02-23T17:00:01Z
i_ItZISefa0,Safari Live - Day 109 | Nat Geo Wild,3h 3m 4s,2018-02-22T20:59:46Z
ZdWH8v6X5R4,Showdown of the Killers | Killer Seals,3m 19s,2018-02-22T13:00:04Z
vE1Y7Lexwag,Safari Live - Day 108 | Nat Geo Wild,3h 1m 20s,2018-02-21T18:15:43Z
qFEV4K9hUq8,Cuttlefish Look Like Squid—and Like Crabs and Like Algae and Like Rocks | Nat Geo Wild,2m 5s,2018-02-20T13:00:04Z
KgB_P28DspE,Safari Live - Day 107 | Nat Geo Wild,2h 8m 18s,2018-02-19T23:49:37Z
XgsgWYCVe6o,Bombardier Beetles Squirt Boiling Anal Chemicals to Make Frogs Vomit | Nat Geo Wild,1m 14s,2018-02-19T13:00:05Z
wJ-LcrIbKr0,We've Got Springing Sheep! - Season 2 Episode 5 | Barnyard Babies with Dr. Pol,1m 16s,2018-02-18T17:00:04Z
36-2AfSwRbE,Watch a Diving Bird Pluck a Suckerfish Off a Shark | Nat Geo Wild,2m 30s,2018-02-18T13:00:01Z
R5Tifoo52_A,Snowball the Cockatoo Can Dance Better Than You | Nat Geo Wild,57s,2018-02-17T21:00:01Z
Cug96qdtOlk,This Beetle Is So Metal | Untamed,1m 42s,2018-02-17T13:00:01Z
wr5SqGTlJeU,See Westminster Dog Show Contestants Get Pampered Behind the Scenes | Nat Geo Wild,48s,2018-02-16T13:00:06Z
HgLfsMP8udo,Safari Live - Day 106 | Nat Geo Wild,1h 30m 51s,2018-02-15T16:13:13Z
eslxdInGIPY,Sloth 'Thief' Commits Slowest Burglary Ever | Nat Geo Wild,1m 23s,2018-02-15T13:00:03Z
lcPHFQP9GN0,The Blue Footed Boobies Mating Dance | Wild Love,2m 25s,2018-02-14T17:00:08Z
p-34GNAzpPM,Safari Live - Day 105 | Nat Geo Wild,1h 30m 31s,2018-02-14T16:22:19Z
i83k2KRV-Vc,Animals That Mate For Life | Nat Geo Wild,2m 8s,2018-02-14T13:00:05Z
4ndcorRHMqs,When a Corgi Can't Walk Her Owner Finds a Set of Wheels | BarkFest,2m 49s,2018-02-13T17:00:00Z
YzQJwICkvBU,Tense Chase Follows as Unsuspecting Hyena Trespasses on Lion Territory | Nat Geo Wild,1m 42s,2018-02-13T13:00:02Z
jcjDrE1ye-E,For Ring Tailed Lemurs the Ladies Rule | Wild Love,2m 48s,2018-02-12T17:00:03Z
kZKX-cV0QIM,Safari Live - Day 104 | Nat Geo Wild,1h 28m 18s,2018-02-12T16:13:25Z
P9do23V7FDI,Sea Turtles Get Life-Saving Surgery at Florida Hospital | Nat Geo Wild,2m 41s,2018-02-12T13:00:03Z
1-63RDy0CQA,George the Wombat Begins New Life in the Wild | Nat Geo Wild,2m 31s,2018-02-11T21:00:00Z
6zwgYXbX_IQ,Reindeer Games - Season 2 Episode 4 | Barnyard Babies with Dr. Pol,1m 15s,2018-02-11T17:00:00Z
AP1Ydc0gJuk,The Love of Dogs Has No Age Limit | BarkFest,2m 35s,2018-02-11T13:00:00Z
3ao55J9eevU,Hippo vs. Crocodile | Nat Geo Wild,1m 53s,2018-02-10T21:00:00Z
7JwdhGi0pDo,The Greatest Dane of All Never Leaves Your Side | BarkFest,3m 15s,2018-02-10T17:00:00Z
xOZvX848P3s,A Truly Golden Spider | Untamed,1m 42s,2018-02-10T13:00:03Z
P_ckAbOr0r4,Giraffes 101 | Nat Geo Wild,3m 49s,2018-02-09T13:00:05Z
lAZIZeUkKDI,Safari Live - Day 103 | Nat Geo Wild,1h 31m 59s,2018-02-08T16:27:26Z
in4NKrB5D8Q,Can Animals Be Creative? Pigcasso the Painting Pig is Making Her Case | Nat Geo Wild,1m 22s,2018-02-08T13:00:04Z
jztbUlGJkec,Safari Live - Day 102 | Nat Geo Wild,2h 30m 56s,2018-02-08T03:38:20Z
cAmZrdUApM8,Young Bonobos Play Airplane at Cincinnati Zoo | Nat Geo Wild,56s,2018-02-07T13:00:13Z
EJhyJuqNKCs,Orcas vs. Sperm Whales | Nat Geo Wild,1m 46s,2018-02-06T21:00:01Z
8OMPe5oGTfw,Elephant Rams Safari Vehicle Breaks Tusk | Nat Geo Wild,1m 42s,2018-02-06T13:00:00Z
haXDBo2kX6A,Safari Live - Day 101 | Nat Geo Wild,1h 38m 7s,2018-02-05T20:59:47Z
Xn4E_plJCp0,Watch an Unlikely Encounter Between a Sled Dog and a Polar Bear | Nat Geo Wild,1m 22s,2018-02-05T13:00:04Z
jEwvchX6t4w,The More Puppies The Better - Season 2 Episode 3 | Barnyard Babies with Dr. Pol,1m 16s,2018-02-04T17:00:04Z
CRYBZtBhpVw,This Jellyfish Contains an Ecosystem | Nat Geo Wild,1m 46s,2018-02-04T13:00:00Z
Melxo6eKgoA,See a Hidden Hammerhead Shark Nursery in the Galapagos | Nat Geo Wild,2m 52s,2018-02-03T17:00:02Z
08vxdjS5IZQ,What Giant Fangs This Viper Has | Untamed,1m 49s,2018-02-03T13:00:00Z
QLHH6WxbhV0,Even Tigers Must Battle For Food | Nat Geo Wild,1m 46s,2018-02-02T13:00:04Z
tKhWW1jK7vo,Playful Lion Cubs – Day 99 | Safari Live,1h 30m 24s,2018-02-01T16:13:08Z
QOalrx5khi4,For Golden Eagles Urine Shows Them the Way | Nat Geo Wild,1m 46s,2018-02-01T13:00:02Z
KjyxijrGfcI,Safari Live - Day 98 | Nat Geo WILD,49m 23s,2018-01-31T21:00:14Z
MXsZg1sQYvA,Narwhals: The Unicorns of the Sea! | Nat Geo WILD,2m 57s,2018-01-31T13:00:02Z
U-16eckVOZk,A Pistol of a Pony | The Incredible Dr. Pol,2m 39s,2018-01-30T17:00:02Z
oHA9oMkskHo,Rarely Seen Brazilian Dragon Mantis Filmed in Wild | Nat Geo Wild,2m 3s,2018-01-30T13:00:04Z
Rmww8Ej8yZM,Double the Lion Prides – Day 96 | Safari Live,1h 30m 7s,2018-01-29T21:00:01Z
9GFoNSXsvTY,Seeing a Family of Spots! – Day 97 | Safari Live,1h 28m 34s,2018-01-29T16:13:54Z
yCtQa5ajmpU,The 24-Hour Life of the Mayfly | Nat Geo Wild,1m 46s,2018-01-29T13:00:04Z
s-CS7z1CEN4,This One's For the Chicks - Season 2 Episode 2 | Barnyard Babies with Dr. Pol,1m 16s,2018-01-28T17:00:04Z
8mnSgHoGkTU,Safari Live - Day 100 | National Geographic,2h 31m 8s,2018-01-28T15:32:57Z
vDKmqLlPu-U,Rare Red Handfish Colony Discovered in Tasmania | Nat Geo Wild,1m 25s,2018-01-28T13:00:04Z
9p-DNmLRkzY,Pronghorn Face Modern Challenges | Nat Geo Wild,1m 46s,2018-01-27T17:00:02Z
w3VbesU853s,That's Certainly a Magnificent Hummingbird | Untamed,1m 43s,2018-01-27T13:00:04Z
kAUinh1NmL0,Croc v. Chopper | Monster Croc Wrangler,2m 8s,2018-01-26T21:00:02Z
2J8BUXV_VTk,Watch a Crabeater Seal Evade a Pod of Hungry Orcas | Nat Geo Wild,2m 22s,2018-01-26T17:00:01Z
AF-GUqiuRm8,Waiting For a Wolverine | Wolverine,3m 6s,2018-01-26T13:00:01Z
dmyNkKiikMg,Croc In The Mud | Monster Croc Wrangler,2m 16s,2018-01-25T17:00:07Z
Aw6GkiCvcWs,Elephants 101 | Nat Geo Wild,4m 59s,2018-01-25T13:00:01Z
vebS3__bEKM,Safari Live - Day 95 | Nat Geo Wild,1h 32m 4s,2018-01-24T20:59:50Z
skn-KEeGdxE,See the Cuttlefish's Incredible Offensive Strategy | Animal Fight Night,3m,2018-01-24T17:00:08Z
UZM9GpLXepU,Tool-Making Crows Are Even Smarter Than We Thought | Nat Geo Wild,2m 25s,2018-01-24T13:00:06Z
JdJCuh6aJBk,What Not To Do When Interacting With Monkeys | Nat Geo Wild,1m 47s,2018-01-23T21:00:00Z
MMgYTauL0-s,Watch Rescued Penguins Waddle Their Way to Freedom | Nat Geo Wild,1m 49s,2018-01-23T13:00:05Z
BWZln7In3Fw,A Doggone Cutie! | The Incredible Dr. Pol,2m 16s,2018-01-22T20:28:53Z
z5zK0RNVxzY,Safari Live - Day 94 | Nat Geo Wild,52m 7s,2018-01-22T16:20:21Z
DZea4l69dIU,Fight For the Right To Mate | Nat Geo Wild,1m 50s,2018-01-22T13:00:01Z
aUHbal6YJMY,Bonkers For Bunnies - Season 2 Episode 1 | Barnyard Babies with Dr. Pol,1m 16s,2018-01-21T17:00:01Z
gjWWZ9gRK6k,Watch a Tiger Shark Make a Meal of a Turtle | Nat Geo Wild,1m 46s,2018-01-21T13:00:03Z
CW8NUCPLE1c,The Mantis Shrimp Packs a Powerful Punch | Nat Geo Wild,1m 46s,2018-01-20T21:00:00Z
T57F0jmWMPM,Tiny Rats Have the Sniffles | The Incredible Dr. Pol,2m 27s,2018-01-20T17:00:02Z
En2NTF9zx6M,See a Frog and Its Tadpoles | Untamed,1m 43s,2018-01-20T13:00:01Z
rNrUFRYlsE8,Owl Be Hearing You | Planet of the Birds,3m 9s,2018-01-19T21:00:02Z
if_aifzvaT8,Tiny Rescued Antelope Makes an Unlikely Friend | Nat Geo Wild,1m 33s,2018-01-19T13:00:03Z
1Guifo5mxf4,Safari Live - Day 92 | Nat Geo WILD,1h 24m 48s,2018-01-18T20:59:56Z
gVfoyaUQEp4,Safari Live - Day 91 | Nat Geo Wild,1h 24m 5s,2018-01-17T20:59:48Z
o0WJOHGGoyk,Jellyfish: A Success Story | Nat Geo Wild,1m 54s,2018-01-17T17:00:03Z
4Ij5XKA9DL8,The 5 Musketeers Eat Together – Day 89 | Safari Live,1h 20m 21s,2018-01-16T15:00:25Z
zkfBk5oHGXk,Elephants Take a Swim Break – Day 90 | Safari Live,1h 26m 59s,2018-01-15T16:16:25Z
IZiERu3UFoM,See 'Frozen' Alligators Breathing Through Ice to Survive | Nat Geo Wild,1m 32s,2018-01-15T13:00:05Z
SuHMhCgBaso,Safari Live - Day 93 | National Geographic,1h 16m 16s,2018-01-14T15:30:32Z
reHaY3Ml5pw,Spellbinding Jellyfish Spotted in Rare Deep Sea Footage | Nat Geo Wild,51s,2018-01-14T13:00:05Z
DNKoh8aVRNo,The Caterpillar That Looks Like a Snake | Untamed,1m 49s,2018-01-13T13:00:01Z
IhzLLCHts6Q,A Leopard Duel Means a Bloody Battle | Animal Fight Night,2m 23s,2018-01-12T17:00:03Z
HR8Vs4HylBU,We’re Seeing Spot Today – Day 88 | Safari Live,1h 26m 6s,2018-01-11T20:59:49Z
756x161KT1U,Why Is This Arctic Fox 'Dancing With a Snowy Owl? | Nat Geo Wild,1m 34s,2018-01-11T13:00:00Z
p8H5ixHT5kY,James Tracks a Leopard – Day 87 | Safari Live,1h 32m 39s,2018-01-10T16:19:25Z
HgHjG-q8QV8,Watch as a Baby Elephant Gets a Helping Hand | Nat Geo Wild,1m 46s,2018-01-10T13:00:01Z
93YNE1EBrPo,Moose v. Moose: The Battle For Love | Animal Fight Night,2m 28s,2018-01-09T17:00:00Z
hSq11LV4q0o,Introducing a New Baby Elephant – Day 85 | Safari Live,1h 31m 6s,2018-01-08T21:00:10Z
dKbbkIiQu2Y,Safari Live - Day 86 | Nat Geo WILD,1h 11m 17s,2018-01-08T16:08:59Z
_kOkfFJGBr4,Ugly Cute' Baby Aardvark Takes its First Steps | Nat Geo Wild,1m 45s,2018-01-08T13:00:04Z
fGpamcNFSTU,This Mongolian Wolf Family Struggles to Survive | Nat Geo Wild,1m 57s,2018-01-07T13:00:05Z
DcZdMmrBBS8,Fixing Doc the Horse | The Incredible Dr. Pol,3m 2s,2018-01-06T17:00:00Z
