Video ID,Title,Length,Published,Region Restriction Count
IYiYqgJE0JQ,Cold Turkey | Vet School,2m 43s,2015-11-02T18:00:00Z
hHafxLQ1ORI,Great White Predator | Deadly Instincts,2m 32s,2015-11-02T15:00:02Z
DaH0ivM-JXI,Animal Update - Bonzai the Parakeet | Dr. K's Exotic Animal ER,2m 22s,2015-11-01T15:00:01Z
6GmgwKGsgtY,Battle of the Sexes | Deadly Instincts,2m 35s,2015-10-29T15:00:01Z
4fGmHPmZzPQ,Race to Victory | Vet School,2m 43s,2015-10-28T17:00:00Z
q51xG5oAdgA,Macho's Sticky Situation | Dr. K's Exotic Animal ER,3m 56s,2015-10-28T14:00:01Z
UiQQh-9EvPA,Protect the Bloodline | Deadly Instincts,3m 1s,2015-10-27T17:00:03Z
_R86PmoGMCY,Alpaca Spit Fire | Vet School,3m 8s,2015-10-27T14:00:01Z
Ic0035ODH-c,Mamba Shakedown | Snake City,2m 49s,2015-10-26T17:00:00Z
UjFUswIIu5U,Bunny Bonding Camp | Dr. K's Exotic Animal ER,2m 14s,2015-10-26T14:00:03Z
4HJWURu5V_A,Animal Update - Cindy and Trixie | Dr. K's Exotic Animal ER,2m 26s,2015-10-25T17:00:01Z
G14zpbTupK8,Happy Tails - Bentley the Bulldog | Vet School,1m 31s,2015-10-25T17:00:01Z
U4kzK8l8NGo,Spirit-Filled Snake | Snake City,3m 33s,2015-10-24T14:00:00Z
aeiGE15TjVM,Egg-Bound Turtle | Dr. K's Exotic Animal ER,1m 42s,2015-10-23T14:00:01Z
h5_QMXMKKoo,Horses Gone Wild | Africa's Wild West,3m 7s,2015-10-22T16:00:00Z
AfdLnRCQixw,Lovesick Mantis Homicide | Deadly Instincts,1m 44s,2015-10-22T14:00:01Z
BQR_LRQmRt0,Race Against Time | Vet School,1m 54s,2015-10-21T14:00:00Z
a1IXcDGuRno,Elephant Seal Sex | Deadly Instincts,2m 26s,2015-10-20T16:00:01Z
ltb6oROzSyk,Casualties of the Desert | Africa's Wild West,2m 37s,2015-10-20T16:00:01Z
FFwPf_Norvk,Hold Your Horse’s Tongue | Vet School,2m 31s,2015-10-20T14:00:00Z
Hh_CBeh977w,Massive Python Rescue | Snake City,2m 15s,2015-10-19T17:00:00Z
t0l71ovL-vk,Snake City | Dr. K's Exotic Animal ER,2m 12s,2015-10-19T14:00:01Z
ksAiNQeDAFk,Animal Update - Shelby the Chinchilla | Dr. K's Exotic Animal ER,2m 1s,2015-10-18T12:46:49Z
ReYU3Z0CWck,Meerkat vs. Jackal | Little Killers,2m 12s,2015-10-17T15:00:01Z
s4Yt3iBSL50,Ornery Spitting Cobra | Snake City,4m 7s,2015-10-17T14:00:01Z
52fuxKM2uBY,There's a Fox in the Goose House | Little Killers,2m 21s,2015-10-16T18:20:45Z
KhVEm5ak-xs,Grizzly Bear Fight Club | Deadly Instincts,2m,2015-10-15T14:00:00Z
ivpW7Aq0T-M,Diva Pig Conference Call | Dr. K's Exotic Animal ER,2m 16s,2015-10-14T17:00:01Z
myXdQCmTIX0,From the Horse’s Mouth | Vet School,2m,2015-10-14T14:00:01Z
gexJ6X1v4p4,Green Snake Identification | Snake City,4m 2s,2015-10-13T16:00:02Z
r52jxvdmhp4,If You Give a Puppy Peanut Butter… | Vet School,2m 42s,2015-10-13T14:00:01Z
Kb1shPzf1nM,Lion vs. Wildebeest | Deadly Instincts,2m 22s,2015-10-12T18:00:00Z
VEfzIbwBjGg,Happy Tails - Coming up Rosey | Vet School,2m 48s,2015-10-12T17:00:01Z
BMRNMckSPM8,Animal Update - Kirby the Chinchilla | Dr. K's Exotic Animal ER,2m 45s,2015-10-12T16:17:11Z
S2Ev26eQwNM,Lump Humps and Bumps | Dr. K's Exotic Animal ER,2m 10s,2015-10-12T14:00:00Z
GYr0wOZ-uCE,Forest Cobra Capture | Snake City,4m 4s,2015-10-10T16:00:00Z
p3joMdsAzqw,Chameleon Killer Tactics | Deadly Instincts,1m 59s,2015-10-08T20:00:00Z
GB7I81ensTQ,Dangerous Drink | Vet School,1m 53s,2015-10-08T17:00:01Z
agsecQTJy3s,Humongosaur the Bearded Dragon | Dr. K's Exotic Animal ER,2m 31s,2015-10-07T14:00:01Z
XT45LVeVZJw,Reporting for Dairy Duty | Vet School,3m 3s,2015-10-06T17:00:01Z
X4Ue5OTbnGU,Loveable Lovebird | Dr. K's Exotic Animal ER,2m 35s,2015-10-05T14:00:02Z
XYhINu3VrSk,Animal Update - Lacey the Chicken | Dr. K's Exotic Animal ER,2m 15s,2015-10-04T14:37:56Z
LC2k_sjj48o,Happy Tails - Cancer Free Sebastian | Vet School,2m 44s,2015-10-04T14:30:00Z
EsR_eKedf6Q,Monkey the Smelly Pig | Dr. K's Exotic Animal ER,1m 32s,2015-10-01T14:00:00Z
OKssQZ08zcc,Eye Exam Struggles | Vet School,1m 53s,2015-09-30T16:00:01Z
0hJTBIJbLfE,Tyrannical Naked Mole Mommy | World's Weirdest,2m 36s,2015-09-30T14:00:00Z
WNDI7S4yhSs,Animal Update: Fox Farms | The Incredible Dr. Pol,2m 17s,2015-09-30T14:00:00Z
1l1K79zgaVE,A Hairy Situation | Dr. K's Exotic Animal ER,3m 3s,2015-09-29T18:00:01Z
qOd9Qvt3vc0,Polments: Crew Games | The Incredible Dr. Pol,1m 19s,2015-09-29T14:00:01Z
BtqY9kxS4SA,Happy Tails - Millie the Bulldog | Vet School,2m 42s,2015-09-28T17:00:00Z
Nws018MTP2E,Examining a Donkey's Mouth | Vet School,1m 55s,2015-09-28T16:00:01Z
OkXVQi6DYeo,Bull's-eye! - Season 2 Episode 10 | Coffee Break With Dr. Pol,2m 58s,2015-09-28T14:00:00Z
KMy0pIdu-FM,Murderous Siblings | World's Weirdest,2m 22s,2015-09-27T14:00:00Z
06HNLFd0Q_4,Polments: Bucket List | The Incredible Dr. Pol,2m 39s,2015-09-24T18:00:00Z
hBfNAu17pfg,A Tough Lesson For a Seal Pup | Land of 10,000 Grizzlies,2m 51s,2015-09-24T16:00:02Z
_6WWOTRsmLs,Jeep No More | The Incredible Dr. Pol,1m 52s,2015-09-24T14:00:00Z
8vQAQLnwZl8,Master Predators of the Sea | Land of 10,000 Grizzlies,2m 27s,2015-09-23T19:00:00Z
CV_-yKd0--Q,Lesson #1: The Hand Washing Dance | Vet School,1m 46s,2015-09-23T17:00:00Z
oixkyxZ5mzc,Great White Migrations | World's Weirdest,3m 29s,2015-09-23T16:00:03Z
MTl09_RMYRw,An Ear Full of Problems | The Incredible Dr. Pol,2m 33s,2015-09-23T14:00:01Z
cz_CqC7P_zs,Baby Calf on the Upswing | Vet School,1m 57s,2015-09-22T17:00:01Z
pp3daW760nY,Dr. K's Exotic Animal ER - Trailer | Dr. K's Exotic Animal ER,31s,2015-09-21T19:21:21Z
RTPcrweHUZI,Happy Tails - Stray Kitten Goes Home | Vet School,1m 48s,2015-09-21T17:00:01Z
zsC61g36EqM,Breaching Basking Sharks | World's Weirdest,2m 8s,2015-09-21T16:00:01Z
I1wVIwa2Ihw,Large and In Charge - Season 2 Episode 9 | Coffee Break With Dr. Pol,2m 55s,2015-09-21T14:00:00Z
uNqXZ8Lexy8,We Are Alive! | Behind Russia's Frozen Curtain,3m 24s,2015-09-17T16:00:01Z
IBBBAuV0bqM,Into the Wormhole | The Incredible Dr. Pol,2m 33s,2015-09-17T14:00:00Z
6K5o4jALPnA,Dog Restraint Playtime | Vet School,2m 17s,2015-09-16T17:00:00Z
iVxayoY604Y,Meet Bird Yuri | Behind Russia's Frozen Curtain,2m 35s,2015-09-16T16:00:02Z
K_EvGZyNnpw,Tiny Balls of Fire | World's Weirdest,2m 57s,2015-09-16T16:00:00Z
IgTPgIpk7SM,Cured Hammy | The Incredible Dr. Pol,1m 50s,2015-09-16T14:00:00Z
fsqAvWQqMfc,Polments: Dr. Pol's Crew | The Incredible Dr. Pol,1m 25s,2015-09-15T14:00:02Z
vNhORnwcQcU,Anemone Killer Fish Traps | World's Weirdest,3m 1s,2015-09-14T18:00:03Z
SKZSYv4NAHw,Singen Learns the Four A's of Fracture Repair | Vet School,2m 18s,2015-09-14T17:00:04Z
YidO56yN7DU,Animal Update: Fluffy the Cat | The Incredible Dr. Pol,2m 3s,2015-09-14T14:00:00Z
5pyVY5tbQO8,Bats' Desert Fruit Feast | Wings of Life,3m 25s,2015-09-10T18:00:00Z
flJu1ZojguU,Protective Ninja Frog | Wonderfully Weird,1m 51s,2015-09-10T16:00:04Z
X4i4zhOAdy8,Feisty Squealer | The Incredible Dr. Pol,2m 58s,2015-09-10T14:00:01Z
BDujhzv8Xp8,Unleash the Hammer Claws! | Wonderfully Weird,1m 10s,2015-09-09T18:00:01Z
vGj3XJjPIuU,Underground Survivalist Fish | World's Weirdest,2m 32s,2015-09-09T16:00:02Z
1qe5tFNrhpU,Maverick the Jousting Horse | The Incredible Dr. Pol,2m 38s,2015-09-09T14:00:00Z
_uHJGdTgtXE,An Orchid’s Trap | Wings of Life,4m,2015-09-08T18:00:02Z
3ZYYlqKbV9I,Polments: Stinky Hands | The Incredible Dr. Pol,2m 18s,2015-09-08T14:00:00Z
U9Vj_GQFGHQ,Living Dead Frogs | World's Weirdest,2m 35s,2015-09-07T16:00:03Z
I8DepNhxQ24,Must Love Cats - Season 2 Episode 7 | Coffee Break With Dr. Pol,2m 56s,2015-09-06T14:00:01Z
uptWk44z8LA,Rally the Herd Elephant PSA Contest | Nat Geo Wild,30s,2015-09-04T17:14:26Z
uSQ_QkuB_hQ,A Lion Family's Successful Day | Boteti: The Savage River,3m 3s,2015-09-03T14:00:03Z
pnoP87FovQU,Princess in Peril | The Incredible Dr. Pol,2m 56s,2015-09-03T14:00:02Z
pQVnxH28cTQ,Peacock Daddy-To-Be | The Incredible Dr. Pol,1m 32s,2015-09-02T14:00:02Z
sDzLI8dxlGM,Dry Times Along the Boteti River | Boteti: The Savage River,2m 30s,2015-09-02T14:00:01Z
FddP1em0h2k,Animal Update: KC the Horse | The Incredible Dr. Pol,2m 30s,2015-08-31T14:00:00Z
H3AjeN8Leok,Reaching Deep - Season 2 Episode 6 | Coffee Break With Dr. Pol,2m 56s,2015-08-30T14:00:00Z
GHgwyhQE51w,Doc’s Day Off! | The Incredible Dr. Pol,1m 14s,2015-08-27T14:00:01Z
1QRnKbdIm6Y,Sticky Situation | The Incredible Dr. Pol,2m 28s,2015-08-26T14:00:00Z
-cwud4cSZkg,Polments: Pawmost Famous | The Incredible Dr. Pol,1m 36s,2015-08-25T13:00:00Z
L-rxt-zagoE,Animal Update: Matilda the Cat | The Incredible Dr. Pol,2m 23s,2015-08-24T13:00:00Z
_-Ckkrg3BA4,Pol's Menagerie - Season 2 Episode 5 | Coffee Break With Dr. Pol,2m 48s,2015-08-23T13:00:00Z
tuYQSnbd8Us,Black Vulture Gourmet of Corpses | River Fox,3m 22s,2015-08-20T17:00:02Z
vth2BMFrJaI,Colorless Cave Dwellers | Alpine Underworld,2m 12s,2015-08-20T14:00:02Z
Dx27vn9Hzmo,Shoo Fly Kitty | The Incredible Dr. Pol,3m 30s,2015-08-20T14:00:01Z
zxNp6MMVXUU,Sibling Rivalry to the Death | River Fox,1m 21s,2015-08-19T17:00:01Z
iHuycKwHgbk,Kiwi’s Last Call | The Incredible Dr. Pol,1m 36s,2015-08-19T14:00:02Z
BWNnRhxvUxM,Group Fish Mating | Alpine Underworld,1m 19s,2015-08-18T16:00:00Z
6Dkq2RmuX6I,Polments: A Very Special Visit | The Incredible Dr. Pol,2m 36s,2015-08-18T13:00:00Z
4beJVa3KDt8,Animal Update: Eeyore the... Cow? | The Incredible Dr. Pol,2m 26s,2015-08-17T13:00:00Z
_OxmgHfBYyk,Yes Dear - Season 2 Episode 4 | Coffee Break With Dr. Pol,2m 53s,2015-08-15T13:00:00Z
TE1tM7fJs1s,Cherokee's Twist of Fate | The Incredible Dr. Pol,2m 19s,2015-08-12T14:00:01Z
-E4AxIe_p3k,Polments: Ready for the Rodeo | The Incredible Dr. Pol,2m 33s,2015-08-11T13:00:01Z
HGRoWKqD828,Eeyore’s Nose Piercing | The Incredible Dr. Pol,3m 35s,2015-08-10T14:00:00Z
45_5_-zQHt0,Animal Update: Allie the Dog | The Incredible Dr. Pol,2m 2s,2015-08-10T13:00:00Z
uktFPUavXqs,The Goat Whisperer - Season 2 Episode 3 | Coffee Break With Dr. Pol,2m 48s,2015-08-09T13:00:03Z
-5FgUTtQMcU,A Duel in the Branches | Lemur Island,2m 42s,2015-08-06T14:00:00Z
BNfJUnxmRf0,Dr. Pol Fair-Thee-Well | The Incredible Dr. Pol,2m 43s,2015-08-05T16:00:01Z
c-lwrvizc_M,Aces of Agility | Lemur Island,2m 47s,2015-08-04T14:00:01Z
AeP-41EQdc0,Hookin’ Horse Teeth | The Incredible Dr. Pol,2m 28s,2015-08-03T16:00:00Z
oL7W8T7QZIY,Animal Update: Twinkles the Pig | The Incredible Dr. Pol,2m 20s,2015-08-02T14:00:02Z
IxJIFde42aY,Steer Clear - Season 2 Episode 2 | Coffee Break With Dr. Pol,3m,2015-08-01T14:00:01Z
ZrkwnSpiIcE,Parasitic Baby Goat | The Incredible Dr. Pol,2m 51s,2015-07-27T17:00:01Z
CuLhcQBhqsg,Prolapse Piggy | The Incredible Dr. Pol,3m 19s,2015-07-27T17:00:00Z
gheDoSW4sHI,It's Time for a Refill - Season 2 Episode 1 | Coffee Break With Dr. Pol,2m 57s,2015-07-26T01:00:01Z
9ZSVl2KC998,Mischievous Monkeys | Clever Monkeys,1m 42s,2015-07-24T15:19:53Z
eby7D5dHh7I,Bad Neighbors | Clever Monkeys,1m 31s,2015-07-24T15:09:28Z
brl6FSnWrSM,Polments: Fans Old and New | The Incredible Dr. Pol,1m 46s,2015-07-23T16:00:01Z
ND3fqr05zc0,Rabies Scare | The Incredible Dr. Pol,2m 9s,2015-07-22T13:00:01Z
-yk_YNfwENs,Pups or Pyometra? | The Incredible Dr. Pol,2m 36s,2015-07-20T13:00:00Z
hg9WoCwrB10,Bigger is Better | Brazil,1m 17s,2015-07-18T15:00:01Z
y_U3mmPZLJM,Welcome to Snake Island | Brazil,2m 9s,2015-07-17T19:00:02Z
_XWqOVlIZ40,Bugs Light the Night | Brazil,1m 31s,2015-07-17T15:00:02Z
icd_ob8UWgQ,Amazingly Intelligent Monkeys | Brazil,3m 22s,2015-07-16T19:00:04Z
z0eIeUz9NCc,Official Preview | The Incredible Dr. Pol,31s,2015-07-13T16:22:33Z
UE_mElhwpXU,SharkFest's Shark on the Street: Facts Are Fun | Sharkfest,2m 5s,2015-07-09T15:00:01Z
5vWchcbtrxk,Meet SharkFest's Shark on the Street | Sharkfest,1m 56s,2015-07-09T00:24:55Z
4AakcqFzcu8,The Life of a Bee Eater | Real Angry Birds,1m 43s,2015-07-08T14:00:01Z
c2yffE4cQN8,Bird vs. Lizard | Real Angry Birds,2m 38s,2015-07-07T14:00:00Z
j783M2oQJVk,Shark Chant | SharkFest,1m 48s,2015-07-04T17:00:01Z
ck-80DXQMXc,North Carolina Shark Frenzy | SharkFest,2m 59s,2015-07-03T17:00:02Z
fM2hkndTZmM,Swimming with Sharks - Deleted Scene | SharkFest,3m 35s,2015-07-03T14:00:02Z
ySe48tabRYs,Tiger Shark Attack | SharkFest,3m 12s,2015-07-02T17:00:02Z
JFBIMWw7z6E,Caught in the Bait Ball | SharkFest,1m 22s,2015-07-02T14:00:01Z
g_lmZiLZYf0,Gauntlet of Sharks | SharkFest,2m 11s,2015-07-01T14:00:02Z
XthRytxUEB4,Battle in the Bait Ball | SharkFest,3m 3s,2015-06-30T16:00:03Z
0NXrtAQbdR8,Happy SharkFest! | Sharkfest,1m 1s,2015-06-29T16:00:01Z
8zvISyqMalg,A Hunter Becomes the Hunted | Cobra Mafia,1m 44s,2015-06-26T17:00:01Z
7ZGx8iQbj4A,Make Way for the King | Cobra Mafia,2m 40s,2015-06-24T17:00:00Z
UVzrQI56sKI,SharkFest 2015 | Sharkfest,1m 5s,2015-06-23T19:54:05Z
FOdMsIsmKqw,Showing a Little Leg | Brazil,1m 41s,2015-06-20T20:00:00Z
s1a6rFcLZJY,Curious Coatis | Brazil,2m 24s,2015-06-20T17:00:01Z
NrAQc-ym6gA,Good Vibrations | Brazil,2m 55s,2015-06-20T14:00:00Z
zY2nlgXhWm8,A Whole L'Otter Courage | Brazil,2m,2015-06-19T20:00:01Z
29nJHk-V-JI,Flying Fish | Brazil,1m 50s,2015-06-19T16:00:01Z
eZiReWItEug,Keen-Eyed Killer | Brazil,1m 40s,2015-06-19T14:00:02Z
KyhP1Ag3kgU,A Real Tough Guy | Wild 24,1m 47s,2015-06-16T22:00:01Z
6eS5X_SpweQ,Showdown at Night | Wild 24,2m 15s,2015-06-16T20:43:42Z
zsvtyeXmr4w,Survival Experts | Wild 24,2m 17s,2015-06-16T13:00:04Z
oWc0irykBo8,When Seals Attack | Wild 24,2m 28s,2015-06-15T20:00:01Z
Z3V61kzGTxk,Meet the Echidna | Wild 24,1m 16s,2015-06-15T18:00:03Z
41m3IQ_rDB4,Beauties & Beasts | Wild 24,2m 14s,2015-06-15T16:00:00Z
SWXKSEtsomE,Pitch Black Prey Challenge | Are You Smarter Than...,3m 57s,2015-05-18T14:58:20Z
3A8C3Tp6xJw,Teaching Jumpy Tricks - Deleted Scene | BarkFest,55s,2015-05-14T16:00:01Z
-TJKr3YSjAU,Smart Dog Profile: Chaser | BarkFest,1m 39s,2015-05-11T14:57:20Z
xp8gKyJKvw8,Case File Pupdate: Lexie Jane | Cesar 911,2m 32s,2015-05-09T02:00:02Z
E5RvfQo9_Yg,Top 3 Underdogs | BarkFest,3m 30s,2015-05-08T14:00:00Z
WL4aiLNqMZc,Frolicking Baby Guanacos | Extreme Survivors,2m 2s,2015-05-07T14:00:05Z
ILUOqc8omlI,Top 3 Super Dogs | BarkFest,3m 37s,2015-05-07T14:00:01Z
480ZdYW8HvM,Case File Pupdate: Isaboo | Cesar 911,2m 24s,2015-05-07T12:00:01Z
MLI6KlbSYXY,Case File Pupdate: Stella | Cesar 911,2m 49s,2015-05-06T23:00:00Z
zFFr-RExQ5o,Case File Pupdate: Chloe | Cesar 911,2m 5s,2015-05-06T20:54:01Z
I8_g1R2cInA,Cuteness Overload | BarkFest,1m 3s,2015-05-05T14:00:00Z
dWWTKuYsOFs,BarkFest - Trailer | Barkfest,31s,2015-05-01T16:03:30Z
uUgOPeAcmYo,Smart Dog Profile: Diesel | BarkFest,46s,2015-05-01T15:21:38Z
tUbwnzNY54w,Top 5: Service Dogs | BarkFest,4m 51s,2015-04-29T15:27:30Z
mqEDoh5KgLU,Smart Dog Profile: Kyle | BarkFest,46s,2015-04-29T13:43:31Z
NAgGCNHQUI0,Deleted Scene: Chicken Coop Conditioning | Cesar 911,2m 7s,2015-04-18T02:00:00Z
uFz6GFyRqys,Mini Bull | Aloha Vet,3m 7s,2015-04-13T15:44:10Z
i3m6YDasiAQ,Case File Pupdate: Caper | Cesar 911,2m 58s,2015-04-11T02:00:00Z
jPy_409iZ6g,Case File Pupdate: Roxy | Cesar 911,2m 33s,2015-04-11T02:00:00Z
Q_dBgSQ1PSA,Aloha Extras: Aunt Patty's Farm | Aloha Vet,2m 17s,2015-04-09T02:00:00Z
GV1ms8Zx19Q,Milo the Surfing Dog | Aloha Vet,2m 6s,2015-04-08T15:00:00Z
eWKfctG7HNo,Case File Pupdate: Levi and Phoebe | Cesar 911,2m 59s,2015-04-04T02:00:00Z
WmJkO31u5VQ,Case File: Pixie and Poppy | Cesar 911,1m 51s,2015-04-02T20:01:31Z
lEwA3GtJjJ8,Case File: Levi and Phoebe | Cesar 911,2m 25s,2015-04-02T20:01:11Z
Uw60MCF4mMI,Deleted Scene: Vada at Cesar's Dog Park | Cesar 911,1m 34s,2015-04-02T19:47:24Z
mh5OI1k_I8w,Deleted Scene: Diane and her Poodle Pack | Cesar 911,2m 48s,2015-04-02T18:29:33Z
1hKQuHgyCo8,Case File: Chloe | Cesar 911,2m 26s,2015-04-02T15:37:06Z
cs0SPcKu_9E,Everything You Didn't Know About Animals | Nat Geo Wild,33s,2015-03-30T14:40:11Z
sRdj6alt8bo,Aloha Extras: Shark Research Day | Aloha Vet,3m 50s,2015-03-29T02:00:01Z
E83AL0DqX0o,Aloha Extras: Christmas the Cow Prognosis Aloha Vet,2m 1s,2015-03-29T02:00:00Z
pfNct6mXx1k,A Day in the Life of Dr. Scott Sims | Aloha Vet,2m 7s,2015-03-26T21:22:43Z
7l25qmZZgBE,Case File Pupdate: Vada | Cesar 911,2m 37s,2015-03-21T02:00:01Z
-R24aJa4RsA,Lame Horse Emergency | Aloha Vet,3m 9s,2015-03-20T23:31:55Z
fyRVtO-sRrE,Dia's Disturbed Rescue Parrot | Aloha Vet,2m 55s,2015-03-20T23:30:16Z
_3GDdarhP8Q,Meet the Barefoot Vet | Aloha Vet,2m 24s,2015-03-20T23:28:01Z
YPdnKO9c28U,Aloha Extras: Talking to the Animals | Aloha Vet,1m 1s,2015-03-20T23:22:20Z
xzgQvWaC74U,Aloha Extras: Vet Roadside Assistance | Aloha Vet,1m 21s,2015-03-20T23:21:45Z
NckL5sS0Tc0,Official Trailer | Aloha Vet,33s,2015-03-20T23:18:38Z
G0C-x_HSPfs,Case File Pupdate: Savannah | Cesar 911,2m 28s,2015-03-19T18:51:31Z
JHwM_O99CKo,Case File Pupdate: Gunny | Cesar 911,2m 45s,2015-03-19T18:47:39Z
qfTZv1g6GOM,Case File Pupdate: Opal | Cesar 911,2m 39s,2015-03-19T18:45:46Z
owmE2i78B14,Sweet Revenge | Bumblebees | Bumblebees,2m 48s,2015-03-18T20:03:46Z
d9zKi4EQ7x8,Case File: Toby | Cesar 911,2m 25s,2015-03-17T18:00:02Z
xaisueAUjPI,Case File: Vada | Cesar 911,2m 4s,2015-03-16T18:00:04Z
Pg18kKZb_iM,33 Years With the Doc - Client Tales | The Incredible Dr. Pol,2m 32s,2015-03-16T14:00:01Z
uS34W7CNrNg,That's a Wrap! - Episode 10 | Coffee Break With Dr. Pol,3m 17s,2015-03-15T14:00:01Z
IjDgYgEvxCE,Deleted Scene: Joy and Jim's Saved Marriage | Cesar 911,1m 24s,2015-03-14T02:00:00Z
nf5Kd6xaHPo,Aloha Vet,31s,2015-03-12T14:29:03Z
03vWngbKHwI,Bushel Basket Calf | The Incredible Dr. Pol,2m 8s,2015-03-09T17:00:00Z
aKmWFgKZnkc,Case File: Gunny and Bastian | Cesar 911,3m,2015-03-08T18:00:01Z
VLQHjt83krg,A Horse of Another Color | The Incredible Dr. Pol,3m 37s,2015-03-08T17:00:01Z
6cCt1df4MAg,Racing Chickens - Episode 9 | Coffee Break With Dr. Pol,3m,2015-03-08T14:00:01Z
pEQETlbg9B0,Case File: Savannah | Cesar 911,2m 38s,2015-03-04T17:00:01Z
yU7KyCVSC7k,Case File: Buttons and Princess | Cesar 911,2m,2015-03-03T17:00:06Z
2oxAgDnjk8M,The Trouble with Barking Dogs | Cesar 911,1m 31s,2015-03-02T17:00:02Z
NR4JYGUdbWE,The Cutest Flying Rodent | Super Squirrel,2m 58s,2015-03-02T15:00:00Z
q-iqB2bxsRQ,It's a Dirty Job - Episode 8 | Coffee Break With Dr. Pol,3m 4s,2015-03-01T15:00:06Z
Lxfbdfw5oms,Opposites Attract | Unlikely Animal Friends,2m 11s,2015-02-25T19:00:01Z
MnUNrElSDak,Rolling with the Chicks | Unlikely Animal Friends,3m 5s,2015-02-25T00:33:04Z
JAOXMkdrGiM,Let's Do This! - Episode 7 | Coffee Break With Dr. Pol,2m 42s,2015-02-22T15:00:30Z
tS-iiWhykOQ,Deleted Scene - Fury Friends | Cesar Millan: Viva Las Vegas,1m 42s,2015-02-20T20:00:01Z
l5KLwZsrelw,Learning to Nurture the Right Behavior | Cesar Millan,2m 34s,2015-02-19T20:00:00Z
FYllYheqVlM,Live Trailer | Cesar Millan: Viva Las Vegas,1m 22s,2015-02-19T15:58:44Z
UHnNAToSDKc,Cesar 911,31s,2015-02-18T20:33:59Z
WT195aL2iX0,Fawn’s Feeble Calves | The Incredible Dr. Pol,2m 12s,2015-02-18T15:00:06Z
NeL1WNq-GK8,Dr. Pol Client Tales: Popeye the Rabbit | The Incredible Dr. Pol,2m 36s,2015-02-16T20:04:54Z
q0C8TI1Qv3Q,Penelope Peahen | The Incredible Dr. Pol,1m 38s,2015-02-15T19:00:01Z
3zTvMWo021k,Up With the Chickens - Episode 6 | Coffee Break With Dr. Pol,2m 43s,2015-02-15T15:00:01Z
PN7e93MpjQA,Dr. Pol Client Tales: Smoke the Pig | The Incredible Dr. Pol,2m 40s,2015-02-10T15:00:00Z
TUykXoyn9Fw,Polments: You Rock | The Incredible Dr. Pol,59s,2015-02-09T15:00:00Z
SxqGPa9i4bQ,Farm Call Capers - Episode 5 | Coffee Break With Dr. Pol,3m 17s,2015-02-08T15:00:01Z
mEmDUpQ_PGw,Polments: Puppy Time | The Incredible Dr. Pol,1m 35s,2015-02-05T22:14:10Z
PCPPgY31ZI0,Releasing a Recovered Squirrel | Bandit Patrol,3m 7s,2015-02-03T15:00:00Z
mRVQPiVhl80,Urgent Deer Call | Bandit Patrol,1m 13s,2015-02-02T15:00:01Z
6evy9aLCCwU,Double Dutch - Episode 4 | Coffee Break With Dr. Pol,2m 22s,2015-02-01T15:00:01Z
A0950parNkQ,Behind The Scenes | Fish Bowl 2,1m 59s,2015-01-29T19:29:34Z
MG3lO58EYKs,Dr. Pol Client Tales: Melissa Croll | The Incredible Dr. Pol,2m 39s,2015-01-28T18:10:41Z
4n55vylzI_Y,Holy Lamb Hock! | The Incredible Dr. Pol,2m 49s,2015-01-28T15:00:03Z
DITpYyfxjcI,Old “McCharles” on the Farm! | The Incredible Dr. Pol,1m 43s,2015-01-27T15:00:12Z
kQIZbJ7QlyQ,Playing Favorites - Epsiode 3 | Coffee Break With Dr. Pol,3m 22s,2015-01-25T15:00:17Z
EjvLOAIxbNQ,Hercules Beetle Battle | Wild Costa Rica,1m 50s,2015-01-20T20:00:05Z
1Pt4eauzjGY,What’s Up Doc? | The Incredible Dr. Pol,2m 22s,2015-01-20T19:00:07Z
7EJlZKitj7E,Sea Turtle Nesting Grounds | Wild Costa Rica,1m 53s,2015-01-19T20:00:13Z
dAQHWsgnJtQ,Polments: Gone Vintage | The Incredible Dr. Pol,1m 33s,2015-01-19T16:00:14Z
y783he7FVgI,Dr. Pol Client Tales: Shirley the Pig | The Incredible Dr. Pol,2m 16s,2015-01-18T16:00:10Z
yqqMYR-jrE8,Bum Rushed - Episode 2 | Coffee Break With Dr. Pol,2m 42s,2015-01-18T15:00:04Z
ToWuYg-i_7U,Doc Emily the Newbie | The Incredible Dr. Pol,3m 28s,2015-01-17T15:00:07Z
_xw_U5a8UJ4,Dr. Pol Client Tales: House Farms | The Incredible Dr. Pol,2m 28s,2015-01-12T15:00:16Z
S3-mPnnB_ZI,Dr. Pol's Premiere Party | The Incredible Dr. Pol,1m 47s,2015-01-11T16:00:00Z
EptHsqb8kTA,Coffee Coffee Coffee - Episode 1 | Coffee Break With Dr. Pol,2m 35s,2015-01-11T15:00:04Z
VzH8cgO4LJI,Dr. Pol Unplugs Storm | The Incredible Dr. Pol,3m 21s,2015-01-03T21:00:07Z
8HTlzcMK9kE,Jules’ Problem Pregnancy | The Incredible Dr. Pol,3m 8s,2015-01-02T21:00:06Z
TCrzE-bBt88,Who's the Bunny's Daddy? | Dr. Oakley Yukon Vet,4m 9s,2014-12-27T23:00:06Z
edN3tfsNcOc,Gimpy the Duck | Dr. Oakley Yukon Vet,3m 45s,2014-12-27T15:00:02Z
LIYIwgBLdxI,Behind the Scenes with The Incredible Dr. Pol,2m 41s,2014-12-22T21:42:10Z
PSZQdzgSrMg,The Porcupine Dentist | Dr. Oakley Yukon Vet,2m,2014-12-21T15:00:09Z
aBC8Ilpb6lY,Moose Mamas | Dr. Oakley Yukon Vet,3m 34s,2014-12-20T15:00:16Z
PWGvATgzwjE,High Flying Monkeys | World's Deadliest,2m 23s,2014-12-17T21:00:05Z
Xt2FthcLYj4,Oakley Road Show | Dr. Oakley Yukon Vet,2m 22s,2014-12-17T19:00:05Z
0VU_T41x-xA,Deadly Disguised Orchids | World's Deadliest,2m 23s,2014-12-16T21:00:05Z
X0QvJWDEdME,Wild Horse Corral | Dr. Oakley Yukon Vet,3m 20s,2014-12-16T19:00:08Z
mQ8cim4Bv7s,Deadly Sibling Infighting | World's Deadliest,2m,2014-12-08T22:46:46Z
xLltcVlEO6U,Safari Live: Lions Hunt Down a Buffalo | Nat Geo Wild,2m 45s,2014-12-04T23:03:13Z
HN_RyK1nC8I,Meet the Tiger Family | Tiger Wars,2m 38s,2014-11-26T18:00:09Z
w0gwlMFhIhs,Wildebeest Puke | Man v. Lion,1m 6s,2014-11-26T15:42:22Z
5Z56zFyqogk,The Future of Big Cats | Future Cat,2m 59s,2014-11-24T17:00:02Z
w_NwYcpQ6Io,Behind the Scenes | Man v. Lion,1m 21s,2014-11-23T23:00:01Z
65ZFS90ak3Q,Boone Smith | Man v. Lion,1m 30s,2014-11-22T23:00:03Z
EeJiiImx8r0,Leopard Siblings | Leopard Ultimate Survivor,1m 44s,2014-11-22T19:00:01Z
47VK7e5uMxM,Fierce Big Cats! | Big Cat Week,31s,2014-11-21T21:00:02Z
aCxrxHWuQ6E,Cute Big Kitties | Big Cat Week,31s,2014-11-21T18:32:27Z
xEDZMrDbQtk,Monster-sized Mamba | Snake City,2m 46s,2014-11-16T15:00:05Z
ThKlHVmBpzg,Spitting Mad Cobra | Snake City,3m 7s,2014-11-14T15:00:12Z
9JcgEpj0_tY,An African Enigma | The Nile,2m 51s,2014-11-11T22:00:01Z
ap7ziMLEeHc,Buried Treasure | The Nile,1m 47s,2014-11-11T15:00:03Z
7cM1Go8187E,King of the River | The Nile,2m 49s,2014-11-10T22:00:03Z
s0SHXKHEU1U,Dinner Bell | The Nile,3m 13s,2014-11-10T15:00:05Z
tUvsPFvY5OE,Nile’s Exotic Creatures | The Nile,3m 27s,2014-11-09T22:00:03Z
2V3gmm_f9_g,Sewer Serpent | Snake City,2m 29s,2014-11-09T15:00:09Z
VOxxJYNfpZk,Monkey Business | The Nile,2m 58s,2014-11-09T15:00:09Z
QYpJNTH0UEQ,Menacing Mamba | Snake City,3m 22s,2014-11-08T15:00:06Z
ExHETUWLKO8,If You're Scared of Bugs Don't Watch This | National Geographic,2m 26s,2014-11-05T14:00:08Z
aBGmXGpVutY,Yukon Vet Cameraman (Behind the Scenes) | Dr. Oakley Yukon Vet,1m 39s,2014-11-03T18:34:54Z
dbZLUHKngj8,A Marmoset Mama | Dr. K's Exotic Animal ER,2m 46s,2014-11-02T16:00:10Z
t2-Um4ku6HM,Itching for a Scratch | Dr. Oakley Yukon Vet,2m 35s,2014-11-02T15:00:09Z
bbaU_LXvaLA,Oh Rats! | Dr. K's Exotic Animal ER,2m 23s,2014-11-01T15:00:05Z
70zhjbMiSno,Morris’ Bushy Bum | Dr. Oakley Yukon Vet,2m 19s,2014-11-01T14:00:13Z
9tmwFUFCCKs,Python Power | Snake City,2m 38s,2014-10-31T14:00:18Z
dyOXi5l8WyM,Mamba Mash-up | Snake City,3m,2014-10-30T23:22:35Z
1L1RdktmbF0,Official Preview | Man v. Lion,1m 47s,2014-10-28T19:49:13Z
sCVoh5d9d0k,Attack of the Feral Cat | Dr. Oakley Yukon Vet,2m 34s,2014-10-28T14:00:22Z
OF6xwaUq3zs,Hoping for a Miracle | Dr. Oakley Yukon Vet,2m 34s,2014-10-27T19:35:42Z
NwU9RntO31E,Eaten Alive | Killer Shrew,1m 59s,2014-10-27T14:00:09Z
OYYK5bjsBPg,Enter at Own Risk! | Killer Shrew,2m 4s,2014-10-26T14:00:15Z
yg1wF44BRYI,Squealers! | Dr. K's Exotic Animal ER,1m 59s,2014-10-26T14:00:15Z
RY_6vvXKTCY,Fried Ferret | Dr. K's Exotic Animal ER,2m 14s,2014-10-25T14:01:38Z
GdFuvOMd_Qw,Rowdy Sled Dog Pups (Behind the Scenes) | Dr. Oakley Yukon Vet,56s,2014-10-25T14:00:05Z
yEhO95IWcMw,Puppy Problems in the Yukon | Dr. Oakley Yukon Vet,1m 45s,2014-10-19T18:01:00Z
mnuTGpd6oBk,Maverick’s Gooey Tummy | Dr. Oakley Yukon Vet,2m 21s,2014-10-19T14:00:05Z
UHTYB4dxWPU,Freaky Feathers | Dr. K's Exotic Animal ER,2m 34s,2014-10-19T14:00:04Z
daSga3mYiQY,Potty Trained Tortoise | Dr. K's Exotic Animal ER,1m 56s,2014-10-18T18:00:05Z
Rz1r0ZFqCuk,Give Me Some Sugar... Gliders | The Incredible Dr. Pol,2m 30s,2014-10-18T14:00:12Z
sqZreeEqJzI,Dr. Oakley Yukon Vet,31s,2014-10-14T21:43:08Z
8wxhG_K4skk,Golden Retriever Gone Pale | The Incredible Dr. Pol,2m 31s,2014-10-12T14:00:03Z
6BbtE88uT7Q,Feeling Not-So Foxy | Dr. K's Exotic Animal ER,1m 59s,2014-10-11T21:00:03Z
-YSB125qxYs,Aging Bulldog | The Incredible Dr. Pol,2m 8s,2014-10-11T14:00:03Z
v8WXs4Ex2PI,Smelly Pigs | Dr. K's Exotic Animal ER,2m 49s,2014-10-11T14:00:02Z
APNADPrKyEM,A Love Nest | Pond Stars,1m 23s,2014-10-09T14:00:04Z
7flrqO9euT4,Beyond the Pond: Wolf Water Rescue | Pond Stars,3m 20s,2014-10-08T14:00:08Z
AvHzh9QVP0Y,Rocking and Rolling | Pond Stars,1m 53s,2014-10-07T14:00:04Z
kRdJFPZLhW0,A Turtle Helper | Dr. K's Exotic Animal ER,2m 12s,2014-10-05T14:00:03Z
Q6aNhftwBBI,Egg Bound Turtle | Dr. K's Exotic Animal ER,1m,2014-10-04T21:00:02Z
YUP8IEERIfA,How Are They Now? Dr. Pol Updates: Chaska the Alpaca | The Incredible Dr. Pol,2m 37s,2014-10-02T21:27:54Z
apTW6ZyHM68,Diaper MacGyver | Dr. K's Exotic Animal ER,1m 21s,2014-09-28T14:00:03Z
hQiEa2BUD2Q,A Family’s Plea for Ozzy | The Incredible Dr. Pol,2m 40s,2014-09-27T14:00:03Z
v1i8I4yPTHY,Meet Dr. Thielen | Dr. K's Exotic Animal ER,2m 12s,2014-09-26T20:02:08Z
rRd1piiD0ME,Dr. K's Exotic Animal ER: Meet Dr. K,2m 22s,2014-09-26T20:00:06Z
