"Video ID",Title,Length,Published
0xujsX_F9Fw,"Doctor Strange -- Marvel Becoming -- Cosplayer Allen Hansard","2m 11s","2017-11-22T19:00:00Z"
2AeGBS61PJI,"PHOENIX RESURRECTION Teaser Video","3m 23s","2017-11-22T15:00:01Z"
66Fs06SVOtI,"Thanksgiving with Marvel's Runaways",48s,"2017-11-21T19:50:06Z"
fTntZX78E3g,"Runaways on THWIP! The Big Marvel Show!","7m 51s","2017-11-21T17:00:05Z"
YQJKgtAktLQ,"Marvel's Agents of S.H.I.E.L.D. Season 5 Trailer",1m,"2017-11-20T19:00:05Z"
"xmkOb-baZBI","A New Game & Marvel's Runaways Debuts! The Marvel Minute","1m 29s","2017-11-20T17:30:01Z"
IIZ861vBlsw,"MARVEL Strike Force Teaser Trailer",1m,"2017-11-20T17:00:02Z"
MXsjPo8Fdf0,"Marvel Top 10 Bad Parents","2m 43s","2017-11-17T19:00:01Z"
I7Fox72DM5k,"Gamora -- Marvel Becoming -- Cosplayer Yaya Han","2m 2s","2017-11-16T19:00:01Z"
oYDcnWPAhYY,"Marvel's Agents of S.H.I.E.L.D. - Season 5, Ep. 1 Sneak Peek",37s,"2017-11-16T18:00:06Z"
QuIju58Auzw,"Thor: Ragnarok - Korg Reviews Clip",16s,"2017-11-15T19:00:01Z"
q6CXmNydSlk,"Run for your life on THWIP! The Big Marvel Show!",8m,"2017-11-14T21:00:02Z"
jBhHE3CY46A,"LEGO® MARVEL SUPER HEROES 2 Launch Trailer","1m 14s","2017-11-14T11:00:02Z"
Lpgt088JWxs,"Exclusive LEGO Marvel Super Heroes 2 Sneak Peek - Marvel Minute 2017","1m 51s","2017-11-13T17:16:39Z"
BynD1PEVAB4,"Marvel Studios' Thor: Ragnarok - Chaos Trailer","1m 28s","2017-11-11T19:00:00Z"
RsFlD38bJZc,"Thor: Ragnarok - Buddy Comedy",19s,"2017-11-10T19:00:00Z"
DTphktOZYrQ,"Eat the Inhumans on THWIP! The Big Marvel Show!","7m 5s","2017-11-10T17:00:02Z"
M97CIe3Vc6Y,"Marvel's Inhumans Season 1, Ep. 8 - Sneak Peek","1m 12s","2017-11-10T15:00:01Z"
"b_tDc-4k-_o","Choose VA","1m 1s","2017-11-10T14:00:03Z"
W4xemBs8P9M,"No Veteran Left Behind",31s,"2017-11-10T14:00:02Z"
v1qsvRvh_Rk,"X-Men: Jean Grey Through the Years","1m 1s","2017-11-09T23:01:18Z"
GRy2fZunjhs,"Cosplayers Battle: Madame Hydra vs. Sharon Carter - Marvel Becoming","2m 10s","2017-11-09T19:30:00Z"
y19XVsYxN3I,"Marvel Contest of Champions Thor (Ragnarok) Spotlight",32s,"2017-11-09T17:00:10Z"
dEKsPyNh4sw,"Thor: Ragnarok - R.I.P. Mjolnir (Hammer)","1m 15s","2017-11-08T23:43:45Z"
9u1pimnL_Gg,"LEGO Marvel Super Heroes 2 on THWIP! The Big Marvel Show!","10m 22s","2017-11-08T16:30:00Z"
8_le5MUzsSE,"AVENGERS: NO SURRENDER Teaser Trailer",2m,"2017-11-07T20:00:01Z"
dUOLslINi6w,"Play MARVEL Powers United VR & More - Marvel Minute 2017","1m 41s","2017-11-06T16:00:02Z"
3i4CVzAYPK4,"Marvel's Inhumans Season 1, Ep. 7 - Sneak Peek","1m 35s","2017-11-03T21:36:24Z"
JcAWr4gZgeI,"Thor: Ragnarok - 10 Out of 10 Goldblums",32s,"2017-11-03T18:00:01Z"
sGaNEWNwNWw,"Thor: Ragnarok - Beast Reviews",16s,"2017-11-03T17:00:07Z"
lBBvT6QY2Xk,"Thor: Ragnarok - ""Kneel Before Your Queen"" Film Clip",54s,"2017-11-03T12:00:06Z"
tGIKlVQDD4c,"Thor: Ragnarok - ""We Know Each Other"" Film Clip",45s,"2017-11-03T00:28:13Z"
mSwL_Nr__IQ,"Thor: Ragnarok - ""Get Help"" Film Clip",58s,"2017-11-03T00:26:41Z"
BgNVoc1I8mg,"Thor: Ragnarok - Brilliant Reviews Clip",16s,"2017-11-02T15:00:01Z"
eI1B0MnTgQk,"Marvel's Guardians of the Galaxy: The Telltale Series - Final Trailer","1m 51s","2017-11-02T14:00:05Z"
zr5U2Jkw5ew,"Terrigen Mists -- Marvel 101","1m 19s","2017-11-01T20:00:02Z"
rThsmPlKUlA,"Thor: Ragnarok - Lightning Reviews Clip",16s,"2017-11-01T18:00:03Z"
GbOGY2nFgFU,"Marvel Funko Presents: Mjolnir Mischief (starring Thor & Loki) | EXCLUSIVE","1m 47s","2017-11-01T17:00:26Z"
2i9GCHzpxjA,"Thor: Ragnarok - 2-Day Countdown",19s,"2017-11-01T17:00:01Z"
lZFiAx2XODk,"LEGO Marvel Super Heroes 2 - Thor Trailer","1m 8s","2017-11-01T13:06:07Z"
gFaYbSGjED0,"Thor: Ragnarok - After You Clip",16s,"2017-10-31T19:00:05Z"
CsFwHnJvs6k,"Thor: Ragnarok -- Chris Wishes Cate a Happy Hella-ween",38s,"2017-10-31T16:00:01Z"
pTE8nuxAVbA,"Marvel's Spider-Man PS4 & More! - Marvel Minute 2017","1m 44s","2017-10-30T19:00:06Z"
4L5q2_7W9j4,"Marvel's Spider-Man (PS4) 2017 PGW Teaser Trailer","2m 9s","2017-10-30T17:00:01Z"
"gM-oQqhrJPY","Spidey & Ms. Marvel Get Zapped! | Marvel Super Hero Adventures - Electric Youth | SHORT","3m 13s","2017-10-27T17:48:44Z"
"J-fOpp1_lMY","Spidey & Miles Aren't Kitten Around! | Marvel Super Hero Adventures - That Drone Cat | SHORT","3m 2s","2017-10-27T17:48:24Z"
"bNHqFO7-kAI","Spidey, Ant-Man & Hulk Rock Out! | Marvel Super Hero Adventures - Rock and Roll | SHORT","3m 5s","2017-10-27T17:48:24Z"
X1H4nhfY8B4,"Marvel's Inhumans Season 1, Ep. 6 - Sneak Peek","1m 2s","2017-10-27T15:30:30Z"
2BX3YqBF3Hc,"Thor: Ragnarok - Chris Explains What is Ragnarok",56s,"2017-10-26T18:06:01Z"
Swi5DuIY9ks,"Marvel Contest of Champions Blade Spotlight",33s,"2017-10-26T15:30:01Z"
"ZM-BtqBPUYQ","Marvel Studio's ""Thor: Ragnarok"" - Meet the 'Revengers'!","1m 46s","2017-10-25T16:12:12Z"
c6lJ11JkkKs,"DIY Venom Masks on THWIP! The Big Marvel Show!","7m 30s","2017-10-24T20:00:02Z"
tlZpteWpYDo,"Thor: Ragnarok - It's a New Age Promo",31s,"2017-10-24T15:00:08Z"
nT4HGmlWUZ0,"A Motivational Message from Thor: Ragnarok's Cate Blanchett",33s,"2017-10-23T16:00:08Z"
2XA6GmmttgU,"""Marvel's The Punisher"" Release Date & More - Marvel Minute 2017","1m 24s","2017-10-23T15:30:01Z"
bUmMTolb8jg,"Thor: Ragnarok - Epic TV Spot",31s,"2017-10-22T18:44:10Z"
"ILWnIP-Nd5Q","Cup O'Joe: Q & A Panel with Charlie Cox - Full NYCC 2017 Panel","1h 7m 51s","2017-10-20T22:00:00Z"
zv1i7SEhVE8,"Marvel's Inhumans Season 1, Ep. 5 - Sneak Peek","1m 21s","2017-10-20T20:44:52Z"
hULKJp0Xjao,"Do It Yourself: Hela's Headdress | Thor: Ragnarok","3m 37s","2017-10-20T19:00:03Z"
1B8JONpn9OQ,"Marvel Legacy: Next Big Thing - Full NYCC 2017 Panel","58m 59s","2017-10-20T19:00:00Z"
EJnQP5djQlc,"Cup O'Joe Presents Marvel Legacy: Avengers - Full NYCC 2017 Panel","1h 17s","2017-10-19T22:00:00Z"
"Bj-DGqRNdEw","Marvel Studios' Thor: Ragnarok - It's GO Time!",31s,"2017-10-19T20:30:00Z"
lKqSnjn0Xto,"Interview with Writer Chip Zdarsky - Marvel LIVE! NYCC 2017","9m 31s","2017-10-19T18:00:04Z"
mqdIwYdss5w,"Marvel's Agents of S.H.I.E.L.D. Panel at Madison Square Garden - NYCC 2017","46m 10s","2017-10-18T22:00:01Z"
hkL7lPwzpnU,"Cast of Agents of S.H.I.E.L.D. Talk Season 5 - Marvel LIVE! NYCC 2017","12m 34s","2017-10-18T21:00:03Z"
"Ah6hgAVj_-s","Mjolnir Candy Apples | Thor: Ragnarok",39s,"2017-10-18T20:14:55Z"
H3M2hYwfX2Q,"Experience Marvel Universe LIVE! at NYCC 2017","23m 53s","2017-10-18T18:00:03Z"
md0MkpCulvE,"Interview with Bill Rosemann of Marvel Gaming - Marvel LIVE! NYCC 2017","7m 55s","2017-10-18T15:00:13Z"
"Ht-Va6XJ3pw","Stump Tom Brevoort on THWIP! Big Marvel Show LIVE at NYCC 2017","9m 49s","2017-10-17T20:00:01Z"
_gp4xzpCYrU,"Cast of Marvel’s Runaways (Part 2) -- Marvel LIVE! NYCC 2017","5m 6s","2017-10-17T15:00:02Z"
0n5nh0osEFs,"Cast of Marvel’s Runaways (Part 1) -- Marvel LIVE! NYCC 2017","6m 6s","2017-10-17T15:00:01Z"
so04Yl_JoAg,"Marvel Studios' Thor: Ragnarok Premiere & More! - Marvel Minute","1m 32s","2017-10-16T17:00:05Z"
xjDjIWPwcPU,"Marvel Studios' Black Panther - Official Trailer","2m 19s","2017-10-16T13:00:07Z"
2lJDWbXdLPs,"Thor: Ragnarok - Destiny Spot",31s,"2017-10-13T23:00:17Z"
g9LxAXzvprw,"Spidey & Iron Man Clean Up Ultron | Marvel Super Hero Adventures: One Big Mess | SHORT","3m 46s","2017-10-13T21:02:03Z"
MKarNUz4MTQ,"Spidey & Thor Break The Ice! | Marvel Super Hero Adventures - Uh Oh, It's Magic! | SHORT","3m 46s","2017-10-13T21:02:03Z"
lrxG7iS5Nes,"The Chase Is On! - Marvel's Inhumans Season 1, Ep. 4",57s,"2017-10-13T17:08:50Z"
QbnQovxSWa8,"From Miles Morales to Black Panther - Jason Reynolds & Ta-Nehisi Coates - NYCC 2017","59m 24s","2017-10-12T22:55:46Z"
G_FVZ_Rhhh0,"Celebrating 100 Years of Jack Kirby: The King’s New York - NYCC 2017","59m 3s","2017-10-12T22:53:21Z"
"QF0-FAK1ctw","Marvel Studio's Thor Ragnarok - Strongest Avenger? TV Clip",31s,"2017-10-12T21:00:03Z"
lLypD3IVZrY,"LEGO Marvel Super Heroes 2 - Story Play Trailer","1m 29s","2017-10-12T20:00:04Z"
FxswXD53M8Y,"Guardians of the Galaxy - Monsters After Dark: Mysterious Transmissions",50s,"2017-10-12T16:36:34Z"
f1UmxmpPJRM,"Marvel Contest of Champions Morningstar Spotlight",32s,"2017-10-12T15:00:07Z"
aeQZ9cFPH2o,"Marvel Powers United VR - Thor Reveal Trailer","1m 8s","2017-10-11T18:50:55Z"
"yhX-8OwVDRk","Karl Urban on haircuts & maybe stealing props -- Marvel Studios' Thor: Ragnarok Red Carpet Premiere","3m 12s","2017-10-11T15:00:15Z"
ZJq3Y9v1Kow,"Tessa Thompson On Valkyrie -- Marvel Studios' Thor: Ragnarok Red Carpet Premiere","1m 42s","2017-10-11T15:00:03Z"
6n7k_pEQEBM,"Rachel House on Topaz -- Marvel Studios' Thor: Ragnarok Red Carpet Premiere","1m 45s","2017-10-11T15:00:02Z"
m_2L98XgX4g,"Jeff Goldblum On the Jazz of Thor: Ragnarok -- Marvel Studios' Thor: Ragnarok Red Carpet Premiere","3m 24s","2017-10-11T14:30:01Z"
"0QkRvN-gbfI","Tom Hiddleston On the Improv in Loki -- Marvel Studios' Thor: Ragnarok Red Carpet Premiere","5m 12s","2017-10-11T14:30:00Z"
6_dXvJTQ7cw,"Taika, Thor and a Hulk -- Marvel Studios' Thor: Ragnarok Red Carpet Premiere","6m 56s","2017-10-11T14:30:00Z"
UwjcCv6sSNg,"Thor: Ragnarok LA Red Carpet Premiere","2h 26m 48s","2017-10-11T14:20:27Z"
6UeVXJ3TfGY,"Live from NYCC on THWIP! The Big Marvel Show!","5m 10s","2017-10-10T20:30:01Z"
m_tb1QQnwXk,"Venom and Poison Spider-Man face off in the VENOMVERSE -- Part 5",51s,"2017-10-09T18:00:04Z"
zID6A8mv0Kk,"Medusa Cheeseball - Marvel's Eat the Universe","6m 18s","2017-10-08T21:00:01Z"
ISpWquNgonY,"NYCC Nova Commission by Cory Smith - Marvel Quickdraw","3m 20s","2017-10-08T20:30:01Z"
n8SwCDgmTm0,"Black Eyed Peas Talk ""Masters of the Sun"" - Marvel LIVE! NYCC 2017","10m 28s","2017-10-08T20:00:01Z"
jEnGLXwFc_A,"Marvel LIVE! at New York Comic-Con 2017 - Day 4","1h 52m 22s","2017-10-08T19:44:18Z"
myyi3P8hiR8,"Writer Frank Tieri Stops By the Marvel Skybox - Marvel LIVE! NYCC 2017","9m 51s","2017-10-08T19:37:32Z"
l1aaMEvjpgQ,"Sana Amanat Talks Women in Marvel - Marvel LIVE! NYCC 2017","7m 6s","2017-10-08T19:00:04Z"
dFvJN36CVrc,"Cosplayer Entrepreneur Yaya Han on Marvel LIVE! NYCC 2017","8m 24s","2017-10-08T14:00:07Z"
m_7zbU6zjU4,"Daredevil Trivia Challenge (ft. Ben & James) on Marvel LIVE! NYCC 2017","8m 27s","2017-10-08T00:00:02Z"
JPrPUaYCyj0,"Eat the Universe - Captain America Meatballs - Marvel LIVE! NYCC 2017","21m 52s","2017-10-07T23:30:00Z"
7E1pmcSxXks,"Master Comics Theater with Kat Khavari on Marvel LIVE! NYCC 2017","6m 4s","2017-10-07T23:00:00Z"
rt3qWtra4ns,"Marvel LIVE! at New York Comic-Con 2017 - Day 3","3h 1m 46s","2017-10-07T22:41:26Z"
"-988RxB6098","NYCC Spider-Man Commission by Khary Randolph - Marvel Quickdraw","4m 6s","2017-10-07T20:11:15Z"
gAq0GxCsq1A,"Cosplayer Miss Mad Love Becomes Captain Marvel - Marvel Becoming","2m 34s","2017-10-07T19:19:47Z"
tNa2nSGz2iE,"Marvel's Agents of S.H.I.E.L.D. - Season 4 Blooper Reel","3m 30s","2017-10-07T18:57:53Z"
TPBMy_s4M1A,"Cast of Marvel's Agents of S.H.I.E.L.D. Describes Past Season","3m 23s","2017-10-07T18:55:32Z"
cSGFuMo4ANY,"Designer Melissa Ng Talks Her Ironheart Costume - Marvel LIVE! NYCC 2017","9m 38s","2017-10-07T16:00:02Z"
xqUw1sQErKs,"NYCC Deadpool Commission by Nik Virella - Marvel Quickdraw","3m 10s","2017-10-07T15:30:02Z"
63f3dMJ2SOs,"Interview with Khary Randolph - Marvel LIVE! NYCC 2017","5m 30s","2017-10-07T15:00:00Z"
"-6kpILI5dvs","Gorgon Pounded Steak - Marvel's Eat the Universe","7m 1s","2017-10-07T14:30:00Z"
pmvvdZr809c,"LEGO Marvel Super Heroes 2 Booth Tour on Marvel LIVE! NYCC 2017","5m 51s","2017-10-07T14:00:03Z"
o8nEKYKkV90,"Marvel LIVE! at New York Comic-Con 2017 - Day 2","2h 59m 32s","2017-10-07T13:31:32Z"
JAH5kFterr8,"Marvel Studios' Thor: Ragnarok - Hela Good","1m 16s","2017-10-07T13:29:03Z"
jwgUGF_pqMk,"Marvel's Runaways Teaser (Official) • A Hulu Original","1m 18s","2017-10-06T22:38:41Z"
aZYp8OOdmyg,"Marvel’s Avengers: Secret Wars – ""Why I Hate Halloween"" -- Sneak Peak",58s,"2017-10-06T14:30:00Z"
PXDdypxBu_k,"Marvel’s Spider-Man – “Halloween Moon” -- Sneak Peak","1m 16s","2017-10-06T14:00:02Z"
"mYVuj-CiqX8","Marvel LIVE! at New York Comic-Con 2017 - Day 1","2h 54m 25s","2017-10-06T02:24:28Z"
fMXu6EN5OxQ,"Ashley Eckstein Talks Fangirl Fashion - Marvel LIVE! NYCC 2017","14m 12s","2017-10-06T00:49:40Z"
v3CW2HGKwN4,"Writer Matt Rosenberg of Secret Warriors on Marvel LIVE! NYCC 2017","10m 34s","2017-10-06T00:30:01Z"
"QRmG8jR9-t4","Black Bolt Sock Cold Brew - Marvel's Eat the Universe","2m 57s","2017-10-06T00:00:01Z"
EBqOC1fN3Ys,"Ryan Interviews Xavier & Kofi of WWE's The New Day -- Marvel LIVE! NYCC 2017","7m 15s","2017-10-05T23:00:01Z"
Tx6kiKpmS1w,"Writer Ronald Smith talks Black Panther with Lorrance and Ryan -- Marvel LIVE! NYCC 2017","8m 21s","2017-10-05T22:30:00Z"
"PboU-qqjRPM","Maximus Unlocks a Dangerous Inhuman – Marvel’s Inhumans Sneak Peek",57s,"2017-10-05T18:23:43Z"
tQim4AyFPfA,"Cosplay in a Cab, Part 5: All Together Now -- Marvel LIVE @ NYCC 2017",30s,"2017-10-05T16:00:06Z"
ssFCoKWbz3s,"Cosplayer Charles Xavier Becomes Gorgon - Marvel Becoming","1m 33s","2017-10-05T14:00:04Z"
sjobevGAYHQ,"A Message From Stan Lee","1m 18s","2017-10-05T12:37:35Z"
IcN5lZJ59zc,"Cosplay in a Cab, Part 4: Cloak -- Marvel LIVE @ NYCC 2017",31s,"2017-10-04T22:00:00Z"
_XBf71gkPSg,"Cosplayer Lexi Momo becomes Ironheart – Marvel Becoming","2m 45s","2017-10-04T20:30:00Z"
7SUvZCpbi2Q,"Cosplay in a Cab, Part 3: Spider-Man -- Marvel LIVE @ NYCC 2017",29s,"2017-10-04T16:00:02Z"
gTYhajgfEGM,"Marvel vs. Capcom: Infinite - Black Panther and Sigma Gameplay Trailer","1m 14s","2017-10-04T15:00:23Z"
vYZdxOMRQAU,"Hela-Inspired Cupcakes | Thor: Ragnarok",51s,"2017-10-04T13:51:46Z"
QypVGpUrdC0,"Venom Rocket makes a discovery in the VENOMVERSE -- Part 4",59s,"2017-10-03T20:00:01Z"
i2qs389WJhE,"Action & Adventure on THWIP! The Big Marvel Show!","9m 35s","2017-10-03T18:00:05Z"
"Dc-qsJOpuQo","Cosplay in a Cab, Part 2: Nova -- Marvel LIVE @ NYCC 2017",27s,"2017-10-03T16:00:01Z"
9jB7G6iO8SA,"Cosplay in a Cab, Part 1: Captain Marvel -- Marvel LIVE @ NYCC 2017",33s,"2017-10-02T22:00:00Z"
txOGtXdm2bs,"New York Comic Con Preview! – Marvel Minute 2017","1m 32s","2017-10-02T15:00:04Z"
QNNC4Y3vj7M,"Marvel vs Capcom: Infinite BTS - Part 3 - Bringing the Game to Life","2m 57s","2017-09-29T22:00:01Z"
KX5FJe7etBc,"Marvel's Spider-Man Season 1, Ep. 12 - Sneak Peak","1m 21s","2017-09-29T20:00:01Z"
dGX9h75VQmc,"Marvel Top 10 Punisher Villains","2m 51s","2017-09-29T15:00:03Z"
6QTTjRSoTN0,"Marvel vs Capcom Infinite BTS - Part 2 - Bringing the Story to Life","3m 35s","2017-09-28T22:00:00Z"
ST27A3eL2x0,"The Gifted: Season 1, Ep. 1 - The First Six Minutes Preview","5m 52s","2017-09-28T18:40:06Z"
cl4fVMNsOtA,"Cosplayer Jennifer (Jinglebooboo) Becomes Crystal - Marvel Becoming","1m 38s","2017-09-28T18:00:01Z"
5B1wlJQro2o,"Behind the Scenes with Inhumans on THWIP! The Big Marvel Show","8m 3s","2017-09-28T16:30:00Z"
kn2XCuPdej8,"Marvel Studios' Thor: Ragnarok - Behind the Scenes","1m 31s","2017-09-28T16:00:04Z"
pLOkdrw7bio,"Marvel Contest of Champions Mephisto Spotlight",34s,"2017-09-28T15:30:01Z"
V_PWS31PAcY,"Marvel vs CapCom Infinite BTS - Part 1- Bringing a Legacy to Life","3m 4s","2017-09-27T22:00:01Z"
oiy3vgTBQBQ,"Cosplayer David McKahan Becomes Black Bolt - Marvel Becoming","1m 35s","2017-09-27T18:30:01Z"
9u37m3giVNE,"Marvel Funko Presents: Cosmic Sleigh Ride","1m 51s","2017-09-27T17:11:34Z"
tL3iJDNKB5M,"LEGO Marvel Super Heroes 2 Trailer","1m 3s","2017-09-26T18:00:02Z"
wWHIMH4BgBo,"Phoenix is Back! – Marvel Minute 2017","1m 39s","2017-09-25T15:00:08Z"
Fw2doozJ040,"Disney Parks Blog Galactic Meet-Up at Disney California Adventure Park","2m 34s","2017-09-22T18:00:01Z"
roaa4CNQN5s,"Sam Wilson's Captain America -- Marvel Becoming -- Cosplayer Blerd Vision","2m 5s","2017-09-21T18:00:03Z"
pALvG0fHklo,"Marvel NOW! Titles for September 27th",35s,"2017-09-21T14:12:02Z"
"4-8TsBMGLj4","Poison Deadpool comes to life in the VENOMVERSE -- Episode 3",57s,"2017-09-20T20:00:01Z"
8yxx5uxSnTk,"Capcom vs Marvel: Infinite Gameplay Face-off on THWIP! The Big Marvel Show","9m 48s","2017-09-19T18:00:01Z"
fC78UY0DCew,"Marvel vs. Capcom: Infinite - Launch Trailer","1m 37s","2017-09-19T15:30:01Z"
Z78poR0csvg,"Marvel vs. Capcom: Infinite - Battle for the Stones","2m 30s","2017-09-19T15:02:28Z"
drB3Lql2EWU,"Go behind the scenes of GENERATIONS: THE AMERICAS",32s,"2017-09-18T21:00:02Z"
qGKuIWKUN54,"Go behind the scenes of GENERATIONS: THE SPIDERS","1m 2s","2017-09-18T21:00:01Z"
JbSVAwI0kVg,"Marvel's The Punisher & More - Marvel Minute 2017","1m 43s","2017-09-18T15:00:03Z"
YecEU42SWSI,"Marvel's Spider-Man Season 1, Ep. 7 - Sneak Peak",54s,"2017-09-16T00:00:01Z"
nFLH_jX8Gq4,"Runaways in 2 Minutes - Marvel TL;DR","2m 29s","2017-09-15T16:00:06Z"
qtuBsqb6vgE,"Marvel NOW! Titles for September 20",41s,"2017-09-15T14:00:07Z"
"-h5UzQwu8IE","Venom meets Poison Spider-Man in the VENOMVERSE -- Episode 2",32s,"2017-09-14T21:00:01Z"
TFXLsxP0KPg,"BTS with Sofia Carson on a new episode of Marvel's Spider-Man","1m 1s","2017-09-14T19:00:02Z"
Lhm3Q8TEY40,"Cosplayer Marcy Schwerin Becomes Captain Marvel - Marvel Becoming",2m,"2017-09-14T18:00:02Z"
iabJHP_XAwc,"Marvel Contest of Champions Medusa Spotlight",32s,"2017-09-14T15:30:00Z"
pYKZaSPLy4Y,"Attilan -- Marvel 101","1m 8s","2017-09-13T18:00:04Z"
swKznibepD4,"Go Funko Yourself on THWIP! The Big Marvel Show","8m 38s","2017-09-12T19:30:02Z"
3GFrR52eaNY,"Go behind the scenes of GENERATIONS: THE BRAVEST",34s,"2017-09-12T15:00:00Z"
NSneQuTB2NE,"Inhumans in Games - Marvel Minute","1m 34s","2017-09-11T15:17:01Z"
zY2yN01Vy_I,"Jessica Jones -- Marvel 101 LIVE ACTION!","1m 9s","2017-09-08T20:00:06Z"
4kb8itvB_H0,"Star Wars: Celebrating Writer Jason Aaron's Historic Run!",36s,"2017-09-08T16:00:01Z"
qs493Gi4CaI,"The Unbeatable Squirrel Girl in 2 Minutes - Marvel TL;DR","2m 37s","2017-09-08T14:30:02Z"
"5Hp7A-vcyAU","Marvel NOW! Titles for September 13th",47s,"2017-09-08T14:00:00Z"
QX9sIukOsCw,"Marvel Studios' Thor: Ragnarok Contender Spot",46s,"2017-09-08T01:58:32Z"
xZ9vhxP2oaE,"MARVEL Powers United VR - Inhumans Trailer",50s,"2017-09-08T01:33:45Z"
"BXPZFFmNC-0","Luke Cage -- Marvel 101 LIVE ACTION!","1m 9s","2017-09-07T22:00:01Z"
Yaw0ueZcr4g,"Groot -- Marvel Becoming -- Cosplayer HurleyFX","1m 59s","2017-09-07T18:00:01Z"
"uN-tZMtUBP4","Eddie Brock is dragged into the VENOMVERSE -- Episode 1",58s,"2017-09-07T16:30:02Z"
mUZhZNaPym8,"Iron Fist -- Marvel 101 LIVE ACTION!","1m 12s","2017-09-06T22:00:02Z"
TpFIm6aWiZM,"Teleport to the set of Inhumans on THWIP! The Big Marvel Show","8m 57s","2017-09-06T21:28:44Z"
LNJ6Jezp84Y,"Triton -- Marvel 101","1m 6s","2017-09-06T19:17:34Z"
PJg_7XXBQc0,"Daredevil -- Marvel 101 LIVE ACTION!","1m 12s","2017-09-05T22:00:01Z"
4TBLFfVGITg,"Go Behind the Scenes at Funko HQ Store Grand Opening!","3m 6s","2017-09-05T18:00:25Z"
CYqVeU9Cx_c,"Ellen Woglom on ""Marvel's Inhumans""","1m 30s","2017-09-04T20:30:00Z"
zAhEXM1toqw,"Sonya Balmores on ""Marvel's Inhumans""","2m 22s","2017-09-04T12:30:01Z"
mhbbgvYvDaI,"Eme Ikwuakor, Ken Leung and Mike Moh on ""Marvel's Inhumans""","2m 32s","2017-09-03T13:30:01Z"
MeKPXAaeLu0,"Isabelle Cornish on ""Marvel's Inhumans""","1m 39s","2017-09-02T22:30:00Z"
"W__GxtC-MHQ","Jeph Loeb on ""Marvel's Inhumans""","2m 32s","2017-09-02T18:47:54Z"
yaZoebwtxU8,"Anson Mount, Serinda Swan and Scott Buck on ""Marvel's Inhumans""","2m 7s","2017-09-01T21:30:00Z"
oBViRcXzoJA,"Marvel's Spider-Man Season 1, Ep. 5 - Clip 1","1m 6s","2017-09-01T19:49:21Z"
fc8vnjYGuAk,"MARVEL LEGACY Teaser Trailer","2m 24s","2017-09-01T16:00:05Z"
81KKvgVd4k0,"Avengers Vs. X-Men in 2 Minutes - Marvel TL;DR","2m 47s","2017-09-01T14:35:10Z"
uNzmhc49VhU,"Marvel Studios Day of Giving","1m 14s","2017-09-01T00:17:28Z"
SpcZcDBN4EY,"Cosplayer Cap Santiago Becomes Ares - Marvel Becoming","2m 2s","2017-08-31T18:00:02Z"
IMSG5tUmtSI,"Marvel Contest of Champions Kingpin Spotlight",32s,"2017-08-31T15:00:02Z"
5sDSVwbXVHQ,"Marvel NOW! Titles for September 6th",41s,"2017-08-31T14:00:00Z"
OtmjWtCQLo8,"IMAX Presents: The Making of Marvel's Inhumans","1m 36s","2017-08-31T01:06:26Z"
GpecO2zLvGc,"Lockjaw – Marvel 101","1m 8s","2017-08-30T18:00:01Z"
KkFNdk_6sFw,"Go behind the scenes of GENERATIONS: THE IRON",37s,"2017-08-30T14:00:03Z"
O0fCf6NlF5M,"Funko HQ on THWIP! The Big Marvel Show!","6m 8s","2017-08-29T16:00:02Z"
014XT8PHT6s,"Marvel's Inhumans - War For Their World","1m 1s","2017-08-29T02:00:05Z"
oI7ke8VC1kg,"Marvel's Inhumans, Generations & Games! - Marvel Minute","1m 24s","2017-08-28T15:40:30Z"
ko9Liv9SwB8,"BTS with Cameron Boyce on a new episode of Marvel's Spider-Man",58s,"2017-08-25T22:37:14Z"
rDjf7yXvdQw,"Marvel's Avengers: Secret Wars Sneak Peak: All New, All Different Avengers","1m 11s","2017-08-25T17:30:03Z"
v_qXznKUI1M,"World War Hulk in 3 Minutes - Marvel TL;DR","3m 14s","2017-08-25T15:00:04Z"
HFbwkI7d47A,"Marvel Studios' Thor: Ragnarok Superpower of STEM Challenge","2m 7s","2017-08-24T21:00:01Z"
D5lQpA1ris0,"Cosplayer Jes Reaves Becomes Wasp – Marvel Becoming",2m,"2017-08-24T18:00:00Z"
bnXGMzCfB30,"Marvel's Spider-Man Sneak Peak: ""Osborn Academy""","1m 10s","2017-08-24T16:30:04Z"
iLyEVqWhmE8,"Deadpool is VENOMIZED - Part 5 - Edge of Venomverse",59s,"2017-08-24T15:00:04Z"
"GW5tupKNH-o","Marvel NOW! Titles for August 30th",41s,"2017-08-24T14:08:24Z"
1iXU4VJLN4M,"LEGO Marvel Super Heroes 2 Trailer","1m 31s","2017-08-23T21:00:00Z"
Rq1Urf6eNBg,"Maximus -- Marvel 101","1m 7s","2017-08-23T18:14:47Z"
blBlq2n576k,"Go behind the scenes of GENERATIONS: THE THUNDER!",41s,"2017-08-23T14:00:03Z"
ea6zOQKQPqI,"Guardians of the Galaxy The Telltale Series: Episode 3 MORE THAN A FEELING","1m 21s","2017-08-22T21:00:01Z"
RURTzdG5nB0,"🌶️ Wasabi Challenge on THWIP! The Big Marvel Show","9m 48s","2017-08-22T16:00:02Z"
Il9_auNu6cc,"Marvel vs. Capcom: Infinite - Gameplay Trailer 5","2m 1s","2017-08-22T11:00:04Z"
CDh6nmE8V4Y,"Marvel's Jessica Jones Season 2 & More - The Marvel Minute","1m 31s","2017-08-21T15:00:01Z"
BjS1JkrmgMo,"Luke Cage joins the team at the Defenders Red Carpet Premiere","2m 48s","2017-08-18T23:00:00Z"
M7PGLjaD5jA,"Jessica Jones returns at the Defenders Red Carpet Premiere","2m 45s","2017-08-18T22:30:00Z"
46oaadZKRL0,"Finn Jones and Jessica Henwick talk Iron Fist's return at the Defenders Red Carpet Premiere","2m 58s","2017-08-18T22:00:01Z"
jjGB8PzUI9w,"Cast of Daredevil on their new roles at the Defenders Red Carpet Premiere","2m 43s","2017-08-18T21:30:01Z"
rE86NHsoLEY,"Marvel Contest of Champions Doctor Octopus Spotlight",32s,"2017-08-18T17:00:05Z"
ww4W4kmCMX0,"Who is the Black Panther? in 2 Minutes - Marvel TL;DR","2m 49s","2017-08-18T15:00:10Z"
YiGIBGEAXwg,"Sneak Peak at Marvel's Spider-Man on Disney XD","1m 12s","2017-08-18T14:00:03Z"
NWd7WNI1dRs,"Marvel's Inhumans - Welcoming the Royal Family","1m 1s","2017-08-17T18:43:00Z"
bVBgiwba11g,"Cosplayer Jasmin Loves You Becomes Ms. Marvel – Marvel Becoming","2m 6s","2017-08-17T18:00:03Z"
8i_Z62oPecI,"Marvel vs. Capcom: Infinite - Full Story Trailer","2m 27s","2017-08-17T15:00:01Z"
r1qvnWt_arU,"Marvel NOW! Titles for August 23rd",41s,"2017-08-17T14:00:07Z"
2_KFcgQee1I,"Cort Lane and Joe Quesada Talk Marvel's Spider-Man","2m 9s","2017-08-15T19:00:01Z"
"y5d_-MH1uKM","Sneak on the set of the Defenders on THWIP! The Big Marvel Show!","8m 18s","2017-08-15T17:42:56Z"
13sgYtPdg0E,"GENERATIONS Teaser Trailer",31s,"2017-08-14T20:39:13Z"
snk20e4wHuw,"Marvel’s Spider-Man Cast Featurette, Coming Soon to Disney XD","2m 57s","2017-08-14T20:00:05Z"
DMeWuAzxcUA,"Marvel's Runaways Premiere & More! - Marvel Minute 2017","1m 35s","2017-08-14T15:00:02Z"
hjURmgUrGXc,"Go Behind the Scenes of Marvel's Spider-Man with Patton Oswalt","1m 50s","2017-08-11T20:30:00Z"
GmYQu6BIRq0,"Daredevil Yellow in 2 Minutes - Marvel TL;DR","2m 40s","2017-08-11T15:40:26Z"
foic77P3kg4,"Marvel NOW! Titles for August 16th",47s,"2017-08-10T19:36:24Z"
1TuTybdCTsg,"Star-Lord (Peter Quill) -- Marvel Becoming -- Cosplayer Johnny Junkers","2m 2s","2017-08-10T18:00:01Z"
SiaSHgMM_BA,"Old Man Logan is VENOMIZED - Part 4 - Edge of Venomverse","1m 4s","2017-08-09T15:00:03Z"
Tsay_XHEOA0,"Spider-Man Animation on THWIP! The Big Marvel Show!","8m 33s","2017-08-08T16:00:03Z"
w2x5mRY_iOQ,"Marvel's Defenders Premiere - Marvel Minute 2017","1m 30s","2017-08-07T15:00:30Z"
3MMMe1drnZY,"""Guardians' Inferno"" | Marvel Studios’ Guardians of the Galaxy Vol. 2","3m 39s","2017-08-06T18:11:04Z"
nEmfZr1gGAQ,"The M&M'S® in a Guardians of the Galaxy Adventure!","4m 10s","2017-08-04T20:02:37Z"
Lja9ty9AetU,"The Punisher: Welcome Back, Frank in 2 Minutes- Marvel TL;DR","2m 35s","2017-08-04T15:00:06Z"
kcGB8fGCavI,"Marvel Contest of Champions Green Goblin Spotlight",34s,"2017-08-03T21:00:30Z"
"-MH4YwvGl_A","""Marvel's Inhumans"" Clip -- Maximus and Medusa Face Off",38s,"2017-08-03T19:28:46Z"
_353rln6ki4,"Cosplayer Binkxy Becomes Squirrel Girl – Marvel Becoming","1m 59s","2017-08-03T17:47:25Z"
mQNEozT2C8Q,"Marvel’s Guardians of the Galaxy Season 2, Ep. 21","1m 9s","2017-08-03T16:00:29Z"
Xd6U4jNgtNg,"Marvel NOW! Titles for August 9",47s,"2017-08-03T14:00:02Z"
knyfG7d2QY4,"Grandmaster – Marvel 101","1m 7s","2017-08-02T18:00:06Z"
jiBMQ5M8o2I,"The Defenders Fight THWIP! The Big Marvel Show!","7m 15s","2017-08-02T16:00:06Z"
6cBVVtVdomY,"M&M'S® Come to Life on Marvel Quickdraw!","1m 53s","2017-08-02T14:30:00Z"
V1XvlCIjfZQ,"The Making of the Groot Glass Bowl - San Diego Comic Con 2017","2m 1s","2017-08-01T19:00:03Z"
Ew7hvsnSbAY,"“Ant-Man & The Wasp” Now In Production",15s,"2017-08-01T16:27:35Z"
8I7j1NRW8ig,"5 Marvel Games You Don’t Want to Miss | SDCC 2017","12m 25s","2017-07-31T21:00:00Z"
"0-_HB7oHdno","San Diego Comic-Con Round-Up! - Marvel Minute 2017","1m 28s","2017-07-31T17:28:34Z"
FbDzeA9QU5g,"Spider-Man on Marvel Quickdraw!","1m 56s","2017-07-30T16:00:02Z"
yfciA8beo3o,"D23 2017: Marvel Studios’ Avengers: Infinity War Cast and Creators Reveal Some Hints","2m 45s","2017-07-28T21:00:06Z"
G7aVhH0FXfM,"The Inhumans Among Us, in 3 Minutes - Marvel TL;DR","3m 32s","2017-07-28T14:54:05Z"
3Mji4cpgt38,"Ghost Rider is VENOMIZED - Part 3 - Edge of Venomverse",48s,"2017-07-27T22:16:49Z"
qGXqKqbQPh4,"Squirrel Girl on Marvel Quickdraw!","2m 28s","2017-07-27T18:00:03Z"
