"Video ID",Title,Length,Published
"AkJ0Kd-VXpE","Roller Derby Girl | Marvel Make me a Hero","3m 16s","2019-08-18T15:00:02Z"
mpRo5gHggAg,"Ingrid Michaelson talks fandom and her new album! | Earth's Mightiest Show","5m 22s","2019-08-17T16:00:15Z"
R395AubFil0,"Marvel Contest of Champions: Summoner Showdown | Best of Week 3!","1m 29s","2019-08-16T21:30:00Z"
gXMtW4HtP0k,"Skillet's John Cooper on collecting Marvel comics around the world!","3m 1s","2019-08-16T15:45:01Z"
"yIkq-5Ksg1U","Marvel Contest of Champions: Summoner Showdown | Week 3 Winner","4m 40s","2019-08-15T21:00:07Z"
L4BpMsAIEQc,"SPIDER-MAN #1 by J.J. Abrams, Henry Abrams, Sara Pichelli | Trailer","2m 21s","2019-08-15T20:15:02Z"
MdqY1VJ2Eeo,"Marvel Studios’ Avengers: Endgame — Making the Cap vs. Cap fight!","15m 4s","2019-08-15T15:30:01Z"
hTY2UN6qkb0,"Back to School with Marvel and Walmart!","1m 1s","2019-08-14T21:15:00Z"
4zmSg6KfGZI,"Marvel Contest of Champions: Summoner Showdown | Week 3","29m 2s","2019-08-14T20:35:35Z"
ogNyuj40oRg,"Absolute Carnage: Breakout | Marvel Ultimate Comics","4m 48s","2019-08-14T20:30:00Z"
HYZFC9W8mDw,"Bushmaster | Marvel 101","1m 31s","2019-08-14T14:30:02Z"
zZGcjZvPO7Y,"EXCLUSIVE: November Preview Special! | Marvel's Pull List","5m 53s","2019-08-13T20:15:00Z"
6YQQT_va_RY,"Creating a team in MARVEL ULTIMATE ALLIANCE 3: The Black Order @ SDCC 2019","4m 39s","2019-08-13T01:00:01Z"
5F7XCUqiJy0,"Marvel's Top 10 Infinity Stone Protectors!","2m 32s","2019-08-12T18:30:00Z"
"qt3fRPk2P-Y","Marvel's Agents of S.H.I.E.L.D. | Debriefing Season 6 Finale","3m 10s","2019-08-12T18:00:05Z"
"E-kou1J769U","Marvel's Iron Man VR Gameplay at SDCC 2019","26m 29s","2019-08-12T16:00:04Z"
Hgfh8n49eBA,"Namor arrives in Marvel Games and Gwenpool strikes back! | Marvel Minute","1m 28s","2019-08-12T14:30:00Z"
bwYnjgBHliE,"Telekinetic Powers | Marvel Make me a Hero","3m 20s","2019-08-11T14:45:01Z"
"NQgxZGPkX-o","Lauren Tsai on LEGION and creating cover art for Marvel Comics @ SDCC 2019","6m 49s","2019-08-11T03:30:00Z"
QR8H_qHay3c,"Marvel Contest of Champions: Summoner Showdown | Best of Week 2!","6m 5s","2019-08-11T01:00:02Z"
rFp6tK6YMu8,"The REAL Purpose of these Wild Marvel Inventions| Earth’s Mightiest Show","2m 49s","2019-08-10T14:30:03Z"
pZBoFD9agXc,"Marvel Studios visual development team talks Avengers: Endgame @ SDCC 2019!","5m 13s","2019-08-10T01:00:04Z"
3Wecy5z4hCw,"Meet the Marvel fans at the X Games!","2m 31s","2019-08-09T21:15:00Z"
"-1hvbh2mOAE","ABSOLUTE CARNAGE #1 - Critics React | Marvel Comics",30s,"2019-08-09T18:30:01Z"
su81g0ZzdrE,"Silk (Cindy Moon) | Marvel 101","1m 54s","2019-08-09T14:15:00Z"
"g-wFiMGZX9M","Marvel's Agents of S.H.I.E.L.D. composer Bear McCreary at SDCC 2019!","5m 25s","2019-08-09T01:00:06Z"
G8Tr1LISegM,"Marvel Contest of Champions: Summoner Showdown | Week 2 Winner","3m 23s","2019-08-08T21:00:00Z"
FTWV54cd5sU,"Agent M vs Team Liquid: Pinball Battle at the X Games","2m 18s","2019-08-08T20:15:00Z"
cI4dwRpw7yo,"Adam Savage Makes REAL Iron Man Armor | Earth’s Mightiest Show","9m 36s","2019-08-08T18:15:01Z"
CEOPAdslMcA,"Today in Marvel History: Fantastic Four First Appearance",53s,"2019-08-08T14:00:03Z"
"W-erQ0-HjTw","Brendon Small talks the anniversary of Home Movies, performing with Dethklok, and More @ SDCC 2019!","8m 2s","2019-08-08T01:00:04Z"
1L3DHLkhe9c,"Marvel Contest of Champions: Summoner Showdown | Week 2","25m 59s","2019-08-07T20:58:42Z"
AXaIWWkF1NI,"How to draw Carnage with Ryan Stegman | Marvel Quickdraw","3m 24s","2019-08-07T18:00:00Z"
WriuIl2z7e8,"Marvel Future Fight: Wave, Namor, and Silver Surfer Join Battle","1m 5s","2019-08-07T01:00:02Z"
"ibbr-kJfF7E","9 Best Moments with Marvel at the X Games!","2m 27s","2019-08-06T22:00:04Z"
LLrez0ffSf8,"ABSOLUTE CARNAGE Plus More Summer Blockbusters! | Marvel’s Pull List","4m 52s","2019-08-06T19:15:00Z"
Q89Uy2OTzv4,"The X-Men Influence | Marvel Comics","2m 43s","2019-08-06T17:45:02Z"
y53JkTtJ91M,"X Trial Survival: Marvel's Agent M tackles a Marvel themed obstacle course!","1m 25s","2019-08-05T21:45:01Z"
SzhlGv58lbs,"Marvel Contest of Champions: Summoner Showdown | Week 1 Recap","4m 46s","2019-08-05T17:30:01Z"
gXs6LOdxM74,"Marvel LIVE returns, HOUSE OF X #2, and more! | Marvel Minute","1m 39s","2019-08-05T15:00:10Z"
_8cfsyhSTug,"Chicago Dog Pizza with SNL's Chris Redd | Marvel Eat the Universe","8m 17s","2019-08-04T19:00:02Z"
"EE8-b9526BA","Harnessing Energy | Marvel Make Me a Hero","3m 26s","2019-08-04T14:00:00Z"
VODi4jIIGvE,"Can Timothy DeLaGhetto and David So Feed Galactus? | Earth’s Mightiest Show","6m 2s","2019-08-03T20:15:02Z"
KutLv3F9WDA,"Venom (Eddie Brock) | Marvel 101","1m 31s","2019-08-03T17:15:01Z"
"ZdQe-qAo9N0","POWERS OF X #1 — Critics React | Marvel Comics",30s,"2019-08-02T20:00:00Z"
PWoRSz_x00U,"Marvel’s Agents of S.H.I.E.L.D. | Season 6 Finale Sneak Peek","1m 57s","2019-08-02T17:08:25Z"
wJ_GdT4HeTI,"Marvel Studios’ Avengers: Endgame — Comic Book Easter Eggs!","3m 3s","2019-08-02T17:00:08Z"
WJyDj6wf4zY,"Marvel Contest of Champions: Summoner Showdown | Week 1 Winner","2m 10s","2019-08-01T21:30:00Z"
MkOng3w841Q,"Carnage Returns! Everything You Need To Know!","11m 8s","2019-08-01T20:15:01Z"
5CTb0wo4DvY,"Marvel's Agents of S.H.I.E.L.D.: The Key to Mack and Yo-Yo's Relationship","1m 44s","2019-08-01T18:30:00Z"
3wheDZKnJsg,"Spider-Man's Top 10 Costumes!","3m 2s","2019-08-01T16:15:00Z"
Xcv3si66Eds,"Marvel's Runaways x Marvel's Cloak & Dagger: Crossover Episode Confirmed!",53s,"2019-08-01T15:00:09Z"
malFDhoC8RM,"SDCC 2019 Recap with This Week In Marvel!","2m 39s","2019-07-31T22:00:12Z"
aR_IYtz66lY,"Marvel Contest of Champions: Summoner Showdown | Week 1","31m 27s","2019-07-31T21:05:40Z"
IJjVPOezyh0,"Marvel's Agents of S.H.I.E.L.D. | Fitz + Mack's Bromance","1m 29s","2019-07-31T19:15:01Z"
"i-xGKC3MxwE","TIME’S RUNNING OUT In These New Comics! | Marvel’s Pull List","4m 32s","2019-07-30T18:30:00Z"
"IoT7_EZ-EUc","Top 10 Marvel Time-Travelers","2m 32s","2019-07-29T21:00:00Z"
"D53-MFX6SlE","10 facts about X-Men series HOUSE OF X and POWERS OF X","2m 40s","2019-07-29T18:15:01Z"
pfRogKW9g9g,"LEGO Marvel Spider-Man swings onto the scene and more news! | Marvel Minute","1m 36s","2019-07-29T14:30:02Z"
pjZy4JLh1sM,"Penguin Sidekick | Marvel Make Me a Hero","3m 31s","2019-07-28T15:00:09Z"
RV2RgRrX43g,"Can YOU name 80 Marvel characters in 60 seconds?!","3m 30s","2019-07-26T21:30:00Z"
TwBpvDvDwgA,"HOUSE OF X #1 — Critics React | Marvel Comics",30s,"2019-07-26T19:48:59Z"
xjUS_YhBoo0,"VALKYRIE #1 — Critics React | Marvel Comics",30s,"2019-07-26T17:30:02Z"
Fg8pOiBTTRc,"Marvel's Agents of S.H.I.E.L.D. | Season 6, Ep. 11 'Wake Up' Sneak Peek","1m 12s","2019-07-26T17:00:01Z"
H502JIkESOI,"Marvel's Runaways | Season 3 Announcement",23s,"2019-07-26T16:35:00Z"
nxypt9SwLfk,"Marvel Studios’ Avengers: Endgame — Making the Hulk!","5m 48s","2019-07-25T16:00:06Z"
sGWgdCQl3MY,"Best of San Diego Comic-Con 2019 | Earth’s Mightiest Show Bonus","5m 12s","2019-07-24T21:00:04Z"
"Ixd-Ku6TAAI","Maria Hill | Marvel 101","1m 46s","2019-07-24T15:45:00Z"
12mY_rpFsEc,"HUGE DEBUTS: House of X Is Here! | Marvel’s Pull List","5m 7s","2019-07-23T23:15:00Z"
ZW3_38xXJlM,"HISTORY OF THE MARVEL UNIVERSE Launch Trailer | Marvel Comics","1m 43s","2019-07-23T20:45:02Z"
"1rhi-bjVhdo","X-MEN questions answered with Jonathan Hickman! | This Week in Marvel","2m 34s","2019-07-23T15:30:00Z"
"sd-RdaP6osM","How The Runaways Save the World | Marvel’s Voices","3m 11s","2019-07-22T23:00:03Z"
3CKJXpYgVqw,"Marvel Studios' Black Widow | Meet the Cast","4m 15s","2019-07-22T20:30:01Z"
mErw56WfM1s,"Best of Marvel @ SDCC 2019! Day 4","3m 33s","2019-07-21T23:21:24Z"
Jr4reaZZStw,"Mondo's exclusive Marvel posters, figures and more @ SDCC 2019!","3m 5s","2019-07-21T23:19:18Z"
"QqRMG4-3DNg","Marvel's Pull List LIVE at SDCC 2019!","28m 54s","2019-07-21T23:15:00Z"
GvuedZUUFBE,"Marvel Becoming Cosplay Contest LIVE at SDCC 2019!","20m 9s","2019-07-21T23:06:58Z"
P6dPhFrC9nk,"New Marvel statues at the Kotobukiya booth @ SDCC 2019!","2m 53s","2019-07-21T22:42:57Z"
"Crj-cPF9KGc","Best of: Marvel Comics Next Big Thing Panel @ SDCC 2019","19m 14s","2019-07-21T22:37:13Z"
LaLDjX_INwM,"Behind the Scenes of Fandom with Lootcrate @ SDCC 2019","7m 14s","2019-07-21T22:33:40Z"
xEPXVU_x10I,"Marvel LIVE from SDCC 2019! | Day 4","3h 43m 15s","2019-07-21T22:18:17Z"
_2NGrWPX3r4,"Marvel Games Revealed with Bill Rosemann LIVE from SDCC 2019!","5m 1s","2019-07-21T22:06:49Z"
c6XVvkSJfIM,"Marvel Comics Secrets with Editor-in-chief C.B. Cebulski at SDCC 2019","5m 56s","2019-07-21T21:38:17Z"
OYCvHAwJkJM,"Best of: Women of Marvel Panel @ SDCC 2019","19m 41s","2019-07-21T21:34:07Z"
"qFs6nMl-WSQ","Lucasfilm's Matt Martin talks Star Wars: Galaxy's Edge at SDCC 2019!","5m 26s","2019-07-21T21:34:07Z"
a1qEV1BQVTU,"Deadpool's taco truck and more from Jada Toys at SDCC 2019!","3m 26s","2019-07-21T21:26:27Z"
Y_CmKc9jA8g,"MARVEL ULTIMATE ALLIANCE 3: The Black Order LIVE @ SDCC 2019","15m 4s","2019-07-21T21:21:32Z"
HkPJtIudQOU,"WWE Champion Kofi Kingston join us on Marvel LIVE SDCC 2019!","5m 51s","2019-07-21T21:20:09Z"
A5r6c5TtfRU,"Fans Answer ""Who is Spider-Man's Deadliest Foe?"" @ SDCC 2019!","2m 17s","2019-07-21T20:55:28Z"
A3QCdltBxDI,"Women of Marvel's Sana Amanat & Judy Stephens @ SDCC 2019!","4m 59s","2019-07-21T20:43:34Z"
PuynkpH6xSU,"Earth's Mightiest Show LIVE at SDCC 2019!","30m 1s","2019-07-21T20:41:58Z"
bpT5PUdTdQI,"Marvel Studios' Visual Development Team on creating the look of Black Widow","6m 39s","2019-07-21T19:35:32Z"
yYQCLgQqM7g,"Marvel Studios Announcements from Hall H at SDCC 2019!","5m 47s","2019-07-21T18:38:26Z"
t8O53X5HSXE,"Best of Marvel @ SDCC 2019! Day 3","4m 32s","2019-07-21T03:45:02Z"
lNFobbL5nmQ,"Becky Lynch, ""The Man"", talks her Marvel origin story at SDCC 2019!","7m 33s","2019-07-21T03:32:40Z"
DimarT4rjAE,"Best Of: Marvel Comics Spider-Man Panel at SDCC 2019","28m 31s","2019-07-21T03:30:01Z"
tpnanRo_SAk,"Comic Writer Margaret Stohl talks Captain Marvel at SDCC 2019!","4m 54s","2019-07-21T03:15:00Z"
vukRMFA3GU8,"Marvel Toys with Jesse Falcon LIVE from SDCC 2019!","3m 42s","2019-07-21T03:00:03Z"
KOmJ6HNq_ag,"Voice actor Dee Bradley Baker on his illustrious Marvel career at SDCC 2019!","7m 48s","2019-07-21T03:00:02Z"
WOCfNvHOx88,"Sebastian Stan and the Russo Brothers talk Marvel Studios' Avengers: Endgame at SDCC 2019!",9m,"2019-07-21T03:00:02Z"
jqvLZcSAtUU,"Sam Maggs on writing Captain Marvel at SDCC 2019!","5m 46s","2019-07-21T02:45:00Z"
n_T9x566YmE,"Sharon Blynn on her role as Soren in Captain Marvel at SDCC 2019!","6m 18s","2019-07-21T02:30:00Z"
QFDoPp8g6YI,"Marvel Rising writer Nilah Magruder LIVE from SDCC 2019!","6m 13s","2019-07-21T02:15:02Z"
cXLu4EYb5M4,"Sesame Street at Marvel LIVE from SDCC 2019!","8m 7s","2019-07-21T02:15:02Z"
VsMDe7DGv68,"Marvel LIVE from SDCC 2019! | Day 3","5h 24m 43s","2019-07-21T00:35:24Z"
"3VL_Eudcr-s","Eat the Universe LIVE with Amber Nash at SDCC 2019!","24m 43s","2019-07-21T00:03:04Z"
Xo_mYn7uNyU,"Marvel Animation's Cort Lane reveals Shuri coming to Marvel Rising @ SDCC 2019!","6m 58s","2019-07-20T23:44:19Z"
wdJpFwOaXN4,"Marvel Minute @ SDCC 2019! | Day 3","4m 42s","2019-07-20T22:48:45Z"
"-5yYO8t6_U4","Marvel Television Prop Store Auction Items Revealed at SDCC 2019!","3m 38s","2019-07-20T22:38:12Z"
KTLcsPAa9UQ,"Marvel Hot Wheels exclusives at the Mattel Booth at SDCC 2019!","3m 34s","2019-07-20T22:34:39Z"
TySyEPPoetA,"Bobby Moynihan talks Fandom and Collecting at SDCC 2019!","4m 16s","2019-07-20T22:08:17Z"
CJf7Zd9udYE,"Marvel Comics Major X Q&A with Rob Liefeld at SDCC 2019","10m 22s","2019-07-20T21:24:39Z"
9dZ4xsXA5Fs,"90s Wolverine, Cyclops and more from the Beast Kingdom booth at SDCC 2019!","2m 37s","2019-07-20T21:20:55Z"
nK7Ro3nVc8I,"Actor and Comedian Phil LaMarr on Marvel LIVE at SDCC 2019!","4m 57s","2019-07-20T21:09:26Z"
1Q7o9MIVV8M,"Marvel Editor Nick Lowe on Runaways, Spider-Man and more at SDCC 2019!","5m 2s","2019-07-20T21:06:02Z"
wiAlLSifCaE,"Fans Try to Win this Pin on Marvel LIVE at SDCC 2019!","2m 26s","2019-07-20T20:59:01Z"
azztbpxY80c,"Neil Gaiman Revealed on Marvel Comics #1000 at This Week in Marvel LIVE at SDCC 2019!","4m 5s","2019-07-20T20:53:58Z"
fIioFF1ARXA,"Tour the LEGO Booth with Marvel @ SDCC 2019!","3m 17s","2019-07-20T19:17:01Z"
5vlIcmJqzA8,"FUNKO shows off their Marvel Exclusives @ SDCC 2019!","3m 6s","2019-07-20T19:03:39Z"
4cCMP146hDQ,"Today in Marvel History: The Defenders First Appearance",41s,"2019-07-20T17:24:06Z"
OU_wF32JpQ4,"Best of Marvel @ SDCC 2019 Day 2","2m 2s","2019-07-20T02:47:11Z"
"Jt562-tai4Q","Behind the Scenes of the video game Marvel's Avengers LIVE @ SDCC 2019!","5m 23s","2019-07-20T02:10:31Z"
YHTzlHKFoGI,"The Cast of Marvel's Agents of S.H.I.E.L.D. LIVE in the Marvel Booth at SDCC 2019","14m 45s","2019-07-20T02:05:04Z"
Xjz7AxzLTyw,"Marvel Make Me a Hero LIVE with the GEICO Gecko at SDCC 2019","25m 35s","2019-07-20T02:03:48Z"
Btq7mSuCobs,"Troy Baker, Nolan North, and Jeff Schine talk Marvel's Avengers LIVE at SDCC 2019!","5m 47s","2019-07-20T02:00:55Z"
5EYHCbycu_I,"Preeti Chhibber talks Spider-Man with us LIVE from SDCC 2019!","12m 29s","2019-07-20T01:20:25Z"
FeeRB6uQM_o,"Run-DMC's Darryl McDaniels performs Marvel freestyle rap at SDCC19!","16m 49s","2019-07-20T01:02:34Z"
"41H5Om-mTyw","Best of Hall H: Marvel's Agents of S.H.I.E.L.D. SDCC 2019 Panel","28m 42s","2019-07-20T01:01:44Z"
"CTDG7Md-4jI","Marvel LIVE from SDCC 2019! | Day 2","5h 53m 25s","2019-07-20T00:56:25Z"
"J0-2bTAMH5s","Tom Lennon hangs out on Marvel LIVE at SDCC 2019!","5m 51s","2019-07-19T23:53:18Z"
H_S5Sk172Rw,"MARVEL ULTIMATE ALLIANCE 3: The Black Order Q&A at SDCC 2019!","6m 50s","2019-07-19T23:50:46Z"
8AsHkGGPz2w,"Marvel Toys in the Diamond Select Booth with Marvel at SDCC 2019!","3m 6s","2019-07-19T23:14:38Z"
yFH9iTd1QpU,"Marvel Studios' Avengers: Endgame Screenwriters LIVE from SDCC 2019","8m 57s","2019-07-19T23:10:25Z"
DXdJY5fWnuc,"Venompool and other stunning Marvel Hot Toys at SDCC 2019!","2m 41s","2019-07-19T22:51:55Z"
koffzyUlYeQ,"Ashley Eckstein, Founder of Her Universe, LIVE from SDCC 2019!","6m 49s","2019-07-19T21:19:14Z"
fh0VF24ABI8,"Marvel's Iron Man VR Q&A LIVE from SDCC 2019!","5m 29s","2019-07-19T21:13:08Z"
XcxCONshcU0,"The McElroy family visits the Marvel booth at SDCC 2019!","7m 4s","2019-07-19T21:02:15Z"
7oOgJzNY9N0,"Hasbro shows off their Marvel SDCC 2019 Exclusives & 2020 Toy Reveals!","7m 13s","2019-07-19T20:28:31Z"
bA2aMmblrB8,"Best of Hall H: Marvel Games SDCC 2019 Panel!","3m 48s","2019-07-19T20:12:01Z"
N9MTFwDzY6A,"Best of Marvel @ SDCC 2019 Day 1","2m 19s","2019-07-19T02:48:53Z"
mOUAgQ9Zy7o,"Marvel Contest of Champions Summoner Showdown Kick-Off at SDCC 2019!","32m 4s","2019-07-19T02:45:52Z"
PKOZOLwYjtc,"Marvel Minute @ SDCC 2019 | Day 1!","2m 14s","2019-07-19T01:17:16Z"
V8BMFteJDH0,"Marvel LIVE from SDCC 2019! | Day 1","5h 40m 49s","2019-07-19T01:12:43Z"
58CPjThRDFg,"Robot Chicken's Matthew Senreich joins the Marvel LIVE couch at SDCC 2019","8m 1s","2019-07-18T23:35:52Z"
"Z8xB321z-YA","Marvel's Agents of S.H.I.E.L.D. | SDCC 2019 Hall H Extended Season 6 Trailer","2m 6s","2019-07-18T23:32:59Z"
3oOGVro1VzE,"""Who is the Most Powerful of the X-Men?"" Asking fans at SDCC 2019!","2m 52s","2019-07-18T23:23:06Z"
KuecTxN2F3k,"Jordan D. White, Marvel Comics Sr. Editor talks X-Men LIVE at SDCC 2019!","7m 31s","2019-07-18T23:14:52Z"
"lA8-r0Kh3aM","Jonathan Hickman on the future of the X-Men at SDCC 2019!","6m 54s","2019-07-18T22:42:11Z"
OKJP2xdkgj4,"MARVEL ULTIMATE ALLIANCE 3: The Black Order | Launch Trailer","1m 1s","2019-07-18T22:38:23Z"
"unQvY6-o2o4","Colton Dunn talks fandom LIVE at SDCC 2019!","5m 36s","2019-07-18T22:34:12Z"
"X6BlPlu-HW8","Marvel's Iron Man VR | Time-lapse Drawing","1m 8s","2019-07-18T22:09:00Z"
XDVMyHHJgKg,"Marvel's Iron Man VR | Learning to Fly","2m 54s","2019-07-18T22:08:50Z"
l0WhCwmIRX0,"Steve Sansweet joins Marvel LIVE to talk Star Wars collectibles at SDCC 2019!","8m 9s","2019-07-18T21:36:36Z"
CFXMp7YYVhE,"Exclusive Marvel statues at the Sideshow Booth at SDCC 2019!","3m 23s","2019-07-18T21:25:58Z"
LMo60OfzlIY,"Artist Jen Bartel answers YOUR questions LIVE from SDCC 2019!","6m 55s","2019-07-18T21:03:12Z"
erSPPvraujs,"Artist Bosslogic on sampling the world for his Marvel art LIVE at SDCC 2019!","8m 1s","2019-07-18T20:56:25Z"
kcjBubZkduc,"Rainbow Rowell talks writing RUNAWAYS from SDCC 2019!","5m 12s","2019-07-18T20:39:13Z"
"tDL8UkScv-U","Marvel's Agents of S.H.I.E.L.D. | Meet Sarge's Oddball, Badass Crew","1m 33s","2019-07-17T18:00:04Z"
"b-47MHlRrMM","Marvel's Agents of S.H.I.E.L.D. | Season 6, Ep. 10 ‘Bad Idea, Love’ Promo",31s,"2019-07-17T14:36:22Z"
vHm5xLpSWSk,"Namor | Marvel 101","1m 56s","2019-07-16T22:00:10Z"
I23TqvONWXU,"EXCLUSIVE: Marvel Comics October Announcements | Marvel's Pull List","6m 43s","2019-07-16T17:00:02Z"
iuMxa1NOtJ0,"Marvel's Top 10 Symbiote Hosts","2m 32s","2019-07-15T21:45:00Z"
"-B0ttLnDzOU","Your MARVEL ULTIMATE ALLIANCE 3: The Black Order questions answered!","3m 18s","2019-07-15T18:30:01Z"
PWzolbxJ1_Y,"Marvel Props Auction! A Loki Comic! SDCC 2019! | Marvel Minute","1m 57s","2019-07-15T14:30:00Z"
O2Z05uVIlvQ,"Mysterio inspired crudité with Kevin Smith! | Eat the Universe","8m 23s","2019-07-14T21:30:01Z"
"M79JLj-gkIw","Behind-The-Scenes of Spider-Man: Far From Home’s 3D Transformation | Earth’s Mightiest Show","5m 51s","2019-07-14T18:00:02Z"
Rq36hbW1gKk,"Energy Reflection Powers! | Marvel Make Me a Hero","3m 52s","2019-07-14T14:00:07Z"
Cv3bu1HUbLU,"Jean Grey | Marvel 101","1m 31s","2019-07-13T00:30:01Z"
"t9C6kJB1-_c","This Week in Marvel is coming to SDCC 2019!","1m 54s","2019-07-12T21:30:02Z"
wLXI6LRY7Rw,"Spider-Man: Far From Home toys swing into Walmart!",1m,"2019-07-12T19:15:02Z"
RV44npGUCNc,"Marvel's Agents of S.H.I.E.L.D. | Season 6, Ep. 9 ‘Sarge’s In Charge Now’ Promo",31s,"2019-07-12T17:12:08Z"
"IlmHexd0m-o","Etiquette Expert Teresa McElroy Chooses Nightcrawler to Babysit Her Kids! | Women of Marvel","2m 3s","2019-07-11T22:30:00Z"
2TddRUYOMLs,"Marvel's SDCC 2019 Merch!","3m 44s","2019-07-11T20:30:00Z"
"3ErHi-mIQEM","MARVEL ULTIMATE ALLIANCE 3: The Black Order is almost here!","11m 41s","2019-07-11T18:58:47Z"
i7f4Ma1QEuI,"Marvel's Agents of S.H.I.E.L.D. | Izel Is The Creator of the Shrikes",44s,"2019-07-11T18:00:04Z"
"hcBbMXkk-Mw","Traveling the World with Spider-Man: Far From Home! | This Week in Marvel","2m 42s","2019-07-10T16:30:00Z"
JmfKPBmAOQE,"ABSOLUTE CARNAGE Trailer | Marvel Comics","2m 8s","2019-07-09T21:30:02Z"
_QdEXIzYlbc,"New Beginnings in AMAZING SPIDER-MAN and WAR OF THE REALMS! | Marvel’s Pull List","4m 55s","2019-07-09T19:45:01Z"
2FnIAKrg9TE,"How Marvel Studios Designed Mysterio in Spider-Man: Far From Home","6m 16s","2019-07-09T15:45:00Z"
x2i3HuBxuvc,"Mysterio Cosplay Making Of! | Marvel Becoming","5m 40s","2019-07-08T19:30:05Z"
cmBPO4IOLBk,"Marvel Employees React to Spider-Man: Far From Home!","2m 52s","2019-07-08T15:30:01Z"
DhnZKjNxyBM,"Energy Manipulation | Marvel Make Me a Hero","4m 11s","2019-07-07T16:00:04Z"
"Zsd-LPGWFUE","Iron Fist (Danny Rand) | Marvel 101","1m 21s","2019-07-06T17:00:08Z"
Wl7h6Ve0uHY,"Marvel’s Agents of S.H.I.E.L.D. | Season 6, Ep. 8 ‘Collision Course’ Promo",31s,"2019-07-05T18:06:58Z"
1IZf1_QstBs,"MCU Newscaster Reads Marvel Headlines!","4m 44s","2019-07-05T15:00:00Z"
FA8iF03TxGE,"Mysterio from Spider-Man: Far From Home | Marvel Becoming","2m 47s","2019-07-03T16:00:04Z"
8GQZ0lDDAt0,"New Kids on the Marvel Block! | Marvel’s Pull List","3m 59s","2019-07-02T21:15:00Z"
ihPIQP3Crhs,"Goose the Cat of Marvel Studios' Captain Marvel | Ask Marvel",51s,"2019-07-02T17:15:01Z"
WhfaLL0_41s,"Today in Marvel History: The Avengers Assemble for the First Time!",53s,"2019-07-02T14:45:00Z"
PiY5pfiU34A,"'Spider-Man: Far From Home' Director Reveals Inspiration for Film’s Setting","1m 26s","2019-07-01T20:30:00Z"
PTtxcPOYHtk,"Top 10 Animal-Themed Marvel Villains!","2m 32s","2019-07-01T17:00:02Z"
FshRKgpHdCQ,"'Spider-Man: Far From Home' in Theaters AND Marvel Games Tomorrow! | Marvel Minute","1m 42s","2019-07-01T14:30:02Z"
xibaUMPlO2E,"Tom Holland! Zendaya! Jake Gyllenhaal! Samuel L. Jackson! | Earth's Mightiest Show",3m,"2019-06-30T19:30:02Z"
sLcfCo_YdpI,"Water Manipulation | Marvel Make Me a Hero","3m 41s","2019-06-30T15:30:01Z"
a91ZzzPLkoE,"Inhumans | Marvel 101","1m 21s","2019-06-29T19:15:00Z"
3YRTg8i3P9c,"Mike Lawrence knows a lot about Spider-Man | Marvel Let's Play","3m 41s","2019-06-29T15:15:00Z"
QoW5X5umKCA,"Preeti Chhibber Writes a New Book for Marvel Studio’s Spider-Man: Far From Home","2m 15s","2019-06-28T23:30:00Z"
nYmXlnb6gvo,"Greg Pak talks WAR OF THE REALMS: NEW AGENTS OF ATLAS! | This Week in Marvel","3m 13s","2019-06-28T19:00:05Z"
QWt9yrURX54,"Marvel Studios’ Avengers: Endgame | “Everything” TV Spot",16s,"2019-06-28T17:01:44Z"
lQmC6BSc9yg,"Marvel’s Agents of S.H.I.E.L.D. | Season 6, Ep. 7 ‘That’s Not Coulson’ Promo",31s,"2019-06-28T16:00:12Z"
QTMRq3S4hG8,"Women of Marvel Celebrates Pride Month | Women of Marvel","4m 5s","2019-06-28T15:00:08Z"
"0xl-qeU_pzo","Marvel Studios' Avengers: Endgame | ""All Day"" TV Spot",16s,"2019-06-27T17:00:00Z"
IX8JZuLU81Y,"Spider-Man: Far From Home Countdown Special! | Earth’s Mightiest Show","10m 1s","2019-06-27T16:30:01Z"
kEljkcJR7XY,"Spider-Man: Far From Home Red Carpet | Best Moments!","6m 42s","2019-06-27T05:20:05Z"
4oxQC7qFGzc,"JB Smoove on joining the Marvel Cinematic Universe in Spider-Man: Far From Home","2m 26s","2019-06-27T05:15:42Z"
f5LjFLIwG08,"Emma Fuhrmann (Cassie Lang) on shipping Peter + MJ LIVE at the Spider-Man: Far From Home red carpet","1m 30s","2019-06-27T03:58:44Z"
HLWXSXiHDN8,"Pete Wentz wants to know what happens in Spider-Man: Far From Home LIVE from the red carpet","3m 14s","2019-06-27T03:53:12Z"
zlSD7x2k6O8,"Executive Producer Eric Hauserman Carroll LIVE from the Spider-Man: Far From Home red carpet","1m 49s","2019-06-27T03:43:00Z"
X3wKbNFef1M,"Writers Chris McKenna and Erik Sommers reveal the creative process for Spider-Man: Far From Home","3m 48s","2019-06-27T03:42:59Z"
YnryobNrchg,"Kevin Feige reveals the secret connections of Spider-Man: Far From Home and Avengers: Endgame","3m 33s","2019-06-27T03:30:45Z"
nSXDBA4z4BM,"Jake Gyllenhaal adores Tom Holland and wants everyone to know it","3m 49s","2019-06-27T03:25:09Z"
RnkaBn4fmno,"Spider-Man star Tom Holland avoids spoilers on the Spider-Man: Far From Home red carpet!","2m 45s","2019-06-27T03:18:22Z"
ElUbTyafVB4,"Jon Favreau on his role of a lifetime in Spider-Man: Far From Home LIVE on the red carpet","5m 21s","2019-06-27T03:12:16Z"
Jy2EGkuoeb4,"Raising Spider-Man with Marisa Tomei LIVE from the Spider-Man: Far From Home red carpet","2m 57s","2019-06-27T02:59:39Z"
I0agZLVpqao,"Angourie Rice answers fan questions LIVE from the Spider-Man: Far From Home red carpet","3m 56s","2019-06-27T02:54:23Z"
omYW1FmnQGU,"Sharon Blynn LIVE from the Spider-Man: Far From Home red carpet","1m 44s","2019-06-27T02:50:34Z"
ZOF5_zI8w1A,"Spider-Man: Far From Home Red Carpet | FULL STREAM","1h 59m 35s","2019-06-27T02:49:32Z"
"-v9AlbrrEto","Samuel L. Jackson talks about Nick Fury's return in Spider-Man: Far From Home","4m 16s","2019-06-27T02:42:13Z"
5uDBM9XcxOk,"Director Jon Watts on picking up Spider-Man's story after Avengers: Endgame","2m 43s","2019-06-27T02:38:28Z"
G6qvLTbfzDg,"Remi Hii & Tony Revolori LIVE from the Spider-Man: Far From Home red carpet!","3m 18s","2019-06-27T02:22:38Z"
QtrImOnUcwM,"Martin Starr LIVE at the Spider-Man: Far From Home red carpet","2m 48s","2019-06-27T02:22:38Z"
h73v0VFVKM4,"Spider-Man's ""sidekick"" Jacob Batalon LIVE from the Spider-Man: Far From Home red carpet!","2m 35s","2019-06-27T02:22:37Z"
v8NsSSOYMlY,"Numan Acar talks working with Samuel L. Jackson on Spider-Man: Far From Home","1m 36s","2019-06-27T02:22:37Z"
0UugUD4gukM,"Cobie Smulders shares Maria Hill's journey LIVE from the Spider-Man: Far From Home red carpet","2m 50s","2019-06-27T02:19:36Z"
PKf7T08a248,"Zendaya finds inspiration for MJ at the Spider-Man: Far From Home world premiere","4m 4s","2019-06-27T02:11:11Z"
LD8ojiiya3o,"Spider-Man Artists from the 1990s! | This Week in Marvel","4m 54s","2019-06-26T14:30:01Z"
"w-lUE5egBqs","Marvel Studios' Avengers: Endgame | On Digital 7/30 & Blu-ray 8/13","1m 1s","2019-06-26T14:15:14Z"
08E3HpjFW_U,"WAR OF THE REALMS Culminates in a Climactic Conclusion!","4m 19s","2019-06-26T01:00:01Z"
nuu9GThyi4Q,"X-MEN: HOUSE OF X and POWERS OF X Trailer","2m 7s","2019-06-25T22:00:05Z"
n5XZRh1wBzE,"Ironheart Savory Oatmeal | Eat the Universe","7m 42s","2019-06-25T16:45:02Z"
mBa5bsjlJi8,"Today in Marvel History: X-FORCE is Introduced!",45s,"2019-06-25T14:15:01Z"
ixCsdtUUaeU,"Spider-Man Swings into Marvel Games with 'Spider-Man: Far From Home'-Inspired Event",52s,"2019-06-25T00:05:37Z"
FOFCS_opkRM,"Spider-Ham Saves the Day and Legion Returns! | Marvel Minute","1m 29s","2019-06-24T15:00:02Z"
O4vNreolGjw,"Spider-Man (Peter Parker) | Marvel 101","1m 26s","2019-06-23T21:00:02Z"
lVypEduSc5A,"Dax ExclamationPoint! | Marvel Make Me a Hero","3m 45s","2019-06-23T15:00:06Z"
"F8Goeue-Zxw","Gaby Dunn presses the ""crime"" button in Marvel's Spider-Man for PS4","4m 2s","2019-06-22T22:00:00Z"
aXP0iMM7qjk,"KISS printed comics using their own blood?!","5m 32s","2019-06-22T17:00:02Z"
VhsRkyhTy9s,"Ann Nocenti talks editing Marvel Comics in the 1980s!","2m 42s","2019-06-21T21:15:00Z"
GqXQvP7sxVw,"Marvel’s Agents of S.H.I.E.L.D. | Season 6, Ep. 6 'No Escape' Promo",31s,"2019-06-21T19:00:00Z"
bPDTxWRNQH8,"Bishop Travels Back in Time to the 1990s to Become a Fan Favorite","2m 48s","2019-06-21T16:45:10Z"
WoaQEzeU7u8,"Krysten Ritter Makes Her Directorial Debut with Marvel’s Jessica Jones",2m,"2019-06-20T21:00:02Z"
AJ2cKDOXte4,"Epic Moments from the Dark Phoenix Saga! | Earth's Mightiest Show","10m 57s","2019-06-20T16:15:00Z"
6WsuZCebPDY,"J.J. Abrams & Henry Abrams' Spider-Man Announcement | Marvel Comics",55s,"2019-06-20T14:00:00Z"
sNtElk5TxUs,"Nightstalkers | Marvel 101","1m 36s","2019-06-19T22:15:01Z"
yPYQOHiXC9c,"90s X-Men and Magneto Cosplay! | Marvel Becoming","5m 13s","2019-06-19T18:15:00Z"
