"Video ID",Title,Length,Published
epOInfo_LWU,"Stan Lee | Announcement | Disney+",26s,"2022-12-28T18:00:12Z"
7iG8wJVepGA,"Iron Man's Tech Turned Against Him?! | Marvel's Long Story Short","5m 9s","2022-12-22T19:00:02Z"
x6Mxf9E5nrw,"Meet Namor's Warriors | Marvel Studios' Black Panther: Wakanda Forever","2m 28s","2022-12-21T20:00:30Z"
5gWehaeq1Ew,"Marvel's Wastelanders: Episode 1","43m 32s","2022-12-19T16:00:04Z"
"8xIr-VJX110","Daredevil: The Protector Of Hell's Kitchen","4m 10s","2022-12-18T20:00:02Z"
v0q2jL_b3QY,"Behind the Scenes: The New Black Panther Suit | Marvel Studios' Black Panther: Wakanda Forever","5m 34s","2022-12-17T20:00:11Z"
mn7imhErLE8,"Monica Rambeau: Photon #1 Trailer | Marvel Comics",38s,"2022-12-16T21:00:20Z"
3V8H_ARLN3Y,"RED GOBLIN #1 Trailer | Marvel Comics","1m 47s","2022-12-14T21:00:02Z"
loXtfM4qiHY,"X-Men: Sins of Sinister Alpha Trailer | Marvel Comics","2m 12s","2022-12-09T21:30:04Z"
Dr3fpmRnokc,"Review | Marvel Studios’ Special Presentation: The Guardians of the Galaxy Holiday Special",31s,"2022-12-09T17:00:10Z"
gfpUsuGAg3I,"Fight the Multiverse | Marvel Contest of Champions","2m 10s","2022-12-09T16:00:18Z"
ONJ2Cr8h6A8,"Hero ft. Martin Garrix & JVKE | ANIMATED CINEMATIC | MARVEL SNAP","2m 50s","2022-12-08T18:00:14Z"
"BowUySYwg-8","Marvel's Wastelanders: Story So Far","2m 19s","2022-12-08T16:00:06Z"
c83E2V0r0ho,"Sabotage At The Mantis House | Champion Reveal Trailer | Marvel Contest of Champions","1m 23s","2022-12-05T18:00:10Z"
el4Sw38LbEw,"The Guardians of the Galaxy Holiday Special Is Out NOW!","1m 42s","2022-12-05T17:00:32Z"
"qnfc8kT-7MA","Marvel's Wastelanders | Trailer","1m 58s","2022-12-05T15:00:22Z"
S1xPHEt_Mks,"Marvel Studios’ Black Panther: Wakanda Forever | Namor",53s,"2022-12-03T19:00:16Z"
9reTrHdL7rQ,"Marvel's Midnight Suns | Accolades Trailer",1m,"2022-12-02T19:30:00Z"
"o4AQ-q8AeKo","Marvel Studios’ Black Panther: Wakanda Forever | Ship",16s,"2022-12-02T17:00:29Z"
cRSwXvMcT5c,"The Legacy of Ant-Man | Brazil Comic Con Special Look","2m 7s","2022-12-01T22:07:15Z"
u3V5KDHRQvk,"Marvel Studios’ Guardians of the Galaxy Volume 3 | Official Trailer","1m 57s","2022-12-01T22:01:32Z"
"fFp--oobraM","New Heroes for FIFA 23 Ultimate Team","7m 27s","2022-11-30T16:00:30Z"
VBsB3FgqEx4,"Marvel's Midnight Suns Developer Livestream | Rise Up With The Midnight Suns","1h 31m 15s","2022-11-29T19:37:40Z"
"kTHMbNo4-n8","Marvel's Midnight Suns | Official Launch Trailer","2m 24s","2022-11-29T18:00:13Z"
lT9z8hSfpfk,"Marvel's Avengers | The Winter Soldier | Cloning Lab Trailer",46s,"2022-11-28T18:00:32Z"
on0QQWQmPso,"Nico TV - Prequel Shorts | Marvel's Midnight Suns","5m 6s","2022-11-28T17:00:29Z"
2o4dJ3YhPoU,"The Cast of Black Panther: Wakanda Forever Answer YOUR Questions!","3m 7s","2022-11-25T19:00:02Z"
3MVukkermNI,"Marvel Studios’ Special Presentation: The Guardians of the Galaxy Holiday Special | Christmas Time",31s,"2022-11-25T17:00:05Z"
6TAwfAD7ikY,"Marvel's Avengers | The Winter Soldier | Combat Trailer","4m 30s","2022-11-25T16:00:05Z"
MsnRzvKRRx0,"Marvel’s Midnight Suns x MARVEL Strike Force Collaboration Event | Magik Midnight Suns Costume",52s,"2022-11-23T22:00:08Z"
ELtbTkqXXQo,"The Secret Invasion Was Caused By Hypnotized Cows?! | Long Story Short","5m 57s","2022-11-23T19:00:07Z"
x2WWtlfYmk8,"Marvel's Avengers | The Winter Soldier | Narrative Trailer","3m 3s","2022-11-23T17:34:35Z"
DfgATLaicJc,"Marvel's Avengers | The Winter Soldier | Launch Trailer",58s,"2022-11-23T16:00:10Z"
Il2FcrqHFMg,"Marvel’s Guardians of the Galaxy | Creating the Star-Lord band","6m 52s","2022-11-22T19:00:15Z"
owWo7Lgq4A0,"The Daywalker - Prequel Shorts | Marvel's Midnight Suns","5m 8s","2022-11-22T17:00:40Z"
8OnkjT3SZV8,"Marvel Studios’ Black Panther: Wakanda Forever | #1 Movie for 2 Weeks",16s,"2022-11-20T17:00:06Z"
IH4Z3tgPjF8,"Marvel Studios’ Black Panther: Wakanda Forever | Wakanda Forever",31s,"2022-11-19T17:00:14Z"
_pAmhY0siWM,"Marvel Studios’ Special Presentation: The Guardians of the Galaxy Holiday Special | Featurette","1m 16s","2022-11-18T19:08:21Z"
hY3qiRq0yEM,"Marvel’s Spider-Man: Miles Morales | PC Launch Trailer","1m 38s","2022-11-18T16:00:23Z"
A3F8tOMjNH4,"SCARLET WITCH #1 Trailer | Marvel Comics","1m 48s","2022-11-17T15:00:07Z"
tsETHHx4Kh4,"INVINCIBLE IRON MAN #1 Final Trailer",43s,"2022-11-16T19:00:34Z"
OlwkKGxENoA,"Hell On Wheels - Prequel Shorts | Marvel's Midnight Suns","7m 6s","2022-11-15T17:00:15Z"
"kyMMq8Kz-8I","Marvel Studios' Black Panther: Wakanda Forever | Global Celebration",31s,"2022-11-13T17:00:36Z"
bGid3n9mqbI,"Marvel Studios' Black Panther: Wakanda Forever | In Theaters Now",31s,"2022-11-12T17:00:25Z"
LZx22ZcMPy0,"Battle for Wakanda | Marvel Contest of Champions","1m 2s","2022-11-11T22:00:09Z"
CT0z0LLJXmE,"Marvel Studios’ Black Panther: Wakanda Forever | Cast Unboxing","1m 1s","2022-11-11T21:00:07Z"
SY_UKKsa_Zc,"Marvel Studios’ Black Panther: Wakanda Forever | Now Playing",1m,"2022-11-11T17:00:18Z"
mqYGw8oaroQ,"Marvel Studios’ Black Panther: Wakanda Forever | Guess Who","1m 57s","2022-11-11T04:28:45Z"
e_TqrYihR7E,"Dream Team-Ups? | The Cast & Crew of Marvel Studios' Black Panther: Wakanda Forever","3m 25s","2022-11-10T23:30:07Z"
7nb3Q74UrXA,"Wakanda Por Siempre.",56s,"2022-11-10T23:09:59Z"
KZerM0TAh_Q,"Marvel Studios’ Black Panther: Wakanda Forever | Mexico City Q&A","31m 17s","2022-11-10T22:30:17Z"
GXQWWhGabPM,"The Dashers | Full Comic","11m 49s","2022-11-10T15:00:11Z"
Sa13L_4gfAQ,"Marvel Studios’ Black Panther: Wakanda Forever | In Theaters Tonight",31s,"2022-11-10T14:15:01Z"
7ZORrCcXo24,"Marvel Studios’ Black Panther: Wakanda Forever | In Theaters Tomorrow Night",16s,"2022-11-09T19:30:00Z"
B7mpN_cOAEs,"FANTASTIC FOUR #1 Teaser | Marvel Comics",40s,"2022-11-09T18:30:10Z"
qWWe_0Z41e0,"The Dashers | Chapter 5","2m 29s","2022-11-09T17:00:40Z"
m5WbtOrzNhY,"Marvel Studios’ Black Panther: Wakanda Forever | African Premiere",49s,"2022-11-08T23:00:23Z"
4QY_JvfATTU,"A New Sun Must Rise - Prequel Shorts | Marvel's Midnight Suns","7m 4s","2022-11-08T17:00:05Z"
btJfmhY5Y4o,"Sea of Troubles | Champion Reveal Trailer | Marvel Contest of Champions","1m 39s","2022-11-07T18:00:14Z"
"Z-alXY_6f94","Marvel Studios’ Black Panther: Wakanda Forever | Ryan Coogler","2m 19s","2022-11-07T17:00:25Z"
ZINiIBHyX14,"Marvel Studios' Black Panther: Wakanda Forever In Theaters This Week! | Marvel Minute","1m 35s","2022-11-07T15:00:16Z"
R7esI4S_uYo,"Marvel Studios’ Black Panther: Wakanda Forever | Live",31s,"2022-11-05T16:07:01Z"
CQbKSDyt7IU,"Black Panther | Marvel Studios’ Legends | Disney+",40s,"2022-11-04T21:30:04Z"
QbX7Qlg6cqc,"Marvel Studios’ Special Presentation: Director By Night | Official Trailer | Disney+","1m 20s","2022-11-04T20:00:11Z"
vUwLkOZFxaM,"INVINCIBLE IRON MAN #1 Trailer | Marvel Comics","1m 38s","2022-11-04T17:00:40Z"
P5vp_QPttf4,"Marvel Studios’ Black Panther: Wakanda Forever | One Week",1m,"2022-11-04T15:30:05Z"
5z5nSBI2LAY,"Unboxing a very-special Xbox with Letitia Wright","1m 5s","2022-11-03T20:00:01Z"
"BUo--zPPSyw","Assembled | Marvel Studios’ She-Hulk: Attorney at Law | Disney+","1m 14s","2022-11-03T18:00:04Z"
"8ML-5AAiM1Y","Marvel Studios’ Black Panther: Wakanda Forever | Lift Me Up",1m,"2022-11-03T17:00:08Z"
qOs66S6zWKM,"Marvel’s Iron Man VR - Launch Trailer | Quest 2","1m 1s","2022-11-03T14:00:24Z"
GXIwRv1q9bg,"The Dashers | Chapter 4","2m 32s","2022-11-02T16:00:19Z"
"o77h301-VIE","Marvel Studios’ Black Panther: Wakanda Forever | Namor","1m 46s","2022-11-01T17:00:28Z"
"w_-2mYtc1iY","Marvel Studios' Black Panther: Wakanda Forever | Remember",31s,"2022-11-01T16:00:34Z"
CWAe9B6sRz8,"🚪 Trick or treat!",47s,"2022-10-31T19:00:06Z"
er2utNHGTmQ,"Salem Sisters | Prequel Shorts | Marvel's Midnight Suns","8m 8s","2022-10-31T16:00:24Z"
oN7aELE1HIo,"The Queen has arrived | Marvel Studio's Black Panther: Wakanda Forever",16s,"2022-10-30T16:30:06Z"
UWCf7GNy6cc,"Rihanna - Lift Me Up (Wakanda Forever Lyric Video)","3m 18s","2022-10-30T16:00:17Z"
f9oFE8IYN7s,"They call him Namor | Marvel Studios' Black Panther: Wakanda Forever",12s,"2022-10-29T19:00:13Z"
UIiUSqfmT_s,"Behind the Scenes | VFX of Marvel Studios' She-Hulk: Attorney at Law","6m 48s","2022-10-29T16:00:30Z"
Mx_OexsUI2M,"Rihanna - Lift Me Up (From Black Panther: Wakanda Forever)","3m 33s","2022-10-28T19:30:03Z"
6gcr3_6YZos,"Marvel Studios’ Black Panther: Wakanda Forever | World Premiere",49s,"2022-10-28T19:30:00Z"
zimcd8omqPc,"Miles Morales: Spider-Man #1 Trailer","1m 43s","2022-10-28T19:00:38Z"
KOcJvsD0Y4U,"How The Spider-Verse Saves the Multiverse! | Marvel's Long Story Short","4m 32s","2022-10-28T17:30:04Z"
aa1xzhJIFJc,"Marvel's Midnight Suns | ""Deadpool Did It"" - Season Pass Reveal Trailer","1m 16s","2022-10-28T16:00:01Z"
wYfWVN_UClE,"Rihanna - Lift Me Up (Lyric Video)","3m 17s","2022-10-28T04:23:07Z"
2qml0WU9hIM,"Rihanna - Lift Me Up (Wakandan Lyric Video)","3m 17s","2022-10-28T04:23:02Z"
"uz2-eYojYAM","Rihanna - Lift Me Up (Audio)","3m 17s","2022-10-28T04:19:53Z"
ixZLIOkTkxE,"Rihanna - Lift Me Up (Instrumental Video)","3m 16s","2022-10-28T04:19:49Z"
"ospQ06jJe-I","Rihanna - Lift Me Up (Visualizer)","3m 17s","2022-10-28T04:08:02Z"
QPNa54GA53g,"Marvel Studios' Black Panther: Wakanda Forever Fans React Presented by Hasbro","2m 18s","2022-10-27T20:00:12Z"
878MCS2H8LU,"Black Panther Trivia At The Premiere Of Black Panther: Wakanda Forever Presented By Lexus","3m 19s","2022-10-27T18:00:05Z"
UH0KeoB72zs,"Marvel Studios' Black Panther: Wakanda Forever | Time",1m,"2022-10-27T17:00:16Z"
E0EEWcz35Dw,"Marvel's Guardians of the Galaxy | Crafting the Story","4m 47s","2022-10-27T16:00:07Z"
CTKLSaaY7OU,"Sydeon At The Premiere Of Marvel Studios' Black Panther","2m 19s","2022-10-27T15:00:07Z"
"HidfFQO-lZE","Best Red Carpet Moments! | Marvel Studios' Black Panther: Wakanda Forever","4m 4s","2022-10-27T05:19:29Z"
6xBU7gMO460,"Inside The Dora Milaje In Black Panther: Wakanda Forever with Michaela Coel","1m 54s","2022-10-27T04:44:28Z"
uJZQ8emo7Vc,"Dominique Thorne On Making Her MCU Debut as Ironheart","1m 43s","2022-10-27T04:41:15Z"
KVkYQxpKqWQ,"Winston Duke On What Black Panther: Wakanda Forever Means To Him","2m 35s","2022-10-27T04:40:48Z"
exzPdi8gwyg,"Victoria Alonso and Louis D'Esposito On Introducing Namor in Black Panther: Wakanda Forever","2m 54s","2022-10-27T04:38:39Z"
zHqpfbu9pBM,"Lake Bell Joins The MCU In Black Panther: Wakanda Forever","2m 30s","2022-10-27T04:29:01Z"
OcHz9EBlHSE,"Ruth Carter On The Intricate Costumes In Black Panther: Wakanda Forever","3m 48s","2022-10-27T04:26:00Z"
Ba1ofUOWCew,"Kevin Feige On Expanding the MCU with Phase Four and Black Panther: Wakanda Forever","2m 40s","2022-10-27T04:22:23Z"
KV6eA9NKrxQ,"Alex Livinalli On The Magnitude Of Marvel Studios' Black Panther: Wakanda Forever","2m 34s","2022-10-27T04:20:20Z"
"Hi4bC-3vZlk","Lupita Nyong'o On Nakia In Marvel Studios' Black Panther: Wakanda Forever","2m 17s","2022-10-27T04:02:00Z"
XHhX2wJxUmU,"Mabel Cadena On Freediving As Namora In Marvel Studios' Black Panther: Wakanda Forever","3m 2s","2022-10-27T03:55:01Z"
"S_kMYes1l-0","Danai Gurira and Letitia Wright On The Strong Black Women In Black Panther: Wakanda Forever","2m 26s","2022-10-27T03:51:45Z"
iZyb0pXFJs8,"Black Panther: Wakanda Forever Producer Nate Moore On Namor","4m 30s","2022-10-27T03:39:36Z"
6lZQGzyAqwA,"Tenoch Huerta On Bringing Namor To The MCU in Black Panther: Wakanda Forever","3m 44s","2022-10-27T03:39:00Z"
PG6JusXCRSA,"Angela Bassett On The Emotions Of Returning To Black Panther: Wakanda Forever","3m 56s","2022-10-27T03:32:04Z"
"xVML-239L3Q","Abbott Elementary's Quinta Brunson At The Premiere Of Black Panther: Wakanda Forever","2m 14s","2022-10-27T03:23:51Z"
vx68sPuOpQk,"Black Panther: Wakanda Forever Composer Ludwig Göransson","3m 1s","2022-10-27T03:16:39Z"
o9JUuUHxZnA,"Discovering Ironheart with Marvel Studios' Casting Director Sarah Halley Finn","3m 28s","2022-10-27T03:15:34Z"
qpMl7aydbdc,"Black Panther: Wakanda Forever Production Designer Hannah Beachler On Inspiring Artists","3m 25s","2022-10-27T03:11:24Z"
Kk7xu1Y7ulA,"Ryan Coogler On Returning To The World Of Wakanda In Marvel Studios' Black Panther: Wakanda Forever","3m 50s","2022-10-27T03:10:42Z"
p1JLfZeclyo,"Marvel Studios’ Black Panther: Wakanda Forever | Red Carpet LIVE","2h 26m 30s","2022-10-27T02:48:00Z"
eOECV17jbnY,"Ghost Acoustic | ""Marvel's Guardians of the Galaxy: Original Video Game""","5m 45s","2022-10-26T19:00:15Z"
CV3t6OfAjKs,"Marvel Studios’ Black Panther: Wakanda Forever | Throne",31s,"2022-10-26T17:15:00Z"
"kDcR-J_iOVc","The Dashers | Chapter 3","3m 23s","2022-10-26T16:00:35Z"
OYhFFQl4fLs,"Marvel Studios’ Special Presentation: The Guardians of the Galaxy Holiday Special | Official Trailer","1m 15s","2022-10-25T18:30:18Z"
X4QzYBlfdb8,"Marvel Studios’ Ant-Man and The Wasp: Quantumania | Official Trailer (Ant-Size Version)","2m 20s","2022-10-25T01:31:15Z"
"ZlNFpri-Y40","Marvel Studios’ Ant-Man and The Wasp: Quantumania | Official Trailer","2m 20s","2022-10-24T16:00:40Z"
vs4TwfoIYo0,"Who is Adam Warlock?","5m 21s","2022-10-22T16:00:38Z"
JuGZiOM10V8,"AVENGERS ASSEMBLE ALPHA #1 Trailer | Marvel Comics","1m 57s","2022-10-21T20:00:11Z"
_cCrp8gDsVA,"Marvel Studios’ Black Panther: Wakanda Forever | Long Live Wakanda",46s,"2022-10-21T03:56:55Z"
L6NqIbzTxLw,"Marvel's Midnight Suns | “Where the Heck is Deadpool?!""",43s,"2022-10-20T14:00:10Z"
a_z2sfg6F2s,"Marvel's Spider-Man Remastered | Halloween Party (Back to School) Mission","3m 50s","2022-10-19T20:00:01Z"
pcNKwgIXL9I,"DEADLY NEIGHBORHOOD SPIDER-MAN #1 Trailer | Marvel Comics",47s,"2022-10-19T18:00:30Z"
BKrGc4138aA,"The Dashers | Chapter 2","3m 16s","2022-10-19T17:00:06Z"
kI_aPiGaAWY,"S.H.I.E.L.D. Replaces Director Nick Fury With a MARVEL SNAP Player","1m 1s","2022-10-18T15:30:15Z"
_mvzI0IhiXk,"Monsters in the MCU | Disney+","2m 3s","2022-10-17T16:00:21Z"
GNuq6E3enZQ,"MARVEL SNAP | Gameplay Trailer","1m 20s","2022-10-14T16:00:09Z"
yYt_UP3H7Xc,"Marvel Studios Star Xochitl Gomez Tours the Disney Wish! | Disney Cruise Line","1m 30s","2022-10-13T23:00:22Z"
63xU9nuikdg,"Twerking | She-Hulk: Attorney at Law | Disney+",31s,"2022-10-13T20:00:01Z"
FLop8vMHfcE,"Marvel's Spider-Man: Miles Morales - PC Features Trailer | PC Games","1m 19s","2022-10-13T15:00:10Z"
ouveahkZ4ww,"Intelligencia | She-Hulk: Attorney at Law | Disney+","1m 1s","2022-10-12T19:00:29Z"
g18ojcisgLg,"The Dashers | Chapter 1","2m 22s","2022-10-12T16:00:33Z"
F4ItqxQ7qzc,"Behind the Scenes with She-Hulk's Lawyer",7m,"2022-10-11T20:00:05Z"
LjO87EB_YO8,"Marvel Studios' Black Panther: Wakanda Forever | One Month",31s,"2022-10-11T18:00:06Z"
kypetXduCJk,"Marvel's Iron Man VR | Meta Quest 2",42s,"2022-10-11T17:16:02Z"
_AkZ1aG5jYA,"Beginning | Marvel Studios’ She-Hulk: Attorney at Law | Disney+",31s,"2022-10-11T15:00:33Z"
V5ym9Sqc9_Y,"Marvel Studios' Black Panther: Wakanda Forever | Return to Wakanda","2m 41s","2022-10-11T13:47:41Z"
A0hmPYAzKME,"The Civilian Life Of Captain America","6m 25s","2022-10-10T21:30:00Z"
"wx047-Yl-Gc","How Sam Wilson Became Captain America | Long Story Short","3m 29s","2022-10-10T16:00:42Z"
4ricDvyD5mA,"The Best of Marvel LIVE at New York Comic Con 2022!","6m 32s","2022-10-10T00:00:01Z"
jeqIZXBheMI,"Marvel LIVE from NYCC 2022! | Day 4","2h 2m 31s","2022-10-09T20:08:55Z"
Eh7T4GFZBwc,"Exclusive Access To Artist Alley At New York Comic Con","3m 38s","2022-10-09T20:07:28Z"
_2MaGgf1jhI,"Simon Spurrier Talks Legion of X At NYCC 2022","7m 33s","2022-10-09T19:55:48Z"
UIVQgwLN8N0,"Superstar Marvel Comics Creator Peach Momoko at New York Comic Con","4m 36s","2022-10-09T19:46:18Z"
FUTZz1zQelE,"The New Era Of X-Men Revealed At NYCC 2022","6m 19s","2022-10-09T19:43:47Z"
aCpSpocjzNU,"Exclusive New Marvel Funko Items At NYCC 2022","3m 23s","2022-10-09T19:28:21Z"
0i5FyBcs7oU,"Drawing Riri Williams for Marvel Comics","6m 27s","2022-10-09T19:12:32Z"
3WnlQRIWzlk,"The Best Marvel Cosplay at NYCC 2022!","16m 58s","2022-10-09T19:10:01Z"
xbq5ENOtpvU,"Zeb Wells on Writing the Upcoming Spider-Man & X-Men Event: DARK WEB!","5m 22s","2022-10-09T15:00:39Z"
Obv_tOgJza4,"Secrets of Marvel SNAP at NYCC!","3m 11s","2022-10-08T21:19:11Z"
xmLTHrrCWkw,"Marvel LIVE from NYCC 2022! | Day 3","3h 2m 20s","2022-10-08T21:12:24Z"
68U8HoOY2Po,"Where Is YOUR Favorite Comic Book Shop?","2m 58s","2022-10-08T20:57:57Z"
"GVH-VUMcrfs","SINS OF SINISTER #1 Teaser | Marvel Comics",44s,"2022-10-08T20:27:31Z"
VKfHoTwuuqU,"DARK WEB Trailer | Marvel Comics","1m 45s","2022-10-08T20:07:49Z"
JdiqLM6ShxI,"Loki Joins The Hall Of Heroes At Madame Tussaud's NYC!","5m 34s","2022-10-08T20:02:00Z"
Lz02uLE6pAY,"Artist Rachael Stott On Drawing Fantastic Four","4m 51s","2022-10-08T19:35:32Z"
mJJE7SXuCsQ,"Bloodline: Daughter of Blade Announced at NYCC 2022!","10m 10s","2022-10-08T19:34:32Z"
rsgCQDS_Wjc,"Inside The Different Personalities of Moon Knight with Jed MacKay","6m 45s","2022-10-08T19:30:18Z"
NkhVkXzn2pw,"Beyond Amazing Spider-Man Cosplay at NYCC 2022","6m 59s","2022-10-08T18:53:55Z"
WboWAks_6B0,"Writing Venom and Carnage with Ram V at NYCC 2022","5m 43s","2022-10-07T22:47:37Z"
M0f7B8okjeg,"Behind-the-Scenes: Making of the Marvel Wax Figures at Madame Tussauds","9m 21s","2022-10-07T21:42:11Z"
XAe9SChZ6kA,"Marvel LIVE from NYCC 2022! | Day 2","3h 2m 5s","2022-10-07T21:13:49Z"
HtecVzSqumw,"Incredible Ghost Rider Toys from Hasbro at NYCC 2022","12m 30s","2022-10-07T20:42:09Z"
7rcnuXJqKYo,"How Well Do You Know The World of Wakanda?","30m 11s","2022-10-07T19:40:30Z"
rxdAQ1SlABE,"Marvel x Veve Booth Tour at NYCC 2022!","3m 17s","2022-10-07T19:29:09Z"
q8vh8IKcjHg,"Artist Ryan Stegman On Falling In Love With Venom","5m 21s","2022-10-07T19:22:26Z"
X897nj9uZq0,"Now Streaming | Marvel Studios’ Special Presentation: Werewolf by Night | Disney+",35s,"2022-10-07T16:20:56Z"
DzEEYsWd8HA,"Daredevil | Marvel Studios' She-Hulk: Attorney at Law | Disney+",56s,"2022-10-06T21:00:02Z"
"-s8b3m1asro","Madame Tussauds Unveils a Lifelike Loki Figure at NYCC 2022","4m 13s","2022-10-06T20:53:30Z"
2O4SagMmUNA,"Marvel LIVE from NYCC 2022! | Day 1","2h 21m 11s","2022-10-06T20:27:21Z"
XXpKOxMlQoQ,"Thunderbolts Arrive in Marvel Comics at NYCC 2022!","6m 46s","2022-10-06T19:52:19Z"
"H5xW-HEdlyk","LeapFrog | Marvel Studios' She-Hulk: Attorney at Law | Disney+","1m 3s","2022-10-05T19:00:10Z"
"g_JZv-gdghg","Episode 7 Recap | Marvel Studios' She-Hulk: Attorney at Law | Disney+",56s,"2022-10-05T18:00:18Z"
GNaai9OG6v4,"Swing Through Marvel’s Spider-Man: Beyond Amazing - The Exhibition","8m 55s","2022-10-05T14:00:06Z"
ul2wPrYVzr0,"Marvel Multiverse Role-Playing Game Explained!","2m 37s","2022-10-04T17:00:27Z"
x77m59IE6Qk,"Marvel Studios’ Black Panther: Wakanda Forever | Tickets on Sale",52s,"2022-10-03T22:00:32Z"
kHxxnSMegE8,"Arachnophobia Motion Comic | Marvel Contest of Champions","2m 3s","2022-10-03T18:00:14Z"
g2LMbPGsweU,"Marvel Heads to NYCC 2022! | Marvel Minute","1m 51s","2022-10-03T16:00:33Z"
_Z3QKkl1WyM,"Marvel Studios’ Black Panther: Wakanda Forever | Official Trailer","2m 11s","2022-10-03T13:00:01Z"
QjrWxvhDE7I,"Monstrous New Side | Marvel Studios’ Special Presentation: Werewolf by Night | Disney+","1m 37s","2022-09-30T19:07:01Z"
b31gwJBuk98,"Marvel Studios’ Thor: Love and Thunder | Drawing The Mighty Thor with Andy Park","9m 53s","2022-09-29T16:01:41Z"
oC3qPzRdbmQ,"Apologize | Marvel Studios’ She-Hulk: Attorney at Law | Disney+","1m 15s","2022-09-28T19:00:16Z"
NvGSBEbjzjQ,"Episode 6 Recap | Marvel Studios’ She-Hulk: Attorney at Law | Disney+",53s,"2022-09-28T17:15:00Z"
QTcLnqp2T1Y,"Marvel x Fortnite: Zero War | Marvel Unlimited",44s,"2022-09-28T14:00:14Z"
lsseZNpwZsk,"MARVEL’S VOICES: COMUNIDADES #1 Trailer | Marvel Comics","1m 19s","2022-09-27T15:00:36Z"
eoL2IDjc5Cs,"STRANGE ACADEMY: FINALS #1 Trailer | Marvel Comics","1m 46s","2022-09-23T22:00:18Z"
NrtwYvOI_9M,"The Cast of Marvel Studios' She-Hulk Talk How the Series Smashes Stereotypes | Presented by Toyota","1m 23s","2022-09-23T19:00:07Z"
lC7ie1xCDEY,"Marvel’s Spider-Man: Miles Morales | PC Teaser",30s,"2022-09-23T15:00:25Z"
fQ_xlE945Cg,"Chit Chat is Over | Marvel Studios’ She-Hulk: Attorney at Law | Disney+","1m 7s","2022-09-21T21:08:33Z"
4XHmYYYcRKI,"Episode 5 Recap | Marvel Studios’ She-Hulk: Attorney at Law | Disney+","1m 4s","2022-09-21T17:00:05Z"
WfsHZN2Ii1k,"Sham | Marvel Studios' She-Hulk: Attorney at Law | Disney+","1m 6s","2022-09-14T19:00:11Z"
q9qaEH9IM4g,"Episode 4 Recap | Marvel Studios' She-Hulk: Attorney at Law | Disney+",44s,"2022-09-14T18:00:18Z"
Y6XZGKkraxg,"Breaking News out of D23 Expo! | Marvel Minute","1m 45s","2022-09-12T22:00:12Z"
cmWrzXNVnCE,"Moon Girl and Devil Dinosaur Premiere Date Announced!","2m 6s","2022-09-12T20:00:22Z"
Yp6satbo14A,"Marvel's Wastelanders: Doom | Trailer","1m 51s","2022-09-12T15:00:20Z"
"_CVld-PI3xA","New Avengers Campus Attraction News from D23 Expo 2022",54s,"2022-09-11T22:00:21Z"
k_ZN0Xv2WSc,"Marvel Studios Announcements at D23 Expo 2022","10m 11s","2022-09-11T20:25:49Z"
FkUL4M7F1Qo,"Best of Marvel Cosplay at D23 Expo 2022!","1m 19s","2022-09-11T14:00:11Z"
uawf2OInDY8,"MCU Stars LIVE from the Marvel Studios panel at D23 Expo 2022","5m 58s","2022-09-11T05:55:05Z"
eZtO4ESwmMg,"Marvel Superfans React To Brand New MCU Announcements","2m 4s","2022-09-11T03:00:15Z"
Fq6_26R2QFI,"Marvel's Moon Girl and Devil Dinosaur | Teaser Trailer","1m 54s","2022-09-10T23:56:56Z"
zgvbtezWpQc,"Marvel Games + Skydance New Media Ensemble Team Up | D23 Expo 2022","10m 38s","2022-09-10T22:45:02Z"
qRwT_6BXr60,"Become a Super Hero with Marvel World of Heroes | D23 Expo 2022","7m 34s","2022-09-10T22:30:04Z"
LvzTpMf_oYc,"The Strategy Behind Marvel's Midnight Suns Video Game | D23 Expo 2022","10m 27s","2022-09-10T22:15:00Z"
XtZUuHVaN8w,"MARVEL COMICS: Celebrating 60 Years of the Amazing Spider-Man","1h 1m 35s","2022-09-10T22:14:35Z"
qZVTkn2NjS0,"Marvel Studios’ Secret Invasion | Official Trailer | Disney+","1m 57s","2022-09-10T18:55:51Z"
bLEFqhS5WmI,"Marvel Studios’ Special Presentation: Werewolf By Night | Official Trailer | Disney+","1m 27s","2022-09-10T18:52:36Z"
lYGwJgC_GPs,"Marvel’s Midnight Suns | Live Among Legends Trailer","1m 8s","2022-09-09T21:00:23Z"
k9IPmCKu7qI,"Marvel's Midnight Suns | Prequel Shorts - Intro Teaser","1m 36s","2022-09-09T21:00:21Z"
ewXXN0S81_Q,"MARVEL World of Heroes | Reveal Trailer",33s,"2022-09-09T21:00:15Z"
NQkoJrv4d3M,"Marvel Strike Force | Red Hulk Trailer",46s,"2022-09-09T21:00:12Z"
3eWAAKQcv0c,"MARVEL SNAP | Release Date Trailer","1m 30s","2022-09-09T21:00:01Z"
"-duwSMIgNMU","Marvel | Skydance New Media Project Teaser Trailer","1m 12s","2022-09-09T21:00:00Z"
mPm7MLt2BgQ,"Disney & Marvel Games Showcase | D23 Expo","23m 22s","2022-09-09T20:00:12Z"
p4pq5oJqeFg,"Tour The Marvel Studios Pavilion at D23 Expo 2022!","3m 2s","2022-09-09T17:00:35Z"
"1FdQblg-kQU","Sneak Peek | Marvel Studios' She-Hulk: Attorney at Law | Disney+","1m 40s","2022-09-09T16:00:02Z"
F7gaEO6LTqM,"It's Jeff Season 2 Trailer | Marvel Unlimited Exclusive",28s,"2022-09-09T15:00:11Z"
sKfdoUpioA8,"The Making of Thor: Love and Thunder | Official Trailer | Disney+","1m 14s","2022-09-08T18:00:30Z"
hRUMPVyoyT4,"Disney+ Day | Marvel Studios’ Thor: Love and Thunder | Disney+",19s,"2022-09-08T16:00:03Z"
z8pAY4W5qvM,"Matcher | Marvel Studios’ She-Hulk: Attorney at Law | Disney+","1m 6s","2022-09-08T00:05:00Z"
MWMeB9TdCUg,"Episode 3 Recap | Marvel Studios' She-Hulk: Attorney at Law | Disney+",56s,"2022-09-07T18:00:15Z"
yiqAhCd9nr4,"Grudge Match | Champion Reveal Trailer | Marvel Contest of Champions","1m 36s","2022-09-06T20:00:15Z"
"8OMx6FM-Q40","Marvel's Stormbreakers Class Of 2023!",1m,"2022-09-06T18:00:06Z"
RmJcFnu6pzg,"When Love Meets Thunder | Marvel Studios’ Thor: Love and Thunder | Disney+","1m 46s","2022-09-06T17:00:18Z"
2dJ0vk5dHko,"Wanda's Hidden Tribute to Vision | Marvel Studios' Wandavision",14s,"2022-09-04T14:00:02Z"
_lPYtIFZfQE,"Cameos | Marvel Studios' She-Hulk: Attorney at Law | Disney+",52s,"2022-09-02T21:54:04Z"
JqZxtg8yS44,"Thor, Thor, and Gorr | Marvel Studios’ Thor: Love and Thunder | Disney+","1m 7s","2022-09-01T19:00:10Z"
hizMoBPpBtk,"Forced to Leave | Marvel Studios’ She-Hulk: Attorney at Law | Disney+","1m 5s","2022-08-31T21:00:31Z"
"65yU4OO9-qU","Episode 2 Recap | Marvel Studios' She-Hulk: Attorney at Law | Disney+",59s,"2022-08-31T19:43:03Z"
"wjCCkDY8-y8","Hulk Smash or She-Hulk Smash? | Ask Marvel","2m 59s","2022-08-31T17:00:37Z"
"sGyBzQP-IwI","What It Takes to Draw Spider-Man","24m 42s","2022-08-30T20:00:11Z"
"hvhpg-MsGK4","Secret X-Men Trailer | X-Men Unlimited",43s,"2022-08-29T17:00:19Z"
"d4Lw5B-WY8Q","Marvel Studios' Thor: Love and Thunder | Streaming September 8",31s,"2022-08-29T16:00:23Z"
gXuObJHE8lc,"Green Things Challenge | Marvel Studios’ She-Hulk: Attorney at Law | Disney+","1m 37s","2022-08-26T20:25:07Z"
6UsZwc8aRuE,"Official Clip | Marvel Studios’ She-Hulk: Attorney at Law | Disney+","1m 13s","2022-08-24T22:00:02Z"
U8agdTVOuxw,"Previously On | Marvel Studios’ She-Hulk: Attorney at Law | Disney+","1m 13s","2022-08-24T18:00:21Z"
VdN0TWU9q2Y,"SPIDER-MAN #1 Trailer | Marvel Comics",2m,"2022-08-24T16:00:16Z"
ooQ85Y1NQCs,"Spider-Man's Sensational Origins","19m 39s","2022-08-23T20:00:21Z"
XwFFelKtDLU,"Era Review | Marvel Studios’ She-Hulk: Attorney at Law | Disney+",31s,"2022-08-19T21:40:18Z"
t82IQ38bBfQ,"Red Carpet Best Moments | Marvel Studios' She-Hulk: Attorney at Law","4m 35s","2022-08-18T20:30:03Z"
Uj5emGzqzrk,"Size | She-Hulk: Attorney at Law | Disney+",31s,"2022-08-18T17:00:30Z"
0iAh1U3EJrg,"Anger and Fear | Marvel Studios’ She-Hulk: Attorney at Law | Disney+",51s,"2022-08-17T19:00:00Z"
jXIwWvUsYJU,"Spider-Man 60th Big Releases! | Marvel Comics","19m 2s","2022-08-16T20:00:09Z"
P28Gl7E9bYg,"Disney & Marvel GAMES SHOWCASE | September 9 | D23 2022",17s,"2022-08-15T17:03:22Z"
AN1Vb54cR5E,"GLK&H Commercial | Marvel Studios’ She-Hulk: Attorney at Law | Disney+",46s,"2022-08-15T16:00:05Z"
CZH1WdMRBd8,"Marvel Studios’ She-Hulk: Attorney at Law Arrives THIS WEEK!","1m 39s","2022-08-15T14:30:05Z"
