"Video ID",Title,Length,Published
R48_eRCk1Dc,"Marvel's Avengers: Age of Ultron - Re-Assembled Featurette","1m 1s","2015-04-06T20:30:09Z"
kkY13J2rcsc,"Marvel's Daredevil - TV Spot 1",31s,"2015-04-06T17:59:55Z"
uqlOwOJGkPE,"DD Debuts! Avengers Run! And Marvel Mighty Heroes! - The Marvel Minute 2015","1m 21s","2015-04-06T15:00:01Z"
qZ2G8JSbpEo,"Marvel's Avengers: Age of Ultron - TV Spot 3",31s,"2015-04-02T22:18:12Z"
jJ0psSGUkWU,"Marvel's Avengers: Age of Ultron - TV Spot 4",31s,"2015-04-02T22:08:10Z"
4t79X2NCh4k,"Carol Danvers Becomes Ms. Marvel in Marvel Contest of Champions",20s,"2015-04-02T16:00:01Z"
60zjpOmojQ4,"Phase 9?","1m 1s","2015-04-01T20:23:00Z"
_7NJRDQyrlA,"Marvel's Rage of Ultron Trailer","1m 38s","2015-04-01T18:01:06Z"
CcynIQHMfG0,"New Game Alert: Marvel Mighty Heroes – The Watcher 2015","2m 56s","2015-04-01T16:57:18Z"
BbA2bkFMuDc,"Watch the trailer for Marvel Mighty Heroes!","1m 9s","2015-03-31T18:26:49Z"
nzyEAOvBluQ,"The Spider-Verse Finale in Spider-Man Unlimited!","1m 11s","2015-03-30T19:14:30Z"
1BjLeUKud9U,"Marvel's Agents of S.H.I.E.L.D. Season 2, Ep. 15 - Clip 2","1m 41s","2015-03-30T17:35:03Z"
5X5JXIDw064,"Free Comics, Spidey Goes Co-op, & S.H.I.E.L.D. vs. S.H.I.E.L.D.?! - Marvel Minute 2015","1m 33s","2015-03-30T15:00:02Z"
bClGSkZymoM,"Meet Quicksilver & the Scarlet Witch - Marvel's Avengers: Age of Ultron - Featurette 1","1m 16s","2015-03-28T16:00:03Z"
"cnu-azS2GX0","Marvel's Agents of S.H.I.E.L.D. Season 2, Ep. 15 - Clip 1","1m 8s","2015-03-27T23:41:45Z"
"Az0SqUQEs-Y","Marvel Heroes 2015 – She-Hulk Trailer",57s,"2015-03-26T19:46:54Z"
dhYwLVp_12Q,"Superior Minds Clash in Spider-Man Unlimited with Doc Ock!","1m 4s","2015-03-26T15:59:37Z"
zU5_oW1phJ8,"Marvel History Lesson - The Watcher 2015","2m 24s","2015-03-25T15:28:56Z"
v53rCjDOKFE,"Marvel's Ultimate Spider-Man: Web-Warriors Season 3, Ep. 12 - Clip 1","1m 25s","2015-03-24T16:00:07Z"
"2Xxe0-fEkvM","Marvel's Agents of S.H.I.E.L.D. Season 2, Ep. 14 - Clip 2","1m 48s","2015-03-23T17:59:51Z"
"g-CeEKXsNaY","Doctor Strange! Edward James Olmos! Civil Wars! - The Marvel Minute 2015","1m 31s","2015-03-23T16:30:33Z"
X4kreYvg6Ss,"Marvel's Agents of S.H.I.E.L.D. Season 2, Ep. 14 - Clip 1","1m 21s","2015-03-20T22:00:08Z"
JBHSaxTEKgY,"Contest of Champions: Dr. Strange Spotlight",22s,"2015-03-20T18:00:01Z"
beL87ZtNSh8,"Joss Whedon on the cast for Marvel's Avengers: Age of Ultron","3m 9s","2015-03-19T19:00:05Z"
0WM915QsOyI,"Marvel's Avengers: Age of Ultron - TV Spot 2","1m 1s","2015-03-19T16:38:00Z"
ltzGfeqWp_M,"Marvel's Daredevil - Street Scene Motion Poster",36s,"2015-03-19T15:02:02Z"
qHkT1G0xguw,"Secret Marvel Futures – The Watcher 2015","2m 51s","2015-03-18T16:00:02Z"
JzJ_dlIKlMs,"Marvel Word Association With Ming-Na Wen","2m 3s","2015-03-17T19:00:01Z"
xHfR86DdULw,"Marvel's Ultimate Spider-Man: Web-Warriors Season 3, Ep. 11 - Clip 1","1m 27s","2015-03-17T17:00:04Z"
"jDjq1m9-jWU","Marvel's Daredevil - Transformation Motion Poster",15s,"2015-03-17T16:00:32Z"
84aztY2xmd8,"Marvel's Agents of S.H.I.E.L.D. Season 2, Ep. 13 - Clip 2","1m 16s","2015-03-16T16:00:01Z"
3mq6FZpVguc,"Daredevil! Donald Glover! Disneyland! - Marvel Minute 2015","1m 32s","2015-03-16T15:17:17Z"
dqqWbtIjlYE,"Marvel's Agents of S.H.I.E.L.D. Season 2, Ep. 13 - Clip 1","1m 3s","2015-03-13T20:00:27Z"
H5PWi5P92BI,"James Patterson joins Marvel for Max Ride: First Flight!","1m 44s","2015-03-13T18:00:00Z"
"tKa7gnk_-4E","Joss Whedon on Ultron for Marvel's Avengers: Age of Ultron","1m 42s","2015-03-12T18:01:10Z"
uNgO9TqbQW8,"Marvel Universe Ending?! - The Watcher 2015","3m 8s","2015-03-11T15:00:04Z"
Eco1QTsmQMc,"Marvel’s Agents of S.H.I.E.L.D. Season 2, Ep. 12 – Clip 2","1m 39s","2015-03-10T19:00:00Z"
Hzp5oVmRa6E,"Marvel’s Agents of S.H.I.E.L.D. Season2, Ep. 12 – Clip 1","1m 35s","2015-03-10T17:30:01Z"
"_JSVxWx7-m0","Marvel's Ultimate Spider-Man: Web-Warriors Season 3, Ep. 10 - Clip 1","1m 3s","2015-03-10T16:00:04Z"
ZdNK8L3ZdmE,"Marvel's Daredevil - Trailer 2","2m 9s","2015-03-10T15:00:17Z"
X8S2Lmijklk,"New Trailer! Howard the Duck! Women of Gaming!","1m 21s","2015-03-09T18:18:18Z"
5AP8eVoVNjU,"Meet the Spider-Women of Marvel in Spider-Man Unlimited",43s,"2015-03-09T15:00:50Z"
x2QlV5M9CAw,"Vote for the next Spidey in Spider-Man Unlimited!",46s,"2015-03-06T18:30:00Z"
tpu05kdnua0,"Joss Whedon on world-building for Marvel's Avengers: Age of Ultron!","2m 17s","2015-03-05T20:30:01Z"
rP_hyJqH8so,"Recruit Rocket Raccoon in Marvel Contest of Champions",22s,"2015-03-05T19:16:13Z"
JAUoeqvedMo,"Marvel's Avengers: Age of Ultron - Trailer 3","2m 19s","2015-03-04T18:13:15Z"
"--wTOYvUTx8","Marvel Comics Runway – The Watcher 2015","3m 1s","2015-03-04T16:33:46Z"
7UEWHFyk0qo,"Marvel’s Agents of S.H.I.E.L.D.: Double Agent – Teaser",31s,"2015-03-03T22:48:50Z"
"v-OhbpW9mBA","Making of the Hulkbuster Funko Pop for the Collector Corps!","1m 7s","2015-03-03T19:58:51Z"
knfTFj56TTo,"Marvel's Ultimate Spider-Man: Web-Warriors Season 3, Ep. 9 - Clip 2","1m 15s","2015-03-03T17:00:04Z"
cD5gIGZPftQ,"Marvel’s Agents of S.H.I.E.L.D. Season 2, Ep. 11 – Clip 2","1m 37s","2015-03-02T23:00:01Z"
26QQYIm7SDM,"Marvel's Agents of S.H.I.E.L.D. - Clark Gregg & Chloe Bennet on Season 2","4m 31s","2015-03-02T21:45:47Z"
XNdSmjx1P24,"Inhuman Agents! Avengers Assemble! Princess Leia! - Marvel Minute 2015","1m 30s","2015-03-02T16:00:05Z"
"tu6-8VVle9s","Marvel’s Agents of S.H.I.E.L.D. Season 2, Ep. 11 – Clip 1","1m 13s","2015-02-27T21:19:10Z"
Kuh6jSqKVBc,"Behind the Scenes with Marvel Contest of Champions","1m 46s","2015-02-27T18:59:49Z"
5v1Cq7F_w_U,"Marvel's Avengers Assemble Season 2, Ep. 13 - Clip 1","1m 8s","2015-02-27T17:00:01Z"
Y65EkBFyNYc,"Marvel's Ultimate Spider-Man: Web-Warriors Season 3, Ep. 9 - Clip 1","1m 7s","2015-02-26T20:35:06Z"
cTFpoSZtUv0,"Daredevil Gets Bloody - Marvel's Daredevil Motion Poster 2",13s,"2015-02-26T20:00:00Z"
ELxLd7FPQIM,"Marvel's Agents of S.H.I.E.L.D. Returns - The Watcher 2015","2m 41s","2015-02-25T18:05:44Z"
SaoeEJCRgzo,"Marvel's Agent Carter - Dress For Success, Part 3","2m 19s","2015-02-24T22:30:00Z"
nCPmwEvZ9as,"Marvel’s Agent Carter Season 1, Ep. 8 – Clip 2",1m,"2015-02-23T23:01:00Z"
jWtbirID6lM,"Netflix Casting! Spider-Gwen! More Thors! - Marvel Minute 2015","1m 29s","2015-02-23T22:01:00Z"
"-V9nr7Fgquw","Marvel's Agents of S.H.I.E.L.D. - Mid-Season Return Preview",32s,"2015-02-23T21:01:00Z"
dj_wOgUsOxs,"Marvel’s Agent Carter Season 1, Ep. 8 – Clip 1",57s,"2015-02-23T20:32:43Z"
Fqr3OB2oPHk,"Marvel Mighty Heroes Launch Trailer",48s,"2015-02-23T16:14:22Z"
7z2R6SDYEOQ,"Iron Man Gets a Contest of Champions Upgrade",22s,"2015-02-20T18:12:33Z"
XSLM33Z5Kb4,"Marvel's Avengers Assemble Season 2, Ep. 12 - Clip 1",49s,"2015-02-20T16:30:00Z"
n1MHDNxQNGI,"Best of Toy Fair 2015","2m 42s","2015-02-19T22:00:10Z"
MxylgIMIYlo,"James Arnold Taylor as Yondu/Cosmo in ""Marvel's Guardians of the Galaxy""",10s,"2015-02-19T20:28:10Z"
i8JPFXG6jls,"Marvel's Agent Carter - Dress For Success, Part 2","3m 3s","2015-02-19T19:57:47Z"
kDVWun3x6fs,"Vanessa Marshall as Gamora in ""Marvel's Guardians of the Galaxy""",16s,"2015-02-19T17:53:08Z"
Hx6r7ULnRZw,"David Sobolov as Drax in ""Marvel's Guardians of the Galaxy""",10s,"2015-02-18T20:27:30Z"
W3jsw7fH62U,"Will Friedle as Star-Lord in ""Marvel's Guardians of the Galaxy""",14s,"2015-02-18T19:55:43Z"
"jADAFIeeL-A","Now That’s Graphic Audio! – The Watcher 2015","3m 1s","2015-02-18T18:40:17Z"
JROFuS7XElk,"Marvel's Agent Carter Season 1, Ep. 7 - Clip 2","1m 26s","2015-02-17T21:34:35Z"
yNbTBDyUADk,"Trevor Devall as Rocket in ""Marvel's Guardians of the Galaxy""",16s,"2015-02-17T20:27:45Z"
lfyazXax3b8,"Kevin Michael Richardson as Groot in ""Marvel's Guardians of the Galaxy""",14s,"2015-02-17T19:16:21Z"
1j3WZ0oq9ko,"Marvel's Agent Carter - Dress For Success, Part 1","3m 12s","2015-02-17T18:34:37Z"
Jpkx467qj9k,"Spidey Joins MCU, Toy Fair, & Silk Goes Solo - The Marvel Minute","1m 23s","2015-02-16T16:11:57Z"
"ne-_KxjSDKA","Listen to Howard The Duck #1 …WTD?!?!","4m 37s","2015-02-13T22:22:19Z"
MJ3O2cXiYOY,"Happy Valentine's Day? – Marvel Super Heroes: What The--?! Ep 40","2m 51s","2015-02-13T20:20:10Z"
66eT_4Vye_0,"Marvel's Avengers Assemble Season 2, Ep. 11 - Clip 1",55s,"2015-02-13T17:00:00Z"
"zeyfJyv-wUs","Marvel's Agent Carter Season 1, Ep. 7 - Clip 1","1m 8s","2015-02-12T20:00:00Z"
"h-PrJc9-N4o","Greatest Comic Book Couples! – The Watcher 2015","2m 57s","2015-02-11T19:22:30Z"
gvULM7s7AU0,"Marvel's Agent Carter Season 1, Episode 5 - Clip 1","1m 31s","2015-02-09T21:30:00Z"
2ZQPkJabjOc,"Marvel's Agents of S.H.I.E.L.D. - What Have They Become",31s,"2015-02-09T20:00:00Z"
ie_INBQy7Qg,"Peggy's On The Run, Daredevil Gets Gritty, Comics & More! - Marvel Minute 2015","1m 31s","2015-02-09T18:32:33Z"
w3xwib51xsQ,"Marvel's Agents of S.H.I.E.L.D. - Meet the Women of S.H.I.E.L.D.",31s,"2015-02-06T22:00:00Z"
kmh51IEiT6U,"Marvel’s Agent Carter – Hayley Atwell & James D’Arcy Interview","3m 10s","2015-02-06T21:00:01Z"
6Le_bYPTFz8,"Marvel's Avengers Assemble Season 2, Episode 10 - Clip 1","1m 2s","2015-02-06T16:00:00Z"
Exn9ehrptVM,"Electro Unleashed in Marvel Contest of Champions",22s,"2015-02-06T14:00:01Z"
ntZcgb_EMII,"Ultron’s Master Plan – Marvel Super Heroes: What The--?! Ep 39","3m 27s","2015-02-05T22:04:11Z"
AWN_WIp7mAY,"Spider-Girl, Inheritors & More! Spider-Man Unlimited Update 3",58s,"2015-02-05T18:00:00Z"
BZiFZHOeLE8,"Guardians of the Galaxy & X-Men: The Black Vortex Trailer","1m 54s","2015-02-05T14:00:01Z"
"iS6xHRk1y-s","Introducing Silk & Spider-Gwen! - The Watcher 2015","2m 55s","2015-02-04T17:00:05Z"
XC7GPdBV9WQ,"Marvel's Daredevil - Teaser Trailer","1m 31s","2015-02-04T14:30:01Z"
PcyJbPxA8o0,"Marvel's Agent Carter - Chad Michael Murray & Enver Gjokaj Interview","4m 39s","2015-02-03T19:00:01Z"
XZ3yXDFvybA,"Marvel's Daredevil - :15 Teaser",16s,"2015-02-03T17:11:32Z"
"l88rcIO-XCk","Marvel’s Agent Carter Season 1, Ep. 5 – Clip 2","1m 45s","2015-02-02T23:00:00Z"
tH_vVdpR6_8,"Marvel's Agent Carter Season 1, Episode 5 - Clip 1","1m 35s","2015-01-30T20:00:01Z"
Sx5GToxRh8Q,"Marvel's Avengers Assemble Season 2, Episode 9 - Clip 1",57s,"2015-01-30T16:00:01Z"
sX8zYa_E_kg,"Marvel’s Agents of S.H.I.E.L.D. - Season 2 Return Preview",32s,"2015-01-29T22:00:00Z"
"kj5nGgt-GXI","Marvel's Avengers: Age of Ultron - TV Spot 1",31s,"2015-01-29T21:00:00Z"
2bfuvCFb0bU,"Disney Infinity: Toy Box 2.0 iOS Trailer",59s,"2015-01-29T18:46:35Z"
wcREW5BcdeM,"Jason Aaron Writer of Thor & Star Wars - The Watcher 2015",3m,"2015-01-28T17:00:12Z"
WP8zKCFG4so,"Marvel’s Agent Carter Season 1, Episode 4 – Clip 1","2m 1s","2015-01-26T21:48:01Z"
jAlUKbCy6wU,"""Marvel's Avengers Assemble"" Season 2, Episode 8 - Clip 1",47s,"2015-01-23T16:00:18Z"
8q60PYcjgRY,"Marvel Contest of Champions – Magik Spotlight",23s,"2015-01-21T18:00:04Z"
"aT-j66O7MQg","Deadpool Dying?! - The Watcher 2015","2m 51s","2015-01-21T15:44:32Z"
j7L6mDjQHNs,"SECRET WARS Live Kickoff","36m 9s","2015-01-20T21:04:09Z"
hI9nujk8wOk,"Spider-Punk is Coming to Spider-Man Unlimited",37s,"2015-01-14T20:18:47Z"
l7FY8eBAls4,"Most-Anticipated of Marvel 2015 - The Watcher 2015","3m 20s","2015-01-14T17:03:11Z"
MZoO8QVMxkk,"New Avengers Trailer Arrives - Marvel's Avengers: Age of Ultron Trailer 2","1m 41s","2015-01-13T01:57:58Z"
oB2ZgFTAHuw,"Disney Infinity: Marvel Super Heroes (2.0 Edition) - Ronan Spotlight",46s,"2015-01-12T21:40:56Z"
ffj2KwR_zeU,"Disney Infinity: Marvel Super Heroes (2.0 Edition) - Green Goblin Spotlight",49s,"2015-01-12T21:01:18Z"
nT_mwi8gyHQ,"The Hunt For Stark Continues - Marvel's Agent Carter Season 1, Ep. 3 - Clip 2","1m 32s","2015-01-12T20:59:08Z"
e6aLBmTqrUU,"Disney Infinity: Marvel Super Heroes (2.0 Edition) - Yondu Spotlight",46s,"2015-01-12T20:01:39Z"
1i4jxBGfCxk,"The Critics Love Agent Carter - Marvel's Agent Carter TV Spot 1",31s,"2015-01-09T19:33:19Z"
5aciXTHVpb8,"The SSR Comes Knocking - Marvel's Agent Carter Season 1, Ep. 3 - Clip 1","1m 57s","2015-01-08T19:38:30Z"
h334vn103YM,"Marvel & Netflix Announce Daredevil Release Date - Marvel's Daredevil Motion Poster",16s,"2015-01-07T17:17:10Z"
xInh3VhAWs8,"1st Full Look at Ant-Man - Marvel's Ant-Man Teaser","1m 57s","2015-01-07T02:58:45Z"
H1G6fOcBcfU,"Marvel Contest of Champions: Captain Marvel Spotlight",23s,"2015-01-06T21:26:59Z"
GnCsBOjf0R4,"Uncover Agent Carter's Secrets - Marvel's Agent Carter Behind-the-Scenes Featurette 2","2m 2s","2015-01-06T17:49:01Z"
ent7BoDR1yE,"1st Human-Sized Look at Ant-Man - Marvel's Ant-Man Teaser Preview",18s,"2015-01-03T17:03:40Z"
KQjhJf1R4k4,"1st Ant-Sized Look at Ant-Man - Marvel's Ant-Man Teaser Preview",18s,"2015-01-02T17:00:48Z"
nOSgoawQ7DE,"New Avengers Trailer January 12 - Marvel's Avengers: Age of Ultron Trailer 2 Preview",16s,"2015-01-02T02:14:48Z"
FmwDSolYG1Q,"Go Undercover with Hayley Atwell - ""Marvel's Agent Carter"" Behind-the-Scenes Clip 1",49s,"2014-12-30T22:31:03Z"
mUgIDlzL5_g,"11 Biggest Marvel Moments of 2014 - The Watcher 2014 Finale","4m 14s","2014-12-30T17:00:08Z"
TWFvzcOKLhQ,"Avengers NOW! Trailer","1m 39s","2014-12-30T16:46:26Z"
oH1GaIzW3mo,"Disney Infinity (2.0 Edition) – IN Moments – Iron Man and Iron Fist",31s,"2014-12-26T17:00:17Z"
K9pIhD39b84,"Holiday Spectacular 2014 - Marvel Super Heroes: What The--?! Ep 38","3m 22s","2014-12-22T20:13:36Z"
HzgSZYfNldQ,"The Lowe Down on Spider-Verse - Marvel AR for Amazing Spider-Man","5m 40s","2014-12-18T17:00:18Z"
"-i6QZ47hyhs","Win Marvel Contest of Champions - The Watcher 2014","4m 10s","2014-12-17T17:00:06Z"
nH7Vg9XNaec,"March to AXIS – A Marvel Heroes 2015 One-Shot",37s,"2014-12-15T22:02:32Z"
"9l5Kt_c1-7U","Agent Carter Gets Ready for Work - Marvel’s Agent Carter Season 1, Ep. 1 – Clip 1","1m 10s","2014-12-12T18:00:15Z"
"2jj1HMAE-P8","Marvel Contest of Champions Launch Trailer",33s,"2014-12-11T17:56:12Z"
aDx52jAPxow,"Behind-the-Scenes of Avengers - Marvel's Guardians of the Galaxy Blu-ray Featurette 12",32s,"2014-12-11T00:10:32Z"
XeZpTTK8nK4,"Marvel Gift Guide - The Watcher 2014","4m 47s","2014-12-10T20:54:03Z"
nvRALLjxL1w,"May Takes Extreme Evasive Maneuvers - Marvel's Agents of S.H.I.E.L.D. Season 2, Ep. 10 - Clip 2","1m 45s","2014-12-09T22:29:28Z"
T82NkXIBiZ4,"Spider-Verse Arrives in Spider-Man Unlimited",59s,"2014-12-09T16:25:31Z"
M__Zb9OSsTM,"Spider-Man Unlimited – Spider-Verse Teaser Trailer",14s,"2014-12-09T15:00:10Z"
zQ2PvUe_PP0,"Spider-Verse Frozen Dessert & Flashbacks! 3 Course Comics - Episode 1, Part 3","8m 35s","2014-12-08T16:32:50Z"
GFmjKL2czQY,"Skye Comes Face-To-Face with her Father - Marvel's Agents of S.H.I.E.L.D. Season 2, Ep. 10 - Clip 1","1m 18s","2014-12-07T23:48:55Z"
4u8tympprJU,"Magneto in Marvel Heroes 2015",50s,"2014-12-05T20:00:44Z"
0Awv3875J5Y,"Howard the Duck: Unfeathered - The Watcher 2014","3m 42s","2014-12-03T17:42:09Z"
FrFKi3NLra0,"Spider-Man Celebrates - ""Marvel's Ultimate Spider-Man: Web Warriors"" - Ep. 22, Clip 1","1m 4s","2014-12-02T17:52:45Z"
HxuIVSUUYpI,"Agent Skye Faces a Familiar Foe - Marvel's Agents of S.H.I.E.L.D. Season 2, Ep. 9 - Clip 1","1m 11s","2014-12-01T14:00:04Z"
"-ExUzmhCm0c","Peggy Carter Gets to Work – Marvel’s Agent Carter Preview 2",32s,"2014-11-25T20:04:36Z"
CfGrwAFknpc,"It Ain’t Life and Death – Marvel’s Agent Carter Preview 1",32s,"2014-11-25T20:02:30Z"
lcrQAoHAO_Y,"The Wait is Over - Marvel's Guardians of the Galaxy Available on Blu-ray December 9th",33s,"2014-11-24T18:43:45Z"
NdKc201MfEI,"Spider-Verse Pasta & a Spidey Roll Call! 3 Course Comics - Episode 1, Part 2","5m 22s","2014-11-21T18:07:46Z"
x_zJhZCrFdQ,"Ah! Spiders!!! - The Watcher 2014","4m 1s","2014-11-19T17:55:28Z"
bnAsnquM3o0,"The Kyln Will Have To Do - Marvel's Guardians of the Galaxy Blu-ray Deleted Scene 2",49s,"2014-11-18T17:00:18Z"
"W-LNlr_Zf-I","Designing Baby Groot - Marvel's Guardians of the Galaxy Blu-ray Featurette Clip 8",47s,"2014-11-16T17:00:15Z"
9zhDcuHJBG0,"Sisterly Love - Marvel's Guardians of the Galaxy Blu-ray Deleted Scene 1",1m,"2014-11-15T21:39:59Z"
LHVQ9lvnLxw,"Vin Diesel as Groot - Marvel's Guardians of the Galaxy Blu-ray Featurette Clip 7",57s,"2014-11-15T17:00:28Z"
yYtNLBZoD6g,"Iron Man Travels Through Time - Marvel's Avengers Assemble Season 2, Ep. 7 - Clip 1","1m 19s","2014-11-15T01:34:39Z"
U9Sto1BnZPU,"Agent Carter Returns - Marvel's Agents of S.H.I.E.L.D. Season 2, Ep. 8 - Clip 2","1m 47s","2014-11-14T23:00:07Z"
GWc4CsftHSc,"Coulson Travels to Hawaii - Marvel's Agents of S.H.I.E.L.D. Season 2, Ep. 8 - Clip 1","1m 24s","2014-11-13T22:53:13Z"
LPUO20GKEmM,"Benicio Del Toro as the Collector - Marvel's Guardians of the Galaxy Blu-ray Featurette Clip 5","1m 12s","2014-11-13T17:00:22Z"
IvdHeqxbDrc,"Bradley Cooper as Rocket Raccoon - Marvel's Guardians of the Galaxy Blu-ray Featurette Clip 4",37s,"2014-11-13T16:00:02Z"
XYaWDFFIkX0,"Blu-Ray Trailer for Marvel's ""Guardians of the Galaxy""","1m 26s","2014-11-13T14:00:08Z"
oYQjC7_3kjk,"Marvel Heroes 2015 – Rogue Trailer","1m 57s","2014-11-12T19:00:18Z"
UkClaG1qI_M,"14 Summer Teasers Revealed! - The Watcher 2014 Ep 40","4m 1s","2014-11-12T18:08:50Z"
eCkwHZZvqVA,"Chris Pratt at the Xandar Crash Site - Marvel's Guardians of the Galaxy Blu-ray Featurette Clip 3",47s,"2014-11-12T17:30:05Z"
"XLQyg-CPdeU","Music from the Morag Scene - Marvel's Guardians of the Galaxy Blu-ray Featurette Clip 2","1m 3s","2014-11-12T17:00:25Z"
wt63HUq6E7E,"Marvel's Agents of S.H.I.E.L.D. Season 2, Ep. 7 - Clip 2","1m 57s","2014-11-11T19:06:10Z"
19ojXM4iceY,"James Gunn's Aesthetic Vision - Marvel's Guardians of the Galaxy Blu-ray Featurette Clip 1","1m 26s","2014-11-11T17:02:16Z"
"--OL702mIho","3 Course Comics with CB Cebulski - Episode 1, Part 1","6m 35s","2014-11-07T20:31:19Z"
FAl3MF4Qc4k,"Marvel's Agents of S.H.I.E.L.D. Season 2, Ep. 7 - Clip 1",59s,"2014-11-07T19:52:31Z"
1I0KUGBBXj0,"Avengers tussle with Nighthawk in this clip from this week’s all-new ‘Marvel’s Avengers Assemble’","1m 2s","2014-11-07T16:00:11Z"
CZsPoPIjLZg,"Hulk clip from this week's all-new ‘Marvel’s Avengers Assemble’","1m 22s","2014-11-06T22:07:51Z"
3FQRDW3IaZ4,"Secret Wars: Battleworld Revealed!","1m 19s","2014-11-06T16:26:04Z"
2jO8aBCvFVg,"Get Evil with Axis - The Watcher 2014 Ep 39","4m 43s","2014-11-05T21:56:21Z"
V13W9gQ_1GA,"Marvel's Agent Carter Sneak Peek","2m 40s","2014-11-05T03:00:25Z"
ZyrGEi8_Ogg,"""Marvel's Avengers Assemble"" Season 2, Ep. 5 - Clip 1",59s,"2014-10-31T19:05:09Z"
QZmJSqcvGp4,"2014 Halloween Spooktacular - Marvel Super Heroes: What The--?! Ep. 37","2m 24s","2014-10-31T15:20:25Z"
lPWCkd_T1A0,"The Unstoppable Juggernaut - Marvel Heroes 2015 Trailer",1m,"2014-10-31T14:59:24Z"
KlTmrbPEPUQ,"9 New Marvel Films Revealed!","2m 44s","2014-10-30T19:05:23Z"
kglfDMImYw8,"Joss Whedon Talks ""Marvel's Avengers: Age of Ultron"" - The Watcher 2014 Ep 38","4m 50s","2014-10-29T21:21:14Z"
5XkkRVeyVnw,"First Official Look at Marvel's Agent Carter on ABC",16s,"2014-10-29T18:04:51Z"
eGwuoYKhqx8,"Get a Special Look at Marvel's ""Avengers: Age of Ultron""","2m 31s","2014-10-29T05:03:57Z"
"NbKH-yUBZR4","""Marvel's Agents of S.H.I.E.L.D."" Season 2, Ep. 6 - Clip 2","1m 43s","2014-10-27T23:31:35Z"
iISbaTa7Uh4,"Marvel's Avengers Assemble Season 2, Ep. 4 - Clip 1","1m 6s","2014-10-25T00:27:07Z"
klMNfuTYLPk,"Marvel's Agents of S.H.I.E.L.D. Season 2, Ep. 6 - Clip 1","1m 15s","2014-10-23T22:52:40Z"
tmeOjFno6Do,"Marvel's ""Avengers: Age of Ultron"" - Teaser Trailer (OFFICIAL)","2m 17s","2014-10-23T01:17:07Z"
VOSfM0iRLaE,"""Marvel's Guardians of the Galaxy Awesome Mix Vol. 1"" comes to your tape deck","1m 1s","2014-10-22T18:17:29Z"
9kszDyFpfIM,"Secret Wars, Marvel's Daredevil & More NYCC Announcements! - The Watcher 2014 Ep 37","4m 12s","2014-10-22T15:15:57Z"
NW9fkZescj4,"Marvel Contest of Champion: Avengers Tower",24s,"2014-10-21T14:55:32Z"
dvQkFGV54A8,"Marvel Heroes 2015 - Nova Trailer",53s,"2014-10-17T23:29:21Z"
HUJRcavP0Do,"Marvel's Agents of S.H.I.E.L.D. Season 2, Ep. 5 - Clip 2",48s,"2014-10-17T22:31:23Z"
agbmvIumVnU,"Marvel's Agents of S.H.I.E.L.D. Season 2, Ep. 5 - Clip 1","1m 41s","2014-10-16T21:27:21Z"
4Lglk_hwfV4,"Avengers & X-Men: AXIS - Marvel Super Heroes: What The--?! Ep. 36","2m 53s","2014-10-15T19:34:13Z"
0pAVbY_XKsw,"Watch the FULL Marvel's Daredevil on Netflix Panel from New York Comic Con 2014!","43m 15s","2014-10-13T20:22:47Z"
pgIcXFoN2O8,"Spider-Man Unlimited: Sandman Trailer","1m 4s","2014-10-13T17:54:53Z"
S5nQHax4vC8,"Marvel LIVE! at New York Comic Con 2014- Day 4","7h 24m 36s","2014-10-12T23:22:58Z"
WI3lSXt8JVg,"Eric Orr, Pete Rock, Quelle Chris, and Jean Grae Show Off Their Comic Book Knowledge at NYCC 2014","8m 31s","2014-10-12T20:20:56Z"
oxUvGi0ugNM,"Cary Elwes Shares Details from His New Book ""As You Wish..."" on Marvel LIVE! at NYCC 2014","7m 45s","2014-10-12T19:58:43Z"
yfOv1PMLdFc,"Ales Kot Soaks Up the Praise on Marvel LIVE! at New York Comic Con 2014","10m 4s","2014-10-12T19:47:32Z"
nqHTAJVeo6o,"Jerry Springer Talks about Possibly Becoming a Comic Book Character at NYCC 2014","9m 2s","2014-10-12T19:29:17Z"
Y3X4NPDLZ1U,"Kathrine Zan Talks the Ups and Downs of Cosplay on Marvel LIVE! at NYCC 2014","7m 2s","2014-10-12T19:10:59Z"
gmETKEANzQk,"Kyle Stevens Picks His Marvel Character Band on Marvel LIVE! at NYCC 2014","7m 14s","2014-10-12T18:49:38Z"
JPjveXRukgs,"Jack Antonoff from Bleachers Visits Marvel LIVE! at New York Comic Con 2014","7m 3s","2014-10-12T18:37:12Z"
YmyNvJrt9XM,"Frank Tieri Does His Best Agent M Impression and Talks His History at Marvel at NYCC 2014",7m,"2014-10-12T18:31:56Z"
kkY1bRTyV2c,"Autumn Reeser, Craig Cackowski, and Terry Kinney Talk Improv on Marvel LIVE! at NYCC 2014","7m 31s","2014-10-12T18:21:42Z"
"NdQV-V5uV1c","The Florida Department of Citrus Unveil a New Character on Marvel LIVE! at NYCC 2014","5m 32s","2014-10-12T18:14:46Z"
rkKXaYJitTE,"Scott Adsit and Marc Evan Jackson Share a Few Words On Marvel LIVE! at NYCC 2014",7m,"2014-10-12T17:52:14Z"
fK__g6nncyY,"Steve Wilkos Talks His Show and Captain America on Marvel LIVE! at NYCC 2014","6m 54s","2014-10-12T17:46:30Z"
wl3Tgg9SVik,"The Legendary Writer of Spider-Man 2099 Joins Us on Marvel LIVE! at NYCC 2014","11m 22s","2014-10-12T17:25:43Z"
tPOAv6SIJBY,"Artistic Director of Ka Cirque Du Soleil Takes A Quick Visit to Marvel LIVE! at NYCC 2014","6m 3s","2014-10-12T17:06:44Z"
"X5S-rctuv-g","Cuz Parry and Gabriel Frizzera Talk the Creative Process on Marvel Contest of Champions at NYCC 2014","10m 10s","2014-10-12T16:51:40Z"
CfmLvkJJPMg,"The Cast of Sleepy Hollow Stop By Marvel LIVE! and Talk Cosplay at NYCC 2014","8m 33s","2014-10-12T16:34:01Z"
sUjYATqVXLI,"Taran Killam Does Some Amazing Character Impressions on Marvel LIVE! at NYCC 2014","9m 28s","2014-10-12T16:26:12Z"
90OlZoJYW0g,"Russell Dauterman Talks About the New Thor on Marvel LIVE! on NYCC 2014","9m 3s","2014-10-12T16:12:23Z"
ITwmJG4wMeU,"Artist Robbi Rodriguez Talks Spider-Gwen and the Key to Drawing On NYCC 2014","9m 28s","2014-10-12T16:00:46Z"
Vl7TyrdBYG0,"The Writer of Ms. Marvel Talks About Growing Up With Superpowers at NYCC 2014",9m,"2014-10-12T15:43:41Z"
9U2r54z9JPg,"Cosplayer Tony Ray Talks Costume Creation and Young Avengers on Marvel LIVE! at NYCC 2014","4m 47s","2014-10-12T14:35:08Z"
nQ0EX1NVpOU,"Marvel LIVE! at New York Comic Con 2014- Day 3","7h 55m 28s","2014-10-12T07:29:22Z"
nAN_rRfBqac,"For The First Time, Here is the Cast of ""Marvel's Daredevil"" on Marvel LIVE! at NYCC 2014 - Part 2","6m 9s","2014-10-11T23:36:14Z"
1377IpI3GVk,"For The First Time, Here is the Cast of ""Marvel's Daredevil"" on Marvel LIVE! at NYCC 2014 - Part 1","4m 26s","2014-10-11T23:10:38Z"
IlgYiWpmLu4,"Mike Del Mundo Talks About His Inspiration for Drawing Elektra on Marvel LIVE! at NYCC 2014","10m 2s","2014-10-11T22:36:31Z"
5zi2yIcfywM,"Michael D'Alessio Talks About ACBC in Atlantic City on Marvel LIVE! at NYCC 2014","9m 12s","2014-10-11T22:18:38Z"
Pl12gEVMotQ,"Watch for Everything Kurt Busiek on Marvel LIVE! at New York Comic Con 2014","12m 4s","2014-10-11T21:23:47Z"
R_YdBUIzj0s,"Sam Humphries Talks About Marvel's Contest of Champions Exclusively on Marvel LIVE! at NYCC 2014","10m 42s","2014-10-11T20:50:30Z"
Qhg30ALJ3GI,"Mike Tyson Interacts With Some Fans from the Marvel Skybox at NYCC 2014","9m 4s","2014-10-11T20:23:28Z"
"-p_w_TScBAA","Mark Bagley Talks His Inspirations and Art on Marvel LIVE! at New York Comic Con 2014","8m 2s","2014-10-11T19:56:02Z"
"-REXktAcmb0","Alex Irvine and Joe Fletcher Talk About Making An Addicting Game at NYCC 2014","8m 36s","2014-10-11T19:42:21Z"
tRBnfamQbjw,"Various of Cartoon Network's Amazing Talent Visit Marvel LIVE! at NYCC 2014","7m 57s","2014-10-11T19:40:00Z"
QYBub8CFrDs,"Tom Brevoort Gives the Scoop on Some New Announcements at NYCC 2014","8m 1s","2014-10-11T19:29:03Z"
KWMJUNa_C00,"Melanie Lynskey, Patrick McHale, Kent Osborne, Rebecca Sugar Talk About Past Comic Cons at NYCC 2014","6m 36s","2014-10-11T19:01:55Z"
z2brAxrtLaU,"The Cast of The League Which Sexy Superheroes They Would Dress Up As at NYCC 2014","8m 1s","2014-10-11T18:50:26Z"
JDdjGakxa7Q,"Tommy Davidson, Kym Whitley, and Byron Minns Make the Marvel Skybox Laugh at NYCC 2014","7m 36s","2014-10-11T18:37:56Z"
lkyzh95NKAY,"Carl Jones and Michael Jai White Talk Their New Animated Show and More at NYCC 2014","9m 3s","2014-10-11T18:33:15Z"
N7tM8Ju9u1c,"John Lee, Scott Adsit, and Judith Roberts Stop By Marvel LIVE! at NYCC 2014","8m 13s","2014-10-11T18:25:46Z"
31OLSEMpO6k,"Freddie Wong Creator of ""VGHS"" Stops by at New York Comic Con 2014","6m 37s","2014-10-11T16:14:54Z"
_iA9qPHcwbQ,"Kelly Sue DeConnick from Captain Marvel Stops By Marvel LIVE! at New York Comic Con 2014","9m 26s","2014-10-11T15:51:03Z"
psik4wUmUIo,"Joe Kelly and Duncan Rouleau from ""Man of Action"" Join Marvel LIVE! at New York Comic Con 2014","10m 26s","2014-10-11T15:37:18Z"
f5Hx1evX3cI,"Tim Molyneux and Derick Groves Talk All About Contests of Champions at NYCC 2014",9m,"2014-10-11T15:18:06Z"
"OZw0-EVVO0I","Marvel LIVE! at New York Comic Con 2014- Day 2","7h 6m 20s","2014-10-11T07:09:52Z"
GsKZGON96ek,"Phil Noto Talks About His Process on Black Widow on Marvel LIVE! at NYCC 2014","8m 1s","2014-10-10T23:08:51Z"
